"video_id","publishedAt","channelId","title","description","thumbnails.default.url","thumbnails.default.width","thumbnails.default.height","thumbnails.medium.url","thumbnails.medium.width","thumbnails.medium.height","thumbnails.high.url","thumbnails.high.width","thumbnails.high.height","channelTitle","liveBroadcastContent","viewCount","likeCount","dislikeCount","favoriteCount","commentCount","month","year"
"cq2Ef6rvL6g",2019-10-16,"UCUjD5RFkzbwfivClshUqqpg","ambient chillout lounge relaxing music essential relax session 1 background chill out music","AMBIENT CHILLOUT LOUNGE RELAXING MUSIC - Essential Relax Session 1 - Background Chill Out Music - Music For Relax, Study, Work Enjoy Calm music ...","https://i.ytimg.com/vi/cq2Ef6rvL6g/default.jpg","120","90","https://i.ytimg.com/vi/cq2Ef6rvL6g/mqdefault.jpg","320","180","https://i.ytimg.com/vi/cq2Ef6rvL6g/hqdefault.jpg","480","360","Relax Chillout Music","none",4669442,26952,1453,0,649,10,2019
"DTqmzCDM59Q",2016-11-04,"UC0OqjLDBPKRPO2gIBIwWXtA","matthew 2024 20expository 20study 20 20youtube mp4","","https://i.ytimg.com/vi/DTqmzCDM59Q/default.jpg","120","90","https://i.ytimg.com/vi/DTqmzCDM59Q/mqdefault.jpg","320","180","https://i.ytimg.com/vi/DTqmzCDM59Q/hqdefault.jpg","480","360","louise Lacourse","none",18,0,0,0,0,11,2016
"9uIk_91GQYI",2018-11-14,"UCjzHeG1KWoonmf9d5KBvSiw","beautiful relaxing music calm piano music amp guitar music with birds singing","Beautiful relaxing music by Peder B. Helland. Stream or download this music: https://soothingrelaxation.lnk.to/sunny-morningsYL Enjoy calm piano music and ...","https://i.ytimg.com/vi/9uIk_91GQYI/default.jpg","120","90","https://i.ytimg.com/vi/9uIk_91GQYI/mqdefault.jpg","320","180","https://i.ytimg.com/vi/9uIk_91GQYI/hqdefault.jpg","480","360","Soothing Relaxation","none",12660860,85003,4241,0,2488,11,2018
"H8-lWIDT19k",2012-01-25,"UCoEiMuO3sPS9TbeKvVAL8IQ","music to help study and work concentration music focus music alpha waves studying music <U+262F>r2","Music to Help Study and Work - Concentration Music, Focus Music, Alpha Waves, Studying Music - RelaxingRecords are experts in creating study music and ...","https://i.ytimg.com/vi/H8-lWIDT19k/default.jpg","120","90","https://i.ytimg.com/vi/H8-lWIDT19k/mqdefault.jpg","320","180","https://i.ytimg.com/vi/H8-lWIDT19k/hqdefault.jpg","480","360","RelaxingRecords - Study Music for Concentration","none",7355825,20806,1309,0,3934,1,2012
"GBexfwe-9j0",2017-06-27,"UCQINXHZqCU5i06HzxRkujfg","disney piano collection relaxing piano music music for relax study work","0:00 Beauty And The Beast/<U+7F8E><U+5973><U+3068><U+91CE><U+7363> 3:31 A Whole New World/<U+30A2><U+30E9><U+30B8><U+30F3> 7:07 For The First Time In Forever/<U+751F><U+307E><U+308C><U+3066><U+306F><U+3058><U+3081><U+3066> <U+30A2><U+30CA><U+3068><U+96EA><U+306E><U+5973><U+738B> 9:55 Let It Go/<U+30A2><U+30CA><U+3068> ...","https://i.ytimg.com/vi/GBexfwe-9j0/default.jpg","120","90","https://i.ytimg.com/vi/GBexfwe-9j0/mqdefault.jpg","320","180","https://i.ytimg.com/vi/GBexfwe-9j0/hqdefault.jpg","480","360","BGM channel","none",11286450,74401,3935,0,1292,6,2017
"unU8SdLtd3E",2014-01-09,"UCixFwZ8qA3R0QRnIzcIb-vw","harp music tibetan celestial relaxing 432 hz strings solo playlist for study concentrate and yoga","please sub http://www.youtube.com/subscription_center?add_user=relaxriverofficial Tibetan meditation music with harp is the best new age meditation music for ...","https://i.ytimg.com/vi/unU8SdLtd3E/default.jpg","120","90","https://i.ytimg.com/vi/unU8SdLtd3E/mqdefault.jpg","320","180","https://i.ytimg.com/vi/unU8SdLtd3E/hqdefault.jpg","480","360","Relax River - Relaxation Flows in You","none",8277237,34096,1752,0,1005,1,2014
"WRWVywsfcpg",2011-11-29,"UCJJmDk_lxosfvRFiwgOn6xw","learning numbers counting 1 20 for kids by elf learning numbers song elf kids videos","Count from 1 to 20 with this fun, marching style numbers learning video for kids! Perfect for preschool, kindergarten, esl and efl children. ---------------- To make ...","https://i.ytimg.com/vi/WRWVywsfcpg/default.jpg","120","90","https://i.ytimg.com/vi/WRWVywsfcpg/mqdefault.jpg","320","180","https://i.ytimg.com/vi/WRWVywsfcpg/hqdefault.jpg","480","360","ELF Kids Videos","none",4756168,2584,1327,0,9,11,2011
"c6XGRW7C4wU",2012-11-23,"UCVQFeI0_cTGpnE519lWsrHg","animals 20video 20for 20kids 20 20youtube","Video converted and uploaded via free Leawo PSP Video Converter http://www.leawo.com/video-converter/free-pspconverter.html.","https://i.ytimg.com/vi/c6XGRW7C4wU/default.jpg","120","90","https://i.ytimg.com/vi/c6XGRW7C4wU/mqdefault.jpg","320","180","https://i.ytimg.com/vi/c6XGRW7C4wU/hqdefault.jpg","480","360","MrAhmednawawy","none",315,0,0,0,0,11,2012
"ETTcskgCv0M",2018-01-05,"UCMdV1ynMzE4y0NoeTZa7GZA","30 minute french sing along compilation for beginners basho amp friends 4k learning songs for kids","Enjoy 30 uninterrupted minutes of beginner French sing-along songs from BASHO & FRIENDS! Learn the French alphabet, greetings, common phrases, and ...","https://i.ytimg.com/vi/ETTcskgCv0M/default.jpg","120","90","https://i.ytimg.com/vi/ETTcskgCv0M/mqdefault.jpg","320","180","https://i.ytimg.com/vi/ETTcskgCv0M/hqdefault.jpg","480","360","BASHO & FRIENDS","none",48858,728,22,0,13,1,2018
"2u0FgW0P73I",2019-05-08,"UCM-kkAdedmM0UYUSj8bXIBA","offset function in excel pivot","Create a pivot table that is based on a dynamic data source -- that is a range that adjusts automatically by offset function in pivot table in data source. if data is ...","https://i.ytimg.com/vi/2u0FgW0P73I/default.jpg","120","90","https://i.ytimg.com/vi/2u0FgW0P73I/mqdefault.jpg","320","180","https://i.ytimg.com/vi/2u0FgW0P73I/hqdefault.jpg","480","360","Knowledge Game","none",11,0,0,0,0,5,2019
"7nOKtPhtI1c",2020-01-02,"UCfVuOtlqVdiRb8CjHBRb56Q","the guitar class tutorial part 4 tujhe kitna chahne lage hum guitar tabs","Please like mye channel videos ...","https://i.ytimg.com/vi/7nOKtPhtI1c/default.jpg","120","90","https://i.ytimg.com/vi/7nOKtPhtI1c/mqdefault.jpg","320","180","https://i.ytimg.com/vi/7nOKtPhtI1c/hqdefault.jpg","480","360","Creative Smart Classes","none",86,16,0,0,0,1,2020
"Oa_d-zaUti8",2020-02-06,"UCZPFjMe1uRSirmSpznqvJfQ","11 preprocessing audio data for deep learning","In this video, I show how to get audio data ready for deep learning applications using Python and an audio analysis library called Librosa. Starting from an audio ...","https://i.ytimg.com/vi/Oa_d-zaUti8/default.jpg","120","90","https://i.ytimg.com/vi/Oa_d-zaUti8/mqdefault.jpg","320","180","https://i.ytimg.com/vi/Oa_d-zaUti8/hqdefault.jpg","480","360","The Sound of AI","none",1479,60,0,0,13,2,2020
"7WF8yySJjTo",2013-12-21,"UCTTWhDwVIrM5mUbfR2V0D8Q","simple learning to count to 20 counting 1 to 20 numbers for toddlers preschool kids children","Warning** This video changes different bright backgrounds every few seconds. Those that have Photosensitive Epilepsy should not watch this video. Learn ...","https://i.ytimg.com/vi/7WF8yySJjTo/default.jpg","120","90","https://i.ytimg.com/vi/7WF8yySJjTo/mqdefault.jpg","320","180","https://i.ytimg.com/vi/7WF8yySJjTo/hqdefault.jpg","480","360","BinkleBee","none",2566437,4103,1546,0,23,12,2013
"_Jvl6PXYd10",2013-02-03,"UCCAj7KhztJe9tCG1d3HQIdA","count to 20 learning for toddlers and preschool children","Learn to count to 20 under the sea with animated tropical fish, octopus and jelly fish. A colorful video perfect for toddlers and preschool children. We believe ...","https://i.ytimg.com/vi/_Jvl6PXYd10/default.jpg","120","90","https://i.ytimg.com/vi/_Jvl6PXYd10/mqdefault.jpg","320","180","https://i.ytimg.com/vi/_Jvl6PXYd10/hqdefault.jpg","480","360","Wee Bee World Educational Videos for Children","none",330585,354,106,0,0,2,2013
"wD48F5uemm4",2017-05-20,"UCpGXHRVPjzNS9XXa3wga_4Q","fix file reading failed vlc could not open the file bad file descriptor","Fix File reading failed-VLC could not open the file (Bad file descriptor)-file reading failed vlc. <U+2713><U+2705>LIKE &  .<U+2713><U+2705>SHARE <U+2713> COMMENTS  <U+2713> I get...","https://i.ytimg.com/vi/wD48F5uemm4/default.jpg","120","90","https://i.ytimg.com/vi/wD48F5uemm4/mqdefault.jpg","320","180","https://i.ytimg.com/vi/wD48F5uemm4/hqdefault.jpg","480","360","Teconz","none",129488,NA,NA,0,18,5,2017
"mVRDd6lNq5c",2015-04-11,"UC9RBr2eLd8cNzbQSFhdtxYA","finding rersources to learn nahuatl","How to find resources to learn Nahuatl Here is the document I am referring to: ...","https://i.ytimg.com/vi/mVRDd6lNq5c/default.jpg","120","90","https://i.ytimg.com/vi/mVRDd6lNq5c/mqdefault.jpg","320","180","https://i.ytimg.com/vi/mVRDd6lNq5c/hqdefault.jpg","480","360","A Paquiliztli","none",23876,1447,15,0,269,4,2015
"wLxlihrYpbs",2020-01-13,"UCKu0P6z03ekC6HSf0qysMsQ","<U+2606> journal with me ft phomemo happy taehyung day <U+2727><U+FF65><U+FF9F> <U+2727><U+FF65><U+FF9F>","[ watch in 1080p!! ] i know this is late... but happy birthday to tae! also, i'm so excited to announce my collaboration with phomemo! thank you so much to ...","https://i.ytimg.com/vi/wLxlihrYpbs/default.jpg","120","90","https://i.ytimg.com/vi/wLxlihrYpbs/mqdefault.jpg","320","180","https://i.ytimg.com/vi/wLxlihrYpbs/hqdefault.jpg","480","360","sunhae!","none",16331,1350,7,0,53,1,2020
"f1pSh6yuZFA",2014-08-26,"UC4Hdb26_xnPQsntwLazMqYw","counting songs for children counting together kids songs by the learning station","Kids will have fun as they learn to count with our popular counting song for children. Counting Together from the CD, Children Love to Sing and Dance. Children ...","https://i.ytimg.com/vi/f1pSh6yuZFA/default.jpg","120","90","https://i.ytimg.com/vi/f1pSh6yuZFA/mqdefault.jpg","320","180","https://i.ytimg.com/vi/f1pSh6yuZFA/hqdefault.jpg","480","360","TheLearningStation - Kids Songs and Nursery Rhymes","none",911492,746,214,0,17,8,2014
"2otlAPbUdEo",2020-01-02,"UCSMWpBmRPJSpTNVuq9Xra5w","all hell can 39 t stop us episode 044 decade in review 2010 2019","This is a Creative Commons podcast CC BY 3.0 It isn't just available on NSA/Alphabet Youtube, see Subscriberstar for full list ...","https://i.ytimg.com/vi/2otlAPbUdEo/default.jpg","120","90","https://i.ytimg.com/vi/2otlAPbUdEo/mqdefault.jpg","320","180","https://i.ytimg.com/vi/2otlAPbUdEo/hqdefault.jpg","480","360","Jeffrey Cliff","none",6,1,0,0,0,1,2020
"Y-eagImEfKo",2015-10-02,"UC25pRoncbePI3mx09_0VGdA","learn multiplication tables from 12 to 19 in 5 minutes","If you know tables from 2 to 9, here is an easy way to learn and write multiplication (times) tables from 12 to 19 . This video targets kids of Age Group from 8 to 12 ...","https://i.ytimg.com/vi/Y-eagImEfKo/default.jpg","120","90","https://i.ytimg.com/vi/Y-eagImEfKo/mqdefault.jpg","320","180","https://i.ytimg.com/vi/Y-eagImEfKo/hqdefault.jpg","480","360","Deepti Sharma","none",278156,2716,323,0,303,10,2015
"gFZ9mPY_0pw",2019-03-10,"UCM-kkAdedmM0UYUSj8bXIBA","online quiz game survey formby using google form timify and php free of cost","Use below PHP admin panel link for online game quize: http://dataquery.xyz/Bucket%20for%20Learning/Default.php Screenrecording credit goes To: ...","https://i.ytimg.com/vi/gFZ9mPY_0pw/default.jpg","120","90","https://i.ytimg.com/vi/gFZ9mPY_0pw/mqdefault.jpg","320","180","https://i.ytimg.com/vi/gFZ9mPY_0pw/hqdefault.jpg","480","360","Knowledge Game","none",344,3,1,0,0,3,2019
"U_9062u3ykM",2016-12-17,"UC6rO3nwH_zDC6pcMO9kZ5gg","video professor learning dos for home computers 1989 nickkie com","More of this: ...","https://i.ytimg.com/vi/U_9062u3ykM/default.jpg","120","90","https://i.ytimg.com/vi/U_9062u3ykM/mqdefault.jpg","320","180","https://i.ytimg.com/vi/U_9062u3ykM/hqdefault.jpg","480","360","Nickkie Retro Computers","none",734,15,1,0,0,12,2016
"NTWRkucC1R4",2014-12-17,"UCzWQYUVCpZqtN93H8RR44Qw","the easiest way to stop procrastinating","We're all guilty of procrastinating, but is there a solution that could stop you from doing it? Follow Crystal on Twitter: https://twitter.com/polycrystalhd Read More: ...","https://i.ytimg.com/vi/NTWRkucC1R4/default.jpg","120","90","https://i.ytimg.com/vi/NTWRkucC1R4/mqdefault.jpg","320","180","https://i.ytimg.com/vi/NTWRkucC1R4/hqdefault.jpg","480","360","Seeker","none",113983,3551,119,0,410,12,2014
"UWh5YF0qgtk",2016-12-19,"UCLR4GqTPlscKhlx2yGSNuow","how to download from kickass katcr to no account needed","kat.am katcr.to.","https://i.ytimg.com/vi/UWh5YF0qgtk/default.jpg","120","90","https://i.ytimg.com/vi/UWh5YF0qgtk/mqdefault.jpg","320","180","https://i.ytimg.com/vi/UWh5YF0qgtk/hqdefault.jpg","480","360","zaghloul hessien","none",68892,256,30,0,63,12,2016
"wMePOFOZmAg",2015-10-30,"UCU9Lq8hhlfsAp5XJKyy1_oA","philipp scale studies for guitar d major and harmonic minor","These are from a set of scale studies I'm currently putting together. They feature scales consisting of 2 to 1 notes played alternating in both bass and treble ...","https://i.ytimg.com/vi/wMePOFOZmAg/default.jpg","120","90","https://i.ytimg.com/vi/wMePOFOZmAg/mqdefault.jpg","320","180","https://i.ytimg.com/vi/wMePOFOZmAg/hqdefault.jpg","480","360","Brian Kozaczek","none",150,2,0,0,1,10,2015
"0KBLgJ6UCJ0",2012-05-12,"UC6LKuH7RPkvRmzS9-8URtqA","numbers 11 20 learning for kids little flyers","This fun video teaches the numbers from 11-20! Can you say the numbers as they come by on the clouds? Let's take off! Now available! Little Flyers Apps! 3 ...","https://i.ytimg.com/vi/0KBLgJ6UCJ0/default.jpg","120","90","https://i.ytimg.com/vi/0KBLgJ6UCJ0/mqdefault.jpg","320","180","https://i.ytimg.com/vi/0KBLgJ6UCJ0/hqdefault.jpg","480","360","Dream English Kids","none",558426,715,141,0,1,5,2012
"kATxxxM1D94",2019-04-14,"UCM-kkAdedmM0UYUSj8bXIBA","excel to pdf txt search in multiple pdf","Use below PHP admin panel link for download the file: http://dataquery.xyz/Bucket%20for%20Learning/File%20download.php Music credit goes To ...","https://i.ytimg.com/vi/kATxxxM1D94/default.jpg","120","90","https://i.ytimg.com/vi/kATxxxM1D94/mqdefault.jpg","320","180","https://i.ytimg.com/vi/kATxxxM1D94/hqdefault.jpg","480","360","Knowledge Game","none",4,0,0,0,0,4,2019
"i0_n9pwvBTk",2016-09-30,"UCsV_xDVe9DUY7xXq0rezB9g","µ<U+03B9>a sta<U+03B3><U+03CC><U+03BD>a st<U+03BF><U+03BD> <U+03C9><U+03BA>ea<U+03BD><U+03CC> <U+03BF>µ<U+03BF><U+03B9><U+03BF>pa<U+03B8><U+03B7>t<U+03B9><U+03BA><U+03AE> <U+03BA>a<U+03B9> <U+03BF> <U+03B8><U+03AC><U+03BD>at<U+03BF><U+03C2> t<U+03BF><U+03C5> <U+03BF><U+03C1><U+03B8><U+03BF><U+03BB><U+03BF><U+03B3><U+03B9>sµ<U+03BF><U+03CD> debunking 3","Sa<U+03C2> p<U+03BF><U+03BD><U+03AC>e<U+03B9> t<U+03BF>...<U+03BF>t<U+03B9>d<U+03AE>p<U+03BF>te; <U+0395><U+03AF>ste a<U+03BB><U+03BB>e<U+03C1><U+03B3><U+03B9><U+03BA><U+03BF><U+03AF> st<U+03BF> fa<U+03B9><U+03BD><U+03CC>µe<U+03BD><U+03BF> placebo; <U+0391><U+03BD> <U+03BF><U+03B9> apa<U+03BD>t<U+03AE>se<U+03B9><U+03C2> e<U+03AF><U+03BD>a<U+03B9> «<U+03BD>a<U+03B9>» <U+03BA>a<U+03B9> «<U+03CC><U+03C7><U+03B9>» <U+03B7> <U+03BF>µ<U+03BF><U+03B9>...","https://i.ytimg.com/vi/i0_n9pwvBTk/default.jpg","120","90","https://i.ytimg.com/vi/i0_n9pwvBTk/mqdefault.jpg","320","180","https://i.ytimg.com/vi/i0_n9pwvBTk/hqdefault.jpg","480","360","The Mad Sc1ent1st","none",180851,4383,211,0,641,9,2016
"krT2C0jf_tY",2019-02-23,"UCM-kkAdedmM0UYUSj8bXIBA","how to copy paste multiple pdf file text in excel using vba macro","First Enable the Macro option in Excel Link for download PDF text in Excel: http://dataquery.xyz/Bucket%20for%20Learning/File%20download.php ...","https://i.ytimg.com/vi/krT2C0jf_tY/default.jpg","120","90","https://i.ytimg.com/vi/krT2C0jf_tY/mqdefault.jpg","320","180","https://i.ytimg.com/vi/krT2C0jf_tY/hqdefault.jpg","480","360","Knowledge Game","none",830,6,0,0,0,2,2019
"CPxSzxylRCI",2016-12-15,"UCGGtl3nZmwzcfwHY4ck_G0Q","how to study effectively for school or college top 6 science based study skills","How to study effectively with 6 essential skills. Boost your study performance with strategies recommended by science - The ANSWER Method. These tips are for ...","https://i.ytimg.com/vi/CPxSzxylRCI/default.jpg","120","90","https://i.ytimg.com/vi/CPxSzxylRCI/mqdefault.jpg","320","180","https://i.ytimg.com/vi/CPxSzxylRCI/hqdefault.jpg","480","360","Memorize Academy","none",2922571,72848,1135,0,1156,12,2016
"NeYbYnrKdJ0",2019-03-11,"UC4-uObu-mfafJyxxZFEwbvQ","the 80 20 principle in studying and how to use it motivated mondays","Hey guys! Welcome to the second episode of Motivated Mondays! (Go watch last week's if you haven't - it's a good 'un!). Every week, I'll be posting some kind ...","https://i.ytimg.com/vi/NeYbYnrKdJ0/default.jpg","120","90","https://i.ytimg.com/vi/NeYbYnrKdJ0/mqdefault.jpg","320","180","https://i.ytimg.com/vi/NeYbYnrKdJ0/hqdefault.jpg","480","360","UnJaded Jade","none",170497,9777,59,0,625,3,2019
"NTSI3YRHv3w",2014-11-11,"UC-_nBoRWmoNUKH1gdXqM1NQ","solubility rules chemist 39 s paradise by abe l","A solubility rules rap by Abe for Mr. Rapp's AP Chemistry class Slides at ...","https://i.ytimg.com/vi/NTSI3YRHv3w/default.jpg","120","90","https://i.ytimg.com/vi/NTSI3YRHv3w/mqdefault.jpg","320","180","https://i.ytimg.com/vi/NTSI3YRHv3w/hqdefault.jpg","480","360","Neil Rapp","none",183,5,0,0,0,11,2014
"x51ahzv_Wk0",2018-05-06,"UC2rzaZgIUXgkxNjUuJu8ikQ","backlit led watch unboxing hindi","Back light Table Digital Clock for table and Study Desk LCD display of Time;Month;Date;Day;Temperature 100 year calendar Alarm with snooze Temperature in ...","https://i.ytimg.com/vi/x51ahzv_Wk0/default.jpg","120","90","https://i.ytimg.com/vi/x51ahzv_Wk0/mqdefault.jpg","320","180","https://i.ytimg.com/vi/x51ahzv_Wk0/hqdefault.jpg","480","360","SD GADGETS","none",4177,51,10,0,11,5,2018
"w9B95JdytAs",2017-04-02,"UCT89sQ4JyCw33ojZrG-QxUQ","how to study more in less time 80 20 rule pareto principle","How to study more in less time by using the 80-20 rule, also known as the Pareto Principle. These study tips will help you to know how study effectively for your ...","https://i.ytimg.com/vi/w9B95JdytAs/default.jpg","120","90","https://i.ytimg.com/vi/w9B95JdytAs/mqdefault.jpg","320","180","https://i.ytimg.com/vi/w9B95JdytAs/hqdefault.jpg","480","360","Ways To Grow","none",122759,2108,69,0,51,4,2017
"SS8mkTC0L_I",2020-01-10,"UC6ChnfFQnL7nXF9VlLnAEHQ","lander verhack machine learning for web developers it talks","Lander Verhack is one of our speakers on the 3rd edition of IT Talks, on 12th of December 2019. Curious about this event, and want to register or see when the ...","https://i.ytimg.com/vi/SS8mkTC0L_I/default.jpg","120","90","https://i.ytimg.com/vi/SS8mkTC0L_I/mqdefault.jpg","320","180","https://i.ytimg.com/vi/SS8mkTC0L_I/hqdefault.jpg","480","360","TVHgroup","none",34,1,0,0,0,1,2020
"FczQa_MJn64",2018-10-05,"UC3hGJLxHZI9xMvZrW6UvG_g","infosys 110 project kidseat","References: 1. Wynd, D. (2011). “Hunger For Learning. Nutritional Barriers to children's education.","https://i.ytimg.com/vi/FczQa_MJn64/default.jpg","120","90","https://i.ytimg.com/vi/FczQa_MJn64/mqdefault.jpg","320","180","https://i.ytimg.com/vi/FczQa_MJn64/hqdefault.jpg","480","360","Felix Ellerm","none",9,0,0,0,0,10,2018
"ibvsuzBicXA",2019-03-04,"UCM-kkAdedmM0UYUSj8bXIBA","multiple images image compare in vb net","Link for download Image comparison file in vb.net: http://dataquery.xyz/Bucket%20for%20Learning/File%20download.php Music credit goes To ...","https://i.ytimg.com/vi/ibvsuzBicXA/default.jpg","120","90","https://i.ytimg.com/vi/ibvsuzBicXA/mqdefault.jpg","320","180","https://i.ytimg.com/vi/ibvsuzBicXA/hqdefault.jpg","480","360","Knowledge Game","none",274,4,0,0,1,3,2019
"NT6vZCJ1N9w",2019-03-04,"UCM-kkAdedmM0UYUSj8bXIBA","insert export and import multiple images in excel rows and comments in excel vba form","Link for download Image adjust and utilisation file in VBA: http://dataquery.xyz/Bucket%20for%20Learning/File%20download.php Music credit goes To ...","https://i.ytimg.com/vi/NT6vZCJ1N9w/default.jpg","120","90","https://i.ytimg.com/vi/NT6vZCJ1N9w/mqdefault.jpg","320","180","https://i.ytimg.com/vi/NT6vZCJ1N9w/hqdefault.jpg","480","360","Knowledge Game","none",84,1,0,0,0,3,2019
"3tC-EBcQKRc",2012-08-01,"UCsP_ZHHuo_kc7DK3ohT75Rw","dreams can come true with agriculture","This short video will show you the endless career possibilities that the Australian Agricultural Industry can offer you... And there are plenty more out there!","https://i.ytimg.com/vi/3tC-EBcQKRc/default.jpg","120","90","https://i.ytimg.com/vi/3tC-EBcQKRc/mqdefault.jpg","320","180","https://i.ytimg.com/vi/3tC-EBcQKRc/hqdefault.jpg","480","360","madie hamilton","none",13549,61,5,0,9,8,2012
"LcF62vp_LJ0",2019-04-03,"UCLLNdYU6rvim12ldHezx86w","oavs full syllabus for the computer based test 2019","OAVS FULL SYLLABUS RELEASED SYLLBUS FOR THE COMPUTER BASED TEST 2019 (Principal, PGT, TGT, Computer Teacher, PET) How to Download ...","https://i.ytimg.com/vi/LcF62vp_LJ0/default.jpg","120","90","https://i.ytimg.com/vi/LcF62vp_LJ0/mqdefault.jpg","320","180","https://i.ytimg.com/vi/LcF62vp_LJ0/hqdefault.jpg","480","360","jobsearch Study","none",124,3,0,0,0,4,2019
"ZItt520Aa1k",2018-10-20,"UCXPawycxyBcW-v6qi6FDQUQ","convivencia escolar y bullying apuntar por reconocimiento paralelo","Qué hacer con los y las estudiantes que no trabajan en clases? ¿Cómo poder llamar la atención de una manera positiva y eficiente a los y las estudiantes que ...","https://i.ytimg.com/vi/ZItt520Aa1k/default.jpg","120","90","https://i.ytimg.com/vi/ZItt520Aa1k/mqdefault.jpg","320","180","https://i.ytimg.com/vi/ZItt520Aa1k/hqdefault.jpg","480","360","Anti bullying Kit","none",599,10,0,0,0,10,2018
"QeBJEPAlq2g",2017-06-26,"UC2yh-MfL2LamSVqb76fEPCg","a refutation of the atheism of the skeptics","DRINKING GAME OF THE VIDEO: If you're like me, you will want a shot of espresso every minute. This video is protected under fair use as the content is ...","https://i.ytimg.com/vi/QeBJEPAlq2g/default.jpg","120","90","https://i.ytimg.com/vi/QeBJEPAlq2g/mqdefault.jpg","320","180","https://i.ytimg.com/vi/QeBJEPAlq2g/hqdefault.jpg","480","360","Mauritian Struggle","none",5566,234,65,0,273,6,2017
"WNeSPAuaMBs",2019-05-23,"UCsu_0uLs_ET8jydw496WxLA","news is bitcoin too early for mainstream adoption study suggests so","For the most complete data on all crypto currencies check: https://coincheckup.com | The crypto research platform. Full credits for this video to NewsBTC who ...","https://i.ytimg.com/vi/WNeSPAuaMBs/default.jpg","120","90","https://i.ytimg.com/vi/WNeSPAuaMBs/mqdefault.jpg","320","180","https://i.ytimg.com/vi/WNeSPAuaMBs/hqdefault.jpg","480","360","CoinCheckup.com","none",6,0,0,0,0,5,2019
"Q8MJFS8Hen0",2012-11-23,"UCVQFeI0_cTGpnE519lWsrHg","abc 20song 20 20youtube 0","Video converted and uploaded via free Leawo PSP Video Converter http://www.leawo.com/video-converter/free-pspconverter.html.","https://i.ytimg.com/vi/Q8MJFS8Hen0/default.jpg","120","90","https://i.ytimg.com/vi/Q8MJFS8Hen0/mqdefault.jpg","320","180","https://i.ytimg.com/vi/Q8MJFS8Hen0/hqdefault.jpg","480","360","MrAhmednawawy","none",247,0,0,0,0,11,2012
"eCEFbUFbF-4",2019-04-14,"UCM-kkAdedmM0UYUSj8bXIBA","rename multiple file name in folder by vba macro","Use below PHP admin panel link for download the file: http://dataquery.xyz/Bucket%20for%20Learning/File%20download.php Music credit goes To ...","https://i.ytimg.com/vi/eCEFbUFbF-4/default.jpg","120","90","https://i.ytimg.com/vi/eCEFbUFbF-4/mqdefault.jpg","320","180","https://i.ytimg.com/vi/eCEFbUFbF-4/hqdefault.jpg","480","360","Knowledge Game","none",81,0,0,0,0,4,2019
"ydhKOI_z4bk",2019-06-01,"UCQC1FxQPbSz14T4XbIg_lCQ","bihar board 2019 2020 syllabus of class 12","easystudyclasses#latestonlineforms#easystudyclasses APPLY link:- https://governmentcareers.in Latest updates playlist: ...","https://i.ytimg.com/vi/ydhKOI_z4bk/default.jpg","120","90","https://i.ytimg.com/vi/ydhKOI_z4bk/mqdefault.jpg","320","180","https://i.ytimg.com/vi/ydhKOI_z4bk/hqdefault.jpg","480","360","EASY STUDY CLASSES","none",29000,899,71,0,136,6,2019
"Lia7_8gUb0M",2019-03-05,"UCM-kkAdedmM0UYUSj8bXIBA","part 2 insert export and import multiple images in excel rows and comments in excel vba form","""Link for download Image adjust and utilisation file in VBA: http://dataquery.xyz/Bucket%20for%20Learning/File%20download.php Music credit goes To ...","https://i.ytimg.com/vi/Lia7_8gUb0M/default.jpg","120","90","https://i.ytimg.com/vi/Lia7_8gUb0M/mqdefault.jpg","320","180","https://i.ytimg.com/vi/Lia7_8gUb0M/hqdefault.jpg","480","360","Knowledge Game","none",44,0,0,0,0,3,2019
"HrsktlSrL1g",2019-05-01,"UCM-kkAdedmM0UYUSj8bXIBA","power bi unique rank sumx cumlative sum with rank countif with rank multiple criteria rank","Unique rank, sumx with rank, cumlative sum with rank,countif with rank, multiple criteria rank - Power BI. Use below PHP admin panel link for download the file: ...","https://i.ytimg.com/vi/HrsktlSrL1g/default.jpg","120","90","https://i.ytimg.com/vi/HrsktlSrL1g/mqdefault.jpg","320","180","https://i.ytimg.com/vi/HrsktlSrL1g/hqdefault.jpg","480","360","Knowledge Game","none",47,1,0,0,0,5,2019
"jA_Oq1r2O2Y",2019-04-14,"UCM-kkAdedmM0UYUSj8bXIBA","get column name and number by vba macro","Use below PHP admin panel link for download file: http://dataquery.xyz/Bucket%20for%20Learning/File%20download.php Music credit goes To ...","https://i.ytimg.com/vi/jA_Oq1r2O2Y/default.jpg","120","90","https://i.ytimg.com/vi/jA_Oq1r2O2Y/mqdefault.jpg","320","180","https://i.ytimg.com/vi/jA_Oq1r2O2Y/hqdefault.jpg","480","360","Knowledge Game","none",168,0,2,0,0,4,2019
