"video_id","publishedAt","channelId","title","description","thumbnails.default.url","thumbnails.default.width","thumbnails.default.height","thumbnails.medium.url","thumbnails.medium.width","thumbnails.medium.height","thumbnails.high.url","thumbnails.high.width","thumbnails.high.height","channelTitle","liveBroadcastContent","viewCount","likeCount","dislikeCount","favoriteCount","commentCount","month","year"
"PVxES5NhSoY",2020-03-18,"UCg7D7ydCY6jqJetETlnSRfQ","teknomiles 20 20duro 20 official 20music 20video","Upload your mp3 to Youtube at https://audioship.io.","https://i.ytimg.com/vi/PVxES5NhSoY/default.jpg","120","90","https://i.ytimg.com/vi/PVxES5NhSoY/mqdefault.jpg","320","180","https://i.ytimg.com/vi/PVxES5NhSoY/hqdefault.jpg","480","360","KELLY OFFICAL","none",0,0,0,0,0,3,2020
"ABd3_iUCE48",2014-08-31,"UCroWR3ajbQe3T9x18EqJ_7w","bhudar o 39 nchekeofficial 20music 20video 2","This music video is of one of Roc-A-Taylor Gang artists Bhudar and was directed and produced by Roc-A-Taylor Films.visit our facebook fan page here ...","https://i.ytimg.com/vi/ABd3_iUCE48/default.jpg","120","90","https://i.ytimg.com/vi/ABd3_iUCE48/mqdefault.jpg","320","180","https://i.ytimg.com/vi/ABd3_iUCE48/hqdefault.jpg","480","360","Taylor Mafia Entertainment","none",162,3,0,0,0,8,2014
"bi2BElD1_c4",2014-11-09,"UCX8UDZV2lGudbewHTCkJClQ","official 20backout 20music 20video","","https://i.ytimg.com/vi/bi2BElD1_c4/default.jpg","120","90","https://i.ytimg.com/vi/bi2BElD1_c4/mqdefault.jpg","320","180","https://i.ytimg.com/vi/bi2BElD1_c4/hqdefault.jpg","480","360","Deezal Kay Films","none",37,0,0,0,0,11,2014
"yOyBmzc6Wqs",2020-02-04,"UChwzHCrvf74cjQzmubiV8nw","lil tjay 20 20 official video","Official video for ""20/20"" by Lil Tjay. Listen & Download “20/20"" out now: https://LilTjay.lnk.to/2020 Amazon - https://LilTjay.lnk.to/2020/amazon Apple Music ...","https://i.ytimg.com/vi/yOyBmzc6Wqs/default.jpg","120","90","https://i.ytimg.com/vi/yOyBmzc6Wqs/mqdefault.jpg","320","180","https://i.ytimg.com/vi/yOyBmzc6Wqs/hqdefault.jpg","480","360","liltjayVEVO","none",5946733,177715,2530,0,8164,2,2020
"3NVsuBJboB8",2017-03-18,"UCTuGnrEOTYkAHIOrBM6ecTQ","wonder 20boys 20 20suatu 20hari 20 official 20music 20video mp4","","https://i.ytimg.com/vi/3NVsuBJboB8/default.jpg","120","90","https://i.ytimg.com/vi/3NVsuBJboB8/mqdefault.jpg","320","180","https://i.ytimg.com/vi/3NVsuBJboB8/hqdefault.jpg","480","360","junet saputra","none",10,1,0,0,0,3,2017
"31T3fNhja00",2017-05-04,"UCAWwR387krMEqonrbv5VALw","mattyb 20 20you 20make 20my 20heart 20skip 20 official 20music 20video mp4","My fellow youths it is our time to expand our music career.","https://i.ytimg.com/vi/31T3fNhja00/default.jpg","120","90","https://i.ytimg.com/vi/31T3fNhja00/mqdefault.jpg","320","180","https://i.ytimg.com/vi/31T3fNhja00/hqdefault.jpg","480","360","manuline classic","none",115,1,0,0,0,5,2017
"KiLCgdrfZMY",2011-01-22,"UC3G1WFwwms__krutUbh-rzg","i 20 critics official video trillestvideoupper","http://make5figures.com I-20 - Critics (Official Music Video) trillestvideoupper World Premiere.","https://i.ytimg.com/vi/KiLCgdrfZMY/default.jpg","120","90","https://i.ytimg.com/vi/KiLCgdrfZMY/mqdefault.jpg","320","180","https://i.ytimg.com/vi/KiLCgdrfZMY/hqdefault.jpg","480","360","Vince Piscitelli","none",1014,11,0,0,1,1,2011
"mintuQ6Cpvg",2016-07-17,"UCfKxjq9qEK1PXGJFjCMxNEQ","jux 20 20wivu 20 official 20music 20video mp4","","https://i.ytimg.com/vi/mintuQ6Cpvg/default.jpg","120","90","https://i.ytimg.com/vi/mintuQ6Cpvg/mqdefault.jpg","320","180","https://i.ytimg.com/vi/mintuQ6Cpvg/hqdefault.jpg","480","360","Makwesheni TV","none",65,0,0,0,0,7,2016
"zjMtaw2mrrc",2020-01-04,"UCq-Fj5jknLsUf-MWSy4_brA","illegal weapon 2 0 street dancer 3d varun d shraddha k tanishk b jasmine sandlas garry sandhu","Presenting the video song ""Illegal Weapon 2.0 "" from the upcoming bollywood movie StreetDancer3D, The movie features Varun Dhawan, Shraddha Kapoor, ...","https://i.ytimg.com/vi/zjMtaw2mrrc/default.jpg","120","90","https://i.ytimg.com/vi/zjMtaw2mrrc/mqdefault.jpg","320","180","https://i.ytimg.com/vi/zjMtaw2mrrc/hqdefault.jpg","480","360","T-Series","none",216130455,1884517,170102,0,20408,1,2020
"WziA88-n02k",2009-10-27,"UC3Xu7mc5Zzep3lV17hqbs5A","matchbox twenty unwell official video","The official video of ""Unwell"" by Matchbox Twenty from the album 'Exile on Mainstream'. ON SALE NOW! Matchbox Twenty 2020 w/ special guest The ...","https://i.ytimg.com/vi/WziA88-n02k/default.jpg","120","90","https://i.ytimg.com/vi/WziA88-n02k/mqdefault.jpg","320","180","https://i.ytimg.com/vi/WziA88-n02k/hqdefault.jpg","480","360","Matchbox Twenty","none",49414060,245907,8110,0,11269,10,2009
"C-Naa1HXeDQ",2009-10-27,"UC3Xu7mc5Zzep3lV17hqbs5A","matchbox twenty 3am official video","The official video of ""3AM"" by Matchbox Twenty from the album 'Exile on Mainstream'. ON SALE NOW! Matchbox Twenty 2020 Tour w/ special guest The ...","https://i.ytimg.com/vi/C-Naa1HXeDQ/default.jpg","120","90","https://i.ytimg.com/vi/C-Naa1HXeDQ/mqdefault.jpg","320","180","https://i.ytimg.com/vi/C-Naa1HXeDQ/hqdefault.jpg","480","360","Matchbox Twenty","none",84234578,341147,18802,0,9544,10,2009
"VfVmCnCP7Mg",2018-06-21,"UCm1dsgJNnhaLkY3uAdqN4mA","chris brown to my bed official video","Official music video for ""To My Bed"" by Chris Brown Listen to Chris Brown: https://ChrisBrown.lnk.to/listenYD Subscribe to the official Chris Brown YouTube ...","https://i.ytimg.com/vi/VfVmCnCP7Mg/default.jpg","120","90","https://i.ytimg.com/vi/VfVmCnCP7Mg/mqdefault.jpg","320","180","https://i.ytimg.com/vi/VfVmCnCP7Mg/hqdefault.jpg","480","360","ChrisBrownVEVO","none",30699437,341957,10149,0,13523,6,2018
"Eopj0klo1YI",2019-09-26,"UCIkR0uNLxmA2fGw_5YxLPvw","hateless 20 20chriss 20eazy 20 amp 20aobeats 20 official 20music 20video 202019","HATELESS%20-%20Chriss%20Eazy%20&%20AoBeats%20(Official%20Music%20Video)%202019.","https://i.ytimg.com/vi/Eopj0klo1YI/default.jpg","120","90","https://i.ytimg.com/vi/Eopj0klo1YI/mqdefault.jpg","320","180","https://i.ytimg.com/vi/Eopj0klo1YI/hqdefault.jpg","480","360","lovely lyon","none",0,0,0,0,0,9,2019
"969RAKkYESU",2009-10-27,"UC3Xu7mc5Zzep3lV17hqbs5A","matchbox twenty bent official video","The official video of ""Bent"" by Matchbox Twenty from the album 'Exile on Mainstream'. ON SALE NOW! Matchbox Twenty 2020 Tour w/ special guest The ...","https://i.ytimg.com/vi/969RAKkYESU/default.jpg","120","90","https://i.ytimg.com/vi/969RAKkYESU/mqdefault.jpg","320","180","https://i.ytimg.com/vi/969RAKkYESU/hqdefault.jpg","480","360","Matchbox Twenty","none",14911206,58407,2268,0,2451,10,2009
"v13poPB_GX0",2020-02-20,"UCV-W40yuzTglTIBg3bEasVA","spice 02 20 2020 official music video","The first 20 fans to catch my New 02.20.2020 Freestyle Lyrics wins $20000JMD each. Yes, that's right Spice is giving away $400000JMD today!! Money will sent ...","https://i.ytimg.com/vi/v13poPB_GX0/default.jpg","120","90","https://i.ytimg.com/vi/v13poPB_GX0/mqdefault.jpg","320","180","https://i.ytimg.com/vi/v13poPB_GX0/hqdefault.jpg","480","360","SpiceOfficialVEVO","none",1097865,61422,1199,0,3627,2,2020
"JVYzy_plKy4",2018-07-13,"UCxnS0WDBVfBnTP2e97DYDSA","crown the empire 20 20 official music video","Buy/stream/download the new album “Sudden Sky” here: https://suddensky.com Catch Crown The Empire in the United States direct support to Falling in ...","https://i.ytimg.com/vi/JVYzy_plKy4/default.jpg","120","90","https://i.ytimg.com/vi/JVYzy_plKy4/mqdefault.jpg","320","180","https://i.ytimg.com/vi/JVYzy_plKy4/hqdefault.jpg","480","360","riserecords","none",1122668,23354,853,0,2023,7,2018
"yM2QRNtkGDg",2020-01-01,"UChwzHCrvf74cjQzmubiV8nw","lil tjay 20 20 official audio","Official audio for ""20/20"" by Lil Tjay. Listen & Download “20/20"" out now: https://LilTjay.lnk.to/2020 Amazon - https://LilTjay.lnk.to/2020/amazon Apple Music ...","https://i.ytimg.com/vi/yM2QRNtkGDg/default.jpg","120","90","https://i.ytimg.com/vi/yM2QRNtkGDg/mqdefault.jpg","320","180","https://i.ytimg.com/vi/yM2QRNtkGDg/hqdefault.jpg","480","360","liltjayVEVO","none",8148732,178919,2362,0,8423,1,2020
"U2JyeciEwSI",2019-10-01,"UC2CCXzC56k0b8L49R_iW-Yw","dababy vibez official music video","DaBaby - VIBEZ (prod. by JetsonMade) “Kirk” out now Directed by @ReelGoats.","https://i.ytimg.com/vi/U2JyeciEwSI/default.jpg","120","90","https://i.ytimg.com/vi/U2JyeciEwSI/mqdefault.jpg","320","180","https://i.ytimg.com/vi/U2JyeciEwSI/hqdefault.jpg","480","360","DaBaby","none",52201135,646227,19504,0,21389,10,2019
"g5rFro4XdZ0",2020-02-26,"UCev-b-xy-p5fHK8x3zJyn1Q","diamond platnumz jeje official music video","Get JEJE Song: https://umgafrica.lnk.to/JejeMB Video Shot & Directed By Director Kenny Under Zoom Extra Contacts: +255718546547 ...","https://i.ytimg.com/vi/g5rFro4XdZ0/default.jpg","120","90","https://i.ytimg.com/vi/g5rFro4XdZ0/mqdefault.jpg","320","180","https://i.ytimg.com/vi/g5rFro4XdZ0/hqdefault.jpg","480","360","Diamond Platnumz","none",8576975,114206,8280,0,15286,2,2020
"-8WLa6umgdw",2012-07-30,"UC3Xu7mc5Zzep3lV17hqbs5A","matchbox twenty she 39 s so mean official video","The official video of ""She's So Mean"" by Matchbox Twenty from the album 'North'. ON SALE NOW! Matchbox Twenty 2020 Tour w/ special guest The Wallflowers ...","https://i.ytimg.com/vi/-8WLa6umgdw/default.jpg","120","90","https://i.ytimg.com/vi/-8WLa6umgdw/mqdefault.jpg","320","180","https://i.ytimg.com/vi/-8WLa6umgdw/hqdefault.jpg","480","360","Matchbox Twenty","none",26013310,140847,4893,0,6954,7,2012
"weRTCk-mJyE",2019-08-30,"UC5-gWZXAQqSGVfPHkA7NRiQ","bebe rexha not 20 anymore official music video","The new song by Bebe Rexha 'Not 20 Anymore' available everywhere. Stream now: https://bebe-rexha.lnk.to/Not20Anymore Connect with Bebe: Instagram: ...","https://i.ytimg.com/vi/weRTCk-mJyE/default.jpg","120","90","https://i.ytimg.com/vi/weRTCk-mJyE/mqdefault.jpg","320","180","https://i.ytimg.com/vi/weRTCk-mJyE/hqdefault.jpg","480","360","Bebe Rexha","none",9423337,278829,6069,0,11333,8,2019
"nwE_BsjBSUw",2020-01-06,"UCqwxMqUcL-XC3D9-fTP93Mg","lil uzi vert futsal shuffle 2020 official music video","Lil Uzi Vert - Futsal Shuffle 2020 Download/Stream: https://Uzi.lnk.to/EADeluxeID Connect with Lil Uzi Vert: https://twitter.com/LILUZIVERT ...","https://i.ytimg.com/vi/nwE_BsjBSUw/default.jpg","120","90","https://i.ytimg.com/vi/nwE_BsjBSUw/mqdefault.jpg","320","180","https://i.ytimg.com/vi/nwE_BsjBSUw/hqdefault.jpg","480","360","LIL UZI VERT","none",23532758,674293,14881,0,45995,1,2020
"H6pODq8_FxE",2009-10-22,"UCGisHCs_0OoG71Epo9ieSYA","rob thomas someday official video","The official video of ""Someday"" from my album 'cradlesong'. Connect with me: https://robthomasmusic.com https://facebook.com/RobThomas ...","https://i.ytimg.com/vi/H6pODq8_FxE/default.jpg","120","90","https://i.ytimg.com/vi/H6pODq8_FxE/mqdefault.jpg","320","180","https://i.ytimg.com/vi/H6pODq8_FxE/hqdefault.jpg","480","360","Rob Thomas","none",14147935,68178,2211,0,3229,10,2009
"2X5Dr-uFVGw",2009-10-27,"UCe4LM_eKc9ywRmVuBm5pjQg","matchbox twenty back 2 good official video","The official video for Matchbox Twenty's ""Back 2 Good"" off the album ""Yourself or Someone Like You"" - available now! Subscribe for more official content from ...","https://i.ytimg.com/vi/2X5Dr-uFVGw/default.jpg","120","90","https://i.ytimg.com/vi/2X5Dr-uFVGw/mqdefault.jpg","320","180","https://i.ytimg.com/vi/2X5Dr-uFVGw/hqdefault.jpg","480","360","Atlantic Records","none",3421767,18965,848,0,1020,10,2009
"YJVmu6yttiw",2012-02-16,"UC_TVqp_SyG6j5hG-xVRy95A","skrillex bangarang feat sirah official music video","Official video for Skrillex - ""Bangarang"" feat. Sirah Buy/stream on: Spotify: http://smarturl.it/S_SkrillexBangarang iTunes: http://smarturl.it/SBangarang Beatport: ...","https://i.ytimg.com/vi/YJVmu6yttiw/default.jpg","120","90","https://i.ytimg.com/vi/YJVmu6yttiw/mqdefault.jpg","320","180","https://i.ytimg.com/vi/YJVmu6yttiw/hqdefault.jpg","480","360","Skrillex","none",782042899,5366722,220001,0,364642,2,2012
"ul2w0EqtqhQ",2019-06-27,"UCWV3obpZVGgJ3j9FVhEjF2Q","real madrid official music video if you create the noise the new away kit by adidas","Real Madrid and adidas unveil the club's away kit for the 2019/20 season. The strip features an elegant dark blue design and, just like the home kit, comes with ...","https://i.ytimg.com/vi/ul2w0EqtqhQ/default.jpg","120","90","https://i.ytimg.com/vi/ul2w0EqtqhQ/mqdefault.jpg","320","180","https://i.ytimg.com/vi/ul2w0EqtqhQ/hqdefault.jpg","480","360","Real Madrid","none",3465035,142124,8102,0,6764,6,2019
"clKAdQnwJ7A",2009-10-27,"UC3Xu7mc5Zzep3lV17hqbs5A","matchbox twenty if you 39 re gone official video","The official video of ""If You're Gone"" by Matchbox Twenty from the album 'Mad Season'. ON SALE NOW! Matchbox Twenty 2020 Tour w/ special guest The ...","https://i.ytimg.com/vi/clKAdQnwJ7A/default.jpg","120","90","https://i.ytimg.com/vi/clKAdQnwJ7A/mqdefault.jpg","320","180","https://i.ytimg.com/vi/clKAdQnwJ7A/hqdefault.jpg","480","360","Matchbox Twenty","none",55774425,231543,9593,0,8366,10,2009
"5d7EbtLb8ok",2009-10-27,"UC3Xu7mc5Zzep3lV17hqbs5A","matchbox twenty how far we 39 ve come official video","The official video of ""How Far We've Come"" by Matchbox Twenty from the album 'Exile on Mainstream'. ON SALE NOW! Matchbox Twenty 2020 Tour w/ special ...","https://i.ytimg.com/vi/5d7EbtLb8ok/default.jpg","120","90","https://i.ytimg.com/vi/5d7EbtLb8ok/mqdefault.jpg","320","180","https://i.ytimg.com/vi/5d7EbtLb8ok/hqdefault.jpg","480","360","Matchbox Twenty","none",15327512,69255,1378,0,4825,10,2009
"od2lX2tJ3Zg",2019-02-01,"UCWKwprVN2fEwH6weIFM08mw","timaya balance official video","Timaya performing ""Balance"" off the Chulo Vibes (EP). ""Chulo Vibes"" on iTunes: https://apple.co/2UvmQQM ""Chulo Vibes"" on Apple Music: ...","https://i.ytimg.com/vi/od2lX2tJ3Zg/default.jpg","120","90","https://i.ytimg.com/vi/od2lX2tJ3Zg/mqdefault.jpg","320","180","https://i.ytimg.com/vi/od2lX2tJ3Zg/hqdefault.jpg","480","360","OfficialTimaya","none",14872023,36409,2500,0,2698,2,2019
"Rg93Lac49-Y",2009-10-27,"UC3Xu7mc5Zzep3lV17hqbs5A","matchbox twenty back 2 good official video","The official video of ""Back 2 Good"" by Matchbox Twenty from the album 'Yourself or Someone Like You'. ON SALE NOW! Matchbox Twenty 2020 Tour w/ special ...","https://i.ytimg.com/vi/Rg93Lac49-Y/default.jpg","120","90","https://i.ytimg.com/vi/Rg93Lac49-Y/mqdefault.jpg","320","180","https://i.ytimg.com/vi/Rg93Lac49-Y/hqdefault.jpg","480","360","Matchbox Twenty","none",10845223,45175,2336,0,1348,10,2009
"xCLN6JuXfpE",2015-11-05,"UCGisHCs_0OoG71Epo9ieSYA","rob thomas hold on forever official video","Here's the official music video for ""Hold On Forever"" from my album 'The Great Unknown'. Connect with me: https://robthomasmusic.com ...","https://i.ytimg.com/vi/xCLN6JuXfpE/default.jpg","120","90","https://i.ytimg.com/vi/xCLN6JuXfpE/mqdefault.jpg","320","180","https://i.ytimg.com/vi/xCLN6JuXfpE/hqdefault.jpg","480","360","Rob Thomas","none",4766015,36994,1003,0,1189,11,2015
"OGYhioVhia4",2015-11-14,"UCaWd5_7JhbQBe4dknZhsHJg","top 10 decade defining music videos of the 2000s","As the millennium changed, these are the music videos that charmed us most of all! Join http://www.WatchMojo.com as we count down our picks for the Top 10 ...","https://i.ytimg.com/vi/OGYhioVhia4/default.jpg","120","90","https://i.ytimg.com/vi/OGYhioVhia4/mqdefault.jpg","320","180","https://i.ytimg.com/vi/OGYhioVhia4/hqdefault.jpg","480","360","WatchMojo.com","none",1945203,26393,1234,0,4074,11,2015
"E8bmhhnkM5o",2009-10-27,"UCe4LM_eKc9ywRmVuBm5pjQg","matchbox twenty if you 39 re gone official video","The official video for ""If You're Gone"" by Matchbox Twenty from their album 'Mad Season' - available now! Subscribe for more official content from Atlantic ...","https://i.ytimg.com/vi/E8bmhhnkM5o/default.jpg","120","90","https://i.ytimg.com/vi/E8bmhhnkM5o/mqdefault.jpg","320","180","https://i.ytimg.com/vi/E8bmhhnkM5o/hqdefault.jpg","480","360","Atlantic Records","none",596603,3868,72,0,140,10,2009
"S5zttEPcCuQ",2009-10-27,"UC3Xu7mc5Zzep3lV17hqbs5A","matchbox twenty disease official video","The official video of ""Disease"" by Matchbox Twenty from the album 'Exile on Mainstream'. JUST ANNOUNCED! Matchbox Twenty 2020 w/ special guest The ...","https://i.ytimg.com/vi/S5zttEPcCuQ/default.jpg","120","90","https://i.ytimg.com/vi/S5zttEPcCuQ/mqdefault.jpg","320","180","https://i.ytimg.com/vi/S5zttEPcCuQ/hqdefault.jpg","480","360","Matchbox Twenty","none",6777848,27702,901,0,1161,10,2009
"Q0zgSxfLJfA",2014-08-03,"UCaWd5_7JhbQBe4dknZhsHJg","top 10 funniest music videos","They're fast becoming an art form in their own right, and these are the most amusing audio-visual masterpieces out there! Welcome to WatchMojo.com, and ...","https://i.ytimg.com/vi/Q0zgSxfLJfA/default.jpg","120","90","https://i.ytimg.com/vi/Q0zgSxfLJfA/mqdefault.jpg","320","180","https://i.ytimg.com/vi/Q0zgSxfLJfA/hqdefault.jpg","480","360","WatchMojo.com","none",5095855,27514,3388,0,6003,8,2014
"BmLSua7LPR8",2018-06-06,"UCm1dsgJNnhaLkY3uAdqN4mA","chris brown hope you do official music video","Get “Heartbreak On A Full Moon"": http://smarturl.it/HeartbreakFullMoon Follow Chris Brown: http://www.chrisbrownworld.com/ ...","https://i.ytimg.com/vi/BmLSua7LPR8/default.jpg","120","90","https://i.ytimg.com/vi/BmLSua7LPR8/mqdefault.jpg","320","180","https://i.ytimg.com/vi/BmLSua7LPR8/hqdefault.jpg","480","360","ChrisBrownVEVO","none",41344212,431095,12876,0,20079,6,2018
"Lgoz3XkW1UM",2009-10-27,"UCe4LM_eKc9ywRmVuBm5pjQg","matchbox twenty long day official video","The official video for ""Long Day"" by Matchbox Twenty from their album 'Yourself Or Someone Like You' - available now! Subscribe for more official content from ...","https://i.ytimg.com/vi/Lgoz3XkW1UM/default.jpg","120","90","https://i.ytimg.com/vi/Lgoz3XkW1UM/mqdefault.jpg","320","180","https://i.ytimg.com/vi/Lgoz3XkW1UM/hqdefault.jpg","480","360","Atlantic Records","none",6866184,21799,1013,0,833,10,2009
"6SOjm3Qk_z4",2013-12-12,"UCvQyYXEWIgIPYuEfFOaf-2Q","happy 20birthday 20gummib c3 a4r 20music 20video 20gummy 20bear 20song","Video converted and uploaded via free Leawo iPhone Video Converter http://www.leawo.com/video-converter/free-iphoneconverter.html.","https://i.ytimg.com/vi/6SOjm3Qk_z4/default.jpg","120","90","https://i.ytimg.com/vi/6SOjm3Qk_z4/mqdefault.jpg","320","180","https://i.ytimg.com/vi/6SOjm3Qk_z4/hqdefault.jpg","480","360","MrCuongxauxi","none",599,1,0,0,0,12,2013
"4_sspwzyXY0",2016-03-29,"UC54U5gpKkaa_BpXRVNip2Dw","lucinda williams performing quot the ghosts of highway 20 quot live on kcrw","Watch / Listen to the full session here: http://www.kcrw.com/music/shows/morning-becomes-eclectic/lucinda-williams-2016-03-15 Lucinda Williams released one ...","https://i.ytimg.com/vi/4_sspwzyXY0/default.jpg","120","90","https://i.ytimg.com/vi/4_sspwzyXY0/mqdefault.jpg","320","180","https://i.ytimg.com/vi/4_sspwzyXY0/hqdefault.jpg","480","360","KCRW","none",25817,443,10,0,61,3,2016
"O-DwpWfPopo",2017-03-12,"UCgJnusW0XuR0PvkcgVQvCOQ","vid c3 a9o clip 20aura 20kasih 20pemilik 20hati 20 official 20music 20video mp4","aura kasih pemilik hati.","https://i.ytimg.com/vi/O-DwpWfPopo/default.jpg","120","90","https://i.ytimg.com/vi/O-DwpWfPopo/mqdefault.jpg","320","180","https://i.ytimg.com/vi/O-DwpWfPopo/hqdefault.jpg","480","360","mas Bay21","none",464,2,0,0,0,3,2017
"elIo1XP7oJw",2017-03-25,"UCH-l3pjas06Lz7rXkBvzC2g","<U+0917><U+0923><U+0917><U+094C><U+0930> <U+0915><U+0947> original 20 video songs official video jukebox isar gangour top best songs","<U+0917><U+0923><U+0917><U+094C><U+0930> <U+0915><U+0947> Original 20 Video Songs || Official Video Jukebox This Jukebox contains 20 Super Hit Collection of Jaipur Gangour Festival Dance Video Songs.","https://i.ytimg.com/vi/elIo1XP7oJw/default.jpg","120","90","https://i.ytimg.com/vi/elIo1XP7oJw/mqdefault.jpg","320","180","https://i.ytimg.com/vi/elIo1XP7oJw/hqdefault.jpg","480","360","Veena Music","none",267116,1097,253,0,53,3,2017
"jzG-mo1POlk",2013-03-08,"UCJUADB14R56nOQwo4Drx3-A","blok liquid space program 2 0 official video","Directed by Damien Blaise and James De La Loza Editing and CG Modeling/Animation by Damien Blaise and James De La Loza Additional input by Adam ...","https://i.ytimg.com/vi/jzG-mo1POlk/default.jpg","120","90","https://i.ytimg.com/vi/jzG-mo1POlk/mqdefault.jpg","320","180","https://i.ytimg.com/vi/jzG-mo1POlk/hqdefault.jpg","480","360","theofficialblok","none",3430,45,1,0,4,3,2013
"v0aHe6rbNGo",2012-06-22,"UCo6g3IWFwR2bZXrAt-HL-tA","flintoid 20music 20video 202010","","https://i.ytimg.com/vi/v0aHe6rbNGo/default.jpg","120","90","https://i.ytimg.com/vi/v0aHe6rbNGo/mqdefault.jpg","320","180","https://i.ytimg.com/vi/v0aHe6rbNGo/hqdefault.jpg","480","360","funnybones2011","none",163,5,0,0,1,6,2012
"O11UikJigxo",2016-08-22,"UCGisHCs_0OoG71Epo9ieSYA","rob thomas pieces official video","Here's the official video of ""Pieces"" from my album 'The Great Unknown'. My single ""Pieces"" available now: iTunes - http://smarturl.it/RobThomasPieces Google ...","https://i.ytimg.com/vi/O11UikJigxo/default.jpg","120","90","https://i.ytimg.com/vi/O11UikJigxo/mqdefault.jpg","320","180","https://i.ytimg.com/vi/O11UikJigxo/hqdefault.jpg","480","360","Rob Thomas","none",10088428,105650,2370,0,2805,8,2016
"K44j-sb1SRY",2016-07-22,"UC89dItegSy120X9dAhnKxMQ","dram broccoli feat lil yachty official music video","From the album Big Baby DRAM, available now. https://Empire.lnk.to/BigBabyDramDeluxeID Directed by Nathan R. Smith & Hidji Films ...","https://i.ytimg.com/vi/K44j-sb1SRY/default.jpg","120","90","https://i.ytimg.com/vi/K44j-sb1SRY/mqdefault.jpg","320","180","https://i.ytimg.com/vi/K44j-sb1SRY/hqdefault.jpg","480","360","DRAM","none",390891482,2467740,181307,0,105456,7,2016
"Yq9cfBbCQAo",2019-07-08,"UC7Gz4nJ-vFPAX3FucDXh2_w","numberblocks twenty 20","Credit to Numberblocks, I dont own Numberblocks.","https://i.ytimg.com/vi/Yq9cfBbCQAo/default.jpg","120","90","https://i.ytimg.com/vi/Yq9cfBbCQAo/mqdefault.jpg","320","180","https://i.ytimg.com/vi/Yq9cfBbCQAo/hqdefault.jpg","480","360","Dunzap","none",393960,2192,305,0,278,7,2019
"4ZmmrGPm0Ek",2019-02-21,"UC1PB_rlzJu3D_lgE9v4WjMg","nightcore immortals lyric","Enjoy my video :) Music: Fall out boy - Immortals Link to download: ...","https://i.ytimg.com/vi/4ZmmrGPm0Ek/default.jpg","120","90","https://i.ytimg.com/vi/4ZmmrGPm0Ek/mqdefault.jpg","320","180","https://i.ytimg.com/vi/4ZmmrGPm0Ek/hqdefault.jpg","480","360","NightCore Player","none",105,24,0,0,37,2,2019
"saiyGIkvGY4",2018-04-04,"UCO7mdkDs0kqCYlYwjIwL6iw","<U+2605> starlove mido <U+2605> ¦ <U+266A> musique sentimentale <U+266A> ¦ official music video","<U+0627><U+063A><U+0646><U+064A><U+0629> <U+0647><U+0627><U+062F><U+0626><U+0629> <U+0645><U+0646> <U+062A><U+0623><U+0644><U+064A><U+0641><U+064A> <U+2606> pour le techargement : format mp3 ...","https://i.ytimg.com/vi/saiyGIkvGY4/default.jpg","120","90","https://i.ytimg.com/vi/saiyGIkvGY4/mqdefault.jpg","320","180","https://i.ytimg.com/vi/saiyGIkvGY4/hqdefault.jpg","480","360","Starlove Mido","none",210,22,1,0,8,4,2018
"7R6mUKAGsWo",2019-10-29,"UC19Qu646N5LbyqrBLBEWYSQ","seneng 20 28 20official 20funny 20music 20video 29","subscribe #like.","https://i.ytimg.com/vi/7R6mUKAGsWo/default.jpg","120","90","https://i.ytimg.com/vi/7R6mUKAGsWo/mqdefault.jpg","320","180","https://i.ytimg.com/vi/7R6mUKAGsWo/hqdefault.jpg","480","360","Daung art project","none",3,1,0,0,0,10,2019
"8-_EDd96fAk",2017-02-02,"UC_2zgYAGICP1XyeXUAtuasA","r3hab amp deorro flashlight official music video 1080p 24fps h264 128kbit aac","ESPERO QUE LES GUSTE AQUÍ LES DEJO EL LINCK ...","https://i.ytimg.com/vi/8-_EDd96fAk/default.jpg","120","90","https://i.ytimg.com/vi/8-_EDd96fAk/mqdefault.jpg","320","180","https://i.ytimg.com/vi/8-_EDd96fAk/hqdefault.jpg","480","360","agustin pro","none",8,1,0,0,0,2,2017
"HAkHqYlqops",2009-10-27,"UC3Xu7mc5Zzep3lV17hqbs5A","matchbox twenty push official video","The official video of ""Push"" by Matchbox Twenty from the album 'Yourself or Someone Like You'. ON SALE NOW! Matchbox Twenty 2020 Tour w/ special guest ...","https://i.ytimg.com/vi/HAkHqYlqops/default.jpg","120","90","https://i.ytimg.com/vi/HAkHqYlqops/mqdefault.jpg","320","180","https://i.ytimg.com/vi/HAkHqYlqops/hqdefault.jpg","480","360","Matchbox Twenty","none",56259702,241747,11448,0,5513,10,2009
"hbRLkFl_NpI",2017-12-25,"UCRhRzqYYYBhrhPykXATOuYQ","janina 20bujhina 20by 20hridoy 20khan 20bangla 20music 20video 20hd 20720p 20bdmusic23 com","","https://i.ytimg.com/vi/hbRLkFl_NpI/default.jpg","120","90","https://i.ytimg.com/vi/hbRLkFl_NpI/mqdefault.jpg","320","180","https://i.ytimg.com/vi/hbRLkFl_NpI/hqdefault.jpg","480","360","AfNan Dip","none",15,5,0,0,0,12,2017
"TOTIbn9jE0c",2014-11-09,"UCX8UDZV2lGudbewHTCkJClQ","official 20bouncin 20in 20da 20whip 20music 20video","","https://i.ytimg.com/vi/TOTIbn9jE0c/default.jpg","120","90","https://i.ytimg.com/vi/TOTIbn9jE0c/mqdefault.jpg","320","180","https://i.ytimg.com/vi/TOTIbn9jE0c/hqdefault.jpg","480","360","Deezal Kay Films","none",32,0,0,0,0,11,2014
"sWj5kagV1SY",2019-08-24,"UCIApvcYGzosV1JHNNb67Xyw","kepiting kari kuning dari bahan sederhana lezat cuyy wennak tenan part 2","Hasil dari perangkap kepiting yang kita pasang di video Part 1 : https://youtu.be/pnH2L7rucJ8 Masakan yang Lezat tidak di lihat dari penampilannya saja, tapi ...","https://i.ytimg.com/vi/sWj5kagV1SY/default.jpg","120","90","https://i.ytimg.com/vi/sWj5kagV1SY/mqdefault.jpg","320","180","https://i.ytimg.com/vi/sWj5kagV1SY/hqdefault.jpg","480","360","Official Paciti","none",83,21,0,0,1,8,2019
