"video_id","publishedAt","channelId","title","description","thumbnails.default.url","thumbnails.default.width","thumbnails.default.height","thumbnails.medium.url","thumbnails.medium.width","thumbnails.medium.height","thumbnails.high.url","thumbnails.high.width","thumbnails.high.height","channelTitle","liveBroadcastContent","viewCount","likeCount","dislikeCount","favoriteCount","commentCount","month","year"
"3Rdn-qD1D74",2018-06-25,"UCqQgtCkL3BY5Si1jjUxv3AA","top 20 meditation songs vol 01 <U+091F><U+0949><U+092A> <U+0968><U+0966> <U+092E><U+0947><U+0921><U+093F><U+091F><U+0947><U+0936><U+0928> <U+0915><U+0947> <U+0917><U+0940><U+0924> yog ke geet","","https://i.ytimg.com/vi/3Rdn-qD1D74/default.jpg","120","90","https://i.ytimg.com/vi/3Rdn-qD1D74/mqdefault.jpg","320","180","https://i.ytimg.com/vi/3Rdn-qD1D74/hqdefault.jpg","480","360","Bk Angel","none",996697,5718,992,0,302,6,2018
"ani4M9sPebs",2013-12-07,"UC_Ro4XuuBiLONfJfLWRU7SQ","psalm 20 we will trust feat aubrey dale the psalms project","http://thepsalmsproject.com In 2006, while on a mission trip to an Indian reservation in South Dakota, singer/songwriter Shane Heilman felt inspired to set the ...","https://i.ytimg.com/vi/ani4M9sPebs/default.jpg","120","90","https://i.ytimg.com/vi/ani4M9sPebs/mqdefault.jpg","320","180","https://i.ytimg.com/vi/ani4M9sPebs/hqdefault.jpg","480","360","The Psalms Project","none",71794,442,13,0,27,12,2013
"xOcNd74txNI",2019-02-21,"UCdJmrLf0tYR8eAxXHL_4o3w","top 50 vidéos les plus vues sur youtube de tous les temps","Top 50 Vidéos Les Plus Vues Sur YouTube De Tous Les Temps.","https://i.ytimg.com/vi/xOcNd74txNI/default.jpg","120","90","https://i.ytimg.com/vi/xOcNd74txNI/mqdefault.jpg","320","180","https://i.ytimg.com/vi/xOcNd74txNI/hqdefault.jpg","480","360","#RedMusicFrance","none",862956,15463,481,0,873,2,2019
"aPguu9hkuq0",2020-02-18,"UCCn_0vWsa35jSTRNlX15hzQ","ali abbasi bi nazir new track <U+0639><U+0644><U+06CC> <U+0639><U+0628><U+0627><U+0633><U+06CC> <U+0628><U+06CC> <U+0646><U+0638><U+06CC><U+0631> <U+0622><U+0647><U+0646><U+06AF> <U+062C><U+062F><U+06CC><U+062F>","<U+0622><U+0647><U+0646><U+06AF> <U+062C><U+062F><U+06CC><U+062F> <U+0628><U+06CC> <U+0646><U+0638><U+06CC><U+0631> <U+0627><U+0632> <U+0639><U+0644><U+06CC> <U+0639><U+0628><U+0627><U+0633><U+06CC> . <U+0634><U+0646><U+0648><U+0646><U+062F><U+0647> <U+0627><U+06CC><U+0646> <U+0622><U+0647><U+0646><U+06AF> <U+062C><U+062F><U+06CC><U+062F> <U+0639><U+0644><U+06CC> <U+0639><U+0628><U+0627><U+0633><U+06CC> <U+0628><U+0627><U+0634><U+06CC><U+0646> . <U+0627><U+0645><U+06CC><U+062F><U+0648><U+0627><U+0631><U+06CC><U+0645> <U+0627><U+0632> <U+0627><U+06CC><U+0646> <U+0622><U+0647><U+0646><U+06AF> <U+062C><U+062F><U+06CC><U+062F> <U+062E><U+0648><U+0634><U+062A><U+0648><U+0646> <U+0628><U+06CC><U+0627><U+062F>...","https://i.ytimg.com/vi/aPguu9hkuq0/default.jpg","120","90","https://i.ytimg.com/vi/aPguu9hkuq0/mqdefault.jpg","320","180","https://i.ytimg.com/vi/aPguu9hkuq0/hqdefault.jpg","480","360","TPM - Top Persian Music","none",30787,604,13,0,31,2,2020
"Uvkqsq-cNTY",2017-03-10,"UCJcouVFREfsuqzjFZ-jSijA","russia top 20 dance hits 2016 official chart","Official Russian Dance/Club Chart Compiled 10/03/2017: 01. Niko Pavlidis - So Lost (Radio Mix) 00:00 02. INNA - Rendez Vous (Criminal Sounds Remix) 03:02 ...","https://i.ytimg.com/vi/Uvkqsq-cNTY/default.jpg","120","90","https://i.ytimg.com/vi/Uvkqsq-cNTY/mqdefault.jpg","320","180","https://i.ytimg.com/vi/Uvkqsq-cNTY/hqdefault.jpg","480","360","MELOMAN DANCE","none",14201,60,18,0,6,3,2017
"_kN6fvDHarE",2015-08-06,"UCSs9H1cyB3OHdy8wkit8ZKg","singer kalpana breathless song in etv 20 years celebrations 2nd august 2015","For latest updates on ETV Channels - http://www.etv.co.in Subscribe for more latest Episodes - http://bit.ly/12A56lY Follow us on ...","https://i.ytimg.com/vi/_kN6fvDHarE/default.jpg","120","90","https://i.ytimg.com/vi/_kN6fvDHarE/mqdefault.jpg","320","180","https://i.ytimg.com/vi/_kN6fvDHarE/hqdefault.jpg","480","360","etvteluguindia","none",7732678,31735,2789,0,2194,8,2015
"mN9dKaT9yuc",2020-01-19,"UCchuF2Q0QhYzeUShQUm1yzQ","top 20 songs january 2020 01 25 2020 i best music chart hits","Week of January 25, 2020 (01/25/20) Top 50 Songs | Best Billboard Music Hits Chart ----------------------------------------------------------------- Main Channel: ...","https://i.ytimg.com/vi/mN9dKaT9yuc/default.jpg","120","90","https://i.ytimg.com/vi/mN9dKaT9yuc/mqdefault.jpg","320","180","https://i.ytimg.com/vi/mN9dKaT9yuc/hqdefault.jpg","480","360","MUSIC CHARTS","none",7603,42,2,0,10,1,2020
"G50f2dmCFFQ",2020-01-12,"UCyKqxNOVX6e1kBKB23g8r6g","prada fall winter 2020 menswear show","Watch the #PradaFW20 Menswear show by #MiucciaPrada live from Fondazione Prada Deposito. #mfw.","https://i.ytimg.com/vi/G50f2dmCFFQ/default.jpg","120","90","https://i.ytimg.com/vi/G50f2dmCFFQ/mqdefault.jpg","320","180","https://i.ytimg.com/vi/G50f2dmCFFQ/hqdefault.jpg","480","360","Prada","none",26246,529,22,0,3,1,2020
"2wc60GiQe7E",2018-01-05,"UCE80xxtgnBxqb3DR6ThohvA","10 hit nepali pop songs collection 2017 hit nepali music videos official songs","Latest ""Hit Nepali Songs"" ""(Top Nepali Pop songs) Music Video Collection From The Year Of 2017. 1.) Ryain Ryain - Nita Thapa Magar Ft. Alisha Rai ...","https://i.ytimg.com/vi/2wc60GiQe7E/default.jpg","120","90","https://i.ytimg.com/vi/2wc60GiQe7E/mqdefault.jpg","320","180","https://i.ytimg.com/vi/2wc60GiQe7E/hqdefault.jpg","480","360","SongsNepal","none",242783,753,90,0,29,1,2018
"peYgzUIOUp8",2018-11-27,"UCsTcErHg8oDvUnTzoqsYeNw","is the huawei mate 20 pro as good as they say","Huawei Mate 20 Pro - http://s.click.aliexpress.com/e/bmy1DzSX The Huawei Mate 20 Pro is the latest powerhouse smartphone from Huawei. It features a large ...","https://i.ytimg.com/vi/peYgzUIOUp8/default.jpg","120","90","https://i.ytimg.com/vi/peYgzUIOUp8/mqdefault.jpg","320","180","https://i.ytimg.com/vi/peYgzUIOUp8/hqdefault.jpg","480","360","Unbox Therapy","none",4803383,77230,2965,0,14322,11,2018
"hmSkliNOzpg",2019-04-12,"UC41qi6C1N78ZzQ4vfhg_ezg","new romantic hindi songs 2019 top 20 new hindi songs 2019 april best bollywood romantic 2019","NEW ROMANTIC HINDI SONGS 2019 | Top 20 New Hindi Songs 2019 April | Best Bollywood Romantic 2019 https://youtu.be/hmSkliNOzpg Hello! Thanks for ...","https://i.ytimg.com/vi/hmSkliNOzpg/default.jpg","120","90","https://i.ytimg.com/vi/hmSkliNOzpg/mqdefault.jpg","320","180","https://i.ytimg.com/vi/hmSkliNOzpg/hqdefault.jpg","480","360","Hindi English Remix - Deep House","none",114088,508,84,0,18,4,2019
"yfqpqiTMUEg",2019-10-28,"UCYx6Sp3W_Djaq8x14yI3S4A","portrait of lotte 0 to 20 years","Lotte Hofmeester from the Netherlands (Utrecht) becomes 20 years old in this film! Subscribe! Also check out New videoart with Lotte & Vince together: ...","https://i.ytimg.com/vi/yfqpqiTMUEg/default.jpg","120","90","https://i.ytimg.com/vi/yfqpqiTMUEg/mqdefault.jpg","320","180","https://i.ytimg.com/vi/yfqpqiTMUEg/hqdefault.jpg","480","360","Hofmeester","none",12718519,295054,5188,0,NA,10,2019
"yCxVoJ3R1Gc",2015-04-23,"UCZX33v-mw99oWMqqYBYr2pA","non stop imran khan top 20 hits syco tm","Playlist Down Below ( Songs Name ) For One Of Your Guys Request Thanks For Watching If You New Don't Forget Too Subscribe For More If Not Just Hit The ...","https://i.ytimg.com/vi/yCxVoJ3R1Gc/default.jpg","120","90","https://i.ytimg.com/vi/yCxVoJ3R1Gc/mqdefault.jpg","320","180","https://i.ytimg.com/vi/yCxVoJ3R1Gc/hqdefault.jpg","480","360","Syco TM","none",1728482,12760,964,0,602,4,2015
"dYovxejT-rA",2017-03-18,"UCZV3yub3q442cA8Q4tvbGHg","top 20 hindi songs march 2017","","https://i.ytimg.com/vi/dYovxejT-rA/default.jpg","120","90","https://i.ytimg.com/vi/dYovxejT-rA/mqdefault.jpg","320","180","https://i.ytimg.com/vi/dYovxejT-rA/hqdefault.jpg","480","360","Top Choice","none",13474958,56324,9456,0,2585,3,2017
"OiINtKh3tOc",2015-01-22,"UC34xi8JB1AKSotPUKHywbaA","andhika pratama feat ussy sulystiawaty quot kupilih hatimu quot dmd show mnctv 21 1","DMD Show MNCTV - Saksikan Senin-Jumat pkl 21.30 WIB hanya di MNCTV Selalu di Hati. Subscribe Us https://www.youtube.com/user/MNCTVOfficial.","https://i.ytimg.com/vi/OiINtKh3tOc/default.jpg","120","90","https://i.ytimg.com/vi/OiINtKh3tOc/mqdefault.jpg","320","180","https://i.ytimg.com/vi/OiINtKh3tOc/hqdefault.jpg","480","360","MNCTV Official","none",150315,631,23,0,23,1,2015
"AuqqiuaLYJA",2018-05-23,"UCtYw-H_L5D09T9uWeNBUvqg","fl studio 20 launch video","TRY FL STUDIO ( Time Unlimited ) - https://support.image-line.com/redirect/TRY_FL_STUDIO BUY FL STUDIO ( Lifetime Free Updates ) ...","https://i.ytimg.com/vi/AuqqiuaLYJA/default.jpg","120","90","https://i.ytimg.com/vi/AuqqiuaLYJA/mqdefault.jpg","320","180","https://i.ytimg.com/vi/AuqqiuaLYJA/hqdefault.jpg","480","360","FL STUDIO by Image-Line Software","none",665245,8229,118,0,NA,5,2018
"WEA9EB7Q5RY",2018-08-10,"UCQJOYS9v30qM74f6gZDk0TA","davido nwa baby","Davido - Nwa Baby --------------------------------------------------- More from Davido: Flora My Flawa - http://smarturl.it/FloraMyFlawa?IQid=YT Like Dat ...","https://i.ytimg.com/vi/WEA9EB7Q5RY/default.jpg","120","90","https://i.ytimg.com/vi/WEA9EB7Q5RY/mqdefault.jpg","320","180","https://i.ytimg.com/vi/WEA9EB7Q5RY/hqdefault.jpg","480","360","DavidoVEVO","none",5515254,40996,2385,0,3938,8,2018
"jus7S5vBJyU",2014-03-15,"UCm6r_b2K5jn1JGkwDcwJXrQ","katy perry dark horse ten second songs 20 style cover","My name is Anthony Vincent and I'm the voice of Ten Second Songs, custom songs made in ANY style. Make sure to subscribe to my channel to see/hear some ...","https://i.ytimg.com/vi/jus7S5vBJyU/default.jpg","120","90","https://i.ytimg.com/vi/jus7S5vBJyU/mqdefault.jpg","320","180","https://i.ytimg.com/vi/jus7S5vBJyU/hqdefault.jpg","480","360","Ten Second Songs","none",23323023,470921,6428,0,27090,3,2014
"GLxHa7iDys0",2019-08-20,"UC-i0sXIAKqZkcD3_gURjfkQ","creating the most annoying player in face of the franchise","I made the most selfish, arrogant and annoying player possible in Madden 20. Twitter: https://twitter.com/beardmohbox.","https://i.ytimg.com/vi/GLxHa7iDys0/default.jpg","120","90","https://i.ytimg.com/vi/GLxHa7iDys0/mqdefault.jpg","320","180","https://i.ytimg.com/vi/GLxHa7iDys0/hqdefault.jpg","480","360","Beardmohbox","none",397213,3653,163,0,278,8,2019
"FzURYHe5bEA",2019-09-30,"UC08-C3TjnbKb6MPnfJd3IVQ","balenciaga summer 20 show","Balenciaga Summer 20 Show Music by BFRND.","https://i.ytimg.com/vi/FzURYHe5bEA/default.jpg","120","90","https://i.ytimg.com/vi/FzURYHe5bEA/mqdefault.jpg","320","180","https://i.ytimg.com/vi/FzURYHe5bEA/hqdefault.jpg","480","360","Balenciaga","none",1070319,5712,581,0,584,9,2019
"6mqgH1c47EI",2019-07-19,"UCEASvrDWITwm6jhp0r6uExw","onze 20 todo santo dia clipe oficial","Esse é o clipe da música ""Todo Santo Dia"", do Onze:20. Ouça nos apps de música clicando aqui: https://SomLivre.lnk.to/Todo_Santo_Dia LETRA ""Todo Santo ...","https://i.ytimg.com/vi/6mqgH1c47EI/default.jpg","120","90","https://i.ytimg.com/vi/6mqgH1c47EI/mqdefault.jpg","320","180","https://i.ytimg.com/vi/6mqgH1c47EI/hqdefault.jpg","480","360","Onze:20","none",1823396,46222,350,0,760,7,2019
"5tSmYvlmx1A",2019-01-25,"UColnnUYyz7CWjhzpF1kASnw","now united what are we waiting for official lyric video","We released 'What Are We Waiting For' 6 months ago TODAY! To celebrate, we wanted to share a special performance with you, enjoy! #NowUnited #WWWF.","https://i.ytimg.com/vi/5tSmYvlmx1A/default.jpg","120","90","https://i.ytimg.com/vi/5tSmYvlmx1A/mqdefault.jpg","320","180","https://i.ytimg.com/vi/5tSmYvlmx1A/hqdefault.jpg","480","360","NOW UNITED","none",1001807,60400,305,0,2573,1,2019
"E6pghU9yE6M",2017-02-10,"UCb6t3z1pZIpVs_SklPT1jeQ","joyous celebration bawo ndixolele live","Click here to download or stream ""Joyous Celebration vol 20. Part 2: The Alumni"" online: https://SonyMusicAfrica.lnk.to/JC20Alumni Music video by Joyous ...","https://i.ytimg.com/vi/E6pghU9yE6M/default.jpg","120","90","https://i.ytimg.com/vi/E6pghU9yE6M/mqdefault.jpg","320","180","https://i.ytimg.com/vi/E6pghU9yE6M/hqdefault.jpg","480","360","joyousVEVO","none",852718,3777,163,0,170,2,2017
"f4tqN19EPlQ",2018-05-26,"UCIcCXe3iWo6lq-iWKV40Oug","how to record in fl studio 20","This video shows you how to record in FL Studio 20. The same easy method can be used for recording your voice, vocals, guitars and any sort of microphone or ...","https://i.ytimg.com/vi/f4tqN19EPlQ/default.jpg","120","90","https://i.ytimg.com/vi/f4tqN19EPlQ/mqdefault.jpg","320","180","https://i.ytimg.com/vi/f4tqN19EPlQ/hqdefault.jpg","480","360","In The Mix","none",472043,8101,172,0,561,5,2018
"filSBJUeQ98",2018-04-14,"UCGVb9qF-1MQoOEOslPZsevQ","ipl 2019 song official ipl theme song 2019 ipl 2019 anthem","IPL VIDEO SONG 2019 | Official IPL theme song 2019 | IPL Anthem #ipl2019 #ipl2019song #ipl The Indian Premier League, officially Vivo Indian Premier ...","https://i.ytimg.com/vi/filSBJUeQ98/default.jpg","120","90","https://i.ytimg.com/vi/filSBJUeQ98/mqdefault.jpg","320","180","https://i.ytimg.com/vi/filSBJUeQ98/hqdefault.jpg","480","360","Saad Studio","none",39417,185,20,0,21,4,2018
"HuguniCAzbw",2016-06-26,"UC3xHkSn2j4YqfZRKGskS6eA","<U+0628><U+0631><U+0646><U+0627><U+0645><U+062C> <U+0627><U+063A><U+0627><U+0646><U+064A> <U+0648><U+0627><U+063A><U+0627><U+0646><U+064A> <U+0627><U+0644><U+062D><U+0644><U+0642><U+0629> 20 <U+0631><U+0645><U+0636><U+0627><U+0646> 2016","<U+0628><U+0631><U+0646><U+0627><U+0645><U+062C> <U+0623><U+063A><U+0627><U+0646><U+064A> <U+0648><U+0627><U+063A><U+0627><U+0646><U+064A> - <U+0631><U+0645><U+0636><U+0627><U+0646> 2016 - <U+0627><U+0644><U+062D><U+0644><U+0642><U+0629> (20) - <U+0642><U+0646><U+0627><U+0629> <U+0627><U+0644><U+0646><U+064A><U+0644> <U+0627><U+0644><U+0627><U+0632><U+0631><U+0642> - <U+062A><U+0642><U+062F><U+064A><U+0645> : <U+0627><U+0644><U+0633><U+0631> <U+0642><U+062F><U+0648><U+0631> <U+0642><U+0646><U+0627><U+0629> <U+0627><U+0644><U+064A><U+0648><U+062A><U+064A><U+0648><U+0628> <U+0627><U+0644><U+0631><U+0633><U+0645><U+064A><U+0629> <U+0644><U+0642><U+0646><U+0627><U+0629>...","https://i.ytimg.com/vi/HuguniCAzbw/default.jpg","120","90","https://i.ytimg.com/vi/HuguniCAzbw/mqdefault.jpg","320","180","https://i.ytimg.com/vi/HuguniCAzbw/hqdefault.jpg","480","360","Blue Nile TV/ <U+0642><U+0646><U+0627><U+0629> <U+0627><U+0644><U+0646><U+064A><U+0644> <U+0627><U+0644><U+0623><U+0632><U+0631><U+0642>","none",62996,133,21,0,105,6,2016
"IoHY-f_bh44",2019-02-20,"UCo6fjlKg6GuCmEMeqYbGJng","gucci fall winter 2019 fashion show","See the Gucci Fall Winter 2019 collection live from the runway at the Gucci Hub in Milan. Music: 'Gabriel's Message' arranged by Edgar Pettman Music Direction: ...","https://i.ytimg.com/vi/IoHY-f_bh44/default.jpg","120","90","https://i.ytimg.com/vi/IoHY-f_bh44/mqdefault.jpg","320","180","https://i.ytimg.com/vi/IoHY-f_bh44/hqdefault.jpg","480","360","GUCCI","none",718898,9916,900,0,919,2,2019
"3wb3JiT4bzY",2012-08-14,"UCaJBo_nRSL1XF1eewwukTCg","bose companion 20 multimedia speaker system","See how the best Bose 2-piece computer speaker system can fill an entire room with high-quality sound. You don't need to be sitting at your computer to enjoy it.","https://i.ytimg.com/vi/3wb3JiT4bzY/default.jpg","120","90","https://i.ytimg.com/vi/3wb3JiT4bzY/mqdefault.jpg","320","180","https://i.ytimg.com/vi/3wb3JiT4bzY/hqdefault.jpg","480","360","Bose","none",51351,NA,NA,0,NA,8,2012
"2WcJw1z2yNg",2016-04-01,"UC38aAjn1MJAApjSiYVdK50g","josé josé 40 y 20 cover audio","Ya Tienes el Álbum José José Duetos Volumen 1 Descárgalo en: iTunes en http://smarturl.it/josejoseduetos1?IQid=youtube Google Play en http://bit.ly/1frriDN ...","https://i.ytimg.com/vi/2WcJw1z2yNg/default.jpg","120","90","https://i.ytimg.com/vi/2WcJw1z2yNg/mqdefault.jpg","320","180","https://i.ytimg.com/vi/2WcJw1z2yNg/hqdefault.jpg","480","360","JoseJoseVEVO","none",108253,431,22,0,4,4,2016
"iCOkcm0ErHA",2019-10-21,"UCMCj9mjUAxpGh6OLgvKnmkw","5 new features in mlb the show 20","The first MLB The Show 20 Feature news is here as well as the cover announce reveal. Let's take a look and talk about what you think! Hope you Enjoy!","https://i.ytimg.com/vi/iCOkcm0ErHA/default.jpg","120","90","https://i.ytimg.com/vi/iCOkcm0ErHA/mqdefault.jpg","320","180","https://i.ytimg.com/vi/iCOkcm0ErHA/hqdefault.jpg","480","360","Emmdotfrisk","none",239288,2467,117,0,786,10,2019
"CkB0rucfZXs",2016-03-13,"UCbtLbq67S92zwD5EcxF3sog","no audio sound in pinnacle studio fix","Pinnacle Studio no audio. This is the fix for when there is no sound in Pinnacle Studio. This is the fix if there is no audio or sound preview in the edit mode of ...","https://i.ytimg.com/vi/CkB0rucfZXs/default.jpg","120","90","https://i.ytimg.com/vi/CkB0rucfZXs/mqdefault.jpg","320","180","https://i.ytimg.com/vi/CkB0rucfZXs/hqdefault.jpg","480","360","PinnacleStudioPro","none",36345,762,47,0,364,3,2016
"1hmCdN0i-iY",2020-01-17,"UCYuSY7i4wgL5wTEnu_Nbx_Q","top 20 charts • 17 januar 2020 persönliche charts","Meine persönlichen TOP 20 Charts | 17. Januar 2020 Mit neuen Songs von Eminem, dem Lied zum aktuellen Dschungelcamp von Emily Roberts, neue ...","https://i.ytimg.com/vi/1hmCdN0i-iY/default.jpg","120","90","https://i.ytimg.com/vi/1hmCdN0i-iY/mqdefault.jpg","320","180","https://i.ytimg.com/vi/1hmCdN0i-iY/hqdefault.jpg","480","360","Hits of Tomorrow","none",48596,303,22,0,19,1,2020
"Pq_WtY2En6Q",2020-01-20,"UC3T5fmgL4Kvk3kG1kF6JFeA","jacquemus fall winter 2020 2021 full show","Jacquemus | Fall Winter 2020/2021 by Simon Porte Jacquemus | Full Fashion Show in High Definition. (Widescreen - Exclusive Video - PFW/Paris Fashion ...","https://i.ytimg.com/vi/Pq_WtY2En6Q/default.jpg","120","90","https://i.ytimg.com/vi/Pq_WtY2En6Q/mqdefault.jpg","320","180","https://i.ytimg.com/vi/Pq_WtY2En6Q/hqdefault.jpg","480","360","FF Channel","none",72004,1982,53,0,170,1,2020
"xcGhTkhKVVQ",2018-05-24,"UCCwnVx7Dusa8uCsHX4OyMyg","60k subscriber thanx to all octapad spd20 patch bhojpuri punjabi and more","Please watch: ""Kick Jumme Ki Raat Octapad Cover Santy Gupta"" https://www.youtube.com/watch?v=WPkbByu_PGw --~-- 60k+ Subscriber Thanx To All Octapad ...","https://i.ytimg.com/vi/xcGhTkhKVVQ/default.jpg","120","90","https://i.ytimg.com/vi/xcGhTkhKVVQ/mqdefault.jpg","320","180","https://i.ytimg.com/vi/xcGhTkhKVVQ/hqdefault.jpg","480","360","Rhythm House","none",1952288,20201,2314,0,1168,5,2018
"eHbByA0fQnQ",2018-02-06,"UC4P8csyQKa2_0D5-VtITRIg","counting 1 to 20 song for kids counting 1 to 20 fun kids english","Get this song on iTunes: http://bit.ly/Buy-FKS2 Learn to count to 20 with our Counting 1 to 20 Song for Kids - It's a fun song that helps kids count the numbers 1 to ...","https://i.ytimg.com/vi/eHbByA0fQnQ/default.jpg","120","90","https://i.ytimg.com/vi/eHbByA0fQnQ/mqdefault.jpg","320","180","https://i.ytimg.com/vi/eHbByA0fQnQ/hqdefault.jpg","480","360","Fun Kids English","none",151923,321,115,0,4,2,2018
"lEEVlmuk5Ng",2018-10-12,"UCOL10n-as9dXO2qtjjFUQbQ","aladdin teaser trailer german deutsch 2019","Offizieller ""Aladdin"" Teaser Trailer Deutsch German 2019 | Abonnieren <U+27A4> http://abo.yt/kc | (OT: Aladdin) Movie Trailer | Kinostart: 23 Mai 2019 | Filminfos ...","https://i.ytimg.com/vi/lEEVlmuk5Ng/default.jpg","120","90","https://i.ytimg.com/vi/lEEVlmuk5Ng/mqdefault.jpg","320","180","https://i.ytimg.com/vi/lEEVlmuk5Ng/hqdefault.jpg","480","360","KinoCheck","none",504175,4135,372,0,407,10,2018
"ZZAAOcNz6bw",2009-12-21,"UCf5PoBN7xNk1rRfW-hW8nDw","band aid 20 do they know it 39 s christmas","merry christmas (c)UMG ------------------------------- Bono, Keane, Paul McCartney, Sugababes, Skye Edwards (Morcheeba), Robbie Williams, Dido, Jamelia, Justin ...","https://i.ytimg.com/vi/ZZAAOcNz6bw/default.jpg","120","90","https://i.ytimg.com/vi/ZZAAOcNz6bw/mqdefault.jpg","320","180","https://i.ytimg.com/vi/ZZAAOcNz6bw/hqdefault.jpg","480","360","kamikatze07","none",351782,2137,243,0,358,12,2009
"MwAnRdtToO0",2019-10-19,"UCVDKPOPmcsZuEjLVqFgQDcg","top 40 songs of the week october 19 2019 uk bbc chart","Top 40 Songs of the Week in UK, ranked by BBC Best Songs Of The Week In UK October 19, 2019 Best Songs October 19, 2019 Top songs of 2019 A collection ...","https://i.ytimg.com/vi/MwAnRdtToO0/default.jpg","120","90","https://i.ytimg.com/vi/MwAnRdtToO0/mqdefault.jpg","320","180","https://i.ytimg.com/vi/MwAnRdtToO0/hqdefault.jpg","480","360","TopMusicMafia","none",142655,1199,93,0,85,10,2019
"b2i3rpIHQq0",2019-10-27,"UCchuF2Q0QhYzeUShQUm1yzQ","top 20 songs november 2019 11 02 2019 i best billboard music chart hits","Week of November 2, 2019 (11/02/19) Top 50 Songs | Best Billboard Music Hits Chart SUBSCRIBE HERE for Top Songs EVERY WEEK: http://bit.ly/1x2UX2M ...","https://i.ytimg.com/vi/b2i3rpIHQq0/default.jpg","120","90","https://i.ytimg.com/vi/b2i3rpIHQq0/mqdefault.jpg","320","180","https://i.ytimg.com/vi/b2i3rpIHQq0/hqdefault.jpg","480","360","MUSIC CHARTS","none",17238,62,11,0,6,10,2019
"HqealpVjeO0",2013-05-19,"UCdhbkIGzsMRgfQHn7Y0WwxA","matchbox twenty 20 damn hq w lyrics","Matchbox Twenty 20 - Damn - HQ w/ lyrics ""Damn"" This old world well Don't it make you wanna think damn This cold girl well Don't she wanna make you scream ...","https://i.ytimg.com/vi/HqealpVjeO0/default.jpg","120","90","https://i.ytimg.com/vi/HqealpVjeO0/mqdefault.jpg","320","180","https://i.ytimg.com/vi/HqealpVjeO0/hqdefault.jpg","480","360","BehindTheDeals dotcom","none",365795,1598,67,0,43,5,2013
"RQH7XrCmWBA",2015-04-11,"UCilObEVHp5Pys5dEfeO3Xzw","top songs of 1980","1 Call Me - Blondie 2 Another Brick in the Wall, Part II - Pink Floyd 3 Magic - Olivia Newton-John 4 Rock with You - Michael Jackson 5 Do That to Me One More ...","https://i.ytimg.com/vi/RQH7XrCmWBA/default.jpg","120","90","https://i.ytimg.com/vi/RQH7XrCmWBA/mqdefault.jpg","320","180","https://i.ytimg.com/vi/RQH7XrCmWBA/hqdefault.jpg","480","360","Ultra Lists","none",1187821,6443,507,0,526,4,2015
"qbuL8FMnoDQ",2019-10-14,"UC3vpPS0ouqlQ1xJcOa_qZfA","billboard hot 100 top 10 songs of the week october 19 2019","Music: Top 10 Songs | Billboard Hot 100 Chart | Billboard This week's most popular songs across all genres, ranked by radio airplay audience impressions as ...","https://i.ytimg.com/vi/qbuL8FMnoDQ/default.jpg","120","90","https://i.ytimg.com/vi/qbuL8FMnoDQ/mqdefault.jpg","320","180","https://i.ytimg.com/vi/qbuL8FMnoDQ/hqdefault.jpg","480","360","Billboard Charts","none",17695,284,24,0,198,10,2019
"Y_Ot6uza2uA",2018-04-29,"UCuY44m-cD124oITaNkBtsLA","14th yumi fm music awards 2018 celebrates achievements of png artists","Mt Lemina was voted the most popular song in PNG in 2017. Wame Blood took out the award at the 14th YUMI FM Music Awards on Friday night. It was an ...","https://i.ytimg.com/vi/Y_Ot6uza2uA/default.jpg","120","90","https://i.ytimg.com/vi/Y_Ot6uza2uA/mqdefault.jpg","320","180","https://i.ytimg.com/vi/Y_Ot6uza2uA/hqdefault.jpg","480","360","EMTV Online","none",25013,72,6,0,1,4,2018
"Ce1r05SSbwA",2013-01-02,"UCPXqBc6ccXvChjgO0Pn0FYw","quot smooth quot santana feat rob thomas lyrics video","Smooth- Santana Feat. Rob Thomas Lyrics: Man it's a hot one Like seven inches from the midday sun Well I hear you whisper and the words melt everyone But ...","https://i.ytimg.com/vi/Ce1r05SSbwA/default.jpg","120","90","https://i.ytimg.com/vi/Ce1r05SSbwA/mqdefault.jpg","320","180","https://i.ytimg.com/vi/Ce1r05SSbwA/hqdefault.jpg","480","360","fadeDRIFTING","none",9834368,56478,2002,0,1731,1,2013
"2k-FYwbNOYM",2019-03-11,"UCvoza3fiCybZ1PuxVb02e6w","top 20 punjabi song this week 12 march top 20 punjabi songs of the week latest punjabi songs 2019","TOP 20 MUSIC channel presents Top 20 punjabi song this week Top 20 punjabi songs of the week Top 20 punjabi songs latest this week Top 20 new punjabi ...","https://i.ytimg.com/vi/2k-FYwbNOYM/default.jpg","120","90","https://i.ytimg.com/vi/2k-FYwbNOYM/mqdefault.jpg","320","180","https://i.ytimg.com/vi/2k-FYwbNOYM/hqdefault.jpg","480","360","Top 20 Music","none",582775,5868,367,0,179,3,2019
"DPdNFzw7gec",2019-04-10,"UCMpEIycNITIObpSISTSWRQA","real cricket™ 19 trailer","A trailer of our next offering - Real Cricket™ 19 with Real Time Multiplayer.","https://i.ytimg.com/vi/DPdNFzw7gec/default.jpg","120","90","https://i.ytimg.com/vi/DPdNFzw7gec/mqdefault.jpg","320","180","https://i.ytimg.com/vi/DPdNFzw7gec/hqdefault.jpg","480","360","NautilusMobile","none",8060344,32417,1365,0,4826,4,2019
"pBB_vPESiVA",2019-02-13,"UCvoza3fiCybZ1PuxVb02e6w","top 20 punjabi song this week 14 feb top 20 punjabi songs of the week 14 feb 2019","TOP 20 MUSIC channel presents Top 20 punjabi song this week Top 20 punjabi songs of the week Top 20 punjabi songs latest this week Top 20 new punjabi ...","https://i.ytimg.com/vi/pBB_vPESiVA/default.jpg","120","90","https://i.ytimg.com/vi/pBB_vPESiVA/mqdefault.jpg","320","180","https://i.ytimg.com/vi/pBB_vPESiVA/hqdefault.jpg","480","360","Top 20 Music","none",155243,1703,98,0,69,2,2019
"9Blx6wbFDoQ",2019-02-27,"UCQIrhE_-rD69fz3_CH_9bag","christian dior fall winter 2019 2020","Christian Dior Fall Winter 2019 2020 Full Womenswear Runway Fashion Show Collection by Maria Grazia Chiuri #Bayoucool2Favourite.","https://i.ytimg.com/vi/9Blx6wbFDoQ/default.jpg","120","90","https://i.ytimg.com/vi/9Blx6wbFDoQ/mqdefault.jpg","320","180","https://i.ytimg.com/vi/9Blx6wbFDoQ/hqdefault.jpg","480","360","Bayoucool2","none",99598,719,90,0,59,2,2019
"pOMPsgUsx14",2018-01-05,"UCsrXO5Zgulz8_9BQXBOb2aw","frederic chopin nocturne no 20 in c sharp minor from quot the pianist quot by anastasia huppmann 4k uhd hd","The Nocturne No. 20 in C-sharp minor, Op. posth., Lento con gran espressione, P 1, No. 16, KKIVa/16, is a solo piano piece composed by Frédéric Chopin in ...","https://i.ytimg.com/vi/pOMPsgUsx14/default.jpg","120","90","https://i.ytimg.com/vi/pOMPsgUsx14/mqdefault.jpg","320","180","https://i.ytimg.com/vi/pOMPsgUsx14/hqdefault.jpg","480","360","Anastasia Huppmann","none",376892,10530,110,0,481,1,2018
