video_id,Comment_text,duration,publishedAt,channelId,title,description,thumbnails.default.url,thumbnails.default.width,thumbnails.default.height,thumbnails.medium.url,thumbnails.medium.width,thumbnails.medium.height,thumbnails.high.url,thumbnails.high.width,thumbnails.high.height,channelTitle,liveBroadcastContent,viewCount,likeCount,dislikeCount,favoriteCount,commentCount,month,year
igJmBJxH2CE,"umber 20 is fake
That trick doesn't make sense
Captain disillusion already de-bunked it
You are my favourite youtuber!
How did you made the water stable please explain in detail
Trying all of these as I type this!
The invisible I did not see it
That's my weekend sorted

Where’s the trick shots
I’d bet he won’t pin me
I love your science experiments so much
Its fake lol
a
The first one is fake. you can't actually do that. Captain dissolution actually debunked the first trick so go check out that video.
This channel is not really doing that well
2d
First ones fake
20 is fake
Yay

Hi",11.25,2019-02-08,UCckDzKIPNKfSZYb647SQRwQ,20 awesome science experiments kids can do at home,20 AWESOME SCIENCE EXPERIMENTS KIDS CAN DO AT HOME! Subscribe to our channel for more top 10 videos & watch our other videos below! 100 Life ...,https://i.ytimg.com/vi/igJmBJxH2CE/default.jpg,120,90,https://i.ytimg.com/vi/igJmBJxH2CE/mqdefault.jpg,320,180,https://i.ytimg.com/vi/igJmBJxH2CE/hqdefault.jpg,480,360,Spacebound,none,64601,585,83,0,32,2,2019
-wxCxGmfEF8,NaN,66.36,2019-11-06,UCuq7Yiy6S0lfrI-A-nsvzNw,2019 11 05 20 29 week 2 behavioral science live lecture,,https://i.ytimg.com/vi/-wxCxGmfEF8/default.jpg,120,90,https://i.ytimg.com/vi/-wxCxGmfEF8/mqdefault.jpg,320,180,https://i.ytimg.com/vi/-wxCxGmfEF8/hqdefault.jpg,480,360,Michelle Fynan,none,126,0,0,0,0,11,2019
I-tzCDRwbtg,NaN,122.28,2019-07-03,UCv17R5VZDLw8m4QRWUjeP_g,science amp technology 10 20 17,,https://i.ytimg.com/vi/I-tzCDRwbtg/default.jpg,120,90,https://i.ytimg.com/vi/I-tzCDRwbtg/mqdefault.jpg,320,180,https://i.ytimg.com/vi/I-tzCDRwbtg/hqdefault.jpg,480,360,Georgia House of Representatives,none,3,NA,NA,0,NA,7,2019
epQ2TJFHcWc,NaN,2.15,2019-02-05,UCWSgiqBpF-5iESZhSrosPzA,stanmore college science technology engineering amp maths departments showreel,"Interested in enrolling at Stanmore College? Watch what our current students like about the Science, Technology, Engineering & Maths Departments. Find out ...",https://i.ytimg.com/vi/epQ2TJFHcWc/default.jpg,120,90,https://i.ytimg.com/vi/epQ2TJFHcWc/mqdefault.jpg,320,180,https://i.ytimg.com/vi/epQ2TJFHcWc/hqdefault.jpg,480,360,Stanmore College,none,768,4,1,0,0,2,2019
s3lw1w9lk4Q,NaN,3.52,2019-09-07,UCDeHtICo40borhJgWLlQ0bQ,pabna science and technology university admission 2019 20 nahid24,<U+0986><U+09AC><U+09C7><U+09A6><U+09A8><U+09C7><U+09B0> <U+09B8><U+09AE><U+09AF><U+09BC> : <U+09E7><U+09EB> <U+09B8><U+09C7><U+09AA><U+09CD><U+099F><U+09C7><U+09AE><U+09CD><U+09AC><U+09B0> <U+09A5><U+09C7><U+0995><U+09C7> <U+09E7><U+09E6> <U+0985><U+0995><U+09CD><U+099F><U+09CB><U+09AC><U+09B0><U+0964> <U+09AD><U+09B0><U+09CD><U+09A4><U+09BF> <U+09AA><U+09B0><U+09C0><U+0995><U+09CD><U+09B7><U+09BE> <U+09E7><U+09EB><U+0987> <U+09A8><U+09AD><U+09C7><U+09AE><U+09CD><U+09AC><U+09B0> <U+0964>...,https://i.ytimg.com/vi/s3lw1w9lk4Q/default.jpg,120,90,https://i.ytimg.com/vi/s3lw1w9lk4Q/mqdefault.jpg,320,180,https://i.ytimg.com/vi/s3lw1w9lk4Q/hqdefault.jpg,480,360,Nahid24,none,4430,128,0,0,38,9,2019
WK5cgoq_6l0,NaN,13.39,2019-09-23,UCRdmQECNkC7eCEoOT-5nYOg,this week september 16 to 20 2019 gaming technology and science news,"Videogame releases across platforms as well as gaming news in general, Technology news, and Science! Enjoy, cya next week! Sources: ...",https://i.ytimg.com/vi/WK5cgoq_6l0/default.jpg,120,90,https://i.ytimg.com/vi/WK5cgoq_6l0/mqdefault.jpg,320,180,https://i.ytimg.com/vi/WK5cgoq_6l0/hqdefault.jpg,480,360,T3h K1tt3h,none,11,2,0,0,0,9,2019
Q_kuKoBSBZg,NaN,5.13,2019-12-20,UCOWt4O7NxJ4QARqYbPLmwPQ,science city celebrates 20 years,,https://i.ytimg.com/vi/Q_kuKoBSBZg/default.jpg,120,90,https://i.ytimg.com/vi/Q_kuKoBSBZg/mqdefault.jpg,320,180,https://i.ytimg.com/vi/Q_kuKoBSBZg/hqdefault.jpg,480,360,UnionStationKC,none,41,1,0,0,NA,12,2019
PvInWsGrNrw,"The best ever lecture for science and technology. Explained each and every concept in such a nice manner. Team Synopsis is great, and you are the best sir ???
Thank you very much sir... Hats off you sir... 
You are so good sir & youare very calculative sir....aap mere jaise students ko plz SCIENCE AND TECHNOLOGY  pura padha dijiye sir.... Aapka bahut ????? ?????? ?? ??
?????? ?????? ? how cute way to explain.
Sir will u provide this series at free of cost ? I thought it would be a paid initiative that's I paid for this
Done , thanks  sir
Thanks sir science and tech pura Kara do sir pls YouTube p.thanks a ton sir
thank you so much guruji.
Sir I want to join test series what will be the procedure for jioning
Hello sir!
Sir you are Great . please sir Kuch kijiye csat ke liye
??????? ?????? ?? ??
Hi sir. Thanks for the awesome lecture. Matlab ki your every lecture is worth watching ?.
Sir, some questions:
1. If you don't mind, pleaee tell Why submarines are your first love?  Please reply sir if it is not personal.
Excellent lecture sir
Bhut badhiya maja aa gya sir.
great lecture sir....but sir ek suggestion he ki..lecture ki pdf aap video ke sath hi provide kra dijiye website pr.. taaki hum lecture dekhne ke baad use ek baar revise karke pdh le.....& sir one more thing...website pr expert support wale option me humaari problems submit nahi ho rhi he...isliye mughe yaha likhna pd rha he....thanku??
Sir what's the assignment?
sir video ke saath pdf bhi share kijiye sir
please provide the pdf link for the registered students
Nice! 
Please upload one video for indian monsoon
Very helpful lecture
Superb ? thank u big b
Awesome
Fabulous
",56.57,2019-11-15,UCmAIxR82R7uVggBEAm56zkw,science and technology defense technology part 1 internal security upsc ias 20 20 and 50 50,visit full course at: https://synopsisias.in/ For queries related to the course mail us at synopsisias.in@gmail.com or 9620206040 #Science&Technology.,https://i.ytimg.com/vi/PvInWsGrNrw/default.jpg,120,90,https://i.ytimg.com/vi/PvInWsGrNrw/mqdefault.jpg,320,180,https://i.ytimg.com/vi/PvInWsGrNrw/hqdefault.jpg,480,360,Synopsis IAS - Synacademy,none,2493,119,1,0,32,11,2019
tHIkQRMxP7o,NaN,8.26,2019-12-21,UCRdmQECNkC7eCEoOT-5nYOg,this week december 16 to december 20 2019 gaming technology and science news,"Videogame releases across platforms as well as gaming news in general, Technology news, and Science! Enjoy, cya next week! PS: My thanks to Dracologist ...",https://i.ytimg.com/vi/tHIkQRMxP7o/default.jpg,120,90,https://i.ytimg.com/vi/tHIkQRMxP7o/mqdefault.jpg,320,180,https://i.ytimg.com/vi/tHIkQRMxP7o/hqdefault.jpg,480,360,T3h K1tt3h,none,7,2,0,0,0,12,2019
T-Ku36em8gQ,"Subject wise pass fail asa
vaia...  gopalgonj er frm uthaic..  
gopalgonj e 1 trikh ee xm..
noakhali 2 trikh...
vaia NSTU te safe zone koto.. amar ssc te .. 4.83 and hsc te 3.58.. please answer
Negative mark ki nai?
Result er opor ?? marks?
vai b unite qouta 12..any hope
Architecture ace?
Vaiya koto pale subject pate pari..
Alada vabe pass krte hbe?
how much poin maximam get change of noakhali university
b r c unit e ki vhai calculator use kora jabe?
Vaiya nstu a negative mark koto?
vaiya d unit a science ar jonno seat koto? ar alada vaba pass krta hoba?
WITHOUT CLOTHE. WITHOUT HOUSE. ADAM AND EVE. LIVED SOMEWHERE NEAR SUNDERBAN.
Total not Tottal
Bitch vuo news dei
Vaia results er upore koto mark?
Vaia ami ebar rajshahi University  te form fill up vhul kore felsi.... Ekhn nstu ki better option  hote pare than rajshahi
Safe jone koto d, e r jonno?
D unit 
nstu te negative marking ace naki?

Vaiay  e unit  ki iq test aca…",4.52,2019-09-06,UC4idIhtNqER4nKCYhfM2zCQ,nstu admission 2019 20 noakhali science and technology university admission <U+09A8><U+09CB><U+09AC><U+09BF><U+09AA><U+09CD><U+09B0><U+09AC><U+09BF> <U+098F><U+09A1><U+09AE><U+09BF><U+09B6><U+09A8>,Subscribe my channel- https://bit.ly/2k2cKua ---------------------------------------------------------------- Noakhali science and technology University complete circular ...,https://i.ytimg.com/vi/T-Ku36em8gQ/default.jpg,120,90,https://i.ytimg.com/vi/T-Ku36em8gQ/mqdefault.jpg,320,180,https://i.ytimg.com/vi/T-Ku36em8gQ/hqdefault.jpg,480,360,Tips Talk24,none,9949,141,17,0,40,9,2019
rhe6cW5oPT0,NaN,4.03,2019-04-15,UCylLLrmeftM2ldUxDFZhbFw,chemistree technology inc otcqb chmjf chm cn partners with applied cannabis sciences,Chemistree Technology Inc. US OTCQB: CHMJF is an investment company dedicated to the U.S. and international cannabis sector.,https://i.ytimg.com/vi/rhe6cW5oPT0/default.jpg,120,90,https://i.ytimg.com/vi/rhe6cW5oPT0/mqdefault.jpg,320,180,https://i.ytimg.com/vi/rhe6cW5oPT0/hqdefault.jpg,480,360,ThePublicwire,none,94634,149,0,0,0,4,2019
itHr-V5ucpc,NaN,9.5,2019-12-29,UC24N7CuIUZA5jVfCO4_9I8g,state science fair 2019 20 part2,"Jnnsmee-2019 Ongole,Ap Boga venkatasubbaiah youtube channel.",https://i.ytimg.com/vi/itHr-V5ucpc/default.jpg,120,90,https://i.ytimg.com/vi/itHr-V5ucpc/mqdefault.jpg,320,180,https://i.ytimg.com/vi/itHr-V5ucpc/hqdefault.jpg,480,360,boga venkatasubbaiah,none,666,12,0,0,0,12,2019
gupM3eBeNJQ,"Sir, one doubt world meterological( ulaga vaanilai dhinam) day is March 23 . 
But you have told May 20 ? Please check it sir.. Am sorry if am wrong.
Good compilation nanba
Tanq for this
Facebook digital currency name is Libra.. kindly verify it bro
Bro .. 1st black hole picture pannunathu KATIE BOUMAN .  Black hole-ku name vachavaru thaan LARRY
Very knowledgeable video with more information and good message. Thank u Sir..
Very informative....thanks for ur  message of science and tech....
Sports current affairs podunga
Useless current affairs",17.2,2019-08-20,UCM6YFCUkr820fB-JBnS96Pg,current affairs 2019 20 science amp technology 2019 tnpsc current affairs 2019 tnpsc group 2 4 ssc,currentAffairs_2019 #ScienceTechnology #Discoveries #inventions #tnpsc #ssc #RRB #ws #winshineias Science & Technology 2019 current Affairs in Tamil ...,https://i.ytimg.com/vi/gupM3eBeNJQ/default.jpg,120,90,https://i.ytimg.com/vi/gupM3eBeNJQ/mqdefault.jpg,320,180,https://i.ytimg.com/vi/gupM3eBeNJQ/hqdefault.jpg,480,360,WIN & SHINE IAS,none,3901,111,2,0,20,8,2019
BmzHumQH_Rw,"Shift 2 solve

1st ",1.09,2019-12-02,UCYspFr_rnedbOse_sFGQwjg,hajee danesh science and technology university admission question solution 2019 20,Hstu admission question solution 2019.,https://i.ytimg.com/vi/BmzHumQH_Rw/default.jpg,120,90,https://i.ytimg.com/vi/BmzHumQH_Rw/mqdefault.jpg,320,180,https://i.ytimg.com/vi/BmzHumQH_Rw/hqdefault.jpg,480,360,Oxygen School,none,835,18,5,0,8,12,2019
STCEJUqAcPM, C unit,0.51,2019-12-02,UCYspFr_rnedbOse_sFGQwjg,hajee danesh science and technology university admission question solution 2019 20,Hstu admission question solution 2019.,https://i.ytimg.com/vi/STCEJUqAcPM/default.jpg,120,90,https://i.ytimg.com/vi/STCEJUqAcPM/mqdefault.jpg,320,180,https://i.ytimg.com/vi/STCEJUqAcPM/hqdefault.jpg,480,360,Oxygen School,none,401,6,2,0,2,12,2019
-vFBxApXUX8,"amr SSC te 4.09 
R HSC te 3.00 
ami kono unit ei ki xm dite parbona? 
Lots of time remaining...
1st view?

Vaia, jodi 4th subject phycology thake tahole ki ami abedon kora jabe.. Math nai..
JUST Admission 
EEE theke diploma pass kore ki eee te bsc kora jabe...
Vai, hsc English a D hole ki apply kora jabe
Vai koto marks payle chance hoyte pare a,b unit e Amr gpa 8.58 ace vai answer den 

Exam Period/ somoy koto tuko.
Vaiya Ami to science theky c unit a apply krsi kintu sub kon group ar hby?exam to English,Bangla,gk ai 3 ta sub a hby .sub ki comars ar hby?
Make a video on nursing admission pls

Specific date bolen A unit er...mnush er to jawer jnno ticket katte hbe naki
B unit a calculator use kora jabe?
Vai Ami haji danesh e apply korsi kintu ora kono confirmation message deynai. Form ta ki asholei tola hoise thikmoto?
Thanks vai...my varsity details dwr jnoo
Vaiya PUST khub taratari dorkar... Please upload it
D unit aa ki somonnito seat naki alada vabe boraddho ace

khulna versity tutorial den
Bhaiya IT sub niye 1 ta video dan. Kon Public / private a IT kora jai eitar ans oh diyen.
B unit a exam time ta ktkhn..?
A unit e 150 marks er vitore koto pele pass

vaiya..MBTU and NSTU niye akta video dile valo hoy
Vi akta question cilo Kori.
Vi Agriculture University te 1st. A je circular dewa hoicilo oita te ssc ar hsc te mot point Dora hoicilo 7.0
Amra onk a to from tulci full payment Kore 
Vai dhakar bairer varsity te section jot hoy????
Vai 2nd merit a ki apply korte hoy naki
Vai biksh a pamant korar kono option pacce na please help
Iba du nea ekta video banan plsssss..
Begum rokeya University   details.  ???????
Vaiya jodi architecture a fail kori tobe mcq te valo mark pai tahole ki sub pabo?
Thanks vaiya
2nd timer der koto number ktbe?
Rangpur begum rokeya niye vdo koren
bhai ami jani apni amar comment ar answer diben A and B unit exam date janan
Akhon abedon kora jabe
Diploma student apply korte parbe cse .. computer department ... diploma theke ...
Vai.. Calculator...  Use... Kora..jabe.. Nai..to.. Bollen..na..??..
Vaia music sona haram. Plz music use koiren na. Apner vdo amnei onk valo. R music use krle subtitle diyen plz
Vaia hstu valo naki bsmrstu.
Vaia C r D er  xm kobe?? Plz janan plz
Vaia C r D er  xm kobe?? Plz janan plz
Vaiya maulana vasani niye akta video banan...
Cumilla,nstu eigula chai
THANKS VAIYA
Admit kobe theka kobe uthano jabe
Vaiya admission  xm a total koto pele chance hbe????
Ata kothai ?????
vaiya kono boi ache Hstu er jonoo
HSTU ??? ????? ???? ???? ????? 
HSC= 3.33
SSC= 3.95 
Plz Help
calculator use krte dei ki?
Vaiya Comilla university plz
answer ???
Thanks a lot vaiya.apnake dhonnobad jananor moto bhasha khuje pacchi na
vai ebar ki g unit nei?
????? ??? ????
??? ???????????? ????? ????? ???? ?? ???????? ??? ?? ?? ????? ??? ???? ?? ?? ???? ??????? ?? ??????????? ????? ???? ?????  ?????? ????? ????
Admission pdf file a tu bola asa ????? ??????? ???
Vorti xm ta just disgusting.Er chaite poralekha na kora valo.
thanks
Vai patuakhali er ta dien ?
Vaiya comilla B unit a ki alada vabe pass korte hobe ???

R biggan theke B unit a physic math biology chemistry sob questions thakbe ki???plz help
??? ??? ???? ???? ????? ?????
Private university vs public university ar akta video cai vai
KU nie video den vaiya
????? ??? ??? ????? ?????
Bdu niya vedio valo hoto
Thanks Junaid bhai
Vhaia RU te to 3rd eligible list e science theke A uniter Jonno 3.92 porjonto niche... Tahole amer phn keno sms aslona... ?Aber paid korar last date to 30 September 2019... Ami tahole kivhabe bujbo amer holo kina... ?Please vhaia ektu janaben... Please please please vhaia...
??? ??????? ????? ??????? ??? ????
MBSTU er akta vedio banan
Vai negative marking ki ace....pls vai ans
MBSTU chai vaia
?? ?????? ?????? ????? ?? ???????????? ??????? ???? ????
jurain a kono  private university ache plz bolen
????? ???? ???? ?? ?????? ?????? ???? ????? ?????? ????? ???? ????? ???? ????? ?? ????? ??????
?? ????? ?? ???????? ???? ?? ?????? ???????????
Vaiya aita ki public University???
Vaia pstu r mbstu er mark distribution den",6.06,2019-09-28,UC7UFOK9ZBwxEpSsz7lnIVZw,hstu admission test 2019 20 <U+09B9><U+09BE><U+09AC><U+09BF><U+09AA><U+09CD><U+09B0><U+09AC><U+09BF> <U+0964> hajee mohammad danesh science and technology university,HSTU Website Link - https://www.hstu.ac.bd/admission This Video About Hajee Mohammad Danesh Science and Technology University (HSTU) Admission Test ...,https://i.ytimg.com/vi/-vFBxApXUX8/default.jpg,120,90,https://i.ytimg.com/vi/-vFBxApXUX8/mqdefault.jpg,320,180,https://i.ytimg.com/vi/-vFBxApXUX8/hqdefault.jpg,480,360,ICT Point,none,23917,611,16,0,112,9,2019
GBdjkrbfX9s,"pabnai ki written o hobe..naki only MCQ..?
7.50 ace,  B unit exam deoa jbe,,,  arts theky??
Vaiya just ar circular Kobe hbe ?
Baiya ami jodi math ans kori tahola ki amk engineering sub diva.
Second time ase
35 mark er written hoby naki
Accha eybar mane 20-21 shikkha borshe pust te 2nd time thakbe ki???pls janaben
??? ???? ??? ??? ????
?????????? ??????? ????? ?? ??????? ??????? ??? ????? ??????? ???????? ??? ?? ???????, ???????? ? ?? ?? ???????? ???????? ???????? ???? ??? ???????? ??????
??? ??????, ??????? ???? ??? ??????  ????? ???? ??????????? ???? ???? ??? ???? ????? ",4.16,2019-08-21,UC4idIhtNqER4nKCYhfM2zCQ,pust admission 2019 20 pabna university of science amp technology admission circular 2019 20 <U+09AA><U+09BE><U+09AC><U+09BF><U+09AA><U+09CD><U+09B0><U+09AC><U+09BF>,"Subscribe my channel- https://bit.ly/2k2cKua Pabna University of science and technology University admission test circular 2019-20, Pabna University of science ...",https://i.ytimg.com/vi/GBdjkrbfX9s/default.jpg,120,90,https://i.ytimg.com/vi/GBdjkrbfX9s/mqdefault.jpg,320,180,https://i.ytimg.com/vi/GBdjkrbfX9s/hqdefault.jpg,480,360,Tips Talk24,none,5087,55,6,0,17,8,2019
dbCw5U3toFo,Nice,10.25,2019-09-06,UC40htyARBYpi4gwDNaATUMA,igko preparation for grade 4 2019 20 science amp technology,Welcome to IGKO olympiad Preparation 2019- 20. This is Grade 4 level chapter 4 preparation video i.e.Science & Technology. The IGKO (International General ...,https://i.ytimg.com/vi/dbCw5U3toFo/default.jpg,120,90,https://i.ytimg.com/vi/dbCw5U3toFo/mqdefault.jpg,320,180,https://i.ytimg.com/vi/dbCw5U3toFo/hqdefault.jpg,480,360,Orchids eLearning,none,192,6,1,0,1,9,2019
A2E5r3OE1r8,NaN,10.02,2019-11-02,UCILLlgN9cpmdf7dP9yOTuTw,science gk top 20 question science gk in hindi science gk question science gk trick in hindi,Dear students <U+0939><U+092E><U+093E><U+0930><U+0940> Yearly Current affairs 2018 - 19 PDF notes <U+0915><U+0947> <U+0932><U+093F><U+090F> <U+0928><U+0940><U+091A><U+0947> <U+0932><U+093F><U+0902><U+0915> <U+092E><U+0947><U+0902> <U+0915><U+094D><U+0932><U+093F><U+0915> <U+0915><U+0930><U+0915><U+0947> Download <U+0915><U+0930> <U+0938><U+0915><U+0924><U+0947> <U+0939><U+0948><U+0902>...,https://i.ytimg.com/vi/A2E5r3OE1r8/default.jpg,120,90,https://i.ytimg.com/vi/A2E5r3OE1r8/mqdefault.jpg,320,180,https://i.ytimg.com/vi/A2E5r3OE1r8/hqdefault.jpg,480,360,Online Study Point,none,22399,2155,33,0,141,11,2019
yGpBC5Wngc8,"That is precisity Chineseium translatory explanationism ;)
Crap, not a single picture of the sky through the instrument
2:09 haha
Well just learned something, precisity. 
 I’ve never used the word but I like it. Precision needs a rest.
4:29 person powder coating needs better PPE
Impressive, Scott.  Big improvement over the original release.  Would love to review it one day.
Hello, I have an older 400 Explore scientific, thanks for the video! I wanted to know if in these generations, you had fixed the problem with the connection between the UTA and the tubes. The issue was that the threaded insert in the L shaped bracket screwed on the UTA on which the tube screws could 'un-insert' from the L bracket. My suggestion is to swap the insert the other way around and make the tube holes larger. This way, the insert can not get loose, AND the protruding insert will then be able to be used as a guide to place the tubes...
?...
So which one of you bought this post a video
Dogs in cage 0:53? I don't like it. ?
?ch habe ein bresser pollux 150mm/1400 mm gekauft und ich sehe immer die 2. Spiegel das ist mein erste teleskop ich weiss nicht wie man es benützt können sie mir helfen
Why is this so big when 500 or 600 f/4 lenses are just a small fraction of the size?
I thought the explore scientific was made in China.
How many grundalwanes does this have? Do you think it could cope with a parallel but orthogonal load perpendicularly in flux with the trunion field?

I should clarify, I'm looking for something that can cope with approcisely 69,420 Geiger-trunsled flouresience tubas
The wording/grammar in this video is just terrible. What i cant understand is how the guy doing the commentary even went along with the script. I mean he's a native english speaker !",12.39,2019-05-08,UCUcNwWWYW3tM4hcOZj3Msmg,explore scientific ultra light 20 39 39 dobson 500mm f 3 6 generation ii,Ultra Light Dobsonian 500mm GENERATION II - telescope mechanics handcrafted in HUNGARY and GERMANY. - Truss-Dobson in full Aluminium construction ...,https://i.ytimg.com/vi/yGpBC5Wngc8/default.jpg,120,90,https://i.ytimg.com/vi/yGpBC5Wngc8/mqdefault.jpg,320,180,https://i.ytimg.com/vi/yGpBC5Wngc8/hqdefault.jpg,480,360,Bresser,none,11450,157,10,0,25,5,2019
jYl8qnwMvwI,,,2019-11-09,UCihO3xa91qrgYzf-yULIPqA,<U+09AA><U+09B0><U+09BF><U+09AC><U+09C7><U+09B6> <U+09AC><U+09BF><U+09A6><U+09CD><U+09AF><U+09BE> 20 mcq environmental science 20 mcq,PATR 1 : https://youtu.be/kcEJhBbTJeQ PART 2 : https://youtu.be/jYl8qnwMvwI <U+09AA><U+09B0><U+09BF><U+09AC><U+09C7><U+09B6> <U+09AC><U+09BF><U+09A6><U+09CD><U+09AF><U+09BE> 20 MCQ || Environmental science 20 MCQ || In this video we trying ...,https://i.ytimg.com/vi/jYl8qnwMvwI/default.jpg,120,90,https://i.ytimg.com/vi/jYl8qnwMvwI/mqdefault.jpg,320,180,https://i.ytimg.com/vi/jYl8qnwMvwI/hqdefault.jpg,480,360,Unacademy - WBPSC,none,2434,208,7,0,21,11,2019
M85P9qkcQ-M,,,2019-09-18,UCkuu5hABB3lGvXFHHVtwr3Q,20 small things are all the flavor of science and technology the small assistant of the enterprise n,20 small things are all the flavor of science and technology the small assistant of the enterprise number of domestic Pokbaby trembler.,https://i.ytimg.com/vi/M85P9qkcQ-M/default.jpg,120,90,https://i.ytimg.com/vi/M85P9qkcQ-M/mqdefault.jpg,320,180,https://i.ytimg.com/vi/M85P9qkcQ-M/hqdefault.jpg,480,360,Mikalyn Nkauj,none,0,0,0,0,0,9,2019
S-nEFfxZ3rM,,,2019-09-12,UC7UFOK9ZBwxEpSsz7lnIVZw,bsmrstu admission test 2019 20 bangabandhu sheikh mujibur rahman science amp technology university,BSMRSTU Website Link- https://www.admission.bsmrstu.edu.bd/b/admission/ This Video About Bangabandhu Sheikh Mujibur Rahman Science & Technology ...,https://i.ytimg.com/vi/S-nEFfxZ3rM/default.jpg,120,90,https://i.ytimg.com/vi/S-nEFfxZ3rM/mqdefault.jpg,320,180,https://i.ytimg.com/vi/S-nEFfxZ3rM/hqdefault.jpg,480,360,ICT Point,none,28893,793,17,0,137,9,2019
a5lZ8SxFYfk,,,2019-12-01,UCmAIxR82R7uVggBEAm56zkw,20 20 and 50 50 science and technology defense technology 3 surface fleet aircraft carrier,visit full course at: https://synopsisias.in/ For queries related to the course mail us at synopsisias.in@gmail.com or 9620206040 ...,https://i.ytimg.com/vi/a5lZ8SxFYfk/default.jpg,120,90,https://i.ytimg.com/vi/a5lZ8SxFYfk/mqdefault.jpg,320,180,https://i.ytimg.com/vi/a5lZ8SxFYfk/hqdefault.jpg,480,360,Synopsis IAS - Synacademy,none,553,44,0,0,11,12,2019
tfPOc5Y4IUQ,,,2019-09-15,UCV5n4LucZyknpq4QqaNZqug,science and technology series video no 20,"13 Science and technology short video collection... 1. Burning cotton wool, please raise your hand when you have been a child. 2. The growth of fungi will ...",https://i.ytimg.com/vi/tfPOc5Y4IUQ/default.jpg,120,90,https://i.ytimg.com/vi/tfPOc5Y4IUQ/mqdefault.jpg,320,180,https://i.ytimg.com/vi/tfPOc5Y4IUQ/hqdefault.jpg,480,360,DnaDan,none,1,0,0,0,0,9,2019
yJevesLTdRY,,,2019-10-20,UCAh1g5umJIAl-Ar4adPT6mw,upsc tamil tnpsc tamil science and technology news analysis part 1 20 10 2019,Blue light link https://youtu.be/ulhwnWJzSe8 Probiotics link https://youtu.be/pX9Df_DIK2g Protein link https://youtu.be/k-JKBd6K_lw part 2 link ...,https://i.ytimg.com/vi/yJevesLTdRY/default.jpg,120,90,https://i.ytimg.com/vi/yJevesLTdRY/mqdefault.jpg,320,180,https://i.ytimg.com/vi/yJevesLTdRY/hqdefault.jpg,480,360,Virtual Vaithi,none,1041,49,2,0,5,10,2019
iVWBRWMXSjc,,,2019-10-29,UCFdexKRIM50DROK9pAbJyJw,best cube 20 best coub <U+0441><U+0431><U+043E><U+0440><U+043D><U+0438><U+043A> <U+043A><U+0443><U+0431><U+043E><U+0432> cube science amp technology,"<U+0414><U+043E><U+0431><U+0440><U+043E> <U+043F><U+043E><U+0436><U+0430><U+043B><U+043E><U+0432><U+0430><U+0442><U+044C> <U+043D><U+0430> <U+043A><U+0430><U+043D><U+0430><U+043B>! <U+0412> <U+044D><U+0442><U+043E><U+043C> <U+0432><U+0438><U+0434><U+0435><U+043E> <U+043F><U+0440><U+0435><U+0434><U+0441><U+0442><U+0430><U+0432><U+043B><U+0435><U+043D><U+044B> <U+0437><U+0430><U+0431><U+0430><U+0432><U+043D><U+044B><U+0435> <U+0432><U+0438><U+0440><U+0443><U+0441><U+043D><U+044B><U+0435> <U+0438><U+043D><U+0442><U+0435><U+0440><U+043D><U+0435><U+0442>-<U+043A><U+043B><U+0438><U+043F><U+044B>, <U+043A><U+043E><U+0442><U+043E><U+0440><U+044B><U+0435> <U+0441><U+0434><U+0435><U+043B><U+0430><U+044E><U+0442>...",https://i.ytimg.com/vi/iVWBRWMXSjc/default.jpg,120,90,https://i.ytimg.com/vi/iVWBRWMXSjc/mqdefault.jpg,320,180,https://i.ytimg.com/vi/iVWBRWMXSjc/hqdefault.jpg,480,360,Coub science&technology,none,27,0,0,0,0,10,2019
2pLsq-jKqkU,,,2019-12-05,UCmAIxR82R7uVggBEAm56zkw,20 20 and 50 50 science and technology defense technology mtcr wassenaar nsg npt etc,visit full course at: https://synopsisias.in/ For queries related to the course mail us at synopsisias.in@gmail.com or 9620206040 ...,https://i.ytimg.com/vi/2pLsq-jKqkU/default.jpg,120,90,https://i.ytimg.com/vi/2pLsq-jKqkU/mqdefault.jpg,320,180,https://i.ytimg.com/vi/2pLsq-jKqkU/hqdefault.jpg,480,360,Synopsis IAS - Synacademy,none,704,42,0,0,10,12,2019
h8ac69EkY3I,,,2019-11-29,UCLLhVCsO2Em-IQXwqq2EVyw,<U+092A><U+093F><U+091B><U+094D><U+0932><U+0947> 20 <U+0935><U+0930><U+094D><U+0937><U+094B> <U+092E><U+0947> <U+0930><U+0947><U+0932><U+0935><U+0947> <U+092E><U+0947> <U+0938><U+092C><U+0938><U+0947> <U+091C><U+094D><U+092F><U+093E><U+0926><U+093E> <U+092C><U+093E><U+0930> repeat 50 science questions science <U+0907><U+0928><U+094D><U+0939><U+0947><U+0902> <U+0930><U+091F> <U+0932><U+0947><U+0902>,,https://i.ytimg.com/vi/h8ac69EkY3I/default.jpg,120,90,https://i.ytimg.com/vi/h8ac69EkY3I/mqdefault.jpg,320,180,https://i.ytimg.com/vi/h8ac69EkY3I/hqdefault.jpg,480,360,Online Shiksha,none,48073,2587,116,0,138,11,2019
