"video_id","publishedAt","channelId","title","description","thumbnails.default.url","thumbnails.default.width","thumbnails.default.height","thumbnails.medium.url","thumbnails.medium.width","thumbnails.medium.height","thumbnails.high.url","thumbnails.high.width","thumbnails.high.height","channelTitle","liveBroadcastContent","viewCount","likeCount","dislikeCount","favoriteCount","commentCount","month","year"
"JVuCp88daOY",2019-03-21,"UCGWDGMuWeng-tctRbgrQwYg","us 2019 movie review spoiler free","Jordan Peele shocks and wows audiences with his second film 'Us'! Check out my review of it here! The written review can be found here!","https://i.ytimg.com/vi/JVuCp88daOY/default.jpg","120","90","https://i.ytimg.com/vi/JVuCp88daOY/mqdefault.jpg","320","180","https://i.ytimg.com/vi/JVuCp88daOY/hqdefault.jpg","480","360","Patrick Beatty Reviews","none",145,10,1,0,2,3,2019
"4UrvLMxxISQ",2013-08-23,"UCJUXynJYyUseTSGFq7Pq4Tw","unibet uk u s open tv ad with goran ivanisevic","Unibet UK`s Summer of Sports TV Ad for the U.S. Open featuring Goran Ivanisevic as our Armchair Expert.","https://i.ytimg.com/vi/4UrvLMxxISQ/default.jpg","120","90","https://i.ytimg.com/vi/4UrvLMxxISQ/mqdefault.jpg","320","180","https://i.ytimg.com/vi/4UrvLMxxISQ/hqdefault.jpg","480","360","Unibet UK","none",266,1,0,0,1,8,2013
"zMl8vl2WYCQ",2019-06-12,"UCv9UlSnCQkd3DLFUjnglo7A","our first videocast fail just us doodz s2 ep1","This week the Doodz started their first episode for season 2 of Just Us Doodz. They opened up with inducing their self and showing their self on the show.","https://i.ytimg.com/vi/zMl8vl2WYCQ/default.jpg","120","90","https://i.ytimg.com/vi/zMl8vl2WYCQ/mqdefault.jpg","320","180","https://i.ytimg.com/vi/zMl8vl2WYCQ/hqdefault.jpg","480","360","Just Us Doodz","none",43,2,0,0,1,6,2019
"wVZlUeQkxqI",2017-09-18,"UC4k3HO5n3aSq_bayF-UHiGg","alcohol fueled raving stream newscast","I probably need to not drink so much before doing one of these streams. Patreon - https://www.patreon.com/LouisLeVau Social Media: Twitter ...","https://i.ytimg.com/vi/wVZlUeQkxqI/default.jpg","120","90","https://i.ytimg.com/vi/wVZlUeQkxqI/mqdefault.jpg","320","180","https://i.ytimg.com/vi/wVZlUeQkxqI/hqdefault.jpg","480","360","Louis Le Vau","none",5578,233,4,0,53,9,2017
"m3hTDPgVr-c",2015-07-20,"UCJmSX7ghommK3pwMLGNUvPA","prosecutor says bill cosby 39 s words could be damaging in court","A lawyer for three women suing Bill Cosby for defamation says the release of decade-old testimony destroys Cosby as a public moralist. The Associated Press ...","https://i.ytimg.com/vi/m3hTDPgVr-c/default.jpg","120","90","https://i.ytimg.com/vi/m3hTDPgVr-c/mqdefault.jpg","320","180","https://i.ytimg.com/vi/m3hTDPgVr-c/hqdefault.jpg","480","360","Wochit News","none",44,1,1,0,1,7,2015
"vvrsT5IL9mo",2010-12-17,"UCDK0-NINoukzsj-79uChjYg","dollars why it crackles crackle","All your favorite Crackle content has made the move over to http://www.Crackle.com. Create a free account and enjoy! SUBSCRIBE: http://bit.ly/CrackleSub ...","https://i.ytimg.com/vi/vvrsT5IL9mo/default.jpg","120","90","https://i.ytimg.com/vi/vvrsT5IL9mo/mqdefault.jpg","320","180","https://i.ytimg.com/vi/vvrsT5IL9mo/hqdefault.jpg","480","360","YouTube Movies","none",1260,6,0,0,0,12,2010
"e_yi22jDODE",2018-03-09,"UCSbdzIEkfyjJXFijIAHq1SA","show dogs trailer 2  anything anytime","Check out the official Show Dogs trailer starring Will Arnett! Let us know what you think in the comments below. <U+25BB> Buy Tickets to Show Dogs: ...","https://i.ytimg.com/vi/e_yi22jDODE/default.jpg","120","90","https://i.ytimg.com/vi/e_yi22jDODE/mqdefault.jpg","320","180","https://i.ytimg.com/vi/e_yi22jDODE/hqdefault.jpg","480","360","ZØRØ Gaming","none",11,3,0,0,0,3,2018
"OYWAQXudxZ4",2017-05-21,"UCBbpLKJLhIbDd_wX4ubU_Cw","<U+092D><U+093E><U+0930><U+0924> <U+0938><U+0947> <U+0926><U+094B><U+0938><U+094D><U+0924><U+0940> <U+092A><U+0930> <U+0905><U+092B><U+093C><U+0917><U+093C><U+093E><U+0928><U+093F><U+0938><U+094D><U+0924><U+093E><U+0928> <U+092A><U+0930> <U+092D><U+0921><U+093C><U+0915><U+093E> <U+092A><U+093E><U+0915> pakistan warns afghanistan","<U+092D><U+093E><U+0930><U+0924> <U+0914><U+0930> <U+0905><U+092B><U+0917><U+093E><U+0928><U+093F><U+0938><U+094D><U+0924><U+093E><U+0928> <U+0915><U+0940> <U+092C><U+0922><U+093C><U+0924><U+0940> <U+0926><U+094B><U+0938><U+094D><U+0924><U+0940> <U+092A><U+093E><U+0915><U+093F><U+0938><U+094D><U+0924><U+093E><U+0928> <U+0915><U+0947> <U+0932><U+093F><U+090F> <U+092A><U+0930><U+0947><U+0936><U+093E><U+0928><U+0940> <U+0915><U+093E> <U+0938><U+092C><U+092C> <U+092C><U+0928> <U+0917><U+0908>...","https://i.ytimg.com/vi/OYWAQXudxZ4/default.jpg","120","90","https://i.ytimg.com/vi/OYWAQXudxZ4/mqdefault.jpg","320","180","https://i.ytimg.com/vi/OYWAQXudxZ4/hqdefault.jpg","480","360","DB Live","none",639,12,0,0,0,5,2017
"BnARXqpXqEc",2015-07-21,"UCHTK-2W11Vh1V4uwofOfR4w","wrap aftermath of police station bombings reactions","Al-Shaab area, east Baghdad 1. Wide shot of blast site, with destroyed building being guarded by US soldiers 2. Large crater caused by blast 3. Close up people ...","https://i.ytimg.com/vi/BnARXqpXqEc/default.jpg","120","90","https://i.ytimg.com/vi/BnARXqpXqEc/mqdefault.jpg","320","180","https://i.ytimg.com/vi/BnARXqpXqEc/hqdefault.jpg","480","360","AP Archive","none",28,0,0,0,0,7,2015
"audDh1q8YhU",2010-07-23,"UC60eoiO50xUmYqyVBOQO36g","mind games by john lennon hd remixed amp remastered","In mid-1973 Lennon decided he wanted to record a new album. He liked the musicians assembled for Ono's album by their assistant and production coordinator, ...","https://i.ytimg.com/vi/audDh1q8YhU/default.jpg","120","90","https://i.ytimg.com/vi/audDh1q8YhU/mqdefault.jpg","320","180","https://i.ytimg.com/vi/audDh1q8YhU/hqdefault.jpg","480","360","DayTripper66","none",14993,132,4,0,10,7,2010
"rkBhqz4pxQY",2015-07-21,"UCfkpM3RuyUHqY4nRlP-egNA","garrison keillor says he 39 s retiring from popular radio show","Garrison Keillor, creator and longtime host of the popular ""A Prairie Home Companion"" radio show, says he means it this time: He's retiring. In an interview ...","https://i.ytimg.com/vi/rkBhqz4pxQY/default.jpg","120","90","https://i.ytimg.com/vi/rkBhqz4pxQY/mqdefault.jpg","320","180","https://i.ytimg.com/vi/rkBhqz4pxQY/hqdefault.jpg","480","360","Wochit Entertainment","none",609,3,0,0,0,7,2015
"nIT-hzwRBM0",2018-04-10,"UCH8UNypuhoJORR0_xQM-qUg","fortnite live level 72 2300 kills 66 wins fortnite battle royale","ATTENTION<U+274C><U+274C> <U+274C><U+274C> 2000 V-BUCK LIVE GIVEAWAY!!! <U+274C><U+274C> I am happy to announce that I've recently started up my very own YouTube channel! To start my ...","https://i.ytimg.com/vi/nIT-hzwRBM0/default.jpg","120","90","https://i.ytimg.com/vi/nIT-hzwRBM0/mqdefault.jpg","320","180","https://i.ytimg.com/vi/nIT-hzwRBM0/hqdefault.jpg","480","360","The Royal Mitten","none",32,5,0,0,0,4,2018
"F69nKKwkJ24",2015-07-21,"UCfkpM3RuyUHqY4nRlP-egNA","keillor says he 39 s sure he 39 s retiring from 39 prairie home 39","Garrison Keillor, creator and longtime host of the popular ""A Prairie Home Companion"" radio show, says he means it this time: He's retiring. In an interview ...","https://i.ytimg.com/vi/F69nKKwkJ24/default.jpg","120","90","https://i.ytimg.com/vi/F69nKKwkJ24/mqdefault.jpg","320","180","https://i.ytimg.com/vi/F69nKKwkJ24/hqdefault.jpg","480","360","Wochit Entertainment","none",256,0,0,0,0,7,2015
"HQvFWBGOgSg",2018-10-18,"UCUWieeOJiY_fzVjS0rDexGQ","destroyer trailer 1 2018 movieclips trailers","Check out the official Destroyer trailer starring Nicole Kidman! Let us know what you think in the comments below. <U+25BB> Buy Tickets to Destroyer: ...","https://i.ytimg.com/vi/HQvFWBGOgSg/default.jpg","120","90","https://i.ytimg.com/vi/HQvFWBGOgSg/mqdefault.jpg","320","180","https://i.ytimg.com/vi/HQvFWBGOgSg/hqdefault.jpg","480","360","Trailer Channel Entertainment","none",4,2,0,0,0,10,2018
"S9l4L-gMyhg",2018-05-19,"UCa07I4HndbpcxfSmcPQocKw","day short film awareness series","Day is a Short Film about a day of a depressed person, made as a part of the Awareness Series Project. Depression, anxiety and othe mental health are very ...","https://i.ytimg.com/vi/S9l4L-gMyhg/default.jpg","120","90","https://i.ytimg.com/vi/S9l4L-gMyhg/mqdefault.jpg","320","180","https://i.ytimg.com/vi/S9l4L-gMyhg/hqdefault.jpg","480","360","Laura Kowalska","none",111,14,1,0,0,5,2018
"rP3433VY8VY",2018-09-08,"UC92gV6poghWpKcIZLH9203Q","9 8 1942 sal valentino laugh laugh beau brummels","Sal Valentino (born Salvatore Willard Spampinato, September 8, 1942) is an American rock musician, singer and songwriter, best known as lead singer of The ...","https://i.ytimg.com/vi/rP3433VY8VY/default.jpg","120","90","https://i.ytimg.com/vi/rP3433VY8VY/mqdefault.jpg","320","180","https://i.ytimg.com/vi/rP3433VY8VY/hqdefault.jpg","480","360","Remember Our Music","none",88,3,0,0,0,9,2018
"xCJQfuXcWLA",2019-11-17,"UCv9UlSnCQkd3DLFUjnglo7A","drunk doodz just us doodz s3 ep5","Sorry again for the audio in the video we are having some technical difficulties but it will be fix soon.....thank you. This week the Doodz decided to open up the ...","https://i.ytimg.com/vi/xCJQfuXcWLA/default.jpg","120","90","https://i.ytimg.com/vi/xCJQfuXcWLA/mqdefault.jpg","320","180","https://i.ytimg.com/vi/xCJQfuXcWLA/hqdefault.jpg","480","360","Just Us Doodz","none",18,2,0,0,0,11,2019
"nZRj9nOZQ_s",2017-11-26,"UC-woTDQWrCsESntNLx2wDmg","amazon hosting 2018 rose parade","Amazon is taking over and hosting its first ever Rose Parade on New Years Day. Will Farrell and Molly Shannon as fake TV hosts named Cord Hosenbeck and ...","https://i.ytimg.com/vi/nZRj9nOZQ_s/default.jpg","120","90","https://i.ytimg.com/vi/nZRj9nOZQ_s/mqdefault.jpg","320","180","https://i.ytimg.com/vi/nZRj9nOZQ_s/hqdefault.jpg","480","360","Retro Crunch","none",1694,8,5,0,2,11,2017
"yU0_8XbXyOY",2019-10-24,"UCv9UlSnCQkd3DLFUjnglo7A","the priest touched us just us doodz s3 ep3","Sorry again for the delay in the video we are having some technical difficulties but it will be fix soon.....thank you. This week the Doodz decide to open up the ...","https://i.ytimg.com/vi/yU0_8XbXyOY/default.jpg","120","90","https://i.ytimg.com/vi/yU0_8XbXyOY/mqdefault.jpg","320","180","https://i.ytimg.com/vi/yU0_8XbXyOY/hqdefault.jpg","480","360","Just Us Doodz","none",34,2,0,0,0,10,2019
"AGfIoN4CM_Q",2014-10-17,"UC_QCGneCW7kEwdjawFSDkCw","govt boys middle school pandhurna m p india psk 2014 electric circuit fun phase","It's an Electric Circuit Fun Phase with Government Boys Middle Schools, Pandhurna (M.P.), India. It is a second module of Pratyaya Eduresearch Lab's ...","https://i.ytimg.com/vi/AGfIoN4CM_Q/default.jpg","120","90","https://i.ytimg.com/vi/AGfIoN4CM_Q/mqdefault.jpg","320","180","https://i.ytimg.com/vi/AGfIoN4CM_Q/hqdefault.jpg","480","360","Pratyaya EduResearch Lab","none",759,1,0,0,0,10,2014
"KkN5bciQyM8",2015-07-21,"UCHTK-2W11Vh1V4uwofOfR4w","wrap fans set up a makeshift memorial for actor found dead at 28 adds voxes","SHOTLIST 1. Pan down of apartment block where Ledger lived 2. Media outside building 3. Close up woman standing up, man kneeling, pull out to flowers and ...","https://i.ytimg.com/vi/KkN5bciQyM8/default.jpg","120","90","https://i.ytimg.com/vi/KkN5bciQyM8/mqdefault.jpg","320","180","https://i.ytimg.com/vi/KkN5bciQyM8/hqdefault.jpg","480","360","AP Archive","none",35,0,0,0,0,7,2015
"T7uYVP6_76A",2019-01-21,"UCHVwKV6PaDVWd9BFdvu9sBQ","curve girl plus size try on haul rgb diva by jay","HAPPY NEW YEAR LOVES!! I am so happy to be back I have been so busy but I will explain everything in another video! For now just sit back ad enjoy this haul!","https://i.ytimg.com/vi/T7uYVP6_76A/default.jpg","120","90","https://i.ytimg.com/vi/T7uYVP6_76A/mqdefault.jpg","320","180","https://i.ytimg.com/vi/T7uYVP6_76A/hqdefault.jpg","480","360","I Am Miss Jay","none",1810,56,4,0,6,1,2019
"jqBtakMbD2Q",2019-09-25,"UCJJdn8P_H9I3Vuvsc2iQqlg","trending top 100 l box office movies 2019","Top 100 Box Office Movies as per below: 1 Avengers: Endgame 2 The Lion King (2019) 3 Spider-Man: Far from Home...","https://i.ytimg.com/vi/jqBtakMbD2Q/default.jpg","120","90","https://i.ytimg.com/vi/jqBtakMbD2Q/mqdefault.jpg","320","180","https://i.ytimg.com/vi/jqBtakMbD2Q/hqdefault.jpg","480","360","TRENDING TOP 100","none",62,4,0,0,0,9,2019
"wDRagxmAXBg",2016-02-20,"UCJmSX7ghommK3pwMLGNUvPA","someone paid 35 000 for a lock of john lennon 39 s hair","On Saturday a lock of John Lennon's hair that was snipped as he prepared for a film role sold for $35000. Dallas-based Heritage Auctions said that the 4-inch ...","https://i.ytimg.com/vi/wDRagxmAXBg/default.jpg","120","90","https://i.ytimg.com/vi/wDRagxmAXBg/mqdefault.jpg","320","180","https://i.ytimg.com/vi/wDRagxmAXBg/hqdefault.jpg","480","360","Wochit News","none",1062,4,0,0,7,2,2016
"_BWQSBA_nmU",2015-07-21,"UCfkpM3RuyUHqY4nRlP-egNA","keillor says he 39 s sure he 39 s retiring from 39 prairie home 39","Garrison Keillor, creator and longtime host of the popular ""A Prairie Home Companion"" radio show, says he means it this time: He's retiring. In an interview ...","https://i.ytimg.com/vi/_BWQSBA_nmU/default.jpg","120","90","https://i.ytimg.com/vi/_BWQSBA_nmU/mqdefault.jpg","320","180","https://i.ytimg.com/vi/_BWQSBA_nmU/hqdefault.jpg","480","360","Wochit Entertainment","none",502,2,0,0,0,7,2015
"ZYV5fX2aYAo",2015-07-20,"UCfkpM3RuyUHqY4nRlP-egNA","sag gives lifetime achievement award to carol burnett","The Screen Actors Guild is recognizing Carol Burnett for her six decades in entertainment. The actors' union announced Monday that Burnett will receive its ...","https://i.ytimg.com/vi/ZYV5fX2aYAo/default.jpg","120","90","https://i.ytimg.com/vi/ZYV5fX2aYAo/mqdefault.jpg","320","180","https://i.ytimg.com/vi/ZYV5fX2aYAo/hqdefault.jpg","480","360","Wochit Entertainment","none",489,0,0,0,0,7,2015
"TPOQo7aEybg",2018-01-02,"UCsNdeLwEZf86swPD3qJJ7Dw","nation reporter us bans usd 255 mn military aid to pakistan","US President Donald Trump banned USD 255 mn military aid to Pakistan after Pakistan supported terrorism. Subscribe us on YouTube Channel: ...","https://i.ytimg.com/vi/TPOQo7aEybg/default.jpg","120","90","https://i.ytimg.com/vi/TPOQo7aEybg/mqdefault.jpg","320","180","https://i.ytimg.com/vi/TPOQo7aEybg/hqdefault.jpg","480","360","News Nation","none",139,0,0,0,0,1,2018
"1xx_MXToTRs",2015-07-20,"UCfkpM3RuyUHqY4nRlP-egNA","stewart heads into home stretch at 39 daily show 39","Jon Stewart enters the home stretch of his 16 years on Comedy Central's ""The Daily Show"" on Monday, with 12 more nights of jokes at the expense of those who ...","https://i.ytimg.com/vi/1xx_MXToTRs/default.jpg","120","90","https://i.ytimg.com/vi/1xx_MXToTRs/mqdefault.jpg","320","180","https://i.ytimg.com/vi/1xx_MXToTRs/hqdefault.jpg","480","360","Wochit Entertainment","none",103,0,0,0,0,7,2015
"-s1NCOcDsiE",2014-03-20,"UC4SH8rh0OjYV3zwqnIfqNbA","breaking 2 quot objects quot spotted off coast of australia malaysian plane","Is this the missing plane from Malaysia in the Ocean 1500 miles off the coast of Australia http://www.paulbegleyprophecy.com also ...","https://i.ytimg.com/vi/-s1NCOcDsiE/default.jpg","120","90","https://i.ytimg.com/vi/-s1NCOcDsiE/mqdefault.jpg","320","180","https://i.ytimg.com/vi/-s1NCOcDsiE/hqdefault.jpg","480","360","Paul Begley","none",8448,143,4,0,58,3,2014
"Otie8ioHp7Q",2013-02-19,"UCJmSX7ghommK3pwMLGNUvPA","news north atlantic treaty organization bp raytheon co pakistan","U.S. General Picked for Top NATO Military Post Will Retire Gen. John R. Allen, the top United States commander in Afghanistan, will retire from the military to ...","https://i.ytimg.com/vi/Otie8ioHp7Q/default.jpg","120","90","https://i.ytimg.com/vi/Otie8ioHp7Q/mqdefault.jpg","320","180","https://i.ytimg.com/vi/Otie8ioHp7Q/hqdefault.jpg","480","360","Wochit News","none",63,0,0,0,0,2,2013
"IzF4FSzVUJY",2015-02-01,"UCBVGZny2lpynNDQe-rdC1eA","the war on terror terrorists and isis al qaeda are fake","thanks for watching https://www.youtube.com/watch?v=ON5QRDjuT-I https://www.youtube.com/watch?v=BY98MS5KZE8 ...","https://i.ytimg.com/vi/IzF4FSzVUJY/default.jpg","120","90","https://i.ytimg.com/vi/IzF4FSzVUJY/mqdefault.jpg","320","180","https://i.ytimg.com/vi/IzF4FSzVUJY/hqdefault.jpg","480","360","Amerishima2012","none",3312,190,3,0,48,2,2015
"OqK5MGD6Vkg",2017-07-23,"UCUowFWIWGw6Pv2JqfEj8njQ","police bodycams vs the amazing flying dindu","Here I address a recent case of a man who claimed to have been attacked by the police, which was refuted by video evidence from police body camera footage ...","https://i.ytimg.com/vi/OqK5MGD6Vkg/default.jpg","120","90","https://i.ytimg.com/vi/OqK5MGD6Vkg/mqdefault.jpg","320","180","https://i.ytimg.com/vi/OqK5MGD6Vkg/hqdefault.jpg","480","360","Aydin Paladin","none",86470,3994,244,0,970,7,2017
"GImiQcS-eZc",2013-11-23,"UCaxLPSbzi20ufqa6ZtiJf7g","bc8000 for saudi arabia riyal notes with uv mg counterfeit detection","In this video, we show our counter BC8000 can count old versions and new versions of Saudi Arabia Riyal banknotes with UV & MG counterfeit detection.","https://i.ytimg.com/vi/GImiQcS-eZc/default.jpg","120","90","https://i.ytimg.com/vi/GImiQcS-eZc/mqdefault.jpg","320","180","https://i.ytimg.com/vi/GImiQcS-eZc/hqdefault.jpg","480","360","bcash electronics","none",8709,14,0,0,0,11,2013
"IjmIRz-aD_w",2019-01-12,"UC9YvNRiOHKaYGEp4YsI-LtQ","video full funny xx china xhk asad ali tv","Commedy video china .Subscribe my channel.","https://i.ytimg.com/vi/IjmIRz-aD_w/default.jpg","120","90","https://i.ytimg.com/vi/IjmIRz-aD_w/mqdefault.jpg","320","180","https://i.ytimg.com/vi/IjmIRz-aD_w/hqdefault.jpg","480","360","Xhk Asad Ali TV","none",93,1,0,0,0,1,2019
"C9BurfA-VWA",2010-02-01,"UC59W-9gKIn42lzDKOTTBs5Q","paresh raval comedy","Comedy movie clips of paresh raval & kadarkhan.","https://i.ytimg.com/vi/C9BurfA-VWA/default.jpg","120","90","https://i.ytimg.com/vi/C9BurfA-VWA/mqdefault.jpg","320","180","https://i.ytimg.com/vi/C9BurfA-VWA/hqdefault.jpg","480","360","sachinpatel20us","none",2174,0,0,0,0,2,2010
"ye4MH8rWMu0",2014-09-20,"UCJmSX7ghommK3pwMLGNUvPA","cia stops spying on friendly nations in w europe","Stung by the backlash over a German caught selling secrets to the U.S. and the revelations of surveillance by the National Security Agency, the CIA has stopped ...","https://i.ytimg.com/vi/ye4MH8rWMu0/default.jpg","120","90","https://i.ytimg.com/vi/ye4MH8rWMu0/mqdefault.jpg","320","180","https://i.ytimg.com/vi/ye4MH8rWMu0/hqdefault.jpg","480","360","Wochit News","none",35,0,0,0,0,9,2014
"_-8tn1wJSYc",2016-04-20,"UCfkpM3RuyUHqY4nRlP-egNA","people 39 s world 39 s most beautiful woman quot of 2016 is","People Magazine has named Jennifer Aniston its ""World's Most Beautiful Woman"" of 2016. The 47-year-old actress graces the cover of People's 27th annual ...","https://i.ytimg.com/vi/_-8tn1wJSYc/default.jpg","120","90","https://i.ytimg.com/vi/_-8tn1wJSYc/mqdefault.jpg","320","180","https://i.ytimg.com/vi/_-8tn1wJSYc/hqdefault.jpg","480","360","Wochit Entertainment","none",119,0,1,0,0,4,2016
"bOFYW9ms5Cc",2016-06-09,"UChhbqFRL0elrRPyOdYR_Dog","t styles presents the worst of us black web series e5","When an accidental murder is committed by one of five siblings they make a poor attempt to cover up the gruesome crime. Roz Hood, the eldest of the quintet, ...","https://i.ytimg.com/vi/bOFYW9ms5Cc/default.jpg","120","90","https://i.ytimg.com/vi/bOFYW9ms5Cc/mqdefault.jpg","320","180","https://i.ytimg.com/vi/bOFYW9ms5Cc/hqdefault.jpg","480","360","T. Styles Presents","none",10982,125,3,0,29,6,2016
"MipGQQB84OU",2019-08-03,"UCzZpgppwC_XQMe8lFiI77-Q","refuting every immigration argument heck off commie","The left has given up hiding their agenda from the American people. They want unrestricted immigration and open borders. It's our job to make sure that they ...","https://i.ytimg.com/vi/MipGQQB84OU/default.jpg","120","90","https://i.ytimg.com/vi/MipGQQB84OU/mqdefault.jpg","320","180","https://i.ytimg.com/vi/MipGQQB84OU/hqdefault.jpg","480","360","John Doyle","none",93777,8819,192,0,2124,8,2019
"Ulo_nUMUX4g",2018-03-20,"UCfkpM3RuyUHqY4nRlP-egNA","fbi hunts for clues in austin city bombings","Investigators in Austin are combing for clues. The city has been rocked by a serial bomber responsible for four explosions. Law enforcement is getting more ...","https://i.ytimg.com/vi/Ulo_nUMUX4g/default.jpg","120","90","https://i.ytimg.com/vi/Ulo_nUMUX4g/mqdefault.jpg","320","180","https://i.ytimg.com/vi/Ulo_nUMUX4g/hqdefault.jpg","480","360","Wochit Entertainment","none",23,0,0,0,0,3,2018
"S8tboAMrt-M",2017-04-20,"UCpVhqCnd6iz3gfJUuGM1r7g","awake with john amp markus april 20th 2017","Happy 4/20! Celebrate Cannabis today! It's your right as a human. Join the conversation with John & Markus about how we deal with the issues that matter.","https://i.ytimg.com/vi/S8tboAMrt-M/default.jpg","120","90","https://i.ytimg.com/vi/S8tboAMrt-M/mqdefault.jpg","320","180","https://i.ytimg.com/vi/S8tboAMrt-M/hqdefault.jpg","480","360","Uphill Media","none",458,42,1,0,6,4,2017
"PJM1Sk3pAHE",2018-07-30,"UC7iFCufFDy9Bg7aZ-7FY3ng","bb20 brett and fessy expose kaitlyn","BB20 Brett and Fessy EXPOSE Kaitlyn big brother live feeds.","https://i.ytimg.com/vi/PJM1Sk3pAHE/default.jpg","120","90","https://i.ytimg.com/vi/PJM1Sk3pAHE/mqdefault.jpg","320","180","https://i.ytimg.com/vi/PJM1Sk3pAHE/hqdefault.jpg","480","360","livvie","none",23973,248,4,0,26,7,2018
"SaKUrnlpdKQ",2013-07-19,"UCJmSX7ghommK3pwMLGNUvPA","in wake of zimmerman verdict obama makes extensive statement on race in america","In Wake of Zimmerman Verdict, Obama Makes Extensive Statement on Race in America President Barack Obama addressed the verdict in the Trayvon Martin ...","https://i.ytimg.com/vi/SaKUrnlpdKQ/default.jpg","120","90","https://i.ytimg.com/vi/SaKUrnlpdKQ/mqdefault.jpg","320","180","https://i.ytimg.com/vi/SaKUrnlpdKQ/hqdefault.jpg","480","360","Wochit News","none",64,0,0,0,0,7,2013
"eU_yfcebv04",2016-12-13,"UCGYaEm70pkI2QkDDha0ELUQ","kavi kesar dev marwadi in malpura top hasya kavi samelan <U+092E><U+093E><U+0930><U+0935><U+093E><U+095C><U+0940> <U+0915><U+0902><U+091C><U+0942><U+0938> <U+0928><U+0939><U+0940><U+0902> <U+0939><U+094B><U+0924><U+0947>","Kavi kesar dev marwadi malpura me sahityalok sansthan ke kavi samelan.","https://i.ytimg.com/vi/eU_yfcebv04/default.jpg","120","90","https://i.ytimg.com/vi/eU_yfcebv04/mqdefault.jpg","320","180","https://i.ytimg.com/vi/eU_yfcebv04/hqdefault.jpg","480","360","Indian Political Forum","none",4562,22,3,0,1,12,2016
"Cdsh7TACICo",2008-07-06,"UCPNUJB3qLBd1BBvT6PHPSKA","the crazicans episode v part 1 of 4","The Crazicans Episode V Is Finally Here! With More Random Comedy Than Ever Before! Followed By Better Quality And A Lot More To Offer! When You ...","https://i.ytimg.com/vi/Cdsh7TACICo/default.jpg","120","90","https://i.ytimg.com/vi/Cdsh7TACICo/mqdefault.jpg","320","180","https://i.ytimg.com/vi/Cdsh7TACICo/hqdefault.jpg","480","360","The Crazicans","none",942,32,3,0,0,7,2008
"Qy3HcH7gKRs",2017-04-17,"UCR8_BX9gsytruT66pp1ezag","us military in afghanistan god help send them home now","US Military in Afghanistan God HELP! Please join me in sending out prayers and decrees to God for miracle after miracle after miracle to the awakened ...","https://i.ytimg.com/vi/Qy3HcH7gKRs/default.jpg","120","90","https://i.ytimg.com/vi/Qy3HcH7gKRs/mqdefault.jpg","320","180","https://i.ytimg.com/vi/Qy3HcH7gKRs/hqdefault.jpg","480","360","Bella Katrina","none",124,2,1,0,1,4,2017
"8KD7_kscN7Q",2018-05-04,"UCOuQqSD1ui87plRmhDhphsA","top upcoming chinese movies 2018 01","WATCH THIS SHOWS WITH ENGLISH SUBS HERE https://amzn.to/33THw9j https://amzn.to/33THw9j https://amzn.to/33THw9j https://amzn.to/33THw9j ...","https://i.ytimg.com/vi/8KD7_kscN7Q/default.jpg","120","90","https://i.ytimg.com/vi/8KD7_kscN7Q/mqdefault.jpg","320","180","https://i.ytimg.com/vi/8KD7_kscN7Q/hqdefault.jpg","480","360","Tuzo Anime","none",4268,27,1,0,1,5,2018
"kJJMZCTN9Jg",2018-06-28,"UC4Ejd2WpY8UPw3rzRrm8WNw","2018 seinfeld re enactments newman and kramer go to traffic court actual scene at 4 16","A re-enactment of the comedic legacies of Kramer and Newman along with the original scene where Newman and Kramer go to traffic court.","https://i.ytimg.com/vi/kJJMZCTN9Jg/default.jpg","120","90","https://i.ytimg.com/vi/kJJMZCTN9Jg/mqdefault.jpg","320","180","https://i.ytimg.com/vi/kJJMZCTN9Jg/hqdefault.jpg","480","360","Hoss Haven Entertainment","none",94,4,0,0,0,6,2018
"6EqrExn4Ngc",2013-03-26,"UCZMnSSxOfaqO7n8F-zF_IOw","jim carrey quot cold dead hands quot original video","http://www.breitbart.com/Big-Government/2012/12/20/US-Homicide-Rates-are-at-a-50-Year-Low FACT: In 2004<U+FEFF> the Assault Weapon ban expired FACT: Every ...","https://i.ytimg.com/vi/6EqrExn4Ngc/default.jpg","120","90","https://i.ytimg.com/vi/6EqrExn4Ngc/mqdefault.jpg","320","180","https://i.ytimg.com/vi/6EqrExn4Ngc/hqdefault.jpg","480","360","Durithick P. Steele","none",54184,82,304,0,384,3,2013
"2A_jom8T2Gk",2008-03-25,"UCvNhLH3gVmj85LE_rsdMhGg","h w brands on andrew jackson 39 s duel","March 10, 2008 - Award-winning historian and presidential biographer, H. W. Brands, discusses his second of six lessons for the next president of the United ...","https://i.ytimg.com/vi/2A_jom8T2Gk/default.jpg","120","90","https://i.ytimg.com/vi/2A_jom8T2Gk/mqdefault.jpg","320","180","https://i.ytimg.com/vi/2A_jom8T2Gk/hqdefault.jpg","480","360","Hauenstein Center","none",2858,8,1,0,4,3,2008
"ThAxinAyG4w",2013-07-18,"UCE7cmNSkYx7M05Zir-10VZg","game test german hd hospital tycoon","Hier Zeige ich euch im Game Test Hospital Tycoon. Ich hoffe ich kann eure Entscheidung erleichtern wenn ihr es Kaufen möchtet ob es sich den lohnt oder nicht ...","https://i.ytimg.com/vi/ThAxinAyG4w/default.jpg","120","90","https://i.ytimg.com/vi/ThAxinAyG4w/mqdefault.jpg","320","180","https://i.ytimg.com/vi/ThAxinAyG4w/hqdefault.jpg","480","360","BlooddragonLP","none",3113,5,4,0,0,7,2013
