video_id,comment_text,,,,,,,
RxAtuMu_ph4,"This is a sequel, she had on feather falling boots",,,,,,,
RxAtuMu_ph4,One of the most helpful world-building tools is the consistency of costume design throughout the MCU. This is what a supersoldier suid looks like. This is what Star Tech looks like. This is what Wakandan tech looks like. It adds so much to the believability.,,,,,,,
RxAtuMu_ph4,Marvel: releases the Black Widow trailer,,,,,,,
RxAtuMu_ph4,Hawkeye: cries,,,,,,,
RxAtuMu_ph4,Kinda unessecary if we know shes gonna die anyways.,,,,,,,
RxAtuMu_ph4,Awaiting support all time I love  NATASHA,,,,,,,
RxAtuMu_ph4,OH MY GOD. I'm in love with it already.,,,,,,,
RxAtuMu_ph4,YEAAH,,,,,,,
RxAtuMu_ph4,So that’s where Hopper went.....,,,,,,,
RxAtuMu_ph4,"""I'm done running from my past""",,,,,,,
RxAtuMu_ph4,1:30 honestly thought that was Thor,,,,,,,
RxAtuMu_ph4,Bollywood walu kuch sekho in sai.,,,,,,,
RxAtuMu_ph4,Black Widows sister must be named Brown Recluse,,,,,,,
RxAtuMu_ph4,wah,,,,,,,
RxAtuMu_ph4,Marvel: Releases Black Widow teaser trailer.,,,,,,,
RxAtuMu_ph4,Soul stone: Am I a joke to you?,,,,,,,
RxAtuMu_ph4,Her powers are,,,,,,,
RxAtuMu_ph4,NATA?A YAT A??A NATA?A YED? BEN?M TA??A?A,,,,,,,
RxAtuMu_ph4,John wick should be in this movie,,,,,,,
RxAtuMu_ph4,Nice Black widow iam # Marvel fan,,,,,,,
RxAtuMu_ph4,Nice,,,,,,,
RxAtuMu_ph4,Ohh myy flo??,,,,,,,
RxAtuMu_ph4,This is what Hopper is doing in Russia.,,,,,,,
RxAtuMu_ph4,Theory: The Soviets captured Hopper and brainwashed him into a Communist loving superhero,,,,,,,
RxAtuMu_ph4,????  ????,,,,,,,
RxAtuMu_ph4,This movie should be made 10 years ago... When ScarJo in her prime,,,,,,,
RxAtuMu_ph4,"Every time I see Marvel Studio Movie Trailer, I think the ost in trailer is better than the movie lol",,,,,,,
RxAtuMu_ph4,Me: tryna sleep,,,,,,,
RxAtuMu_ph4,Marvel: it's free real estate,,,,,,,
RxAtuMu_ph4,"How can i watch this when i already know that in the future, shes goin to die.",,,,,,,
RxAtuMu_ph4,Oooo mate cool gggggggg,,,,,,,
RxAtuMu_ph4,another amusement park movie,,,,,,,
RxAtuMu_ph4,"I did not notice that the other girl was Dani was from Midsommar. And that's a good thing, unlike Chris Hemsworth who always look like Thor in every movie he's in except for Cabin in the Woods.",,,,,,,
RxAtuMu_ph4,Am I the only one who likes the music they did? Truly awesome.,,,,,,,
RxAtuMu_ph4,"God, no.",,,,,,,
RxAtuMu_ph4,He will be alive belive me marvel needs money and everyone will watch scarlett johansson bc she's hot,,,,,,,
RxAtuMu_ph4,"What everybody fails to realise is that the Black Widow movie takes place after Captain America: Civil War, but before Avengers Infinity War",,,,,,,
RxAtuMu_ph4,When you realize Tony Stark hasn't even become Iron man yet,,,,,,,
RxAtuMu_ph4,Someone said that the trailer should be all mysterious and the song playing is Scarlett Johansson singing the lullaby ‘itsy bitsy spider’,,,,,,,
RxAtuMu_ph4,Imagine if the movie ends up being black widow in the ravine just occasionally talking to gamora and taking naps,,,,,,,
RxAtuMu_ph4,This music tho ?,,,,,,,
RxAtuMu_ph4,"Iron Man's best line in Black Widow: ""TRAITOR!""",,,,,,,
RxAtuMu_ph4,Sis: What brings you back home?,,,,,,,
RxAtuMu_ph4,Natasha: I'm finally getting my own solo movie.,,,,,,,
RxAtuMu_ph4,MARVEL EU AMO vcs vai traz ela de Volta em Vingadores 5,,,,,,,
RxAtuMu_ph4,ela e uma Vingadora Maravilhosa?,,,,,,,
RxAtuMu_ph4,So excited for the special look tomorrow. ????,,,,,,,
RxAtuMu_ph4,Who is here in 2020 ??,,,,,,,
RxAtuMu_ph4,So many (rather) positive comments.,,,,,,,
RxAtuMu_ph4,Am I the only one finding it very underwhelming?,,,,,,,
RxAtuMu_ph4,Black Widow Dies ,,,,,,,
RxAtuMu_ph4,Marvel : It's Rewind Time,,,,,,,
RxAtuMu_ph4,I love that his suit is virtually the exact same as Cap's minus the blue and the star... I mean like EXACTLY the same.,,,,,,,
RxAtuMu_ph4,# MARVEL?traz ela de Volta # a Viúva negra e Maravilhosa # Amo a Viúva negra,,,,,,,
RxAtuMu_ph4,As if Scar Jo wasn't a reason enough they hired Rachel Wiesz,,,,,,,
RxAtuMu_ph4,Reminds me from the Russian movie called Guardian (Dubbed) ,,,,,,,
RxAtuMu_ph4,With the superhero and the Team,,,,,,,
RxAtuMu_ph4,I love this trailer it’s on fleek ?,,,,,,,
RxAtuMu_ph4,HELL YEAH,,,,,,,
RxAtuMu_ph4,Love the music.,,,,,,,
RxAtuMu_ph4,I have that BRRRRRRRRR as my ringtone ,,,,,,,
RxAtuMu_ph4,WHO IS WITH ME?!!?!?,,,,,,,
RxAtuMu_ph4,That siren though lol.,,,,,,,
RxAtuMu_ph4,MARVEL traz ela de Volta nos Amamos a Viúva negra MARVEL VAI traz ela de Volta,,,,,,,
RxAtuMu_ph4,Sooooo....Task Master is gonna die in an explosion....and when he does...come back to this comment and give it a like....,,,,,,,
RxAtuMu_ph4,What did they do to Taskmaster?!,,,,,,,
RxAtuMu_ph4,They should pay the green screen,,,,,,,
RxAtuMu_ph4,Jim looks the same,,,,,,,
RxAtuMu_ph4,Best trailer ever,,,,,,,
RxAtuMu_ph4,"Bout time she got her own movie, the character and the actress.",,,,,,,
RxAtuMu_ph4,Sou Fã da Viúva negra número 1 desda primeira vez q eu vi ela,,,,,,,
RxAtuMu_ph4,Quem e Fã da Viúva negra quer que ela Volte ?,,,,,,,
RxAtuMu_ph4,"Ok, 1) that white suit looked like stormtrooper gear and 2) anybody know what the background music is because it’s DOPE",,,,,,,
RxAtuMu_ph4,Is this real??,,,,,,,
RxAtuMu_ph4,"Not Netflix. Hawkeye will still get more solo screen time. Unfortunately. Love ya Hawkeye. Just love Widow and the other heroes more. Sorry, Jeremy!",,,,,,,
RxAtuMu_ph4,Make a move on sentry,,,,,,,
RxAtuMu_ph4,a Viúva negra e Maravilhosa traz a nossa Ruiva de volta,,,,,,,
RxAtuMu_ph4,He became the very thing he swore to destroy.. he became the smirnoff,,,,,,,
RxAtuMu_ph4,I want hulk a powerful version,,,,,,,
RxAtuMu_ph4,I thought Black Widow and her sister are Russians?,,,,,,,
RxAtuMu_ph4,Eu Amo a MARVEL ??,,,,,,,
RxAtuMu_ph4,Tony stark be like : this does put a smile on my face,,,,,,,
RxAtuMu_ph4,"If the Marvel Studios will make Captain Marvel 2 soon, I REALLY hope they'll find a Actress, suitable for portraying Karla Sofen, A.K.A., Moonstone, to be the Perfect Main Antagonist in that movie soon.",,,,,,,
RxAtuMu_ph4,Just one question: Why is the black widow white?,,,,,,,
RxAtuMu_ph4,Back ground music it well osam,,,,,,,
RxAtuMu_ph4,MARVEL eu Amo a Viúva negra vai traz ela de Volta,,,,,,,
RxAtuMu_ph4,12:32:00 AM,,,,,,,
RxAtuMu_ph4,01:13:00 AM,,,,,,,
RxAtuMu_ph4,Love David Harbour though,,,,,,,
RxAtuMu_ph4,Took her dying to get a movie smh,,,,,,,
RxAtuMu_ph4,why do i wannna see black widow more than endgame?,,,,,,,
RxAtuMu_ph4,See!  I knew Hopper was actually an undercover Russian double agent who faked his own death!,,,,,,,
RxAtuMu_ph4,Black Widow: dies,,,,,,,
RxAtuMu_ph4,"Marvel: Some people, move on. But not us. Not us.",,,,,,,
RxAtuMu_ph4,Better thumbnail or poster would be nice,,,,,,,
RxAtuMu_ph4,TAKE. MY. MONEY!!!!!!,,,,,,,
RxAtuMu_ph4,"Not to correct any of you, but Hawkeye Disney Plus Show and when I first heard about it they said it was gonna be on Hulu. Along with Loki, Wanda and Vis, Bucky and Falcon, What If?.",,,,,,,
RxAtuMu_ph4,Who was the bad guy? Taskmaster?,,,,,,,
RxAtuMu_ph4,POR FINNNNNN,,,,,,,
RxAtuMu_ph4,"I so want Yelena Belova, A.K.A., Crimson Widow of H.Y.D.R.A to be the Villainess in this movie! She's definitely one of THE Best of the Equally Match Archenemy/Worthy Adversary Natasha Romanov, A.K.A., Black Widow!",,,,,,,
RxAtuMu_ph4,This is so lit,,,,,,,
RxAtuMu_ph4,THIS is how to execute a female led action movie. cough cough charlie’s angels,,,,,,,
RxAtuMu_ph4,What is the title of avengers 5,,,,,,,
RxAtuMu_ph4,So this is where hopper went after dealing with the Russians,,,,,,,
RxAtuMu_ph4,This music would be sick to sample,,,,,,,
RxAtuMu_ph4,i like it :V,,,,,,,
RxAtuMu_ph4,Am suprised this many people clicked like,,,,,,,
RxAtuMu_ph4,"One of the best superheroes I’ve ever seen, and she’s finally getting a movie",,,,,,,
RxAtuMu_ph4,"To those who said ""I thought she was dead"", this movie is set between Civil War and Infinity War.",,,,,,,
RxAtuMu_ph4,Is this before infinity war?,,,,,,,
RxAtuMu_ph4,a Viúva negra vai ela vai tem que de um jeito eu de outro Marvel traz ela de volta,,,,,,,
RxAtuMu_ph4,Who want see see harry potter in the avengers,,,,,,,
RxAtuMu_ph4,This gave me Captain America: The Winter Soldier vibes.,,,,,,,
RxAtuMu_ph4,And that Black and Red animation in the end is so cool!,,,,,,,
RxAtuMu_ph4,Lbscarlett Johansson: just another dumb hollyweird actress,,,,,,,
RxAtuMu_ph4,Natasha: We're going back to where it all started,,,,,,,
RxAtuMu_ph4,Me: but what about BuDaPeSt,,,,,,,
RxAtuMu_ph4,"Kinda dont care same goes for a Hawkeye movie. I just never cared about the ""special ops"" type stuff in movies. I'm much more of a thor ragnarok, guardians, Ironman, spiderman, and hulk fan",,,,,,,
RxAtuMu_ph4,1977 mang tao ??n ?ây,,,,,,,
RxAtuMu_ph4,wellcome to VietNam,,,,,,,
RxAtuMu_ph4,Black Widow: Dies,,,,,,,
RxAtuMu_ph4,Black Widow Movie: I AM INEVITABLE.,,,,,,,
RxAtuMu_ph4,Florence Pugh roles  went from a British family to a Swedish family and now a Russian family,,,,,,,
RxAtuMu_ph4,"dearest black widow movie, u better have Cap ROGERS on it or i'll bring back thanos",,,,,,,
RxAtuMu_ph4,2020 is gonna be the year of women,,,,,,,
RxAtuMu_ph4,Me: trying to sleep after a long Monday.,,,,,,,
RxAtuMu_ph4,Marvel: I’m about to end this man sleep cycle.,,,,,,,
RxAtuMu_ph4,Black widow returns,,,,,,,
RxAtuMu_ph4,"If this is Natasha’s “flashback before death”, IMMA CRY!!!!!",,,,,,,
RxAtuMu_ph4,Marvel: releases black widow teaser,,,,,,,
RxAtuMu_ph4,Everyone: why am I hearing boss music?,,,,,,,
RxAtuMu_ph4,A prequel to Iron Man 2. Nice.,,,,,,,
RxAtuMu_ph4,Marvel: There will now be a movie based on someone dead.,,,,,,,
RxAtuMu_ph4,Fans: Impossible.,,,,,,,
RxAtuMu_ph4,No one dies on a Marvel film,,,,,,,
RxAtuMu_ph4,All these people who are confused about the timeline are gonna lose it when they find out that Tony is in this movie,,,,,,,
RxAtuMu_ph4,Waaaaaaaaaaaaaaaaaaaaa,,,,,,,
RxAtuMu_ph4,Marve seria bueno que hicierean una pelicula de la hija iron man o si no una de shasan 2,,,,,,,
RxAtuMu_ph4,When does this take place?,,,,,,,
RxAtuMu_ph4,2019: Black Widow dies,,,,,,,
RxAtuMu_ph4,"2020 marvel: yall, it's rewind time",,,,,,,
RxAtuMu_ph4,About TIME,,,,,,,
RxAtuMu_ph4,Are you going to start your phase 4 with a dead character? ,,,,,,,
RxAtuMu_ph4,Marvel : yea .,,,,,,,
RxAtuMu_ph4,"I love how it's like a ""spy thriller"" like Winter Soldier",,,,,,,
RxAtuMu_ph4,black widow and gamora are in haven,,,,,,,
RxAtuMu_ph4,Does anyone know why Natasha looks like a storm trooper in 1:46,,,,,,,
RxAtuMu_ph4,Really soo good,,,,,,,
RxAtuMu_ph4,Everyone: Black Widow already died,,,,,,,
RxAtuMu_ph4,Me:,,,,,,,
RxAtuMu_ph4,Iron Man: Did she have family?,,,,,,,
RxAtuMu_ph4,captain America: Yeah... Us.,,,,,,,
RxAtuMu_ph4,Black Widow movie: I’m not so sure about that.,,,,,,,
RxAtuMu_ph4,"Cant wait..... but, why....... I mean she's dead. What next, another Ironman movie",,,,,,,
RxAtuMu_ph4,Marvel: black widow ,,,,,,,
RxAtuMu_ph4,DC: birds of prey,,,,,,,
RxAtuMu_ph4,"""Our battle will be legendary""",,,,,,,
RxAtuMu_ph4,Nobody:,,,,,,,
RxAtuMu_ph4,Absolutely nobody:,,,,,,,
RxAtuMu_ph4,Russians in all Hollywood movies: ??? ?????? ? ???????,,,,,,,
RxAtuMu_ph4,Russians talking english between themselves....,,,,,,,
RxAtuMu_ph4,I just can’t wait for this movie,,,,,,,
RxAtuMu_ph4,THIS??IS??ABOUT??TO??BE??SICK??,,,,,,,
RxAtuMu_ph4,0:35 That The Spitting Image Of Thunderbolt Ross And USA's Special Forces!,,,,,,,
RxAtuMu_ph4,Music sounds like the Prowler theme from Into the Spider-Verse,,,,,,,
RxAtuMu_ph4,I can't wait!! This looks really good !!,,,,,,,
RxAtuMu_ph4,"Also, the music in this trailer is SO eerie... I LOVE IT!!!",,,,,,,
RxAtuMu_ph4,O heck,,,,,,,
RxAtuMu_ph4,"A non- space, superpowered female marvel movie ",,,,,,,
RxAtuMu_ph4,1:46 henry cavill arm reload,,,,,,,
RxAtuMu_ph4,Waaaaayy overdue IMO. Im glad she getting her movie ?,,,,,,,
RxAtuMu_ph4,0:04 when i look her eyes its looks like she is want revenge,,,,,,,
RxAtuMu_ph4,PER- AND I CANT STRESS THIS ENOUGH- IODT,,,,,,,
RxAtuMu_ph4,Love the music,,,,,,,
RxAtuMu_ph4,"Theory: shes on the run because shes being hunted down for letting captain America and Bucky out of the airport in Germany during civil war, shes at the airport and gets on a plane to Russia to escape, and is also being hunted down by yelena so she can take the title of the black widow",,,,,,,
RxAtuMu_ph4,Me when I see Jim hopper and realize it isn’t him,,,,,,,
RxAtuMu_ph4,Imagine if Mark Ruffalo is in the film,,,,,,,
RxAtuMu_ph4,Wow....this doesn't look like a virtual stereotypical mess at all.....?,,,,,,,
RxAtuMu_ph4,Tron: Uprising ,,,,,,,
RxAtuMu_ph4,Please renew it. Disney listen.,,,,,,,
RxAtuMu_ph4,Everyone: Fills the comment section with the same dull joke,,,,,,,
RxAtuMu_ph4,A marvel movie without superheroes looks like a Lucy or 007 movie.,,,,,,,
RxAtuMu_ph4,I want a Black Widow trilogy !,,,,,,,
RxAtuMu_ph4,MARVEL EU TE AMO MAIS TRAZ A VIÚVA NEGRA DE VOLTA,,,,,,,
RxAtuMu_ph4,Stranger things: ON,,,,,,,
RxAtuMu_ph4,The Guardian character looks very interesting. Good casting.,,,,,,,
RxAtuMu_ph4,??????????,,,,,,,
RxAtuMu_ph4,so an elephant sound a-la Prowler's theme is the new BWAAAH?,,,,,,,
RxAtuMu_ph4,i'm totally ok with this.,,,,,,,
RxAtuMu_ph4,???? ????,,,,,,,
RxAtuMu_ph4,SEGURA BRASILLLLL???????,,,,,,,
RxAtuMu_ph4,U got me feelin like a psycho psycho..,,,,,,,
RxAtuMu_ph4,Can't wait to see my baby mama black widow???,,,,,,,
RxAtuMu_ph4,So did we just get a preview of the Winter Guard?,,,,,,,
RxAtuMu_ph4,Black widow and red guardian friends like here,,,,,,,
RxAtuMu_ph4,"I am Optimus Prime and I send this message to any surviving auto bots taking refuge among the stars.. I send this message so our pasts will always be remembered, for in those memories we live on.",,,,,,,
RxAtuMu_ph4,Bro the new Fast and furious looks good,,,,,,,
RxAtuMu_ph4,Can't wait!!!! MCU has rocked the whole world! And rule the Cinema! Keep it coming please??,,,,,,,
RxAtuMu_ph4,OMG the trailer and its music???,,,,,,,
RxAtuMu_ph4,Course they are sisters..tehy both have that awesome husky vooce,,,,,,,
RxAtuMu_ph4,Can Red Guardian do Squat? ?,,,,,,,
RxAtuMu_ph4,traz ela de volta no filme dos Avengers5,,,,,,,
RxAtuMu_ph4,"Hey fellow Magyarok out there, on a scale from 0-10 how hyped are you cause I'm 11",,,,,,,
RxAtuMu_ph4,"""Mom can we Get Captain america in Black Widow Movie""",,,,,,,
RxAtuMu_ph4,Mom: But We already have Captain America in Black Widow Movie,,,,,,,
RxAtuMu_ph4,Captain America in Black Widow Movie: 1:34,,,,,,,
RxAtuMu_ph4,"not gonna lie, maybe the best trailer music ever",,,,,,,
RxAtuMu_ph4,Black Widow Homecoming...,,,,,,,
RxAtuMu_ph4,she looked like a stormtrooper in that white suit,,,,,,,
RxAtuMu_ph4,Black widow:dies,,,,,,,
RxAtuMu_ph4,Oh hopper from stranger things is the fat guy when stranger things season 4,,,,,,,
RxAtuMu_ph4,Drax is also in the trailer,,,,,,,
RxAtuMu_ph4,.,,,,,,,
RxAtuMu_ph4,.,,,,,,,
RxAtuMu_ph4,.,,,,,,,
RxAtuMu_ph4,Stranger Things:,,,,,,,
RxAtuMu_ph4,Russian Alexei joined the chat,,,,,,,
RxAtuMu_ph4,That speedy man got beard ????!!,,,,,,,
RxAtuMu_ph4,Does anyone has any idea about Trailer 2. When will it be coming???,,,,,,,
RxAtuMu_ph4,Be honest... who else watched this and said what TF,,,,,,,
RxAtuMu_ph4,Omg yes,,,,,,,
RxAtuMu_ph4,WoW,,,,,,,
RxAtuMu_ph4,“gUyS doNt lIke fEmAlE lED mOvIeS” ,,,,,,,
RxAtuMu_ph4,"Millions of guys will be going to see this,  not some trash 3rd remake of Charlie’s Angels ?",,,,,,,
RxAtuMu_ph4,??,,,,,,,
RxAtuMu_ph4,HOPPER HAHAAH,,,,,,,
RxAtuMu_ph4,Poor Hawkeye,,,,,,,
RxAtuMu_ph4,"Jim Hopper didn't die, he transformed into Red Guardian",,,,,,,
RxAtuMu_ph4,black widow :find my vodka,,,,,,,
RxAtuMu_ph4,Spoiler alert: this is after Endgame,,,,,,,
RxAtuMu_ph4,This movie is going to be the highlight of 2020 I’m calling it now ? ?,,,,,,,
RxAtuMu_ph4,"At this moment 38 million views. 2,500,890 of them are mine.",,,,,,,
RxAtuMu_ph4,Black widow aaaaàaaaaaaaaaaaaaaa,,,,,,,
RxAtuMu_ph4,"As a member of the evil patriarchy, I can’t wait to see this movie. Black widow is amazing, skillful, and she is over due for a movie. She is her own form of badass and doesn’t need to take the place of a man or demonize them. That’s y the evil patriarchy loves her. Please don’t make this movie woke. I’m expecting a great movie. The evil patriarchy doesn’t care about her gender. She is awesome and we love her.",,,,,,,
RxAtuMu_ph4,What if Hawkeye is taskmaster ????,,,,,,,
RxAtuMu_ph4,Black Windows,,,,,,,
RxAtuMu_ph4,It's about bloody time,,,,,,,
RxAtuMu_ph4,Man the winter guard,,,,,,,
RxAtuMu_ph4,Knew,,,,,,,
RxAtuMu_ph4,MARVEL traz a Viúva negra de Volta,,,,,,,
RxAtuMu_ph4,Did no one learn the lessons of Highsmith and Danson?,,,,,,,
RxAtuMu_ph4,So they’re all Russians hanging out in Russia speaking English except Black Widow who had a perfect American accent? ,,,,,,,
RxAtuMu_ph4,I'll pass.,,,,,,,
RxAtuMu_ph4,Wow a sister,,,,,,,
RxAtuMu_ph4,"""This is getting out of hand. Now there are two of them.""",,,,,,,
RxAtuMu_ph4,Florence Pugh!!!!,,,,,,,
RxAtuMu_ph4,This has the winter soldier vibes,,,,,,,
RxAtuMu_ph4,"""I used to have nothing,and then I got this job, this family""",,,,,,,
RxAtuMu_ph4,3 Black Widow and 1 Red Guardian : breathes,,,,,,,
RxAtuMu_ph4,Taskmaster : Allow me to introduce myself,,,,,,,
RxAtuMu_ph4,Marvel: releases Black widow's trailer,,,,,,,
RxAtuMu_ph4,Me: she is as beautiful as the day I lost her.,,,,,,,
RxAtuMu_ph4,Nah. No thanks,,,,,,,
RxAtuMu_ph4,Her family: Accent as Russian as Putin,,,,,,,
RxAtuMu_ph4,Black Widow: This is America,,,,,,,
RxAtuMu_ph4,Captain Comrade,,,,,,,
RxAtuMu_ph4,RIP NATASHA,,,,,,,
RxAtuMu_ph4,Marvel: This is a prequel ,,,,,,,
RxAtuMu_ph4,Marvel Fans: So she survived!,,,,,,,
RxAtuMu_ph4,How unoriginal. I am gonna pass this one. ?,,,,,,,
RxAtuMu_ph4,Nothing can keep me from sleeping tonight.,,,,,,,
RxAtuMu_ph4,Marvel: Hold my beer,,,,,,,
RxAtuMu_ph4,Marvel are loving fat jokes recently aren’t they?,,,,,,,
RxAtuMu_ph4,39miliion,,,,,,,
RxAtuMu_ph4,Captain America,,,,,,,
RxAtuMu_ph4,Captain Britain,,,,,,,
RxAtuMu_ph4,Why this is so sad,,,,,,,
RxAtuMu_ph4,2019 Hopper fights a big Russian ,,,,,,,
RxAtuMu_ph4, ,,,,,,,
RxAtuMu_ph4,2020 Hopper is a big Russian,,,,,,,
RxAtuMu_ph4,I’m only watching this again for Florence Pugh,,,,,,,
RxAtuMu_ph4,And Scarlet Witch has officially lost the title of worst Russian accent ever.,,,,,,,
RxAtuMu_ph4,nice trailer,,,,,,,
RxAtuMu_ph4,movie kab tk aayegi yr,,,,,,,
RxAtuMu_ph4,Man it's been 10 years. It feels weird to say this but she too old for the role now. Anyone remembers her 1st marvel appearance?,,,,,,,
RxAtuMu_ph4,“Dude why release at 3am?”,,,,,,,
RxAtuMu_ph4,Laughs in GMT,,,,,,,
RxAtuMu_ph4,Wow,,,,,,,
RxAtuMu_ph4,Feliz año.nuebo,,,,,,,
RxAtuMu_ph4,Red Guardian: I am the fattest Marvel Character ,,,,,,,
RxAtuMu_ph4,"Thor: Hold my beer, wait actually I need that to get fat.",,,,,,,
RxAtuMu_ph4,1:26 I think it should be taskmaster?? I’m not sure,,,,,,,
RxAtuMu_ph4,"Meh, I'm sure she'll be fine in this movie",,,,,,,
RxAtuMu_ph4,Where's Cap??!! I miss him already.....,,,,,,,
RxAtuMu_ph4,Roses are red ,,,,,,,
RxAtuMu_ph4,I want Yelena and Melina ,,,,,,,
RxAtuMu_ph4,In my bed ?,,,,,,,
RxAtuMu_ph4,i'm digging the soundtrack for this movie,,,,,,,
RxAtuMu_ph4,Omg I am a big fan of black widow   so I am really exectied to watch this ????,,,,,,,
RxAtuMu_ph4,"...then i got turned down by a green monster and i flung myself off the cliff of an alien planet.""",,,,,,,
RxAtuMu_ph4,It’s literally worthless trying to read any comments on YouTube now. They’re literally all the same stupid meme.,,,,,,,
RxAtuMu_ph4,RED GUARDIAN -?,,,,,,,
RxAtuMu_ph4,PARKER LUCINI from resident evil revelations ?,,,,,,,
RxAtuMu_ph4,"Scarlett Johansson and Florence Pugh in the same movie ???, there is a God",,,,,,,
RxAtuMu_ph4,How comes black Widow hasn't got a Russian accent?,,,,,,,
RxAtuMu_ph4,And all the other Russians have?,,,,,,,
RxAtuMu_ph4,"Incidentally, I know there not really Russian, anymore than Ivan Drago.",,,,,,,
RxAtuMu_ph4,Can we talk about this trailer instead of telling it was released when everyone was asleep,,,,,,,
RxAtuMu_ph4,tease Spoiler alert- Domino is in this movie,,,,,,,
RxAtuMu_ph4,please tell me that this is her theme song/music,,,,,,,
RxAtuMu_ph4,Red Guardian....,,,,,,,
RxAtuMu_ph4,More like HOPPER!!,,,,,,,
RxAtuMu_ph4,Had to come back and watch this again,,,,,,,
RxAtuMu_ph4,thats gonnabe a viry nice action qadventure !!!! i know it!,,,,,,,
RxAtuMu_ph4,0:37 black window is vietnamese??,,,,,,,
RxAtuMu_ph4,Check out this amazing trailer right now!,,,,,,,
RxAtuMu_ph4,?vlog??????????!,,,,,,,
RxAtuMu_ph4,If there’s no Black Widow Movie Funko POPs I’m gonna riot sooo hard ?,,,,,,,
RxAtuMu_ph4,Scarlett ?,,,,,,,
RxAtuMu_ph4,"Wow , that BGM ~",,,,,,,
RxAtuMu_ph4,Cant believe my wife got the main role at last...,,,,,,,
RxAtuMu_ph4,Miss you ?????? black widow,,,,,,,
RxAtuMu_ph4,"Watching it everyday, maybe i should stop for my own health...",,,,,,,
RxAtuMu_ph4,"I might have a theory. I wonder if Marvel might have concealed information from us like they did the last two Avengers movie. I might be wrong and have looked at some comics pages. I do wonder if there is perhaps clones of Natasha involved. She did say she lived a lot of lives. What if Natasha is really alive and she used one of her clones for the last two Avengers? They have her memories and the same combat skills as she does, or perhaps they would use her clones after Natasha’s death in Endgame?! I am just guessing...",,,,,,,
RxAtuMu_ph4,Hopper really is in Russia ?,,,,,,,
RxAtuMu_ph4,"I don't need a female James Bond I already have one, The Black Widow.",,,,,,,
RxAtuMu_ph4,Fans : it's gonna hell of a reunion,,,,,,,
RxAtuMu_ph4,We Now Know Where Hopper Went!,,,,,,,
RxAtuMu_ph4,"everyone thought David was growing his beard to give us a sign that hopper was still alive for st four, he done proved all yall clowns wrong. he wasn't kidnapped by the Russians he's back as a Russian LmAo",,,,,,,
RxAtuMu_ph4,Wooowh!,,,,,,,
RxAtuMu_ph4,Instead of black widow already dead how come still alive on avangers?,,,,,,,
RxAtuMu_ph4,So Black widow has a sister now?,,,,,,,
RxAtuMu_ph4,Glad they got Hopper out of russian jail,,,,,,,
RxAtuMu_ph4,This looks ace!!,,,,,,,
RxAtuMu_ph4,"""There was an idea...""",,,,,,,
RxAtuMu_ph4,"As of now, we are the movie of 2020 with the most views for it’s first trailer.",,,,,,,
RxAtuMu_ph4,Me: Why is everyone commenting the exact same thing?,,,,,,,
RxAtuMu_ph4,"What I find so funny is I emailed marvel for a movie of Natasha’s backstory and here it is, most likely not inspired off my email because it was sent a couple months ago",,,,,,,
RxAtuMu_ph4,"""I see this as an absolute win""",,,,,,,
RxAtuMu_ph4,"When I saw, ""this summer"", ok, fine, no expection now. Really? After the final fighting then the first BW personal movies show up in the next year? She is one of the leader actors, iron man, thor, captain america, even anti man. Come on, she is a woman leader actor at Marvel series. From the first iron man came at 2008, 12years! Can you believe that? Until now? She comes? Shame.",,,,,,,
RxAtuMu_ph4,Love this movie,,,,,,,
RxAtuMu_ph4,Think about how much more powerful her death would have been if a movie like this came out earlier.,,,,,,,
RxAtuMu_ph4,Where is Tony with iron man suit??,,,,,,,
RxAtuMu_ph4,????????.,,,,,,,
RxAtuMu_ph4,"Widows dead still she has got a movie, Hawkeye  is alive but he does not have a movie ?)lol",,,,,,,
RxAtuMu_ph4,Killing Eve vibes,,,,,,,
RxAtuMu_ph4,Perfect song,,,,,,,
RxAtuMu_ph4,MELINA IS TASK MASTER,,,,,,,
RxAtuMu_ph4,Insane theory: Black widow becomes mistress death in the soul world and Thanos is there and he falls in love with her.,,,,,,,
RxAtuMu_ph4,Aquaman joins the avengers,,,,,,,
RxAtuMu_ph4,?????? ?????,,,,,,,
RxAtuMu_ph4,Ive lived alot of lives,,,,,,,
RxAtuMu_ph4,"nice at least they gave her , her own movie",,,,,,,
RxAtuMu_ph4,We'll finally get to see what happened in Budapest.,,,,,,,
RxAtuMu_ph4,see y’all in a minute,,,,,,,
RxAtuMu_ph4,"My guest, hulk snap bring back black widow, some how she came to earth (possibly crash landing and founded by young Thunderbolt Ross",,,,,,,
RxAtuMu_ph4,).,,,,,,,
RxAtuMu_ph4,Are we gonna talk about how David Harbour’s character is named Alexei?,,,,,,,
RxAtuMu_ph4,Wow,,,,,,,
RxAtuMu_ph4,"Finally, we get to see Black Widow at her best",,,,,,,
RxAtuMu_ph4,Everyone on the west Side saying it’3am,,,,,,,
RxAtuMu_ph4,Me: laughing at 4pm,,,,,,,
RxAtuMu_ph4,"i was worried they were going to stuff a chick flick down our throats, but marvel did a good job with captain marvel and now this looks good. congrats.",,,,,,,
RxAtuMu_ph4,"Looks awesome, but it's missing a giant bear.",,,,,,,
RxAtuMu_ph4,"I love that Hopper is in this Movie, He's been a great father",,,,,,,
RxAtuMu_ph4,Edit: Wow thanks for the likes guys :D,,,,,,,
RxAtuMu_ph4,MY GIRL GETTING THE RECOGNITION SHE DESERVES ??,,,,,,,
RxAtuMu_ph4,how widow back end game he died,,,,,,,
RxAtuMu_ph4,pass,,,,,,,
RxAtuMu_ph4,Let's see who rocks this time....Widow VS WW.,,,,,,,
RxAtuMu_ph4,Dikk Budapest? Varga és Társa,,,,,,,
RxAtuMu_ph4,Please come back to life please come back to life please come back to life please come back to life PLEASE. COME. BACK. TO. LIFEEEEE...,,,,,,,
RxAtuMu_ph4,My Mata Hari,,,,,,,
RxAtuMu_ph4,The fappiest avenger,,,,,,,
RxAtuMu_ph4,We cannot die twice.,,,,,,,
RxAtuMu_ph4,"The end credits scenes better not disappoint I know something's gonna be revealed about her fate. Don't worry I'm excited for the film 100000000x more than its end credits scenes, I'm just saying.",,,,,,,
RxAtuMu_ph4,?????????,,,,,,,
RxAtuMu_ph4,This is How you drop a trailer for the baddest female in the avengers,,,,,,,
RxAtuMu_ph4,Yawnn,,,,,,,
RxAtuMu_ph4,So is black widow secretly the Prowler because of the music?,,,,,,,
