video_id,comment_text,,,,,,,
CX17qmYO0o0,yaaar Avengers endgame mn black widow to mar gaiee h bro  ab Nh aaygi uskii movie,,,,,,,
CX17qmYO0o0,The black widow movie spoils the black widow movie,,,,,,,
CX17qmYO0o0,there all fake watch the films over youll see there clips,,,,,,,
CX17qmYO0o0,Eternals looks as interesting as Inhumans. Yawn.,,,,,,,
CX17qmYO0o0,Wow this is so accurate because there is a trailer about BLACK WIDOW who (DIED),,,,,,,
CX17qmYO0o0,Guardians  of the galaxy vol. 3,,,,,,,
CX17qmYO0o0,Not sure to release??,,,,,,,
CX17qmYO0o0,Is it true or fake news??,,,,,,,
CX17qmYO0o0,Pls answer..thanks,,,,,,,
CX17qmYO0o0,And I can promise you all their movies will be liberal based crap,,,,,,,
CX17qmYO0o0,How tf is iron-man and black widow in the Black Widow movie if they both died,,,,,,,
CX17qmYO0o0,Whtevr mcu will always hv a blank space without iron man,,,,,,,
CX17qmYO0o0,I already miss him ?,,,,,,,
CX17qmYO0o0,But will Stan lee be in it,,,,,,,
CX17qmYO0o0,I dont think black widow will recieve her own movie because she died in endgame,,,,,,,
CX17qmYO0o0,Didn't black widow die?,,,,,,,
CX17qmYO0o0,Black widow!?!??  But she died in endgame,,,,,,,
CX17qmYO0o0,Marvel is going to be little bored without  the cap thor ironman,,,,,,,
CX17qmYO0o0,He just used movie clips,,,,,,,
CX17qmYO0o0,Black widow died,,,,,,,
CX17qmYO0o0,Black widow died,,,,,,,
CX17qmYO0o0,M,,,,,,,
CX17qmYO0o0,"Well. now that Feige has the X-Men and F4 in his hands, all things could be different.",,,,,,,
CX17qmYO0o0,really interested in what they will do in black widow in terms of plot i honestly cant think of a single thing. also in think the movie i am least interested is shang chi,,,,,,,
CX17qmYO0o0,Carnage,,,,,,,
CX17qmYO0o0,How black widow already died in endgame,,,,,,,
CX17qmYO0o0,I don't think that Black widow is really coming,,,,,,,
CX17qmYO0o0,"Man, how awesome would Bruce Lee have been as Shang-Chi",,,,,,,
CX17qmYO0o0,Ok,,,,,,,
CX17qmYO0o0,Where is the hammer after cap took it??,,,,,,,
CX17qmYO0o0,Loki movie anyone ?,,,,,,,
CX17qmYO0o0,Those were celestials. Not eternals,,,,,,,
CX17qmYO0o0,I'm so excited for black widow and doctor strange 2??,,,,,,,
CX17qmYO0o0,Wait Black Widow Already Dead. and why there Black Widow Movie ??,,,,,,,
CX17qmYO0o0,Where is X-men dark Phoenix,,,,,,,
CX17qmYO0o0,Do u remember that black widow died in endgame so there wouldn’t be a movie about black widow,,,,,,,
CX17qmYO0o0,View the list here!!!!!,,,,,,,
CX17qmYO0o0,Wait but in endgame black widow dies so how will they make a movie from the past,,,,,,,
CX17qmYO0o0,"Who wants to see a young female superhero starting out, having to discover her powers just like spidey?",,,,,,,
CX17qmYO0o0,endgame was the peak. now they are just milking it until the bubble pops. marvels knows this too. they planned for it.,,,,,,,
CX17qmYO0o0,Just make a Loki movie already,,,,,,,
CX17qmYO0o0,SPOILER WARNING,,,,,,,
CX17qmYO0o0,"Why did they wait until black widow was DEAD to give her the movie she has deserved for years??? It would have been easier to do when Scarlett Johansson was younger anyways, not as much age reduction",,,,,,,
CX17qmYO0o0,This doesn’t even look like a marvel movie,,,,,,,
CX17qmYO0o0,Doctor strange... Black panther,,,,,,,
CX17qmYO0o0,X men is a part of Marvel but associated by marvel entertainment..,,,,,,,
CX17qmYO0o0,Uh thats tony stark in iron man plus iron man died in end game,,,,,,,
CX17qmYO0o0,Started as I am iron man,,,,,,,
CX17qmYO0o0,Ended as I am iron man,,,,,,,
CX17qmYO0o0,We love you 3000 Tony Stark ? ?,,,,,,,
CX17qmYO0o0,Marvel has said that they will relese three movies every year. So Black Panther 2 will be in 2020,,,,,,,
CX17qmYO0o0,How are they gonna make a black widow movie if she died in end game ?,,,,,,,
CX17qmYO0o0,Doctor Strange 2 real release date is 2020 June 12 not 2020.,,,,,,,
CX17qmYO0o0,I came for black panther,,,,,,,
CX17qmYO0o0,2021 for black panther 2? Lord i hope i can last the wait,,,,,,,
CX17qmYO0o0,Black widow is alive?,,,,,,,
CX17qmYO0o0,Apparently there are going to be at least 15 new marvel movies in 2020 what a load of utter ?they all are...no acting required?...?????,,,,,,,
CX17qmYO0o0,They should definitely do X-MEN again. They screwed that up royally.,,,,,,,
CX17qmYO0o0,SPOILER! ,,,,,,,
CX17qmYO0o0,Chadwick Boseman will be 43 or 44 when black panther 2 comes out I mean it doesn’t matter,,,,,,,
CX17qmYO0o0,What about Morbius?? Thats an upcoming marvel movie also,,,,,,,
CX17qmYO0o0,Here's hoping the Shang Chi movie will include Fu Manchu an M-I6..but i doubt it.,,,,,,,
CX17qmYO0o0,Here are my fanmade future avengers movies,,,,,,,
CX17qmYO0o0,Avengers 5:Galactic War,,,,,,,
CX17qmYO0o0,Avengers 6:Rise of The Demon Force,,,,,,,
CX17qmYO0o0,Avengers 7:Age Of Magma Man,,,,,,,
CX17qmYO0o0,"So apparently black widows getting her own movie... so they haven’t seen endgame, or is she like, alive",,,,,,,
CX17qmYO0o0,Spider man far from home is release in July 2,,,,,,,
CX17qmYO0o0,Where is venom 2?,,,,,,,
CX17qmYO0o0,"If theres one character I could bring back, it would be Loki. Sorry, not stark or widow or cap. Loki and Thor is the best. And btw this is a pattern.",,,,,,,
CX17qmYO0o0,Yay iron man isint dead after endgame,,,,,,,
CX17qmYO0o0,"For shang-chi i think the actor for ""Sunny"" from ""Into the bad lands"" would be a great choice",,,,,,,
CX17qmYO0o0,Black widow and iron man died in End game,,,,,,,
CX17qmYO0o0,Black widow died in in game how,,,,,,,
CX17qmYO0o0,ANyone else would have made a 20 minute video explaining stuff that happend in the mcu and explaining stuff that will happen won’t happen that they think will happen,,,,,,,
CX17qmYO0o0,Spoiler alert sponge bob dies in endgame,,,,,,,
CX17qmYO0o0,Only doctor strange appeals to me,,,,,,,
CX17qmYO0o0,Add Black Widow to season three,,,,,,,
CX17qmYO0o0,Delete Captain Marvel. It never happened. She was a random cameo in endgame.,,,,,,,
CX17qmYO0o0,"You can keep your woke Spiderman, far from reality. ",,,,,,,
CX17qmYO0o0,The MCU died with Iron Man.,,,,,,,
CX17qmYO0o0,Black Widow is died on Endgame... ????,,,,,,,
CX17qmYO0o0,black widow died at endgame how,,,,,,,
CX17qmYO0o0,I have honestly been waiting for years for a Black Widow movie and am now super pumped to know I have a chance to see it!,,,,,,,
CX17qmYO0o0,Black Panther 2 is Phase 5,,,,,,,
CX17qmYO0o0,They should get the Chicago bucket Boys to do the percussion for the black panther fight scenes,,,,,,,
CX17qmYO0o0,Did anybody realise in the black widow movie tony was there?,,,,,,,
CX17qmYO0o0,Wolverine plz,,,,,,,
CX17qmYO0o0,"Tony Stark literally gets all the credit he's the one who started the Avengers, he's the one who came up with how they could time travel, and he was the one to save the whole world...",,,,,,,
CX17qmYO0o0,R.I.P. Tony Stark ( Iron Man),,,,,,,
CX17qmYO0o0,Why don't they make a movie of hulk,,,,,,,
CX17qmYO0o0,But black widow died,,,,,,,
CX17qmYO0o0,N,,,,,,,
CX17qmYO0o0,No Deadpool Spiderman crossover yet,,,,,,,
CX17qmYO0o0,We need another fantastic 4 film.,,,,,,,
CX17qmYO0o0,And in the MCU,,,,,,,
CX17qmYO0o0,HA BLACK WIDOW GETS A MOVIE BEFORE HAWKEYE LOLOL,,,,,,,
CX17qmYO0o0,Good AFTAB,,,,,,,
CX17qmYO0o0,How is it possible Black Widow died in endgame???,,,,,,,
CX17qmYO0o0,I WANT A SCARLET WITCH SOLO MOVIE !!!!!!???,,,,,,,
CX17qmYO0o0,Black Widow died in avengers endgame,,,,,,,
CX17qmYO0o0,July 2 not 5,,,,,,,
CX17qmYO0o0,"They forgot a film, what about Captain America 4???",,,,,,,
CX17qmYO0o0,It better not be az either,,,,,,,
CX17qmYO0o0,there should be a <guardian of the galaxy 3> which is related to Adam Warlock,,,,,,,
CX17qmYO0o0,(If you havent watched endgame this is a spoiler),,,,,,,
CX17qmYO0o0,You ate joking black widow has died in endgame and Captain America has became old in endgame,,,,,,,
CX17qmYO0o0,Black widow is a lie,,,,,,,
CX17qmYO0o0,Very good,,,,,,,
CX17qmYO0o0,Guardians of the Galaxy 3 is also confirmed by Chris Pratt.,,,,,,,
CX17qmYO0o0,The blackwidow is fake cause in endgame blackwidow died ima right guys huh huh huh huhhhhhhh,,,,,,,
CX17qmYO0o0,Love ironman 3000,,,,,,,
CX17qmYO0o0,We don't need another black panther movie,,,,,,,
CX17qmYO0o0,Spiderman and the  sjw crew,,,,,,,
CX17qmYO0o0,I thought black widow died,,,,,,,
CX17qmYO0o0,"The best for me are: SpiderMan,black panther2, Doctor Strange2 and black Widow - that's in order",,,,,,,
CX17qmYO0o0,"you forgot guardians of the galaxy. After that, it all goes down hill from here",,,,,,,
CX17qmYO0o0,"It feels like when Stan Lee died, some avengers died with him.",,,,,,,
CX17qmYO0o0,Finally!!! I can’t wait for black widow movie! It’s LONG overdue,,,,,,,
CX17qmYO0o0,When will they a SCARLET WITCH MOVIE I’m still waiting for Wanda to have her own movie,,,,,,,
CX17qmYO0o0,What my mom and dad grew up watching : Harry Potter ,,,,,,,
CX17qmYO0o0,What me and my future husband grew up watching : avengers,,,,,,,
CX17qmYO0o0,Shang-Chi is basically Bruce Lee!,,,,,,,
CX17qmYO0o0,For Shang chi Rain would be perfect!!!!,,,,,,,
CX17qmYO0o0,"Great, new style is important.",,,,,,,
CX17qmYO0o0,WHAT ABOUT THE ASGARDIANS OF THE GALAXY?,,,,,,,
CX17qmYO0o0,Ok cause I’ll be graduated by the time someone of these come out,,,,,,,
CX17qmYO0o0,Thanks for your business and,,,,,,,
CX17qmYO0o0, management of your order and we,,,,,,,
CX17qmYO0o0,"4:04 Please, thats Marshall Law",,,,,,,
CX17qmYO0o0,Marvel needs a dam silver surfer movie,,,,,,,
CX17qmYO0o0,Is this new wave all going to lead up to Secret Wars?,,,,,,,
CX17qmYO0o0,I add to this top New Mutants :),,,,,,,
CX17qmYO0o0,Guardians of the galaxy 3?,,,,,,,
CX17qmYO0o0,hey what about venom 2 : carnage,,,,,,,
CX17qmYO0o0,Baron Helmut Zemo's Thunderbolts: Need a MOvie.,,,,,,,
CX17qmYO0o0,Great music on this,,,,,,,
CX17qmYO0o0,Sound track name??,,,,,,,
CX17qmYO0o0,Dude Zach Dempsey from 13 reasons why would be a perfect shangchi,,,,,,,
CX17qmYO0o0,I cant wait 2 years ?,,,,,,,
CX17qmYO0o0,For the next black panter,,,,,,,
CX17qmYO0o0,We want guardians of the galaxy vol 3,,,,,,,
CX17qmYO0o0,Who got spiderman far from home trailer before watching,,,,,,,
CX17qmYO0o0,It's a shame war machine never got his own movie,,,,,,,
CX17qmYO0o0,I'm just sitting here waiting for the hulk to get a movie that he deserves,,,,,,,
CX17qmYO0o0,Iron Man!!!!,,,,,,,
CX17qmYO0o0,What is meaning of mcu?,,,,,,,
CX17qmYO0o0,Soul stone:am I joke to you??,,,,,,,
CX17qmYO0o0,Black widow:?,,,,,,,
CX17qmYO0o0,Wait tony,,,,,,,
CX17qmYO0o0,What happened to Naymor they mentioned him in end game,,,,,,,
CX17qmYO0o0,Gotg volume 3??????????????,,,,,,,
CX17qmYO0o0,Rip iron Man,,,,,,,
CX17qmYO0o0,thor 4???,,,,,,,
CX17qmYO0o0,Black Widow 2020Lol???,,,,,,,
CX17qmYO0o0,What about asguardians of the galaxy,,,,,,,
CX17qmYO0o0,Who are the Enterals?,,,,,,,
CX17qmYO0o0,Spider-Man is coming out on my BIRTHDAY! Yessssss?,,,,,,,
CX17qmYO0o0,Should do a Storm movie,,,,,,,
CX17qmYO0o0,I’m mad they are taking forever with Black Panther!,,,,,,,
CX17qmYO0o0,Endgame part 2,,,,,,,
CX17qmYO0o0,old town road,,,,,,,
CX17qmYO0o0,What about New Mutants?,,,,,,,
CX17qmYO0o0,All of the clips is from past movies this bots,,,,,,,
CX17qmYO0o0,Next part her avengers last king,,,,,,,
CX17qmYO0o0,How the heck did Black Widow die and,,,,,,,
CX17qmYO0o0,i cant wait for black panther 2,,,,,,,
CX17qmYO0o0,I love Shuri,,,,,,,
CX17qmYO0o0,BLACK WIDOW ??,,,,,,,
CX17qmYO0o0,Black widow dead and so as iron man,,,,,,,
CX17qmYO0o0,"Ok, so, Deadpool 3 isn't even a THOUGHT yet...",,,,,,,
CX17qmYO0o0,Thx,,,,,,,
CX17qmYO0o0,STILL CRYING OVER PETERS DEATH,,,,,,,
CX17qmYO0o0,Asgaurdians of the galaxy,,,,,,,
CX17qmYO0o0,"If iron fist doesn't fight shang-chi, it will be a real missed opportunity considering the comics",,,,,,,
CX17qmYO0o0,All is always nothing else is going to come after endgame.Thanas wins,,,,,,,
CX17qmYO0o0,you forgot iron man 4,,,,,,,
CX17qmYO0o0,iron man will return by nanotech,,,,,,,
CX17qmYO0o0,Hold on... i thought black widow died?,,,,,,,
CX17qmYO0o0,I just want more Wanda.,,,,,,,
CX17qmYO0o0,there will be  Venom 2 too,,,,,,,
CX17qmYO0o0,Black widow died in end game,,,,,,,
CX17qmYO0o0,Block your theaters for next marvel  movie ?? they don't understand the word end game,,,,,,,
CX17qmYO0o0,Marvel has nothing without Tony,,,,,,,
CX17qmYO0o0,Fazil,,,,,,,
CX17qmYO0o0,Endgame is end no more discussions,,,,,,,
CX17qmYO0o0,Well black widow is no more????,,,,,,,
CX17qmYO0o0,Wouldn't mind another Thor film.,,,,,,,
CX17qmYO0o0,I thought black widow died,,,,,,,
CX17qmYO0o0,Wrong!!! Black Widow is Dead,,,,,,,
CX17qmYO0o0,Rip Natasha Romanoff,,,,,,,
CX17qmYO0o0,why is stark in Black Widow???,,,,,,,
CX17qmYO0o0,No Scarlet Witch movie?,,,,,,,
CX17qmYO0o0,Shang chi looks like jiren,,,,,,,
CX17qmYO0o0,The World Will Never Be The Same After ENDGAME,,,,,,,
CX17qmYO0o0,Yassss!Finally a look into Romanoffs secret  life.,,,,,,,
CX17qmYO0o0,"i'm hyped for black widow,black panther 2 and doctor strange 2",,,,,,,
CX17qmYO0o0,Venom: WEEEEE ARE VENN..!,,,,,,,
CX17qmYO0o0,ETERNAL: WE ARE ETERNALS!,,,,,,,
CX17qmYO0o0,missing cap and tony.....i only hope they would come back once,,,,,,,
CX17qmYO0o0,Endgame spoiler ahead:,,,,,,,
CX17qmYO0o0,AWESOME! but I'll be SUPER excited once I hear news of the first MCU Fantastic 4 and X-Men movies.,,,,,,,
CX17qmYO0o0,"“Nice to finally meet you, Spider-Man.”",,,,,,,
CX17qmYO0o0,Hmm,,,,,,,
CX17qmYO0o0,Omg thank you! ,,,,,,,
CX17qmYO0o0,Another Dr Strange,,,,,,,
CX17qmYO0o0,2:16 Eternals and Celestials are not the same thing,,,,,,,
CX17qmYO0o0,Quick silver- hey bring me back... im ded too,,,,,,,
CX17qmYO0o0,Hope this is not clickbait,,,,,,,
CX17qmYO0o0,Black Widow should've had a movie years ago.,,,,,,,
CX17qmYO0o0,Shang-chi and  black panther 2 will definitely  break the endgame record. This is according to current strategy and people's mindset over MCUs. Strange 2 and black widow will also collect a considerable huge profit.,,,,,,,
CX17qmYO0o0,Black widow just came back to life right guys!,,,,,,,
CX17qmYO0o0,TL,DR,,,,,,
CX17qmYO0o0,- Spider-Man: Far From Home,,,,,,,
CX17qmYO0o0,- Black Widow,,,,,,,
CX17qmYO0o0,Black panther is the best super hero ,,,,,,,
CX17qmYO0o0,I am so siked for the second movie,,,,,,,
CX17qmYO0o0,I could still hear him “love 3000”,,,,,,,
CX17qmYO0o0,Except black widow died genous,,,,,,,
CX17qmYO0o0,Marvel should release another movie ,,,,,,,
CX17qmYO0o0,The title will be : return of iron man,,,,,,,
CX17qmYO0o0,"Really guys? Tony and Widow will come back through some ""loophole.""",,,,,,,
CX17qmYO0o0,Spider-Man homecoming,,,,,,,
CX17qmYO0o0,Spider-Man far from home,,,,,,,
CX17qmYO0o0,Spiderman homeless,,,,,,,
CX17qmYO0o0,"4:30 considering they didnt have the advanced techniques and technology those days, they made some pretty decent fight scenes.",,,,,,,
CX17qmYO0o0,Marvel: Let’s call this movie endgame cause it’s the end ,,,,,,,
CX17qmYO0o0,Also marvel: let’s make 6 more movies before 2022,,,,,,,
CX17qmYO0o0,You missed Guardian of the Galaxy 3 Thor & Star Lord in the lead.,,,,,,,
CX17qmYO0o0,1:05 wait isn't black widow dead ? Is it from when she was alive?,,,,,,,
CX17qmYO0o0,There’s still going to make movies after endgame?? I thought that was the last one,,,,,,,
CX17qmYO0o0,I've thought there's a movie about Moon Knight..,,,,,,,
CX17qmYO0o0,Guardians of the galaxy 3,,,,,,,
CX17qmYO0o0,This gives me a reason to stay alive.,,,,,,,
CX17qmYO0o0,black f-ing widow FINALLY,,,,,,,
CX17qmYO0o0,Perfect ??,,,,,,,
CX17qmYO0o0,I NEED IRON MAN 4!,,,,,,,
CX17qmYO0o0,Make Thor Vs Noobmaster 69,,,,,,,
CX17qmYO0o0,Movies I like to watch,,,,,,,
CX17qmYO0o0,Spiderman: Far From Home,,,,,,,
CX17qmYO0o0,Black Panther 2 ,,,,,,,
CX17qmYO0o0,Doctor Strange 2,,,,,,,
CX17qmYO0o0,1:08 u go,,,,,,,
CX17qmYO0o0,Gardians of the galaxy 3? Pls,,,,,,,
CX17qmYO0o0,Tony stark we love you 3000,,,,,,,
CX17qmYO0o0,1:11 Tony Stark (Iron Man) is back.,,,,,,,
CX17qmYO0o0,What about venom ,-,,,,,,
CX17qmYO0o0,I miss captain america so so much ???,,,,,,,
CX17qmYO0o0,yo don't know for u guys but I want Thor:4 hahahaha,,,,,,,
CX17qmYO0o0,You forgot about the Venom 2,,,,,,,
CX17qmYO0o0,1:11 is it Tony,,,,,,,
CX17qmYO0o0,Without tony ? Hmmmmm... i think...?,,,,,,,
CX17qmYO0o0,Man-thing film plsss :),,,,,,,
CX17qmYO0o0,Guardians of the galaxy Vol 3?,,,,,,,
CX17qmYO0o0,Omg,,,,,,,
CX17qmYO0o0,Omg,,,,,,,
CX17qmYO0o0,Watch here!,,,,,,,
CX17qmYO0o0,No X Force any one?!,,,,,,,
CX17qmYO0o0,"Celestials were introduced though, not the Eternals.",,,,,,,
CX17qmYO0o0,I don’t think I really want to watch anymore marvel movies after endgame,,,,,,,
CX17qmYO0o0,Looks like X-Men Dark Phoenix was forgotten? Marvel Universe too ,),,,,,,
CX17qmYO0o0,Without Iron Man everything will be incomplete...?,,,,,,,
CX17qmYO0o0,No thor?,,,,,,,
CX17qmYO0o0,Black Widow?,,,,,,,
CX17qmYO0o0,I am so here for an Eternals movie.,,,,,,,
CX17qmYO0o0,The director of black panther movie was actually one of my grandpa’s students.,,,,,,,
CX17qmYO0o0,Wish I could meet him one day,,,,,,,
CX17qmYO0o0,So spider man then wait to 2021 this is so sad,,,,,,,
CX17qmYO0o0,What about LOKI?,,,,,,,
CX17qmYO0o0,How about Wave?,,,,,,,
CX17qmYO0o0,Okk soo I have to live 11 years more ?,,,,,,,
CX17qmYO0o0,phase 4 lookin kinda dry tbh,,,,,,,
CX17qmYO0o0,Galactus?,,,,,,,
CX17qmYO0o0,Bro is there the amazing spider man 3 movie shooting is going on... Will they release the movie or not? Please reply,,,,,,,
CX17qmYO0o0,I’m excited for black panther 2,,,,,,,
CX17qmYO0o0,I thought black widow died in endgame,,,,,,,
CX17qmYO0o0,thought black widows dead,,,,,,,
CX17qmYO0o0,Endgame 2,,,,,,,
CX17qmYO0o0,U fr?,,,,,,,
CX17qmYO0o0,-6 the Asian Avenger,,,,,,,
CX17qmYO0o0,Only interested in Black Widow. Will skip others.,,,,,,,
CX17qmYO0o0,Moin,,,,,,,
CX17qmYO0o0,16k dc fans,,,,,,,
CX17qmYO0o0,No one is going to watch black widow,,,,,,,
CX17qmYO0o0,I want to see galactica developed.,,,,,,,
CX17qmYO0o0,Lame,,,,,,,
CX17qmYO0o0,WHAT ABOUT THE PHANTOM ISNT HE A SUPER HERO TOO???,,,,,,,
CX17qmYO0o0,Black widows dead fam,,,,,,,
CX17qmYO0o0,"Well....that's a let down,  not one of those interests me at all except maybe Spidey",,,,,,,
CX17qmYO0o0,I think Dr Strange will bring Tony bak since he is the keeper of time after all...,,,,,,,
CX17qmYO0o0,"Shang Chi is Shang Tsing mixed with Quan Chi, and fights like Liu Kang",,,,,,,
CX17qmYO0o0,Black Widow died though,,,,,,,
CX17qmYO0o0,Marvel Studios should turn out a new movie every month.  Then no one would be going to see anything else.,,,,,,,
CX17qmYO0o0,hey man are you dead black widow is already dead in endgame,,,,,,,
CX17qmYO0o0,I taught black widow died already,,,,,,,
CX17qmYO0o0,How tho black widow died in endgame,,,,,,,
CX17qmYO0o0,"Can we call deadpool to clean up some timelines, I'm getting confused",,,,,,,
CX17qmYO0o0,Details released today state that Taskmaster will be the villain for the black widow film,,,,,,,
CX17qmYO0o0,Iron man 4? Magically Comes back to life ?,,,,,,,
CX17qmYO0o0,A nova movie is also quite likely.,,,,,,,
CX17qmYO0o0,YES! Finally BLACK WIDOW! Her own film!,,,,,,,
CX17qmYO0o0,Me:Yess i cant wait for doctor strange 2,,,,,,,
CX17qmYO0o0,2021:am i a joke to you?,,,,,,,
CX17qmYO0o0,Wait till comic con when they ACTUALLY show what movies are to be released,,,,,,,
CX17qmYO0o0,Dude Black Widow is Dead in Endgame she sacrificed her self for the soul stone,,,,,,,
CX17qmYO0o0,"Thanos-""I am invietable""",,,,,,,
CX17qmYO0o0,"Tony-""I am iron man""",,,,,,,
CX17qmYO0o0,Love you 3000 ????,,,,,,,
CX17qmYO0o0,Most excited for The Eternals and Dr. Strange 2 ?,,,,,,,
CX17qmYO0o0,Phase 4 - 5,,,,,,,
CX17qmYO0o0,Spiderman : Far From Home,,,,,,,
CX17qmYO0o0,Black Widow : Budapest,,,,,,,
CX17qmYO0o0,It's gonna be weird seeing Marvel movies without Mr. Stan Lee. I just hope they remember him and plug an image of him in. IDC if it's a picture or CGI.,,,,,,,
CX17qmYO0o0,Dc got NEW GODS and Marvrl got ETERNALS?,,,,,,,
CX17qmYO0o0,Hope they bring Moon Knight in the Black Panther sequel,,,,,,,
CX17qmYO0o0,"Actually the ""Eternal"" shown in Guardians was actually a Celestial, a being different from Eternal. The Eternals were created By the celestials to protect earth.",,,,,,,
CX17qmYO0o0,"""Love you 3000"" will be remembered.......",,,,,,,
CX17qmYO0o0,Didn’t black widow die?,,,,,,,
CX17qmYO0o0,"I need Loki..., that’s I only want....",,,,,,,
CX17qmYO0o0,For a second I thought #6 was the adventures of Bible-Man.,,,,,,,
CX17qmYO0o0,black window died in end game so how would she be in a movie??,,,,,,,
CX17qmYO0o0,When is MCU going to make moon knight.,,,,,,,
CX17qmYO0o0,Black widow died there can’t be another moive about her,,,,,,,
CX17qmYO0o0,Waiting for black widow movie ???,,,,,,,
CX17qmYO0o0,I was staring blankly after watching the endgame. Foolishly telling myself Captain America made a great exit and black widow needs to do it.,,,,,,,
CX17qmYO0o0,I still cant believe the great Iron Man left us...,,,,,,,
CX17qmYO0o0,But black widow is ded,,,,,,,
CX17qmYO0o0,"But i still wanna see more movie about iron man n his family, capt america thor n his partner, hulk.. still not over them yet",,,,,,,
CX17qmYO0o0,You have to have Donnie Yen from Ip Man be Shang Chi,,,,,,,
CX17qmYO0o0,2017 :- spiderman homecoming,,,,,,,
CX17qmYO0o0,2019 :- spiderman far away from home,,,,,,,
CX17qmYO0o0,2024 :- spiderman homeless,,,,,,,
CX17qmYO0o0,White Panther,,,,,,,
CX17qmYO0o0,Black widow had dead because of soul stone in end game,,,,,,,
CX17qmYO0o0,"Dear MCU,",,,,,,,
CX17qmYO0o0,we are grateful for the upcoming movies that we can't wait to see but please consider we have bills to pay.,,,,,,,
CX17qmYO0o0,Why i see tony stark at black widow movie,,,,,,,
CX17qmYO0o0,"Spider Man is the ONLY one I might see.  I don't really care about any of the others, nor know who some of them are.",,,,,,,
CX17qmYO0o0,BLACK WIDOW IS DEAD,,,,,,,
CX17qmYO0o0,"This made my day, i thought end game was the end of avengers, can't wait to watch them all. Especially Far from home. ???",,,,,,,
CX17qmYO0o0,Shang chi is getting a movie ????????,,,,,,,
CX17qmYO0o0,Wizard guy: Too many sorcerers,,,,,,,
CX17qmYO0o0,Me: Ahhhh shyyeettt,,,,,,,
CX17qmYO0o0,to all mcu fans i know tony death is hard for u but like our friend cap said u have to move on .,,,,,,,
CX17qmYO0o0,we love u 3000 and we will never forget u,,,,,,,
CX17qmYO0o0,Published May 23 2019 How tho???,,,,,,,
CX17qmYO0o0,"Everyone be like “ who shang-chi” bet you havent heard of shanna the she devil, kang the conqueror, living tribunal, the entity, moondragon, the beyonder, onslaught or hyperion",,,,,,,
CX17qmYO0o0,Dr strange had to come early,,,,,,,
CX17qmYO0o0,even if tony stark died we still love him 3000,,,,,,,
CX17qmYO0o0,Finally she gets her own movie.,,,,,,,
CX17qmYO0o0,You know who I'm talking about.,,,,,,,
CX17qmYO0o0,Take a guess.,,,,,,,
CX17qmYO0o0,I love 3000 (3000 is the total minutes of all the marvel movies),,,,,,,
CX17qmYO0o0,Black Widow ?,,,,,,,
CX17qmYO0o0,OBJECTION SPECULATION,,,,,,,
CX17qmYO0o0,"Robert Downey, Jr ""Ironman"" had a contract with Marvel, But the expenses were getting high for the CGI, Suits and Wage was getting high. This meant cutting him from the industry was the best option, Robert even agreed on this. ( I think )",,,,,,,
CX17qmYO0o0,I thought gaurdians of the galaxy 3 was rumored to be one with thor as one of the guardians,,,,,,,
CX17qmYO0o0,Guardian of the galaxy 3?,,,,,,,
CX17qmYO0o0,0:25 mistake already. The release date is 2nd of july,,,,,,,
CX17qmYO0o0,He Biffed it with Black Widow,,,,,,,
CX17qmYO0o0,Hawkeye deserved a movie too,,,,,,,
CX17qmYO0o0,Forgot guardians of the galaxy 3,,,,,,,
CX17qmYO0o0,I think I heard blade is also coming up as well but we will see it makes sense with the morbius movie,,,,,,,
CX17qmYO0o0,What do u mean by eternals? ,,,,,,,
CX17qmYO0o0,Im a kid hehe,,,,,,,
CX17qmYO0o0,After endgame it's just like..... hmmmmm whatever !,,,,,,,
CX17qmYO0o0,"So, no thor?",,,,,,,
CX17qmYO0o0,Sonic the hedgehog the Movie,,,,,,,
CX17qmYO0o0,Stop the I love u 3000 and come up with some original comments or I will have your comments terminated,,,,,,,
CX17qmYO0o0,SPOILER QUESTION FROM ENDGAME,,,,,,,
CX17qmYO0o0,"RDJ was the front man for years and did an amazing job in helping the MCU become what it is today. But, all good things must come to an end. It wont be the same without RDJ or Chris Evan's, but I see potential in the post Endgame future!",,,,,,,
CX17qmYO0o0,We want avengers back,,,,,,,
CX17qmYO0o0,How about the Gambit? When will it be screened?,,,,,,,
CX17qmYO0o0,Where is gotg vol3,,,,,,,
CX17qmYO0o0,Man shang chi looks awesome,,,,,,,
CX17qmYO0o0,Black widow ded lol,,,,,,,
CX17qmYO0o0,Where is nova?,,,,,,,
CX17qmYO0o0,Guardians 3 as well.,,,,,,,
CX17qmYO0o0,I dont think they going to publish like until 2021,,,,,,,
CX17qmYO0o0,Love 3000000,,,,,,,
CX17qmYO0o0,Ant man saved the world and they forgot about dark Phoenix,,,,,,,
CX17qmYO0o0,Hello World,,,,,,,
CX17qmYO0o0,?????????,,,,,,,
CX17qmYO0o0,I LOVE YOU 100000000000000000000000000000000000000 TONY,,,,,,,
CX17qmYO0o0,Wait but black widow is dead how will her movie come?,,,,,,,
CX17qmYO0o0,"More formulaic Hollywood dirge, wrapped up in a delicous-looking parcel of colorful advertising, well-edited trailers, glowing reviews that they pay ppl to write, and school ground ""must-be-the-first to see it"" hype..but make no mistake, it's still dirge.",,,,,,,
CX17qmYO0o0,So the black widow movie is gonna be in the past for sure well duh,,,,,,,
CX17qmYO0o0,What about Morbius: The Living Vampire that is gonna come out next year..?,,,,,,,
CX17qmYO0o0,How can black widow make a movie she's dead,,,,,,,
CX17qmYO0o0,Softer strangeR,,,,,,,
CX17qmYO0o0,Without tony stark marvel nothing,,,,,,,
CX17qmYO0o0,"Only excited for Spider-Man, The Eternals, and that last one Shang Chi.",,,,,,,
CX17qmYO0o0,man there is no guardians of the galaxy volume 3 in the list,,,,,,,
CX17qmYO0o0,Black widow died on endgame,,,,,,,
CX17qmYO0o0,Lol black widow ain’t coming out:( unless it’s about her story,,,,,,,
CX17qmYO0o0,I guess dark phoenix isn't MCU  but definately marvel,,,,,,,
