"video_id","publishedAt","channelId","title","description","thumbnails.default.url","thumbnails.default.width","thumbnails.default.height","thumbnails.medium.url","thumbnails.medium.width","thumbnails.medium.height","thumbnails.high.url","thumbnails.high.width","thumbnails.high.height","channelTitle","liveBroadcastContent","viewCount","likeCount","dislikeCount","favoriteCount","commentCount","month","year"
"CdmgQn6ZQcQ",2019-10-14,"UCcwhqgP7x7KQdV2AEoQg7ZQ","radio nepali short comedy flim ganesh gd","Instagram<U+27A1>Ganeshgd10 https://www.instagram.com/ganeshgd10/ Facebook <U+27A1>Ganesh GD https://www.facebook.com/GaneshGD99/ ...","https://i.ytimg.com/vi/CdmgQn6ZQcQ/default.jpg","120","90","https://i.ytimg.com/vi/CdmgQn6ZQcQ/mqdefault.jpg","320","180","https://i.ytimg.com/vi/CdmgQn6ZQcQ/hqdefault.jpg","480","360","GanEsH GD","none",180294,8858,285,0,410,10,2019
"bIfaljHZMEc",2017-05-02,"UC94wFyzOpaxrwtkoRe1FVfw","olaf schubert papst hartz der vierte quatsch comedy club classics","Olaf Schubert freut sich auf den deutschen Papst. Wobei der seiner Meinung nach auch einen typisch deutschen Namen hätte kriegen können: Papst Hartz der ...","https://i.ytimg.com/vi/bIfaljHZMEc/default.jpg","120","90","https://i.ytimg.com/vi/bIfaljHZMEc/mqdefault.jpg","320","180","https://i.ytimg.com/vi/bIfaljHZMEc/hqdefault.jpg","480","360","Quatsch Comedy Club","none",2180084,8783,843,0,373,5,2017
"O_rGlnOfGfI",2019-12-02,"UCGcheBSVngQt09ubb0BZyJw","albanischer schwabe als polizist luan comedy nightwash talent award 2019","Luan Comedy hat auf Streife schon so einiges erlebt. Luan Comedy beim Halbfinale des NightWash Talent Awards 2019. Mit freundlicher Unterstützung von ...","https://i.ytimg.com/vi/O_rGlnOfGfI/default.jpg","120","90","https://i.ytimg.com/vi/O_rGlnOfGfI/mqdefault.jpg","320","180","https://i.ytimg.com/vi/O_rGlnOfGfI/hqdefault.jpg","480","360","MySpass","none",278863,8425,281,0,384,12,2019
"9aZCdcUta7c",2019-10-27,"UCGcheBSVngQt09ubb0BZyJw","markus krebs bonnie ohne kleid 1live köln comedy nacht xxl 2019","Witze unter der Gürtellinie?! Bei Markus Krebs doch nicht! Die Kalauer Kanone haut wieder einen Knaller nach dem Nächsten raus. Die ganze Folge auf ...","https://i.ytimg.com/vi/9aZCdcUta7c/default.jpg","120","90","https://i.ytimg.com/vi/9aZCdcUta7c/mqdefault.jpg","320","180","https://i.ytimg.com/vi/9aZCdcUta7c/hqdefault.jpg","480","360","MySpass","none",2162180,14515,1199,0,516,10,2019
"4GwiWADRjjs",2019-10-27,"UCGcheBSVngQt09ubb0BZyJw","felix lobrecht krasser einbruch 1live köln comedy nacht xxl 2019","Ruft man bei der Polizei an... geht sie nicht dran. Bei Felix wurde eingebrochen, aber zum Glück hatte er einen gloreichen Einfall, wie er die Situation am besten ...","https://i.ytimg.com/vi/4GwiWADRjjs/default.jpg","120","90","https://i.ytimg.com/vi/4GwiWADRjjs/mqdefault.jpg","320","180","https://i.ytimg.com/vi/4GwiWADRjjs/hqdefault.jpg","480","360","MySpass","none",2622393,56281,2935,0,2278,10,2019
"l8mIX6mEv6M",2011-02-18,"UCRjdhRziOme0OSmUwbnwebg","bas kar bakula superhit gujarati comedy natak siddharth randeria swati shah","Download the app now and share it with all the asli fans https://shemaroome.app.link/MGDMocFk3W Give a missed call on 18002665151 ...","https://i.ytimg.com/vi/l8mIX6mEv6M/default.jpg","120","90","https://i.ytimg.com/vi/l8mIX6mEv6M/mqdefault.jpg","320","180","https://i.ytimg.com/vi/l8mIX6mEv6M/hqdefault.jpg","480","360","Shemaroo Gujarati","none",2305733,4896,987,0,276,2,2011
"mwakqGMhB5s",2015-05-29,"UCuSx-lf2ft7hPceGVNHybOw","vanka russian movie starmedia comedy melodrama english subtitles","More free russian movies with english subtitle: https://www.youtube.com/watch?v=88b1hJVZonM&list=PLwGzY25TNHPDvMR94Tj8lP4cmf6AGURaT Life has ...","https://i.ytimg.com/vi/mwakqGMhB5s/default.jpg","120","90","https://i.ytimg.com/vi/mwakqGMhB5s/mqdefault.jpg","320","180","https://i.ytimg.com/vi/mwakqGMhB5s/hqdefault.jpg","480","360","StarMediaEN","none",1283164,1571,404,0,82,5,2015
"nm5G-1Et0LE",2019-12-30,"UCBpcXP0i6qMsPW6CCU__obA","<U+0432><U+0441><U+0435> <U+0440><U+0435><U+0437><U+0438><U+0434><U+0435><U+043D><U+0442><U+044B> comedy club – <U+0432><U+0430><U+0436><U+043D><U+043E><U+0435> <U+0441><U+043E><U+0432><U+0435><U+0449><U+0430><U+043D><U+0438><U+0435>","","https://i.ytimg.com/vi/nm5G-1Et0LE/default.jpg","120","90","https://i.ytimg.com/vi/nm5G-1Et0LE/mqdefault.jpg","320","180","https://i.ytimg.com/vi/nm5G-1Et0LE/hqdefault.jpg","480","360","Old Spice Russia","none",9250584,136157,6091,0,4187,12,2019
"bS9R1akUWPg",2020-02-28,"UCoyHoMLkbCAqz0F5Pgcg9Ew","episode 142 <U+092C><U+0940><U+0918><U+093E> <U+0921><U+0940><U+0917><U+093E> <U+0926><U+093F><U+092F><U+093E> mukesh dahiya comedy season 2 yaara ke draame dahiya films","DAHIYA FILMS Episode: 142 <U+092C><U+0940><U+0918><U+093E> <U+0921><U+0940><U+0917><U+093E> <U+0926><U+093F><U+092F><U+093E> Like || Share || Comment HARYANVI COMEDY WEB SERIES "" KUNBA DHARME KA - Season-2 “ Latest ...","https://i.ytimg.com/vi/bS9R1akUWPg/default.jpg","120","90","https://i.ytimg.com/vi/bS9R1akUWPg/mqdefault.jpg","320","180","https://i.ytimg.com/vi/bS9R1akUWPg/hqdefault.jpg","480","360","DAHIYA FILMS","none",898408,22960,1497,0,1237,2,2020
"MEWTMTTupgo",2018-07-02,"UCcwhqgP7x7KQdV2AEoQg7ZQ","smoke nepali comedy video ganesh gd","My second Channel https://www.youtube.com/channel/UCGsJIYv3t6hxhnH2mj2xaLg Instagram<U+27A1>Ganeshgd10 https://www.instagram.com/ganeshgd10/ ...","https://i.ytimg.com/vi/MEWTMTTupgo/default.jpg","120","90","https://i.ytimg.com/vi/MEWTMTTupgo/mqdefault.jpg","320","180","https://i.ytimg.com/vi/MEWTMTTupgo/hqdefault.jpg","480","360","GanEsH GD","none",312792,9979,518,0,NA,7,2018
"HyIbwcRToBw",2013-10-31,"UCe7UKRSJM6ITMfXX-CbET0w","amhi doghe raja rani superhit full comedy marathi movies laxmikant berde sharad talwalkar","Enjoy the Superhit Full Marathi Movies ""<U+0906><U+092E><U+094D><U+0939><U+0940><U+0926><U+094B><U+0918><U+0902> <U+0930><U+093E><U+091C><U+093E><U+0930><U+093E><U+0923><U+0940> (Amhi Doghe Raja Rani)"" staring Laxmikant Berde, Tejashri, Sharad Talwalkar. Sit Back ...","https://i.ytimg.com/vi/HyIbwcRToBw/default.jpg","120","90","https://i.ytimg.com/vi/HyIbwcRToBw/mqdefault.jpg","320","180","https://i.ytimg.com/vi/HyIbwcRToBw/hqdefault.jpg","480","360","Everest Marathi","none",851066,1789,469,0,113,10,2013
"Nkk-8ss3PBI",2019-05-19,"UCcwhqgP7x7KQdV2AEoQg7ZQ","result ko pida nepali short comedy flim ganesh gd","Cast : Ganesh GD Raj Malla Nison Supporter :Bharat. Concept and created by Ganesh GD. <U+26D4>For Credit Just mail me........ Don't copyright...","https://i.ytimg.com/vi/Nkk-8ss3PBI/default.jpg","120","90","https://i.ytimg.com/vi/Nkk-8ss3PBI/mqdefault.jpg","320","180","https://i.ytimg.com/vi/Nkk-8ss3PBI/hqdefault.jpg","480","360","GanEsH GD","none",219180,10436,429,0,376,5,2019
"H8Z1HgF9iBs",2013-07-04,"UCqn6IMEa8WtY4_ZhJqjZn8Q","ghuggi labhey gharwali full punjabi comedy movie gurpreet ghuggi","Download the app now and share it with all the asli fans https://shemaroome.app.link/3bXPuCK9cX Give a missed call on 18002665151 www.shemaroome.com ...","https://i.ytimg.com/vi/H8Z1HgF9iBs/default.jpg","120","90","https://i.ytimg.com/vi/H8Z1HgF9iBs/mqdefault.jpg","320","180","https://i.ytimg.com/vi/H8Z1HgF9iBs/hqdefault.jpg","480","360","Shemaroo Punjabi","none",1031679,2728,650,0,77,7,2013
"9y6LwSG97zo",2019-10-08,"UC3GGlS5ZZVvAGZmdEcaA_NA","<U+043F><U+0430><U+0432><U+0435><U+043B> <U+0432><U+043E><U+043B><U+044F> <U+043D><U+043E><U+0432><U+044B><U+0439> <U+0444><U+043E><U+0440><U+043C><U+0430><U+0442> <U+043D><U+043E><U+0432><U+043E><U+0441><U+0442><U+0435><U+0439> comedy club 2016","<U+0411><U+043E><U+043B><U+044C><U+0448><U+0435> <U+0445><U+0430><U+0445><U+0430><U+0435><U+043A>, «<U+0414><U+0435><U+043D><U+044C><U+0433><U+0438> <U+0438><U+043B><U+0438> <U+041F><U+043E><U+0437><U+043E><U+0440>», «<U+041F><U+0440><U+043E><U+0436><U+0430><U+0440><U+043A><U+0430>» <U+0443> <U+043C><U+043E><U+0438><U+0445> <U+0434><U+0440><U+0443><U+0437><U+0435><U+0439> - <U+0442><U+0435><U+043B><U+0435><U+043A><U+0430><U+043D><U+0430><U+043B><U+0430> <U+0422><U+041D><U+0422>4 - https://youtube.com/tnt4ru.","https://i.ytimg.com/vi/9y6LwSG97zo/default.jpg","120","90","https://i.ytimg.com/vi/9y6LwSG97zo/mqdefault.jpg","320","180","https://i.ytimg.com/vi/9y6LwSG97zo/hqdefault.jpg","480","360","<U+041F><U+0430><U+0432><U+0435><U+043B> <U+0412><U+043E><U+043B><U+044F>","none",5972437,113903,10575,0,2702,10,2019
"zGnNEh6Ya80",2016-08-13,"UCKL5hAuzgFQsyrsQKgU0Qng","wowowin stand up comedian sobrang nami miss ang anak na malayo sa kanya","Nakakapagpasaya man ng maraming tao si Super Tekla, may lungkot pa ring nadarama dahil nawalay sa anak at asawa. Watch <U+200B>'Wowowin,' weekdays on ...","https://i.ytimg.com/vi/zGnNEh6Ya80/default.jpg","120","90","https://i.ytimg.com/vi/zGnNEh6Ya80/mqdefault.jpg","320","180","https://i.ytimg.com/vi/zGnNEh6Ya80/hqdefault.jpg","480","360","GMA Network","none",11903349,42534,2726,0,1446,8,2016
"vK_KMicFb3w",2019-09-16,"UC3GGlS5ZZVvAGZmdEcaA_NA","<U+043F><U+0430><U+0432><U+0435><U+043B> <U+0432><U+043E><U+043B><U+044F> <U+043E> <U+0441><U+043E><U+0431><U+0430><U+043A><U+0430><U+0445> <U+043A><U+043E><U+0448><U+043A><U+0430><U+0445> <U+0438> <U+0436><U+0438><U+0432><U+043E><U+0442><U+043D><U+044B><U+0445> comedy club 2017","<U+0411><U+043E><U+043B><U+044C><U+0448><U+0435> <U+0445><U+0430><U+0445><U+0430><U+0435><U+043A>, «<U+0414><U+0435><U+043D><U+044C><U+0433><U+0438> <U+0438><U+043B><U+0438> <U+041F><U+043E><U+0437><U+043E><U+0440>», «<U+041F><U+0440><U+043E><U+0436><U+0430><U+0440><U+043A><U+0430>» <U+0443> <U+043C><U+043E><U+0438><U+0445> <U+0434><U+0440><U+0443><U+0437><U+0435><U+0439> - <U+0442><U+0435><U+043B><U+0435><U+043A><U+0430><U+043D><U+0430><U+043B><U+0430> <U+0422><U+041D><U+0422>4 - https://youtube.com/tnt4ru.","https://i.ytimg.com/vi/vK_KMicFb3w/default.jpg","120","90","https://i.ytimg.com/vi/vK_KMicFb3w/mqdefault.jpg","320","180","https://i.ytimg.com/vi/vK_KMicFb3w/hqdefault.jpg","480","360","<U+041F><U+0430><U+0432><U+0435><U+043B> <U+0412><U+043E><U+043B><U+044F>","none",7737093,132327,7191,0,2325,9,2019
"vOM-ekg708I",2020-02-19,"UCr3cBLTYmIK9kY0F_OdFWFQ","casually explained stand up comedy","Go to https://expressvpn.com/casuallyexplained and find out how you can get 3 months free. Postive comments only, all hecklers will be banned. Big Merch: ...","https://i.ytimg.com/vi/vOM-ekg708I/default.jpg","120","90","https://i.ytimg.com/vi/vOM-ekg708I/mqdefault.jpg","320","180","https://i.ytimg.com/vi/vOM-ekg708I/hqdefault.jpg","480","360","Casually Explained","none",1261521,98727,976,0,2039,2,2020
"maLegAwjExo",2020-02-03,"UCEI_dcoGYhMLyYpXok6jmog","<U+091C><U+093E><U+0926><U+0941><U+0908> <U+0938><U+093F><U+0932><U+0947><U+0902><U+0921><U+0930> magical cylinder <U+0939><U+093F><U+0902><U+0926><U+0940> <U+0915><U+0939><U+093E><U+0928><U+093F><U+092F><U+093E><U+0902> hindi kahaniya funny village comedy stories kahani","<U+091C><U+093E><U+0926><U+0941><U+0908> <U+0938><U+093F><U+0932><U+0947><U+0902><U+0921><U+0930> Magical Cylinder <U+0939><U+093F><U+0902><U+0926><U+0940> <U+0915><U+0939><U+093E><U+0928><U+093F><U+092F><U+093E><U+0902> Hindi Kahaniya Funny Village Comedy Stories Kahani. Please Subscribe for more hindi comedy ...","https://i.ytimg.com/vi/maLegAwjExo/default.jpg","120","90","https://i.ytimg.com/vi/maLegAwjExo/mqdefault.jpg","320","180","https://i.ytimg.com/vi/maLegAwjExo/hqdefault.jpg","480","360","PopCorn /- Funny Hindi Comedy Videos","none",9865236,30188,9531,0,574,2,2020
"6FqUN9MO0zc",2018-07-06,"UCBOmfqgTZi7yDp4-3Lr_3lA","bhagam bhag 2006 hindi comedy full movie akshay kumar govinda lara dutta paresh rawal","For users in USA, use the code “SMDIWALI” to get 40% off on ShemarooMe app https://shemaroome.app.link/l5WBbkVF40 Take part in the following survey and ...","https://i.ytimg.com/vi/6FqUN9MO0zc/default.jpg","120","90","https://i.ytimg.com/vi/6FqUN9MO0zc/mqdefault.jpg","320","180","https://i.ytimg.com/vi/6FqUN9MO0zc/hqdefault.jpg","480","360","Shemaroo Movies","none",54396922,190887,32311,0,7910,7,2018
"EX-x6oul0ZU",2017-02-28,"UCqn6IMEa8WtY4_ZhJqjZn8Q","jija ji bn sharma jaswinder bhalla gurpreet ghuggi punjabi movies comedy movies 2017","Download the app now and share it with all the asli fans https://shemaroome.app.link/3bXPuCK9cX Give a missed call on 18002665151 www.shemaroome.com ...","https://i.ytimg.com/vi/EX-x6oul0ZU/default.jpg","120","90","https://i.ytimg.com/vi/EX-x6oul0ZU/mqdefault.jpg","320","180","https://i.ytimg.com/vi/EX-x6oul0ZU/hqdefault.jpg","480","360","Shemaroo Punjabi","none",659958,3544,455,0,192,2,2017
"SE9K-1IG028",2012-07-01,"UCUwQvRBEzekoJOKXn_657PA","william boeva comedy casino","haha die kerel is echt fataal.","https://i.ytimg.com/vi/SE9K-1IG028/default.jpg","120","90","https://i.ytimg.com/vi/SE9K-1IG028/mqdefault.jpg","320","180","https://i.ytimg.com/vi/SE9K-1IG028/hqdefault.jpg","480","360","Stijn Piessens","none",493503,1764,62,0,136,7,2012
"jAELQ9yCPdA",2020-02-23,"UC-SQpatMUyttygyX3qVWXYw","<U+092A><U+0947><U+091F><U+094D><U+0930><U+094B><U+0932> <U+091A><U+094B><U+0930> <U+091C><U+0947><U+0938><U+0940><U+092C><U+0940> petrol thief jcb wala hindi comedy <U+0939><U+093F><U+0902><U+0926><U+0940> <U+0915><U+0939><U+093E><U+0928><U+093F><U+092F><U+093E> hindi kahaniya comedy video","<U+092A><U+0947><U+091F><U+094D><U+0930><U+094B><U+0932> <U+091A><U+094B><U+0930> <U+091C><U+0947><U+0938><U+0940><U+092C><U+0940> Petrol Thief JCB WALA Hindi Comedy <U+0939><U+093F><U+0902><U+0926><U+0940> <U+0915><U+0939><U+093E><U+0928><U+093F><U+092F><U+093E> Hindi Kahaniya Comedy Video Please subscribe for more hindi kahaniya.","https://i.ytimg.com/vi/jAELQ9yCPdA/default.jpg","120","90","https://i.ytimg.com/vi/jAELQ9yCPdA/mqdefault.jpg","320","180","https://i.ytimg.com/vi/jAELQ9yCPdA/hqdefault.jpg","480","360","Josh - Hindi Kahaniya","none",4813050,22970,5354,0,576,2,2020
"M-EbBS649OU",2020-01-15,"UCSmcgW_N3wRE0tre4IEq70A","lottery faore best comedy scenes silheiba amp sushmita manipuri movie shajik thaba","SUBSCRIBE AND HIT THE BELL ICON FOR MORE LATEST UPDATE Subscribe To Rk Media Entertainment : https://bit.ly/2rbB3tc Must Watch Till The End ...","https://i.ytimg.com/vi/M-EbBS649OU/default.jpg","120","90","https://i.ytimg.com/vi/M-EbBS649OU/mqdefault.jpg","320","180","https://i.ytimg.com/vi/M-EbBS649OU/hqdefault.jpg","480","360","RK Media Entertainment","none",305937,3674,227,0,55,1,2020
"VCFzJeI7poE",2020-01-06,"UC6AUiHjy8mbUuMALch0bjPQ","<U+0939><U+0902><U+0938> <U+0939><U+0902><U+0938> <U+0915><U+0947> <U+0932><U+094B><U+091F> <U+092A><U+094B><U+091F> <U+0939><U+094B> <U+091C><U+093E><U+0913><U+0917><U+0947> comedy kingdom new superhit viral comedy part 85","new vigo viral videos | comedy kingdom new superhit viral comedy | very funny video please channel ko subscribe kare aur bell icon ko dabana na bhulen new ...","https://i.ytimg.com/vi/VCFzJeI7poE/default.jpg","120","90","https://i.ytimg.com/vi/VCFzJeI7poE/mqdefault.jpg","320","180","https://i.ytimg.com/vi/VCFzJeI7poE/hqdefault.jpg","480","360","Indian Club","none",188174,660,73,0,19,1,2020
"p54e46_pmMI",2019-05-08,"UCcwhqgP7x7KQdV2AEoQg7ZQ","exam ko pida nepali short comedy flim ganesh gd","Cast : Ganesh GD Raj Malla. Concept and created by Ganesh GD. Sponsored By : PA Security App Download it from Play store link...","https://i.ytimg.com/vi/p54e46_pmMI/default.jpg","120","90","https://i.ytimg.com/vi/p54e46_pmMI/mqdefault.jpg","320","180","https://i.ytimg.com/vi/p54e46_pmMI/hqdefault.jpg","480","360","GanEsH GD","none",111119,6873,446,0,402,5,2019
"65a-w526X5k",2015-12-29,"UCpMD6kc_WEzt-vxecyfKWpQ","family full length telugu comedy movie rajendra prasad ooha","Watch Family Full Length Telugu Comedy Movie - Rajendra Prasad, Ooha , Ali, Tanikella Bharani, Kinnera, Kovai Sarala, AVS, Subcribe ...","https://i.ytimg.com/vi/65a-w526X5k/default.jpg","120","90","https://i.ytimg.com/vi/65a-w526X5k/mqdefault.jpg","320","180","https://i.ytimg.com/vi/65a-w526X5k/hqdefault.jpg","480","360","Manisha Arts","none",188690,857,183,0,32,12,2015
"Qn1B1qKfTSM",2010-11-27,"UCR0PWWoNlKTuiM3cQKz1CwA","the tragic side of comedy freddie prinze","Excerpt from The Tragic Side of Comedy featuring Freddie Prinze.","https://i.ytimg.com/vi/Qn1B1qKfTSM/default.jpg","120","90","https://i.ytimg.com/vi/Qn1B1qKfTSM/mqdefault.jpg","320","180","https://i.ytimg.com/vi/Qn1B1qKfTSM/hqdefault.jpg","480","360","joeyguse","none",310919,1051,37,0,267,11,2010
"-Jnh_g_yt0Q",2011-12-27,"UCRjdhRziOme0OSmUwbnwebg","aav taru kari nakhu superhit gujarati comedy natak ashish bhatt pratima t surbhi vyas","' Download the app now and share it with all the asli fans https://shemaroome.app.link/MGDMocFk3W Give a missed call on 18002665151 ...","https://i.ytimg.com/vi/-Jnh_g_yt0Q/default.jpg","120","90","https://i.ytimg.com/vi/-Jnh_g_yt0Q/mqdefault.jpg","320","180","https://i.ytimg.com/vi/-Jnh_g_yt0Q/hqdefault.jpg","480","360","Shemaroo Gujarati","none",557797,958,283,0,44,12,2011
"Z1PCtIaM_GQ",2014-12-03,"UCjFqcJQXGZ6T6sxyFB-5i6A","jackie chan how to do action comedy","Some filmmakers can do action. Others can do comedy. But for 40 years, the master of combining them has been Jackie Chan. Let's see how he does it. (Note: to ...","https://i.ytimg.com/vi/Z1PCtIaM_GQ/default.jpg","120","90","https://i.ytimg.com/vi/Z1PCtIaM_GQ/mqdefault.jpg","320","180","https://i.ytimg.com/vi/Z1PCtIaM_GQ/hqdefault.jpg","480","360","Every Frame a Painting","none",17106653,225657,3596,0,7732,12,2014
"6Lc5D68L8ek",2017-05-02,"UCBOmfqgTZi7yDp4-3Lr_3lA","aflatoon hd hindi full movie akshay kumar urmila matondkar popular 90 39 s comedy movie","For users in USA, use the code “SMDIWALI” to get 40% off on ShemarooMe app https://shemaroome.app.link/l5WBbkVF40 Take part in the following survey and ...","https://i.ytimg.com/vi/6Lc5D68L8ek/default.jpg","120","90","https://i.ytimg.com/vi/6Lc5D68L8ek/mqdefault.jpg","320","180","https://i.ytimg.com/vi/6Lc5D68L8ek/hqdefault.jpg","480","360","Shemaroo Movies","none",7283923,17572,4794,0,699,5,2017
"gj4uyjlz-vY",2019-07-10,"UCcwhqgP7x7KQdV2AEoQg7ZQ","simran pandey vs ganesh gd part 2 nepali comedy ganesh gd","Follow me on Instagram<U+27A1>Ganeshgd10 https://www.instagram.com/ganeshgd10/ Facebook page<U+27A1>Ganesh GD https://www.facebook.com/00GD00/ .","https://i.ytimg.com/vi/gj4uyjlz-vY/default.jpg","120","90","https://i.ytimg.com/vi/gj4uyjlz-vY/mqdefault.jpg","320","180","https://i.ytimg.com/vi/gj4uyjlz-vY/hqdefault.jpg","480","360","GanEsH GD","none",245239,13703,512,0,413,7,2019
"SsLc5JwCDNs",2019-10-23,"UCcwhqgP7x7KQdV2AEoQg7ZQ","dhookaa nepali comedy ganesh gd","cast : Ganesh Devi Roshani kamal ubjan:https://www.youtube.com/channel/UCM1Oqa7Y--EPgqhNOeM_eiw concept And Created by - Ganesh GD ...","https://i.ytimg.com/vi/SsLc5JwCDNs/default.jpg","120","90","https://i.ytimg.com/vi/SsLc5JwCDNs/mqdefault.jpg","320","180","https://i.ytimg.com/vi/SsLc5JwCDNs/hqdefault.jpg","480","360","GanEsH GD","none",149396,7662,226,0,255,10,2019
"-cAvpsVhW3o",2019-11-05,"UC6AUiHjy8mbUuMALch0bjPQ","the comedy kingdom comedy kingdom new superhit viral comedy part 25","new vigo viral videos | comedy kingdom new superhit viral comedy | very funny video DOWNLOAD VIGO VIDEO APP : https://go.onelink.me/gtBl/vigoworld ...","https://i.ytimg.com/vi/-cAvpsVhW3o/default.jpg","120","90","https://i.ytimg.com/vi/-cAvpsVhW3o/mqdefault.jpg","320","180","https://i.ytimg.com/vi/-cAvpsVhW3o/hqdefault.jpg","480","360","Indian Club","none",57305,647,36,0,5,11,2019
"SZWBrgyF5FA",2018-06-01,"UCDpCa-bGxbXS6CiZ5fOJLsg","shaadi express hyderabadi full comedy movie mast ali aziz naser altaf hyder sanjay punjabi","Watch & Enjoy Shaadi Express Hyderabadi Full Comedy Movie. Starring: Mast Ali, Aziz Naser, Altaf Hyder, Dheer Charan Srivastav, Anju Ansari, Archana, ...","https://i.ytimg.com/vi/SZWBrgyF5FA/default.jpg","120","90","https://i.ytimg.com/vi/SZWBrgyF5FA/mqdefault.jpg","320","180","https://i.ytimg.com/vi/SZWBrgyF5FA/hqdefault.jpg","480","360","Silly Monks Deccan","none",3750574,17024,2392,0,1064,6,2018
"fr34Tsrcry8",2015-12-25,"UC0PKLLmL8pIJLjOI1gBH_pA","kunwara hd govinda urmila matondkar om puri kader khan comedy hindi movie","Raju meets Urmila in New Zealand and both fall in love deciding to meet again in India. However, as Raju returns India, he meets heartbroken pregnant ...","https://i.ytimg.com/vi/fr34Tsrcry8/default.jpg","120","90","https://i.ytimg.com/vi/fr34Tsrcry8/mqdefault.jpg","320","180","https://i.ytimg.com/vi/fr34Tsrcry8/hqdefault.jpg","480","360","Shemaroo Comedy","none",12541398,28609,7745,0,1288,12,2015
"TRahfoWq_3U",2014-04-25,"UCEKWXRsfUHkan-D_ljU8Asw","phas gaye re obama bollywood comedy hindi movie neha dhupia rajat kapoor sanjay mishra","Download it on Google Play: http://goo.gl/FX0ndA Watch the critically hit comedy drama of 2010 'Phas Gaya Re Obama' starring Rajat Kapoor, Neha Dhupia, ...","https://i.ytimg.com/vi/TRahfoWq_3U/default.jpg","120","90","https://i.ytimg.com/vi/TRahfoWq_3U/mqdefault.jpg","320","180","https://i.ytimg.com/vi/TRahfoWq_3U/hqdefault.jpg","480","360","Rajshri","none",498915,2291,172,0,130,4,2014
"mith6CEZ-V4",2019-03-27,"UCcwhqgP7x7KQdV2AEoQg7ZQ","upcoming rapper of nepal nepali comedy ganesh gd","Instagram<U+27A1>Ganeshgd10 https://www.instagram.com/ganeshgd10/ Facebook page<U+27A1>Ganesh GD https:///Ganesh-GD-194440467803990/ .","https://i.ytimg.com/vi/mith6CEZ-V4/default.jpg","120","90","https://i.ytimg.com/vi/mith6CEZ-V4/mqdefault.jpg","320","180","https://i.ytimg.com/vi/mith6CEZ-V4/hqdefault.jpg","480","360","GanEsH GD","none",98350,6225,326,0,492,3,2019
"PcnzbnDZKHQ",2020-01-13,"UC6AUiHjy8mbUuMALch0bjPQ","<U+0939><U+0902><U+0938> <U+0939><U+0902><U+0938> <U+0915><U+0947> <U+0932><U+094B><U+091F> <U+092A><U+094B><U+091F> <U+0939><U+094B> <U+091C><U+093E><U+0913><U+0917><U+0947> comedy kingdom new superhit viral comedy part 92","new vigo viral videos | comedy kingdom new superhit viral comedy | very funny video please channel ko subscribe kare aur bell icon ko dabana na bhulen new ...","https://i.ytimg.com/vi/PcnzbnDZKHQ/default.jpg","120","90","https://i.ytimg.com/vi/PcnzbnDZKHQ/mqdefault.jpg","320","180","https://i.ytimg.com/vi/PcnzbnDZKHQ/hqdefault.jpg","480","360","Indian Club","none",66139,398,25,0,28,1,2020
"B2zHIq5-jmE",2013-10-31,"UCqn6IMEa8WtY4_ZhJqjZn8Q","jatt airways jaswinder bhalla b n sharma binnu dhillon blockbuster comedy movie","Download the app now and share it with all the asli fans https://shemaroome.app.link/3bXPuCK9cX Give a missed call on 18002665151 www.shemaroome.com ...","https://i.ytimg.com/vi/B2zHIq5-jmE/default.jpg","120","90","https://i.ytimg.com/vi/B2zHIq5-jmE/mqdefault.jpg","320","180","https://i.ytimg.com/vi/B2zHIq5-jmE/hqdefault.jpg","480","360","Shemaroo Punjabi","none",5278555,14731,2472,0,71,10,2013
"jmSdKUQ2N4U",2015-01-22,"UCFhMR0FTvRYoWOvgjaNRQlg","comedy barn theater commercial","Come visit the Comedy Barn® Theater and help us celebrate our 20th Anniversary. This season will be filled with special guests, special events and contests!","https://i.ytimg.com/vi/jmSdKUQ2N4U/default.jpg","120","90","https://i.ytimg.com/vi/jmSdKUQ2N4U/mqdefault.jpg","320","180","https://i.ytimg.com/vi/jmSdKUQ2N4U/hqdefault.jpg","480","360","GCI Inc","none",65352,14,0,0,0,1,2015
"3rgLBXZlCMo",2014-05-15,"UCqn6IMEa8WtY4_ZhJqjZn8Q","family 430 khajana gurchet chitarkar comedy movie shemaroo full hd punjabi movies","Download the app now and share it with all the asli fans https://shemaroome.app.link/3bXPuCK9cX Give a missed call on 18002665151 www.shemaroome.com ...","https://i.ytimg.com/vi/3rgLBXZlCMo/default.jpg","120","90","https://i.ytimg.com/vi/3rgLBXZlCMo/mqdefault.jpg","320","180","https://i.ytimg.com/vi/3rgLBXZlCMo/hqdefault.jpg","480","360","Shemaroo Punjabi","none",2399699,8179,1482,0,507,5,2014
"zTk0dJUlgc0",2018-01-09,"UC7O7af501mv4Ab4oCSdPTxw","rabbit travel don 39 t smoke for paramount comedy","","https://i.ytimg.com/vi/zTk0dJUlgc0/default.jpg","120","90","https://i.ytimg.com/vi/zTk0dJUlgc0/mqdefault.jpg","320","180","https://i.ytimg.com/vi/zTk0dJUlgc0/hqdefault.jpg","480","360","VolFMaple","none",24638,835,11,0,22,1,2018
"jUvWLQ0nw1M",2012-01-27,"UCiHwRw0jF_e4g7h4CejnOAQ","comedy lesson 2 power of silence","www.TheComedyInstitute.com From the 'Mastering Stand-up"" workshop. For more go to www.thecomedyinstitute.com.","https://i.ytimg.com/vi/jUvWLQ0nw1M/default.jpg","120","90","https://i.ytimg.com/vi/jUvWLQ0nw1M/mqdefault.jpg","320","180","https://i.ytimg.com/vi/jUvWLQ0nw1M/hqdefault.jpg","480","360","Greg Romero Wilson","none",15843,NA,NA,0,0,1,2012
"tIfnvw9CwoY",2012-11-27,"UCqn6IMEa8WtY4_ZhJqjZn8Q","ghuggi yaar gupp na maar gurpreet ghuggi full movie blockbuster punjabi comedy","Download the app now and share it with all the asli fans https://shemaroome.app.link/3bXPuCK9cX Give a missed call on 18002665151 www.shemaroome.com ...","https://i.ytimg.com/vi/tIfnvw9CwoY/default.jpg","120","90","https://i.ytimg.com/vi/tIfnvw9CwoY/mqdefault.jpg","320","180","https://i.ytimg.com/vi/tIfnvw9CwoY/hqdefault.jpg","480","360","Shemaroo Punjabi","none",2834856,9890,1621,0,26,11,2012
"vCre5uTqImY",2020-01-26,"UCrXhTiBUGOgWLYILjcJ37Zw","karimeen chala karikku comedy","karikku new episode | Karikku | Comedy karikku latest video DM for removal of this video Copyright : karikku If you have any questions regarding the ...","https://i.ytimg.com/vi/vCre5uTqImY/default.jpg","120","90","https://i.ytimg.com/vi/vCre5uTqImY/mqdefault.jpg","320","180","https://i.ytimg.com/vi/vCre5uTqImY/hqdefault.jpg","480","360","Gopikrishna Techy","none",440678,8104,260,0,112,1,2020
