"video_id","publishedAt","channelId","title","description","thumbnails.default.url","thumbnails.default.width","thumbnails.default.height","thumbnails.medium.url","thumbnails.medium.width","thumbnails.medium.height","thumbnails.high.url","thumbnails.high.width","thumbnails.high.height","channelTitle","liveBroadcastContent","viewCount","likeCount","dislikeCount","favoriteCount","commentCount","month","year"
"Hqpl2jnJOag",2020-03-06,"UCf-UXsmb4y6Uqf4cqe9tJRQ","<U+0939><U+0947><U+0932><U+0940><U+0915><U+093E><U+092A><U+094D><U+091F><U+0930> <U+0938><U+093E><U+0907><U+0915><U+093F><U+0932> <U+0930><U+0947><U+0938> helicopter cycle race comedy video <U+0939><U+093F><U+0902><U+0926><U+0940> <U+0915><U+0939><U+093E><U+0928><U+093F><U+092F><U+093E><U+0902> hindi kahaniya comedy video","<U+0939><U+0947><U+0932><U+0940><U+0915><U+093E><U+092A><U+094D><U+091F><U+0930> <U+0938><U+093E><U+0907><U+0915><U+093F><U+0932> <U+0930><U+0947><U+0938> Helicopter Cycle Race Comedy Video <U+0939><U+093F><U+0902><U+0926><U+0940> <U+0915><U+0939><U+093E><U+0928><U+093F><U+092F><U+093E><U+0902> Hindi Kahaniya Comedy Video. For More Moral Stories Please...","https://i.ytimg.com/vi/Hqpl2jnJOag/default.jpg","120","90","https://i.ytimg.com/vi/Hqpl2jnJOag/mqdefault.jpg","320","180","https://i.ytimg.com/vi/Hqpl2jnJOag/hqdefault.jpg","480","360","Hindi Kahaniya Moral Stories","none",934627,7022,1282,0,183,3,2020
"RmtjUnVTVUA",2019-10-04,"UCF1JIbMUs6uqoZEY1Haw0GQ","comedy scenes from blockbuster movie paresh rawal akshay kumar govinda bhagam bhag","Download the app now and share it with all the asli fans http://twd.bz/shemaroome Subscribe to Shemaroo - http://bit.ly/2DNFnzF Give a missed call on ...","https://i.ytimg.com/vi/RmtjUnVTVUA/default.jpg","120","90","https://i.ytimg.com/vi/RmtjUnVTVUA/mqdefault.jpg","320","180","https://i.ytimg.com/vi/RmtjUnVTVUA/hqdefault.jpg","480","360","Shemaroo","none",20703895,112935,16427,0,2959,10,2019
"pCk6VmsVo6M",2020-03-06,"UCkJqlgjBQ_xRO1N7XjSnE3A","<U+091F><U+094D><U+0930><U+0947><U+0915><U+094D><U+091F><U+0930> <U+091F><U+094D><U+0930><U+0947><U+0928> tractor train village comedy video <U+0939><U+093F><U+0902><U+0926><U+0940> <U+0915><U+0939><U+093E><U+0928><U+093F><U+092F><U+093E> hindi kahaniya hindi stories comedy","<U+091F><U+094D><U+0930><U+0947><U+0915><U+094D><U+091F><U+0930> <U+091F><U+094D><U+0930><U+0947><U+0928> Tractor Train Village Comedy Video <U+0939><U+093F><U+0902><U+0926><U+0940> <U+0915><U+0939><U+093E><U+0928><U+093F><U+092F><U+093E> Hindi Kahaniya Hindi Stories Comedy Video. Please subscribe for more hindi...","https://i.ytimg.com/vi/pCk6VmsVo6M/default.jpg","120","90","https://i.ytimg.com/vi/pCk6VmsVo6M/mqdefault.jpg","320","180","https://i.ytimg.com/vi/pCk6VmsVo6M/hqdefault.jpg","480","360","KirraK Tv","none",1031794,7425,1462,0,206,3,2020
"Wa2U3tcXNAo",2020-02-20,"UC5tuYcCdiKuF5Y2ZonuarwA","chotu dada ambulance wala quot <U+091B><U+094B><U+091F><U+0942> <U+0926><U+093E><U+0926><U+093E> <U+090F><U+092E><U+094D><U+092C><U+0941><U+0932><U+0947><U+0902><U+0938> <U+0935><U+093E><U+0932><U+093E> quot khandesh hindi comedy chotu comedy video","Chotu#Chotudadaambulancewala #Chotucomedy <U+091B><U+094B><U+091F><U+0942> <U+0926><U+093E><U+0926><U+093E> <U+090F><U+092E><U+094D><U+092C><U+0941><U+0932><U+0947><U+0902><U+0938> <U+0935><U+093E><U+0932><U+093E> <U+091B><U+094B><U+091F><U+0942> <U+0926><U+093E><U+0926><U+093E> <U+0915><U+0947> <U+0932><U+093F><U+090F> <U+090F><U+0915> <U+092C><U+0921><U+093C><U+0940> <U+091A><U+0941><U+0928><U+094C><U+0924><U+0940>...","https://i.ytimg.com/vi/Wa2U3tcXNAo/default.jpg","120","90","https://i.ytimg.com/vi/Wa2U3tcXNAo/mqdefault.jpg","320","180","https://i.ytimg.com/vi/Wa2U3tcXNAo/hqdefault.jpg","480","360","Jkk Entertainment","none",27210285,115653,36759,0,923,2,2020
"mcJY5N1ypEc",2020-02-28,"UClcLiU2tRSM0uqi_Lcw5WnQ","indian weddings stand up comedy by vaibhav sethia","I tell the story of my wedding day. Edit : Myoho Films (Karan Asnani) Video : Rakesh U.P. and team. Venue : That Comedy Club, Bangalore.","https://i.ytimg.com/vi/mcJY5N1ypEc/default.jpg","120","90","https://i.ytimg.com/vi/mcJY5N1ypEc/mqdefault.jpg","320","180","https://i.ytimg.com/vi/mcJY5N1ypEc/hqdefault.jpg","480","360","VAIBHAV SETHIA","none",992600,48230,1944,0,896,2,2020
"pZcnvIAL6Ys",2020-02-10,"UC3uTUlmgECBnsP777U4GPKQ","school time 2 jokes cs bisht vines desi comedy video school classroom jokes","Comedy Videos, desi comedy videos, school time comedy, school time 2, comedy Likee videos, comedy Tiktok Video, bisht vines, New Jokes, Hindi Joks, ...","https://i.ytimg.com/vi/pZcnvIAL6Ys/default.jpg","120","90","https://i.ytimg.com/vi/pZcnvIAL6Ys/mqdefault.jpg","320","180","https://i.ytimg.com/vi/pZcnvIAL6Ys/hqdefault.jpg","480","360","CS Bisht Vines","none",8798993,34723,11247,0,472,2,2020
"wsI-usDoGW0",2020-02-13,"UC4B6dDVB0Umrh5l4UgxUtyg","very funny stupid boys 2020 best comedy video 2020 try to not laugh episode 117 by my family","Very Funny Stupid Boys 2020_Best Comedy Video 2020_Try To Not Laugh_Episode 116_By My family #My_Family #new_funny_video #hindi_comedy ...","https://i.ytimg.com/vi/wsI-usDoGW0/default.jpg","120","90","https://i.ytimg.com/vi/wsI-usDoGW0/mqdefault.jpg","320","180","https://i.ytimg.com/vi/wsI-usDoGW0/hqdefault.jpg","480","360","MY FAMILY","none",924984,4953,1092,0,177,2,2020
"uty3UDLCQ2E",2020-02-29,"UCPNH75wRbz-cO-W8732981A","chotu dada gas cylinder wala quot <U+091B><U+094B><U+091F><U+0942> <U+0926><U+093E><U+0926><U+093E> <U+0917><U+0948><U+0938> <U+0938><U+093F><U+0932><U+0947><U+0902><U+0921><U+0930> <U+0935><U+093E><U+0932><U+093E> quot khandesh comedy chotu comedy video","chotudadagascylinderwala #gascylinder #chotudada <U+091B><U+094B><U+091F><U+0942> <U+0926><U+093E><U+0926><U+093E> <U+0906><U+092F><U+093E> <U+0918><U+0930> <U+0938><U+0947> <U+092C><U+093E><U+091F><U+0932><U+093E> <U+0928><U+093F><U+0915><U+093E><U+0932> | <U+091B><U+094B><U+091F><U+0942> <U+0917><U+0948><U+0938> <U+0935><U+093E><U+0932><U+093E> <U+0906><U+092F><U+093E> <U+092C><U+093E><U+091F><U+0932><U+093E>...","https://i.ytimg.com/vi/uty3UDLCQ2E/default.jpg","120","90","https://i.ytimg.com/vi/uty3UDLCQ2E/mqdefault.jpg","320","180","https://i.ytimg.com/vi/uty3UDLCQ2E/hqdefault.jpg","480","360","CHHOTU KI MASTI","none",7394766,41497,9404,0,721,2,2020
"HJ2bn4dAr5Q",2020-03-01,"UCxyCzPY2pjAjrxoSYclpuLg","try not to laugh bewilderment and paranoia laugh factory stand up comedy","Do you think everyone's laughing at you? Either you're paranoid or you're Jessica Keenan, Adam Ray, Matty Chymbor, Vinny Fasline, Alonzo Bodden, and Rob ...","https://i.ytimg.com/vi/HJ2bn4dAr5Q/default.jpg","120","90","https://i.ytimg.com/vi/HJ2bn4dAr5Q/mqdefault.jpg","320","180","https://i.ytimg.com/vi/HJ2bn4dAr5Q/hqdefault.jpg","480","360","Laugh Factory","none",24275,448,19,0,21,3,2020
"jtUgFJO4Q3Q",2020-03-07,"UCZSKGcthSWHJQldMR4lN3zA","rajendra prasad funny interesting comedy scene telugu comedy scenes silver screen movies","Rajendra Prasad Funny Interesting Comedy Scene | Telugu COmedy Scenes | Silver Screen Movies #telugumovies #telugucomedyscenes ...","https://i.ytimg.com/vi/jtUgFJO4Q3Q/default.jpg","120","90","https://i.ytimg.com/vi/jtUgFJO4Q3Q/mqdefault.jpg","320","180","https://i.ytimg.com/vi/jtUgFJO4Q3Q/hqdefault.jpg","480","360","Silver Screen Movies","none",124856,1319,113,0,NA,3,2020
"hFj8CwisIe0",2020-03-04,"UCfl_I6C9DGcSGmjIGUxU04Q","<U+091C><U+0942><U+0924><U+093E> <U+091A><U+094B><U+0930> <U+0935><U+093E><U+0932><U+093E> joota wala chor shoe thief comedy video <U+0939><U+093F><U+0902><U+0926><U+0940> <U+0915><U+0939><U+093E><U+0928><U+093F><U+092F> hindi kahaniya story comedy video","<U+091C><U+0942><U+0924><U+093E> <U+091A><U+094B><U+0930> <U+0935><U+093E><U+0932><U+093E> Joota Wala Chor Shoe Thief Comedy Video <U+0939><U+093F><U+0902><U+0926><U+0940> <U+0915><U+0939><U+093E><U+0928><U+093F><U+092F><U+093E><U+0902> Hindi Kahaniya Comedy Video. For More Moral Stories To Watch Please ...","https://i.ytimg.com/vi/hFj8CwisIe0/default.jpg","120","90","https://i.ytimg.com/vi/hFj8CwisIe0/mqdefault.jpg","320","180","https://i.ytimg.com/vi/hFj8CwisIe0/hqdefault.jpg","480","360","MaJa Tv Moral Stories Fairy Tales","none",5206607,19287,5250,0,474,3,2020
"6Szd-gqoUuI",2020-02-14,"UCQmZ9BIYOBSkxL-eqqg5z-g","broke boyfriend mark angel comedy episode 247","This very funny video will make you laugh out loud. Success is really a clown. Happy Valentine to you all, we love you. Please don't forget to subscribe to Mark ...","https://i.ytimg.com/vi/6Szd-gqoUuI/default.jpg","120","90","https://i.ytimg.com/vi/6Szd-gqoUuI/mqdefault.jpg","320","180","https://i.ytimg.com/vi/6Szd-gqoUuI/hqdefault.jpg","480","360","MarkAngelComedy","none",1712762,45787,803,0,1890,2,2020
"RPTfFjQn5Zg",2020-02-29,"UCgpqzBwX8uTsHCwG2l1jKeA","joke of corona viruse in classroom pm toons classroom comedy kanpuriya jokes","JOKE OF - CRONA SUTDENT VS CRAZY STUDENTS / PM TOONS / CLASSROOM COMEDY / KANPURIYA JOKES For Making website- ...","https://i.ytimg.com/vi/RPTfFjQn5Zg/default.jpg","120","90","https://i.ytimg.com/vi/RPTfFjQn5Zg/mqdefault.jpg","320","180","https://i.ytimg.com/vi/RPTfFjQn5Zg/hqdefault.jpg","480","360","PM Toons","none",197173,1921,173,0,85,2,2020
"60LJHWFu9yA",2020-03-06,"UCSFDSevWU-OX8cjZPZZZAnQ","comedy masters <U+0D15><U+0D4B><U+0D2E><U+0D21><U+0D3F> <U+0D2E><U+0D3E><U+0D38><U+0D4D><U+0D31><U+0D4D><U+0D31><U+0D47><U+0D34><U+0D4D><U+0D38><U+0D4D> episode 44 amrita tv","""<U+0D15><U+0D4B><U+0D2E><U+0D21><U+0D3F> <U+0D2E><U+0D3E><U+0D38><U+0D4D><U+0D31><U+0D4D><U+0D31><U+0D47><U+0D34><U+0D4D><U+0D38><U+0D4D>"" <U+0D35><U+0D4D><U+0D2F><U+0D3E><U+0D34><U+0D02> <U+0D35><U+0D46><U+0D33><U+0D4D><U+0D33><U+0D3F> <U+0D26><U+0D3F><U+0D35><U+0D38><U+0D19><U+0D4D><U+0D19><U+0D33><U+0D3F><U+0D7D> <U+0D30><U+0D3E><U+0D24><U+0D4D><U+0D30><U+0D3F> 8:30 <U+0D2E><U+0D41><U+0D24><U+0D7D> 9:30 <U+0D35><U+0D30><U+0D46> <U+0D28><U+0D3F><U+0D19><U+0D4D><U+0D19><U+0D33><U+0D41>...","https://i.ytimg.com/vi/60LJHWFu9yA/default.jpg","120","90","https://i.ytimg.com/vi/60LJHWFu9yA/mqdefault.jpg","320","180","https://i.ytimg.com/vi/60LJHWFu9yA/hqdefault.jpg","480","360","Amrita TV Reality Shows","none",8198,61,11,0,11,3,2020
"wnlWCZxnwPg",2020-03-05,"UCyxifPm6ErHW08oXMpzqATw","comedy <U+0431><U+0430><U+0442><U+0442><U+043B> <U+0442><U+043E><U+043F> <U+043C><U+0438><U+043D><U+0438><U+0430><U+0442><U+044E><U+0440> <U+0437><U+0430> 10 <U+043B><U+0435><U+0442>","10 <U+0441><U+0435><U+0437><U+043E><U+043D> <U+0433><U+043B><U+0430><U+0432><U+043D><U+043E><U+0439> <U+044E><U+043C><U+043E><U+0440><U+0438><U+0441><U+0442><U+0438><U+0447><U+0435><U+0441><U+043A><U+043E><U+0439> <U+043A><U+0443><U+0437><U+043D><U+0438><U+0446><U+044B> <U+0420><U+043E><U+0441><U+0441><U+0438><U+0438> - <U+043E><U+0442><U+043B><U+0438><U+0447><U+043D><U+044B><U+0439> <U+043F><U+043E><U+0432><U+043E><U+0434> <U+0432><U+0441><U+043F><U+043E><U+043C><U+043D><U+0438><U+0442><U+044C> <U+0441><U+0430><U+043C><U+044B><U+0435> <U+0441><U+043C><U+0435><U+0448><U+043D><U+044B><U+0435> <U+043D><U+043E><U+043C><U+0435><U+0440><U+0430> <U+0437><U+0430> 10 <U+043B><U+0435><U+0442>...","https://i.ytimg.com/vi/wnlWCZxnwPg/default.jpg","120","90","https://i.ytimg.com/vi/wnlWCZxnwPg/mqdefault.jpg","320","180","https://i.ytimg.com/vi/wnlWCZxnwPg/hqdefault.jpg","480","360","<U+0422><U+0435><U+043B><U+0435><U+043A><U+0430><U+043D><U+0430><U+043B> <U+0422><U+041D><U+0422>","none",484565,10271,1017,0,338,3,2020
"UcIlk1tNWsE",2019-12-20,"UCQmZ9BIYOBSkxL-eqqg5z-g","best of aunty success and emanuella 2019 mark angel comedy episode 240","This funny video is hilarious. We wish you all a Very Merry Christmas in advance. Please don't forget to subscribe to Mark Angel Comedy Official YouTube ...","https://i.ytimg.com/vi/UcIlk1tNWsE/default.jpg","120","90","https://i.ytimg.com/vi/UcIlk1tNWsE/mqdefault.jpg","320","180","https://i.ytimg.com/vi/UcIlk1tNWsE/hqdefault.jpg","480","360","MarkAngelComedy","none",4551343,34509,2707,0,1949,12,2019
"UcFMD5GUUn4",2020-03-07,"UC3TZS2NXCGVLz2sahZpr7zA","maa nanna tik tok celebrity comedy videos 2020 funny videos chandragiri subbu latest videos","Maa Nanna Tik Tok Celebrity Latest Comedy Video, exclusively on Chandragiri Subbu channel. #MaaNannaTikTokCelebrity funny video ft. Chandragiri Subbu.","https://i.ytimg.com/vi/UcFMD5GUUn4/default.jpg","120","90","https://i.ytimg.com/vi/UcFMD5GUUn4/mqdefault.jpg","320","180","https://i.ytimg.com/vi/UcFMD5GUUn4/hqdefault.jpg","480","360","Chandragiri Subbu","none",10903,865,23,0,194,3,2020
"9tZz9lCkHgM",2020-03-04,"UCHj0FkOoN-qZpgp3FCEpOeg","holi special nepali comedy short film local production march 2020","Holi Special || Nepali Comedy Short Film || Local Production || March 2020 this is comedy video. this video is funny video. we usually make serious or love story.","https://i.ytimg.com/vi/9tZz9lCkHgM/default.jpg","120","90","https://i.ytimg.com/vi/9tZz9lCkHgM/mqdefault.jpg","320","180","https://i.ytimg.com/vi/9tZz9lCkHgM/hqdefault.jpg","480","360","Local Production","none",253565,9591,378,0,177,3,2020
"Bo3hjrUOppk",2020-03-02,"UCGE-L0dJpos3ut0N96H75Jw","natia comedy part 54 natia ku current utkal cartoon world","Natia Comedy part 54 || Natia ku current.","https://i.ytimg.com/vi/Bo3hjrUOppk/default.jpg","120","90","https://i.ytimg.com/vi/Bo3hjrUOppk/mqdefault.jpg","320","180","https://i.ytimg.com/vi/Bo3hjrUOppk/hqdefault.jpg","480","360","utkal cartoon world","none",5047906,78988,5879,0,1591,3,2020
"YLU6m1D_uWs",2018-09-10,"UC_SFqM6PCAh7N3A4NkCA0cw","stand up comedy aisling bea not viewable in uk ireland apr 2015","Contains strong language. *Not viewable in UK/Ireland. Comedy from Aisling Bea. Apr 2015.","https://i.ytimg.com/vi/YLU6m1D_uWs/default.jpg","120","90","https://i.ytimg.com/vi/YLU6m1D_uWs/mqdefault.jpg","320","180","https://i.ytimg.com/vi/YLU6m1D_uWs/hqdefault.jpg","480","360","Ovid","none",2398764,35644,1822,0,1823,9,2018
"8f-1X3ot5sE",2020-03-01,"UCfl_I6C9DGcSGmjIGUxU04Q","<U+092C><U+0902><U+0926><U+0930> <U+0914><U+0930> <U+092C><U+0915><U+0930><U+0940> <U+0915><U+093E> <U+0916><U+0947><U+0932> bandar aur bakri ka khel comedy video <U+0939><U+093F><U+0902><U+0926><U+0940> <U+0915><U+0939><U+093E><U+0928><U+093F><U+092F><U+093E><U+0902> hindi kahaniya comedy video","<U+092C><U+0902><U+0926><U+0930> <U+0914><U+0930> <U+092C><U+0915><U+0930><U+0940> <U+0915><U+093E> <U+0916><U+0947><U+0932> Bandar Aur Bakri Ka Khel Comedy Video <U+0939><U+093F><U+0902><U+0926><U+0940> <U+0915><U+0939><U+093E><U+0928><U+093F><U+092F><U+093E><U+0902> Hindi Kahaniya Comedy Video. For More Moral Stories To Watch...","https://i.ytimg.com/vi/8f-1X3ot5sE/default.jpg","120","90","https://i.ytimg.com/vi/8f-1X3ot5sE/mqdefault.jpg","320","180","https://i.ytimg.com/vi/8f-1X3ot5sE/hqdefault.jpg","480","360","MaJa Tv Moral Stories Fairy Tales","none",2631716,12187,3449,0,381,3,2020
"uM1Us340040",2020-03-07,"UCo_hCisNRWC3pmRuuEqfP9A","comedy champion judge <U+0938><U+0928><U+094D><U+0924><U+094B><U+0937> <U+092A><U+0928><U+094D><U+0924><U+0915><U+094B> <U+0906><U+0932><U+093F><U+0938><U+093E><U+0928> <U+0918><U+0930> <U+0909><U+0938><U+094D><U+0924><U+0948> <U+0915><U+092E><U+0947><U+0921><U+0940> <U+0936><U+094D><U+0930><U+0940><U+092E><U+0924><U+0940> <U+0909><U+0938><U+094D><U+0924><U+0948> <U+091B><U+094B><U+0930><U+093E> santosh panta home","santosh_panta sunaulo nepal online <U+092A><U+094D><U+0930><U+093E><U+0932><U+093F> <U+0926><U+094D><U+0935><U+093E><U+0930><U+093E> <U+0909><U+0924><U+094D><U+092A><U+093E><U+0926><U+093F><U+0924> <U+0915><U+0941><U+0928><U+0948> <U+092A><U+0928><U+093F> <U+092D><U+093F><U+0921><U+093F><U+092F><U+094B><U+0939><U+0930><U+0941> <U+0915><U+092A><U+093F> <U+0921><U+093E><U+0909><U+0928><U+0932><U+094B><U+0921> <U+0924><U+0925><U+093E>...","https://i.ytimg.com/vi/uM1Us340040/default.jpg","120","90","https://i.ytimg.com/vi/uM1Us340040/mqdefault.jpg","320","180","https://i.ytimg.com/vi/uM1Us340040/hqdefault.jpg","480","360","Sunaulo Nepal TV","none",14561,423,12,0,25,3,2020
"PpCCjRisWSc",2020-03-02,"UC87GeMqLLIIP9D6-6kug11A","rajpal yadav best comedy scence rajpal comedy part 2","Rajpal yadav best comedy scence || rajpal comedy,part 2.","https://i.ytimg.com/vi/PpCCjRisWSc/default.jpg","120","90","https://i.ytimg.com/vi/PpCCjRisWSc/mqdefault.jpg","320","180","https://i.ytimg.com/vi/PpCCjRisWSc/hqdefault.jpg","480","360","RSY Records","none",367605,1214,310,0,20,3,2020
"1ijZnaQ8RcE",2020-03-07,"UCk_x-cJNPiJHKakw9NIJNGQ","comedy champion <U+0915><U+094B> <U+0909><U+092A><U+093E><U+0927><U+093F> <U+0909><U+091A><U+093E><U+0932><U+094D><U+0928> <U+0939><U+093F><U+092E><U+0947><U+0936> <U+092A><U+0928><U+094D><U+0924> <U+0924><U+092E><U+094D><U+0924><U+092F><U+093E><U+0930> <U+0924><U+0930> <U+0906><U+092F><U+094B> <U+091C><U+094D><U+092F><U+093E> <U+0928> <U+092E><U+093E> <U+0930><U+094D><U+0928><U+0947> <U+0927> <U+092E><U+094D><U+0915><U+0940> himesh panta","Follow us on facebook:-https://www.facebook.com/meroonlinetv/ Follow Biswa Limbu on: <U+25B7>Instagram: https://www.instagram.com/biswa.limbu/ ...","https://i.ytimg.com/vi/1ijZnaQ8RcE/default.jpg","120","90","https://i.ytimg.com/vi/1ijZnaQ8RcE/mqdefault.jpg","320","180","https://i.ytimg.com/vi/1ijZnaQ8RcE/hqdefault.jpg","480","360","Mero Online TV","none",14759,874,26,0,145,3,2020
"ltoKDWBAqj8",2020-03-06,"UC3uxeGBkUIYZlLfeQKful8Q","haryana roadways standup comedy by ravi badshami ab india hasega comedy studio","Haryana Roadways Standup Comedy by Ravi Badshami - Ab India Hasega - Comedy Studio #HaryanaRoadways #ComedyStudio #Ravi Badshami ...","https://i.ytimg.com/vi/ltoKDWBAqj8/default.jpg","120","90","https://i.ytimg.com/vi/ltoKDWBAqj8/mqdefault.jpg","320","180","https://i.ytimg.com/vi/ltoKDWBAqj8/hqdefault.jpg","480","360","Shemaroo Comedywalas","none",29505,860,80,0,21,3,2020
"lH5NvlFuku0",2020-03-07,"UCKRcIkN5A1FL2c6t6NmY6GA","superhit tamil movie comedy scenes tamil new movie comedy scenes tamil movie scenes full hd","Superhit Tamil movie comedy scenes | Tamil new movie comedy scenes | Tamil movie scenes full HD Subscribe : https://bit.ly/2xMFAF5 Like ...","https://i.ytimg.com/vi/lH5NvlFuku0/default.jpg","120","90","https://i.ytimg.com/vi/lH5NvlFuku0/mqdefault.jpg","320","180","https://i.ytimg.com/vi/lH5NvlFuku0/hqdefault.jpg","480","360","Latest Tamil Comedy","none",20097,104,20,0,9,3,2020
"KdlawuL19U4",2020-01-27,"UCLZc32yrTEMxH1ZO-6fKOzA","roasting a convicted murderer andrew schulz stand up comedy","What up people. Here it is. A lot of you been asking for this video. We didn't want to repost it until we blurred their faces out of respect and the severe nature of ...","https://i.ytimg.com/vi/KdlawuL19U4/default.jpg","120","90","https://i.ytimg.com/vi/KdlawuL19U4/mqdefault.jpg","320","180","https://i.ytimg.com/vi/KdlawuL19U4/hqdefault.jpg","480","360","The Andrew Schulz","none",1297134,36484,1125,0,1473,1,2020
"N9lKS_i8-g8",2020-01-17,"UCvlVuntLjdURVD3b3Hx7kxw","millennials think seattle is ghetto billy anderson full special","Millenials think that Seattle is Ghetto and a whole bunch of other awesome comedy from Billy Anderson for your viewing pleasure. If you would like to see more ...","https://i.ytimg.com/vi/N9lKS_i8-g8/default.jpg","120","90","https://i.ytimg.com/vi/N9lKS_i8-g8/mqdefault.jpg","320","180","https://i.ytimg.com/vi/N9lKS_i8-g8/hqdefault.jpg","480","360","Dry Bar Comedy","none",360602,6848,560,0,765,1,2020
"Ureo_0gyRAw",2020-02-22,"UCEI_dcoGYhMLyYpXok6jmog","<U+091C><U+093E><U+0926><U+0941><U+0908> <U+092A><U+0947><U+0921><U+093C> magical tree comedy video <U+0939><U+093F><U+0902><U+0926><U+0940> <U+0915><U+0939><U+093E><U+0928><U+093F><U+092F><U+093E><U+0902> hindi kahaniya story funny video","<U+091C><U+093E><U+0926><U+0941><U+0908> <U+092A><U+0947><U+0921><U+093C> Magical Tree Comedy Video <U+0939><U+093F><U+0902><U+0926><U+0940> <U+0915><U+0939><U+093E><U+0928><U+093F><U+092F><U+093E><U+0902> Hindi Kahaniya Story Funny Video. For More Stories To Watch Please Subscribe To This ...","https://i.ytimg.com/vi/Ureo_0gyRAw/default.jpg","120","90","https://i.ytimg.com/vi/Ureo_0gyRAw/mqdefault.jpg","320","180","https://i.ytimg.com/vi/Ureo_0gyRAw/hqdefault.jpg","480","360","PopCorn /- Funny Hindi Comedy Videos","none",7349559,22728,7529,0,400,2,2020
"06Ej52-D7a0",2020-02-04,"UCNU2Xe6kr6OJDxWGDXa66gQ","comedy champion episode 22","Executive Producers Keki Adhikari Bishal Bhandari Raj Ghimire Reshu Tamang Director Bishal Bhandari Executive Producer / Host Rima Bishwokarma Chief ...","https://i.ytimg.com/vi/06Ej52-D7a0/default.jpg","120","90","https://i.ytimg.com/vi/06Ej52-D7a0/mqdefault.jpg","320","180","https://i.ytimg.com/vi/06Ej52-D7a0/hqdefault.jpg","480","360","Comedy Champion","none",1922036,42220,1742,0,3375,2,2020
"Z6YCqqd8nL0",2020-03-05,"UC9X97YaH_1_IR8wyZTCRe6A","<U+0939><U+094B><U+0932><U+0940> <U+092E><U+0947><U+0902> <U+0926><U+093E><U+0930><U+0942> <U+0915><U+0939><U+093E><U+0902> <U+092E><U+093F><U+0932><U+0947><U+0917><U+093E> customer care shayari comedy vinay kumar holi fun friend india","Earn Money on Roz Dhan, India's number 1 money earning app using the link :- https://ylink.cc/bjKhP Use my Invite Code 09T4SQ to immediately earn total...","https://i.ytimg.com/vi/Z6YCqqd8nL0/default.jpg","120","90","https://i.ytimg.com/vi/Z6YCqqd8nL0/mqdefault.jpg","320","180","https://i.ytimg.com/vi/Z6YCqqd8nL0/hqdefault.jpg","480","360","fun friend india","none",691024,27508,1231,0,1458,3,2020
"-t0KBMSXfYI",2020-03-03,"UCVE3f6KA6N56xW4m9i662yw","roasted by abhishek walia i standup comedy","Abhishek Walia, the roast master of Laughter Challenge, is back roasting his audience to a crisp. Roast is a live format where the audience pays to get roasted ...","https://i.ytimg.com/vi/-t0KBMSXfYI/default.jpg","120","90","https://i.ytimg.com/vi/-t0KBMSXfYI/mqdefault.jpg","320","180","https://i.ytimg.com/vi/-t0KBMSXfYI/hqdefault.jpg","480","360","Abhishek Walia","none",666745,26686,1529,0,589,3,2020
"L2hLi_Zu5fM",2020-03-05,"UC-SQpatMUyttygyX3qVWXYw","<U+091C><U+093E><U+0926><U+0941><U+0908> <U+0938><U+093E><U+0902><U+092A> magical snake village comedy <U+0939><U+093F><U+0902><U+0926><U+0940> <U+0915><U+0939><U+093E><U+0928><U+093F><U+092F><U+093E><U+0902> hindi kahaniya hindi stories comedy video","<U+091C><U+093E><U+0926><U+0941><U+0908> <U+0938><U+093E><U+0902><U+092A> Magical Snake Village Comedy Funny Video <U+0939><U+093F><U+0902><U+0926><U+0940> <U+0915><U+0939><U+093E><U+0928><U+093F><U+092F><U+093E><U+0902> Hindi Kahaniya Hindi Stories Comedy Kahani hindi Comedy Video. Please ...","https://i.ytimg.com/vi/L2hLi_Zu5fM/default.jpg","120","90","https://i.ytimg.com/vi/L2hLi_Zu5fM/mqdefault.jpg","320","180","https://i.ytimg.com/vi/L2hLi_Zu5fM/hqdefault.jpg","480","360","Josh - Hindi Kahaniya","none",2831115,11960,3417,0,263,3,2020
"ttGVD6kRc6A",2020-03-05,"UCa_O4LhZxDH1MMPUCLqNC9w","tuition teacher <U+0001F602><U+0001F600><U+0001F602> <U+091F><U+094D><U+092F><U+0942><U+0936><U+0928> <U+091F><U+0940><U+091A><U+0930> <U+0001F602><U+0001F601><U+0001F602> comedy kaddu joke new funny video holicashdhmedy video","Download Helo App-https://helo.onelink.me/rbSL?pid=Helo_MKT&c=Holi2020YTKC TUITION TEACHER || <U+091F><U+094D><U+092F><U+0942><U+0936><U+0928> <U+091F><U+0940><U+091A><U+0930> || COMEDY || KADDU JOKE NEW ...","https://i.ytimg.com/vi/ttGVD6kRc6A/default.jpg","120","90","https://i.ytimg.com/vi/ttGVD6kRc6A/mqdefault.jpg","320","180","https://i.ytimg.com/vi/ttGVD6kRc6A/hqdefault.jpg","480","360","Kaddu Joke","none",121782,3754,199,0,259,3,2020
"HmWiTyHLwG8",2020-02-27,"UC3uTUlmgECBnsP777U4GPKQ","mummy papa 2 jokes cs bisht vines desi comedy video school classroom jokes baap beta comedy","Comedy Videos, baap beta desi comedy videos, baap beta comedy, school time comedy, Pahla pyaar, mammy papa, comedy Likee videos, comedy Tiktok ...","https://i.ytimg.com/vi/HmWiTyHLwG8/default.jpg","120","90","https://i.ytimg.com/vi/HmWiTyHLwG8/mqdefault.jpg","320","180","https://i.ytimg.com/vi/HmWiTyHLwG8/hqdefault.jpg","480","360","CS Bisht Vines","none",1417266,6754,2079,0,87,2,2020
"jNtmyTyV7LA",2020-01-24,"UCvlVuntLjdURVD3b3Hx7kxw","oklahoma is the home of stupid russ nagel full special","Did you enjoy this Full Comedy Special from Russ Nagel? If you did, chances are you'll enjoy our other Dry Bar Comedy Specials as well. You can watch all 160 ...","https://i.ytimg.com/vi/jNtmyTyV7LA/default.jpg","120","90","https://i.ytimg.com/vi/jNtmyTyV7LA/mqdefault.jpg","320","180","https://i.ytimg.com/vi/jNtmyTyV7LA/hqdefault.jpg","480","360","Dry Bar Comedy","none",279248,6132,415,0,383,1,2020
"UJcbeCUNnGA",2020-02-24,"UCfl_I6C9DGcSGmjIGUxU04Q","<U+091C><U+093E><U+0926><U+0941><U+0908> <U+092D><U+0948><U+0902><U+0938> <U+0916><U+093F><U+0932><U+094C><U+0928><U+093E> magical buffalo toy comedy video <U+0939><U+093F><U+0902><U+0926><U+0940> <U+0915><U+0939><U+093E><U+0928><U+093F><U+092F><U+093E><U+0902> hindi kahaniya story comedy video","<U+091C><U+093E><U+0926><U+0941><U+0908> <U+092D><U+0948><U+0902><U+0938> <U+0916><U+093F><U+0932><U+094C><U+0928><U+093E> Magical Buffalo Toy Comedy Video <U+0939><U+093F><U+0902><U+0926><U+0940> <U+0915><U+0939><U+093E><U+0928><U+093F><U+092F><U+093E><U+0902> Hindi Kahaniya Story Comedy Video. For More Moral Stories To Watch...","https://i.ytimg.com/vi/UJcbeCUNnGA/default.jpg","120","90","https://i.ytimg.com/vi/UJcbeCUNnGA/mqdefault.jpg","320","180","https://i.ytimg.com/vi/UJcbeCUNnGA/hqdefault.jpg","480","360","MaJa Tv Moral Stories Fairy Tales","none",30148924,134792,37278,0,1995,2,2020
"CNgOqNNWLQ4",2020-01-30,"UCUxc0iEpV8wZV4WLOui0RwQ","black siri gabriel iglesias","Happy throwback Thursday from 2012! #GabrielIglesias.","https://i.ytimg.com/vi/CNgOqNNWLQ4/default.jpg","120","90","https://i.ytimg.com/vi/CNgOqNNWLQ4/mqdefault.jpg","320","180","https://i.ytimg.com/vi/CNgOqNNWLQ4/hqdefault.jpg","480","360","Gabriel Iglesias","none",4976496,96478,2725,0,2299,1,2020
