"video_id","publishedAt","channelId","title","description","thumbnails.default.url","thumbnails.default.width","thumbnails.default.height","thumbnails.medium.url","thumbnails.medium.width","thumbnails.medium.height","thumbnails.high.url","thumbnails.high.width","thumbnails.high.height","channelTitle","liveBroadcastContent","viewCount","likeCount","dislikeCount","favoriteCount","commentCount","month","year"
"io6wi8DVZ3o",2019-09-05,"UCUsN5ZwHx2kILm84-jPDeXw","the harshest burns from the roast of donald trump","Donald Trump gets roasted by Seth MacFarlane, Anthony Jeselnik, Whitney Cummings and more savage-tongued members of the dais. Watch clips from ...","https://i.ytimg.com/vi/io6wi8DVZ3o/default.jpg","120","90","https://i.ytimg.com/vi/io6wi8DVZ3o/mqdefault.jpg","320","180","https://i.ytimg.com/vi/io6wi8DVZ3o/hqdefault.jpg","480","360","Comedy Central","none",7946183,157243,4616,0,8542,9,2019
"P6cqnrB61AE",2020-02-14,"UCPNH75wRbz-cO-W8732981A","chotu dada shikari quot <U+091B><U+094B><U+091F><U+0942> <U+0926><U+093E><U+0926><U+093E> <U+0936><U+093F><U+0915><U+093E><U+0930><U+0940> quot khandesh hindi comedy chotu dada comedy video","chotushikari #chotudadashikari #chotudada Have your Valentine's Day with Sunny Leone, and win a new car: http://bit.ly/2HgX3Hs Friends, if you want to date ...","https://i.ytimg.com/vi/P6cqnrB61AE/default.jpg","120","90","https://i.ytimg.com/vi/P6cqnrB61AE/mqdefault.jpg","320","180","https://i.ytimg.com/vi/P6cqnrB61AE/hqdefault.jpg","480","360","CHHOTU KI MASTI","none",19648163,93053,24447,0,675,2,2020
"9o8-xC4f9mI",2020-02-08,"UCZIv78thfup6-JB5HxqT3Pg","an angry romesh ranganathan in disneyland universal comedy","Romesh Ranganathan covers mastering the art of parenting and 3 day angry walks around Disneyland... BUY Romesh's Irrational Live DVD now: ...","https://i.ytimg.com/vi/9o8-xC4f9mI/default.jpg","120","90","https://i.ytimg.com/vi/9o8-xC4f9mI/mqdefault.jpg","320","180","https://i.ytimg.com/vi/9o8-xC4f9mI/hqdefault.jpg","480","360","Universal Comedy","none",123869,2668,56,0,60,2,2020
"QiSb6oy6M3E",2020-03-06,"UC_HgNmT8Rs181xk7TgIfPuw","<U+0939><U+093F><U+0924><U+0941><U+0905><U+0928> <U+0915><U+0947><U+0930> <U+092B><U+0917><U+0941><U+0906> hituan ker fagua avinash tiwari comedy avinash tiwari","happyHoli #holi2020 #BagheliSuprstar <U+0939><U+094B><U+0932><U+0940> <U+0915><U+0947> <U+0907><U+0938> <U+0924><U+094D><U+092F><U+094B><U+0939><U+093E><U+0930> <U+092E><U+0947><U+0902> <U+0939><U+092E> <U+0932><U+0947><U+0915><U+0930> <U+0906> <U+0917><U+090F> <U+0939><U+0948> <U+0906><U+092A> <U+0932><U+094B><U+0917><U+094B> <U+0915><U+0947> <U+0932><U+093F><U+090F> <U+090F><U+0915> <U+092C><U+0939><U+0941><U+0924>...","https://i.ytimg.com/vi/QiSb6oy6M3E/default.jpg","120","90","https://i.ytimg.com/vi/QiSb6oy6M3E/mqdefault.jpg","320","180","https://i.ytimg.com/vi/QiSb6oy6M3E/hqdefault.jpg","480","360","Avinash Tiwari","none",115645,2994,261,0,263,3,2020
"nXa3dsrzGMk",2020-01-30,"UC5tuYcCdiKuF5Y2ZonuarwA","chotu dada chole bhature wala quot <U+091B><U+094B><U+091F><U+0942> <U+0915><U+0947> <U+091B><U+094B><U+0932><U+0947> <U+092D><U+091F><U+0942><U+0930><U+0947> quot khandesh hindi comedy chotu comedy video","Cholebhature #chotukecholebhature #chotudada <U+0915><U+094D><U+092F><U+093E> <U+0906><U+092A> <U+0915><U+094B> <U+0915><U+092D><U+0940> <U+091B><U+094B><U+0932><U+0947> <U+092D><U+091F><U+0942><U+0930><U+0947> <U+0916><U+0930><U+0940><U+0926><U+0928><U+0947> <U+092A><U+0930> <U+0905><U+092E><U+0947><U+0930><U+093F><U+0915><U+093E> <U+0926><U+0947><U+0916><U+0928><U+0947> <U+0915><U+093E> <U+092E><U+094C><U+0915><U+093E>...","https://i.ytimg.com/vi/nXa3dsrzGMk/default.jpg","120","90","https://i.ytimg.com/vi/nXa3dsrzGMk/mqdefault.jpg","320","180","https://i.ytimg.com/vi/nXa3dsrzGMk/hqdefault.jpg","480","360","Jkk Entertainment","none",9448556,49950,9822,0,973,1,2020
"ilzEgeb4ZK8",2020-01-23,"UCab142H1vpeKP6z5qEWQJJg","very funny stupid boys new comedy videos 2020 episode 46 by funkivines","Must watch new funny video Comedy Videos 2019 - Episode 46 || Funny Videos | Chotu dipu Funny Videos | Chotu dipu Thanks for watching. Please Like ...","https://i.ytimg.com/vi/ilzEgeb4ZK8/default.jpg","120","90","https://i.ytimg.com/vi/ilzEgeb4ZK8/mqdefault.jpg","320","180","https://i.ytimg.com/vi/ilzEgeb4ZK8/hqdefault.jpg","480","360","Fun Ki Vines","none",2256970,8958,1765,0,152,1,2020
"2R8rQ1q_yLs",2020-01-21,"UCNU2Xe6kr6OJDxWGDXa66gQ","comedy champion episode 18","Executive Producers Keki Adhikari Bishal Bhandari Raj Ghimire Reshu Tamang Director Bishal Bhandari Executive Producer / Host Rima Bishwokarma Chief ...","https://i.ytimg.com/vi/2R8rQ1q_yLs/default.jpg","120","90","https://i.ytimg.com/vi/2R8rQ1q_yLs/mqdefault.jpg","320","180","https://i.ytimg.com/vi/2R8rQ1q_yLs/hqdefault.jpg","480","360","Comedy Champion","none",1893631,38860,1384,0,2701,1,2020
"Zf24GghsESA",2020-02-08,"UCab142H1vpeKP6z5qEWQJJg","new top funny comedy video 2020 try not to laugh episode 50 by funkivines","Must watch new funny video Comedy Videos 2019 - Episode 49 || Funny Videos | Chotu dipu Funny Videos | Chotu dipu In this video You are watching, new ...","https://i.ytimg.com/vi/Zf24GghsESA/default.jpg","120","90","https://i.ytimg.com/vi/Zf24GghsESA/mqdefault.jpg","320","180","https://i.ytimg.com/vi/Zf24GghsESA/hqdefault.jpg","480","360","Fun Ki Vines","none",521365,2343,488,0,73,2,2020
"dzlW38luF-0",2020-01-26,"UCP84QWij0alw4MvzqzyfOnw","chotu dada aeroplane wala <U+091B><U+094B><U+091F><U+0942> <U+0926><U+093E><U+0926><U+093E> <U+090F><U+0930><U+094B><U+092A><U+094D><U+0932><U+0947><U+0928> <U+0935><U+093E><U+0932><U+093E> khandeshi hindi comedy chotu comedy video","<U+091B><U+094B><U+091F><U+0942> <U+0926><U+093E><U+0926><U+093E> <U+0915><U+0947> <U+0905><U+0902><U+0915><U+0932> <U+0935><U+093F><U+091C><U+092F> <U+092E><U+0932><U+094D><U+0932><U+094D><U+092F><U+093E> <U+0928><U+0947> <U+091B><U+094B><U+091F><U+0942> <U+0915><U+0947> <U+0928><U+093E><U+092E> <U+0915><U+0930> <U+0915><U+0947> <U+091A><U+0932><U+0947> <U+0917><U+090F> <U+0939><U+0948> <U+090F><U+0915> <U+090F><U+092F><U+0930><U+094B><U+092A><U+094D><U+0932><U+0947><U+0928><U+0964>...","https://i.ytimg.com/vi/dzlW38luF-0/default.jpg","120","90","https://i.ytimg.com/vi/dzlW38luF-0/mqdefault.jpg","320","180","https://i.ytimg.com/vi/dzlW38luF-0/hqdefault.jpg","480","360","KHANDESHI MOVIES","none",27123198,120835,29738,0,2332,1,2020
"imc7glCxNog",2020-03-06,"UCxjgevgPPCmEdlaj4dYfPCg","potol vs pinki aunty holi comedy film star celebrity","Link: https://upstox.com/open-demat-account/?utm_source=influencer&utm_medium=organic&utm_term=flimstartcelebrity 1. OroStock: Save Rs 10000 on ...","https://i.ytimg.com/vi/imc7glCxNog/default.jpg","120","90","https://i.ytimg.com/vi/imc7glCxNog/mqdefault.jpg","320","180","https://i.ytimg.com/vi/imc7glCxNog/hqdefault.jpg","480","360","Film Star Celebrity","none",397129,6180,800,0,218,3,2020
"hw5gvy6y8QQ",2019-11-22,"UCab142H1vpeKP6z5qEWQJJg","top new comedy video 2019 try not to laugh episode 31 by fun ki vines","Top New Comedy Video 2019 | Try Not To laugh | Episode-31 | By fun ki vines #New_Funny_Videos #Very_Funny #Top_Funny_2019 #Best_Funny_Videos ...","https://i.ytimg.com/vi/hw5gvy6y8QQ/default.jpg","120","90","https://i.ytimg.com/vi/hw5gvy6y8QQ/mqdefault.jpg","320","180","https://i.ytimg.com/vi/hw5gvy6y8QQ/hqdefault.jpg","480","360","Fun Ki Vines","none",11337915,39137,9205,0,652,11,2019
"DEp2hCMChvc",2020-01-07,"UCZIv78thfup6-JB5HxqT3Pg","gandhi was annoying best of ricky gervais politics universal comedy","Taken from his 2nd special POLITICS, the recent host of the 2020 Golden Globes Ricky Gervais, discusses how Ghandi was annoying, soiling yourself on a train ...","https://i.ytimg.com/vi/DEp2hCMChvc/default.jpg","120","90","https://i.ytimg.com/vi/DEp2hCMChvc/mqdefault.jpg","320","180","https://i.ytimg.com/vi/DEp2hCMChvc/hqdefault.jpg","480","360","Universal Comedy","none",1013392,14774,434,0,783,1,2020
"H2TfBTaV9AA",2020-01-05,"UCXVCSFFpHry6WZFMvVCFH4w","joke of local train <U+0932><U+094B><U+0915><U+0932> <U+091F><U+094D><U+0930><U+0947><U+0928> comedy time toons","JOKE OF - LOCAL TRAIN ( <U+0932><U+094B><U+0915><U+0932> <U+091F><U+094D><U+0930><U+0947><U+0928> ) - Comedy time toons It is a funny video about local train safar... Hope u all will like it... Like share and subscribe.","https://i.ytimg.com/vi/H2TfBTaV9AA/default.jpg","120","90","https://i.ytimg.com/vi/H2TfBTaV9AA/mqdefault.jpg","320","180","https://i.ytimg.com/vi/H2TfBTaV9AA/hqdefault.jpg","480","360","Comedy Time Toons","none",5762138,21212,4930,0,378,1,2020
"uB4TlX8cK7g",2020-03-05,"UCJOpEZ4Jy1355EodXjlGZ2w","<U+0930><U+093F><U+0915><U+094D><U+0936><U+093E><U+0935><U+093E><U+0932><U+093E> <U+0915><U+0947> <U+0928><U+093F><U+092F><U+0924> <U+0959><U+0930><U+093E><U+092C> maithili comedy video <U+092E><U+0948><U+0925><U+093F><U+0932><U+0940> <U+0915><U+0949><U+092E><U+0947><U+0921><U+0940> dhorbacomedy","dhorbacomedy #dhorbamaithilicomedy #dhorba #dhorbalaliyamaithilicomedy #dhorbalaliyacomedy #dhorbacomedydowanload #dhorbacomedynew ...","https://i.ytimg.com/vi/uB4TlX8cK7g/default.jpg","120","90","https://i.ytimg.com/vi/uB4TlX8cK7g/mqdefault.jpg","320","180","https://i.ytimg.com/vi/uB4TlX8cK7g/hqdefault.jpg","480","360","Maithili Drama company","none",50434,187,47,0,4,3,2020
"Ef12EVA8_rs",2019-12-29,"UCP84QWij0alw4MvzqzyfOnw","quot <U+091B><U+094B><U+091F><U+0942> quot <U+0924><U+0941> <U+0924><U+094B> <U+0917><U+0908> chotu tu to gai khandesh hindi comedy chotu comedy video","<U+091B><U+094B><U+091F><U+0942> <U+0926><U+093E><U+0926><U+093E> <U+0938><U+0947> <U+092B><U+093F><U+0930> <U+092A><U+0902><U+0917><U+093E> <U+0932><U+0947><U+0932><U+093F><U+092F><U+093E> <U+0939><U+0948> <U+0917><U+0941><U+0902><U+0921><U+093F> <U+0928><U+0947> , <U+0917><U+0941><U+0902><U+0921><U+093F> <U+0915><U+093E> <U+0915><U+093C><U+0930><U+094D><U+091C><U+093C> <U+092E><U+0941><U+0928><U+0940><U+092E> <U+092A><U+0930> <U+0914><U+0930> <U+091B><U+094B><U+091F><U+0942> <U+0928><U+0947>...","https://i.ytimg.com/vi/Ef12EVA8_rs/default.jpg","120","90","https://i.ytimg.com/vi/Ef12EVA8_rs/mqdefault.jpg","320","180","https://i.ytimg.com/vi/Ef12EVA8_rs/hqdefault.jpg","480","360","KHANDESHI MOVIES","none",12219086,56030,11901,0,1165,12,2019
"PREfRJHd3ZY",2020-01-06,"UCPNH75wRbz-cO-W8732981A","chotu dada chicken biryani wala <U+091B><U+094B><U+091F><U+0942> <U+0915><U+0940> <U+091A><U+093F><U+0915><U+0928> <U+092C><U+093F><U+0930><U+092F><U+093E><U+0928><U+0940> khandesh hindi comedy","chickenbiryani #biryani #chotudada Free account by opening the account through the exclusive link - https://bit.ly/2SPWT0K (Pan card is mandatory to avail ...","https://i.ytimg.com/vi/PREfRJHd3ZY/default.jpg","120","90","https://i.ytimg.com/vi/PREfRJHd3ZY/mqdefault.jpg","320","180","https://i.ytimg.com/vi/PREfRJHd3ZY/hqdefault.jpg","480","360","CHHOTU KI MASTI","none",10840794,67860,11908,0,836,1,2020
"F8YAq8jgE70",2020-03-02,"UCHHBERpEv6QvcAwEB9LQ_lg","zafri khan di english <U+0001F92D> <U+0001F923> full comedy drama clip ft megha <U+0001F493> iftikhar thakur o","Watch Comedy Clips Exclusively On MOVIEBOXSTAGEDRAMAS Youtube Channel. SUBSCRIBE FOR REGULAR UPLOADS ...","https://i.ytimg.com/vi/F8YAq8jgE70/default.jpg","120","90","https://i.ytimg.com/vi/F8YAq8jgE70/mqdefault.jpg","320","180","https://i.ytimg.com/vi/F8YAq8jgE70/hqdefault.jpg","480","360","MovieboxStageDramas","none",195127,1957,130,0,27,3,2020
"yuSgcr-J_fA",2020-03-05,"UC4a8qGsblRw6tkwgaxPqE4Q","vigo new comedy video superhit new vigo video today new viral vigo video top mix funny vigo video 2","sogayayehjahan #jubinnautiyal #bypassroad So Gaya Yeh Jahan Full Video Song |Adah Sharma BypassRoad|So Gaya Yeh Jahan please Like,Comment ...","https://i.ytimg.com/vi/yuSgcr-J_fA/default.jpg","120","90","https://i.ytimg.com/vi/yuSgcr-J_fA/mqdefault.jpg","320","180","https://i.ytimg.com/vi/yuSgcr-J_fA/hqdefault.jpg","480","360","KATARIYA VIGO MASTI","none",678473,2068,333,0,29,3,2020
"MDpnnJvZjLM",2015-06-01,"UCm5ONNQT0K7CYsCXalpOWTQ","stand up comedy cnl 31 mei 2015","Comedy Night Live merupakan sebuah program variety comedy dengan konten utama sketsa komedi semi-scripted yang diwarnai dengan spontanitas para ...","https://i.ytimg.com/vi/MDpnnJvZjLM/default.jpg","120","90","https://i.ytimg.com/vi/MDpnnJvZjLM/mqdefault.jpg","320","180","https://i.ytimg.com/vi/MDpnnJvZjLM/hqdefault.jpg","480","360","New Comedy Night Live","none",6884865,21424,1646,0,763,6,2015
"Ozp32aTdkmU",2020-03-03,"UC0rzsIrAxF4kCsALP6J2EsA","cerita cintaku standup comedy raditya dika","Beli stand up comedy Raditya Dika terbaru di: http://www.ceritacintaku.com.","https://i.ytimg.com/vi/Ozp32aTdkmU/default.jpg","120","90","https://i.ytimg.com/vi/Ozp32aTdkmU/mqdefault.jpg","320","180","https://i.ytimg.com/vi/Ozp32aTdkmU/hqdefault.jpg","480","360","Raditya Dika","none",1519747,69536,1282,0,1221,3,2020
"t-eUJmO9kYM",2020-02-06,"UC5tuYcCdiKuF5Y2ZonuarwA","chotu dada tractor wala quot <U+091B><U+094B><U+091F><U+0942> <U+0926><U+093E><U+0926><U+093E> <U+091F><U+094D><U+0930><U+0947><U+0915><U+094D><U+091F><U+0930> <U+0935><U+093E><U+0932><U+093E> quot khandesh hindi comedy chotu comedy video","Chotu #Chotudadatractorwala #chotudada #Khandesh <U+0939><U+093E><U+092F> <U+0926><U+094B><U+0938><U+094D><U+0924><U+094B> <U+0906><U+0917><U+092F><U+093E> <U+091B><U+094B><U+091F><U+0942> <U+0926><U+093E><U+0926><U+093E> TRACTOR <U+0935><U+093E><U+0932><U+093E> <U+0926><U+094B><U+0938><U+094D><U+0924><U+094B><U+0902> <U+0906><U+0916><U+093F><U+0930> <U+091B><U+094B><U+091F><U+0942> <U+0926><U+093E><U+0926>...","https://i.ytimg.com/vi/t-eUJmO9kYM/default.jpg","120","90","https://i.ytimg.com/vi/t-eUJmO9kYM/mqdefault.jpg","320","180","https://i.ytimg.com/vi/t-eUJmO9kYM/hqdefault.jpg","480","360","Jkk Entertainment","none",44076343,154545,53553,0,1200,2,2020
"Wj6YIaL2CcI",2014-08-15,"UCK43DHln_Dv0synLFS0ve0A","learie joseph the vagrant and the police comedy","","https://i.ytimg.com/vi/Wj6YIaL2CcI/default.jpg","120","90","https://i.ytimg.com/vi/Wj6YIaL2CcI/mqdefault.jpg","320","180","https://i.ytimg.com/vi/Wj6YIaL2CcI/hqdefault.jpg","480","360","mistermayaro","none",4082690,23825,2949,0,890,8,2014
"TXNjyX0R0xo",2019-12-15,"UCNTRV4FWCHQ19CtMBA8-02w","3d anim comedy cricket india vs westindies 1st odi last over full video","Watch India vs Westindies 1st ODI Match Full Video Last Over I hope you Enjoy. Next Video will be Available soon.. Keep Watching.. Keep Smiling.","https://i.ytimg.com/vi/TXNjyX0R0xo/default.jpg","120","90","https://i.ytimg.com/vi/TXNjyX0R0xo/mqdefault.jpg","320","180","https://i.ytimg.com/vi/TXNjyX0R0xo/hqdefault.jpg","480","360","3D Anim Comedy","none",6040638,50999,6502,0,1073,12,2019
"F_7QXlXpytM",2019-09-19,"UC8bTQzxgvKkXDAaWkeuUlkg","quot jokes about deaf people quot trevor noah nation wild comedy","Click to Subscribe: http://bit.ly/SubscribeTrevorNoah & turn on notifications to find out when I upload new videos. More videos... From ""It's My Culture"" ""My Mom ...","https://i.ytimg.com/vi/F_7QXlXpytM/default.jpg","120","90","https://i.ytimg.com/vi/F_7QXlXpytM/mqdefault.jpg","320","180","https://i.ytimg.com/vi/F_7QXlXpytM/hqdefault.jpg","480","360","Trevor Noah","none",2269748,62336,1039,0,2197,9,2019
"BOaBoiP92NU",2020-01-27,"UCJGanRdrtdqYlDPoBEM_C_A","comedy central presenta no somos princesas completo standupenvivo","Un especial de comedia en donde Alexis de Anda, Michelle Rodríguez, Marcela Lecuona y Kikis dan sus observaciones sobre el feminismo, el machismo, y de ...","https://i.ytimg.com/vi/BOaBoiP92NU/default.jpg","120","90","https://i.ytimg.com/vi/BOaBoiP92NU/mqdefault.jpg","320","180","https://i.ytimg.com/vi/BOaBoiP92NU/hqdefault.jpg","480","360","Comedy Central en Español","none",443701,6956,705,0,219,1,2020
"-aRy7LZOO7M",2020-01-03,"UCQmZ9BIYOBSkxL-eqqg5z-g","after party mark angel comedy episode 241","This Funny video is very hilarious. Aunty Success is really a clown. Thanks for all your support in 2019. Happy new year to you all. Please don't forget to ...","https://i.ytimg.com/vi/-aRy7LZOO7M/default.jpg","120","90","https://i.ytimg.com/vi/-aRy7LZOO7M/mqdefault.jpg","320","180","https://i.ytimg.com/vi/-aRy7LZOO7M/hqdefault.jpg","480","360","MarkAngelComedy","none",3948170,73317,2413,0,3541,1,2020
"A-vtVm49008",2020-03-05,"UCBh30NFGt4uXbzNMnqfYU0Q","hostel stand up comedy ft anubhav singh bassi pakistani reaction","Hostel - Stand Up Comedy ft. Anubhav Singh Bassi stand up comedy,anubhav singh bassi,comedy,bassi,stand...","https://i.ytimg.com/vi/A-vtVm49008/default.jpg","120","90","https://i.ytimg.com/vi/A-vtVm49008/mqdefault.jpg","320","180","https://i.ytimg.com/vi/A-vtVm49008/hqdefault.jpg","480","360","Namkeen Sach","none",49695,1377,216,0,342,3,2020
"mgWQCu7eJbY",2020-01-10,"UCj4qjgqsAco4nSIVn4kbbIg","<U+0905><U+0915><U+094D><U+0937><U+092F> <U+0915><U+0941><U+092E><U+093E><U+0930> v s <U+092C><U+093F><U+0932><U+094D><U+0932><U+0942> <U+0915><U+0949><U+092E><U+0947><U+0921><U+0940> akshay kumar amp billu comedy funny call bachhan pandey good news","<U+0905><U+0915><U+094D><U+0937><U+092F> <U+0915><U+0941><U+092E><U+093E><U+0930> V/S <U+092C><U+093F><U+0932><U+094D><U+0932><U+0942> <U+0915><U+0949><U+092E><U+0947><U+0921><U+0940> | Akshay kumar & billu comedy funny call | bachhan pandey | good news | lakshmi bomb | housefull 4 | akshay Kumar ...","https://i.ytimg.com/vi/mgWQCu7eJbY/default.jpg","120","90","https://i.ytimg.com/vi/mgWQCu7eJbY/mqdefault.jpg","320","180","https://i.ytimg.com/vi/mgWQCu7eJbY/hqdefault.jpg","480","360","Funny Official","none",1374150,12367,1104,0,141,1,2020
"05Gp0MTDiTg",2020-01-17,"UC3uTUlmgECBnsP777U4GPKQ","mammy papa jokes cs bisht vines desi comedy video school classroom jokes","Comedy Videos, comedy Likee videos, comedy Tiktok Video, helo video, bisht vines,New Jokes, Hindi Joks, #csbishtvines #cs_bisht_vines #bishtvines mammy ...","https://i.ytimg.com/vi/05Gp0MTDiTg/default.jpg","120","90","https://i.ytimg.com/vi/05Gp0MTDiTg/mqdefault.jpg","320","180","https://i.ytimg.com/vi/05Gp0MTDiTg/hqdefault.jpg","480","360","CS Bisht Vines","none",12820213,46585,14802,0,442,1,2020
"Gb1DHxY9wQg",2018-10-21,"UCGcheBSVngQt09ubb0BZyJw","kaya yanar deutsche in hollywood 1live köln comedy nacht xxl 2018","Kaya Yanar hasst das Fliegen und Flughäfen, verursacht gerne Panik am Gepäckband und kommt mit der modernen Technik nicht mehr klar. Dafür liebt er ...","https://i.ytimg.com/vi/Gb1DHxY9wQg/default.jpg","120","90","https://i.ytimg.com/vi/Gb1DHxY9wQg/mqdefault.jpg","320","180","https://i.ytimg.com/vi/Gb1DHxY9wQg/hqdefault.jpg","480","360","MySpass","none",4643087,52325,1826,0,1325,10,2018
"dvWsEC7xGXM",2020-02-20,"UCGE-L0dJpos3ut0N96H75Jw","natia comedy part 52 natia ra bhoji khia","Natia Comedy part 52 || Natia Ra Bhoji Khia.","https://i.ytimg.com/vi/dvWsEC7xGXM/default.jpg","120","90","https://i.ytimg.com/vi/dvWsEC7xGXM/mqdefault.jpg","320","180","https://i.ytimg.com/vi/dvWsEC7xGXM/hqdefault.jpg","480","360","utkal cartoon world","none",9191540,114024,11237,0,2131,2,2020
"C2LSCN2e84g",2018-04-26,"UCF1JIbMUs6uqoZEY1Haw0GQ","best comedy scenes from dulhe raja hd govinda raveena tandon kader khan johnny lever","Download the app now and share it with all the asli fans http://twd.bz/shemaroomeGive a missed call on 18002665151 www.shemaroome.com ""Watch out these ...","https://i.ytimg.com/vi/C2LSCN2e84g/default.jpg","120","90","https://i.ytimg.com/vi/C2LSCN2e84g/mqdefault.jpg","320","180","https://i.ytimg.com/vi/C2LSCN2e84g/hqdefault.jpg","480","360","Shemaroo","none",30069412,88382,23169,0,2075,4,2018
"dvHrDeoqMts",2020-03-02,"UCeU2dRczjRSNbbvSPFaop6w","vijuline kone mayari gujarati comedy one media","Title: Vijuline Kone Mayari Artist: Dhansukh bhanderi, Rajendra Panchal, Krishna Besh , Bhavesh Bhageli Label : One Media Producer-Concept : Ramnik ...","https://i.ytimg.com/vi/dvHrDeoqMts/default.jpg","120","90","https://i.ytimg.com/vi/dvHrDeoqMts/mqdefault.jpg","320","180","https://i.ytimg.com/vi/dvHrDeoqMts/hqdefault.jpg","480","360","One Media Entertainment","none",636898,9229,1178,0,310,3,2020
"9IrooOnETgM",2020-03-05,"UC8ifAVDI15sjoCegIWVaIhA","psl 2020 te nizamanr cricketer akram nizami tp comedy","PSL 2020 Te Nizamanr Cricketer | Akram Nizami | TP Comedy <U+27BD> Subscribe <U+27BD> http://bit.ly/TpComedy Stay updated! Tp comedy presents new Saraiki funny ...","https://i.ytimg.com/vi/9IrooOnETgM/default.jpg","120","90","https://i.ytimg.com/vi/9IrooOnETgM/mqdefault.jpg","320","180","https://i.ytimg.com/vi/9IrooOnETgM/hqdefault.jpg","480","360","TP Comedy","none",96861,4038,257,0,327,3,2020
"jckzyr2a-dE",2020-03-05,"UCdILIiuXr2UQUhc5SFVbKtw","kapil sharma amp sumona full on comedy with ramayan show cast the kapil sharma show","Indian TV's most show Ramayan celebrated its 33 years on The Kapil Sharma Show. Arun Govil, Sita Deepika Chikhalia and Prem Sagar grace the show.","https://i.ytimg.com/vi/jckzyr2a-dE/default.jpg","120","90","https://i.ytimg.com/vi/jckzyr2a-dE/mqdefault.jpg","320","180","https://i.ytimg.com/vi/jckzyr2a-dE/hqdefault.jpg","480","360","Bollywood Now","none",556998,9213,265,0,213,3,2020
"ElBej6DoWr0",2020-01-25,"UCbJ1LG_FylZmLtwjyTErC_w","sami ouladitto jamel comedy club saison 10","Le couple, c'est bien mais qu'au début ! Hâte d'avoir vos retours sur mon passage au Jamel Comedy Club saison 10 la famille ! Pour voir le replay de l'émission ...","https://i.ytimg.com/vi/ElBej6DoWr0/default.jpg","120","90","https://i.ytimg.com/vi/ElBej6DoWr0/mqdefault.jpg","320","180","https://i.ytimg.com/vi/ElBej6DoWr0/hqdefault.jpg","480","360","Sami Ouladitto","none",675098,24415,635,0,325,1,2020
"j5BnbeEdNv4",2020-03-06,"UCFJXdDu1ukYhq52JhjgwXSQ","100 years time african home mc shem comedian","Hi guys in this Episode Shem Takes a peep at his future to see what his future looks like, watch to see the shoking events that took place. WATCH MY ...","https://i.ytimg.com/vi/j5BnbeEdNv4/default.jpg","120","90","https://i.ytimg.com/vi/j5BnbeEdNv4/mqdefault.jpg","320","180","https://i.ytimg.com/vi/j5BnbeEdNv4/hqdefault.jpg","480","360","Mc Shem Comedian","none",80317,3097,86,0,223,3,2020
"MoJ0--bf-jY",2012-05-12,"UCdKYe3r7ohCRanrKnu2oEXA","micky flanagan at the comedy store pt 1","Part 2 here: http://www.youtube.com/watch?v=ROkP5h0oGOk&feature=youtu.be.","https://i.ytimg.com/vi/MoJ0--bf-jY/default.jpg","120","90","https://i.ytimg.com/vi/MoJ0--bf-jY/mqdefault.jpg","320","180","https://i.ytimg.com/vi/MoJ0--bf-jY/hqdefault.jpg","480","360","John Rainey","none",1377512,2415,227,0,117,5,2012
"ZbgZPXsiYto",2020-02-07,"UCZH1ypQDpzzlHw5rrrvNYBg","stand up comedy cazzianesimo renato minutolo nbc comedy central","Come creare una nuova religione di successo? Ce lo spiega Renato Minutolo che creato un piano marketing per far nascere il Cazzianesimo. Natural Born ...","https://i.ytimg.com/vi/ZbgZPXsiYto/default.jpg","120","90","https://i.ytimg.com/vi/ZbgZPXsiYto/mqdefault.jpg","320","180","https://i.ytimg.com/vi/ZbgZPXsiYto/hqdefault.jpg","480","360","Comedy Central Italia","none",44054,2046,42,0,27,2,2020
"bQbH5RZiBgs",2020-01-27,"UCab142H1vpeKP6z5qEWQJJg","very funny stupid boys new comedy videos 2020 episode 47 by funkivines","Must watch new funny video Comedy Videos 2019 - Episode 47 || Funny Videos | Chotu dipu Funny Videos | Chotu dipu Thanks for watching. Please Like ...","https://i.ytimg.com/vi/bQbH5RZiBgs/default.jpg","120","90","https://i.ytimg.com/vi/bQbH5RZiBgs/mqdefault.jpg","320","180","https://i.ytimg.com/vi/bQbH5RZiBgs/hqdefault.jpg","480","360","Fun Ki Vines","none",3466324,10474,2619,0,201,1,2020
"T7O9XkIBtTo",2018-10-21,"UCGcheBSVngQt09ubb0BZyJw","özcan cosar generation aldi 1live köln comedy nacht xxl 2018","Mit seinem Realschulabschluss ist Özcan Cosar der King in seiner Hood. Aber das Leben ist nicht immer Sonnenschein! Özcan gehörte zur Generation ...","https://i.ytimg.com/vi/T7O9XkIBtTo/default.jpg","120","90","https://i.ytimg.com/vi/T7O9XkIBtTo/mqdefault.jpg","320","180","https://i.ytimg.com/vi/T7O9XkIBtTo/hqdefault.jpg","480","360","MySpass","none",3935763,71031,1458,0,2134,10,2018
"roIaW7LDrKo",2019-07-20,"UC3GGlS5ZZVvAGZmdEcaA_NA","<U+043F><U+0430><U+0432><U+0435><U+043B> <U+0432><U+043E><U+043B><U+044F> <U+0434><U+0435><U+0442><U+0441><U+043A><U+0438><U+0435> <U+0444><U+043E><U+0442><U+043E><U+0433><U+0440><U+0430><U+0444><U+0438><U+0438> <U+0437><U+0432><U+0435><U+0437><U+0434> <U+0438> <U+0440><U+0435><U+0437><U+0438><U+0434><U+0435><U+043D><U+0442><U+043E><U+0432> comedy club","<U+0411><U+043E><U+043B><U+044C><U+0448><U+0435> <U+0445><U+0430><U+0445><U+0430><U+0435><U+043A>, «<U+0414><U+0435><U+043D><U+044C><U+0433><U+0438> <U+0438><U+043B><U+0438> <U+041F><U+043E><U+0437><U+043E><U+0440>», «<U+041F><U+0440><U+043E><U+0436><U+0430><U+0440><U+043A><U+0430>» <U+0443> <U+043C><U+043E><U+0438><U+0445> <U+0434><U+0440><U+0443><U+0437><U+0435><U+0439> - <U+0442><U+0435><U+043B><U+0435><U+043A><U+0430><U+043D><U+0430><U+043B><U+0430> <U+0422><U+041D><U+0422>4 - https://youtube.com/tnt4ru.","https://i.ytimg.com/vi/roIaW7LDrKo/default.jpg","120","90","https://i.ytimg.com/vi/roIaW7LDrKo/mqdefault.jpg","320","180","https://i.ytimg.com/vi/roIaW7LDrKo/hqdefault.jpg","480","360","<U+041F><U+0430><U+0432><U+0435><U+043B> <U+0412><U+043E><U+043B><U+044F>","none",18110465,248790,15375,0,3997,7,2019
"ZGfpVdA3w0U",2019-12-08,"UCab142H1vpeKP6z5qEWQJJg","top new comedy video 2019 try to not laugh episode 35 by fun ki vines","Top New Comedy Video 2019 | Try To Not Laugh | Episode-35 | By Fun Ki Vines Hello dear Viewers, We make this video with some fail funny videos and mixed ...","https://i.ytimg.com/vi/ZGfpVdA3w0U/default.jpg","120","90","https://i.ytimg.com/vi/ZGfpVdA3w0U/mqdefault.jpg","320","180","https://i.ytimg.com/vi/ZGfpVdA3w0U/hqdefault.jpg","480","360","Fun Ki Vines","none",8492360,27747,7376,0,350,12,2019
