"video_id","publishedAt","channelId","title","description","thumbnails.default.url","thumbnails.default.width","thumbnails.default.height","thumbnails.medium.url","thumbnails.medium.width","thumbnails.medium.height","thumbnails.high.url","thumbnails.high.width","thumbnails.high.height","channelTitle","liveBroadcastContent","viewCount","likeCount","dislikeCount","favoriteCount","commentCount","month","year"
"sZNj-QdMzns",2019-03-31,"UCFuyCsMOEkJ27lHZ-AT9TmA","sailing the densest archipelago in the mediterranean full time liveaboard travel","During our fill time travel on our liveaboard sailboat we are sailing Croatia exploring Kornati National park and we sail to Sibenik BECOME PART OF THE TEAM: ...","https://i.ytimg.com/vi/sZNj-QdMzns/default.jpg","120","90","https://i.ytimg.com/vi/sZNj-QdMzns/mqdefault.jpg","320","180","https://i.ytimg.com/vi/sZNj-QdMzns/hqdefault.jpg","480","360","FLORB","none",23157,872,14,0,48,3,2019
"RxWS20XFlZg",2019-06-24,"UCo9PK2wb3D-Brj4H9dQvYJA","mobile photography three tips for travel portrait","How can you take the best photos when you are traveling? We'll give you three tips, remember to share your photos with us after the shoot!","https://i.ytimg.com/vi/RxWS20XFlZg/default.jpg","120","90","https://i.ytimg.com/vi/RxWS20XFlZg/mqdefault.jpg","320","180","https://i.ytimg.com/vi/RxWS20XFlZg/hqdefault.jpg","480","360","MIUI ROM","none",587,19,2,0,1,6,2019
"luABFZF9iAs",2019-11-15,"UCJUAqHnkDX15IvFoXIGTm2A","ghost adventures westerfeld house update travel channel","The owner and caretaker of the Westerfeld House in San Francisco reveal what paranormal experiences have occurred since the Ghost Adventure crew's ...","https://i.ytimg.com/vi/luABFZF9iAs/default.jpg","120","90","https://i.ytimg.com/vi/luABFZF9iAs/mqdefault.jpg","320","180","https://i.ytimg.com/vi/luABFZF9iAs/hqdefault.jpg","480","360","Travel Channel","none",24652,238,8,0,35,11,2019
"zHFxqgwbF2I",2019-01-13,"UCbAbhUpCMSpTSNrpDXsedOQ","travel with a dollar episode 5 budapest hungary","On Episode 5 of the official TRAVEL WITH A DOLLAR YouTube channel, join Ron on his latest tour as explores the famous thermal baths of #Budapest, ...","https://i.ytimg.com/vi/zHFxqgwbF2I/default.jpg","120","90","https://i.ytimg.com/vi/zHFxqgwbF2I/mqdefault.jpg","320","180","https://i.ytimg.com/vi/zHFxqgwbF2I/hqdefault.jpg","480","360","Travel With a Dollar","none",1686,20,3,0,3,1,2019
"tGP4VzC4Iyc",2019-04-15,"UClSOiYKcyWz4M5TDB0y2tww","the evolution hoodie perfect for travel","Great for travel and adventure!","https://i.ytimg.com/vi/tGP4VzC4Iyc/default.jpg","120","90","https://i.ytimg.com/vi/tGP4VzC4Iyc/mqdefault.jpg","320","180","https://i.ytimg.com/vi/tGP4VzC4Iyc/hqdefault.jpg","480","360","COALATREE","none",3095,8,0,0,0,4,2019
"DZjfpDxKZPI",2019-02-07,"UCGj_x83xoAhV3V7gTPQD8Vg","alharam travel a leading hajj and umrah travelling agency in uk","Walking in Ihram and performing the journey towards the home of Allah is dream of all Muslims. AlHaram travel provides all the Muslims in UK a chance to avail ...","https://i.ytimg.com/vi/DZjfpDxKZPI/default.jpg","120","90","https://i.ytimg.com/vi/DZjfpDxKZPI/mqdefault.jpg","320","180","https://i.ytimg.com/vi/DZjfpDxKZPI/hqdefault.jpg","480","360","Alharam Travel - UK","none",6544,5,0,0,0,2,2019
"5AKfveOwI8s",2019-11-08,"UCUMkppw_2WgnapBFFu6GVjg","the great 11 11 travel carnival travel makes everything better","Is the stress of routine getting on your nerves? Sastaticket.pk's The Great 11.11 Travel Carnival is here with upto 90% off on all flights and hotels- because ...","https://i.ytimg.com/vi/5AKfveOwI8s/default.jpg","120","90","https://i.ytimg.com/vi/5AKfveOwI8s/mqdefault.jpg","320","180","https://i.ytimg.com/vi/5AKfveOwI8s/hqdefault.jpg","480","360","Sastaticket.pk","none",11020,8,0,0,2,11,2019
"500meaqgBGA",2019-05-09,"UCpkpIbZK_OeQ--L_Nm1dbNw","why choose travel editions","","https://i.ytimg.com/vi/500meaqgBGA/default.jpg","120","90","https://i.ytimg.com/vi/500meaqgBGA/mqdefault.jpg","320","180","https://i.ytimg.com/vi/500meaqgBGA/hqdefault.jpg","480","360","Travel Editions","none",24901,1,0,0,0,5,2019
"QpxzBRFKag0",2019-10-23,"UCZDzd3wDFX33dGeYHH8hkjw","airport rules barbie pretend play airplane travel vacation adventure mymissanand toystar","SUBSCRIBE to TOY STARS - https://goo.gl/HyGNLf Numbers of people are unaware about the rules and facilities provided in the flight and especially if it's the ...","https://i.ytimg.com/vi/QpxzBRFKag0/default.jpg","120","90","https://i.ytimg.com/vi/QpxzBRFKag0/mqdefault.jpg","320","180","https://i.ytimg.com/vi/QpxzBRFKag0/hqdefault.jpg","480","360","Toy Stars","none",2133299,76421,5585,0,NA,10,2019
"abRKd_BJESI",2019-10-25,"UCd3KtKLsROQ8sLfgnI8CzXg","wir haben eine travel 3000 gewinnerin","Dieses Gefühl, wenn Du gewinnst... Dann nimm an der Gratis-Lotterie von DeinDeal teil und gewinne einen Gutschein im Wert von CHF 3'000.- !!! Mehr info: ...","https://i.ytimg.com/vi/abRKd_BJESI/default.jpg","120","90","https://i.ytimg.com/vi/abRKd_BJESI/mqdefault.jpg","320","180","https://i.ytimg.com/vi/abRKd_BJESI/hqdefault.jpg","480","360","DeinDeal","none",1196,2,0,0,1,10,2019
"vKjuL5N0jss",2019-08-13,"UCAzRAkO1pzAzkR7IFiTGZ9g","<U+0D0E><U+0D28><U+0D4D><U+0D31><U+0D46> <U+0D05><U+0D35><U+0D27><U+0D3F><U+0D15><U+0D4D><U+0D15><U+0D3E><U+0D32> <U+0D2F><U+0D3E><U+0D24><U+0D4D><U+0D30><U+0D15><U+0D7E> <U+0D39><U+0D24><U+0D4D><U+0D24><U+0D3E> <U+0D21><U+0D3E><U+0D02> hatta dam dubai travel dubai to hatta travel volger devi","hattadamdubai #mytravel #dubaitraveltouristplace #dubaitravel #beautifualplacedubai <U+0D26><U+0D41><U+0D2C><U+0D48> to Oman border <U+0D32><U+0D41><U+0D33><U+0D4D><U+0D33> <U+0D2E><U+0D32><U+0D2F><U+0D3F><U+0D1F><U+0D41><U+0D15><U+0D4D><U+0D15><U+0D41><U+0D15><U+0D33><U+0D3E><U+0D7D> <U+0D2A><U+0D4D><U+0D30><U+0D15><U+0D43><U+0D24><U+0D3F>...","https://i.ytimg.com/vi/vKjuL5N0jss/default.jpg","120","90","https://i.ytimg.com/vi/vKjuL5N0jss/mqdefault.jpg","320","180","https://i.ytimg.com/vi/vKjuL5N0jss/hqdefault.jpg","480","360","Devi Days","none",1365,35,0,0,58,8,2019
"u7KjXOKiMUg",2019-10-25,"UCsIftxlNk70r2ZH4GLIaWVA","barangnya lucuuuu murah dan berkualitas<U+0001F60D> miniso travel haul marvel edition bahasager devi","I hope you guys enjoy my video. And don't forget to give me a thumbs up if you Like my video, comment down below and also subscribe my channel if you want ...","https://i.ytimg.com/vi/u7KjXOKiMUg/default.jpg","120","90","https://i.ytimg.com/vi/u7KjXOKiMUg/mqdefault.jpg","320","180","https://i.ytimg.com/vi/u7KjXOKiMUg/hqdefault.jpg","480","360","Maulidian Numi","none",144,9,0,0,2,10,2019
"2nWrzPhyoKQ",2019-06-16,"UCFGe3bs70DY3bpENODw3Ftg","<U+043F><U+0430><U+0440><U+0438><U+0436> travel <U+0448><U+043E><U+0443> <U+0436><U+0438><U+0437><U+043D><U+044C> <U+0434><U+0440><U+0443><U+0433><U+0438><U+0445> eng paris the life of others 16 06 2019","<U+0410><U+0432><U+0442><U+043E><U+0440><U+0441><U+043A><U+043E><U+0435> travel-<U+0448><U+043E><U+0443> <U+0416><U+0430><U+043D><U+043D><U+044B> <U+0411><U+0430><U+0434><U+043E><U+0435><U+0432><U+043E><U+0439> «<U+0416><U+0438><U+0437><U+043D><U+044C> <U+0434><U+0440><U+0443><U+0433><U+0438><U+0445>»! <U+0421><U+0435><U+0440><U+0438><U+044F> <U+2116>16 – <U+043E> <U+0436><U+0438><U+0437><U+043D><U+0438> <U+0432> <U+041F><U+0430><U+0440><U+0438><U+0436><U+0435>! Authorial Zhanna Badoeva Travel Show ""The Life...","https://i.ytimg.com/vi/2nWrzPhyoKQ/default.jpg","120","90","https://i.ytimg.com/vi/2nWrzPhyoKQ/mqdefault.jpg","320","180","https://i.ytimg.com/vi/2nWrzPhyoKQ/hqdefault.jpg","480","360","<U+0416><U+0430><U+043D><U+043D><U+0430> <U+0411><U+0430><U+0434><U+043E><U+0435><U+0432><U+0430> - <U+0416><U+0438><U+0437><U+043D><U+044C> <U+0414><U+0440><U+0443><U+0433><U+0438><U+0445>","none",1151048,13629,621,0,1255,6,2019
"qJrqdXIiRdA",2019-11-23,"UC39lhlWynnCCBN0FLtKp-hg","night camp at dessert and tanoora dance travel and information","In this vedio you can see the night camp along with the tanoora dance.","https://i.ytimg.com/vi/qJrqdXIiRdA/default.jpg","120","90","https://i.ytimg.com/vi/qJrqdXIiRdA/mqdefault.jpg","320","180","https://i.ytimg.com/vi/qJrqdXIiRdA/hqdefault.jpg","480","360","travel and information","none",6573,136,1,0,2,11,2019
"fETJzMV2WsY",2019-06-10,"UCauKoiDvJKeDo1UcQlJVi0A","friendly planet travel best of egypt amp nile cruise","Learn more: https://www.friendlyplanet.com/vacation-packages/best-egypt-nile-cruise.html Join us to celebrate the land of ancient wonders and modern miracles ...","https://i.ytimg.com/vi/fETJzMV2WsY/default.jpg","120","90","https://i.ytimg.com/vi/fETJzMV2WsY/mqdefault.jpg","320","180","https://i.ytimg.com/vi/fETJzMV2WsY/hqdefault.jpg","480","360","Friendly Planet Travel","none",141672,0,0,0,NA,6,2019
"RnkrAVRz98A",2019-05-31,"UCz_yrc3BO9ve7UgDGZn4dig","mc naveed travels inside mark friendly zombie brain to destroy everything minecraft mods","MC NAVEED TRAVELS INSIDE MARK FRIENDLY ZOMBIE BRAIN TO DESTROY EVERYTHING!! Minecraft Mods <U+25BB>SUBSCRIBE: https://goo.gl/EMvAue ...","https://i.ytimg.com/vi/RnkrAVRz98A/default.jpg","120","90","https://i.ytimg.com/vi/RnkrAVRz98A/mqdefault.jpg","320","180","https://i.ytimg.com/vi/RnkrAVRz98A/hqdefault.jpg","480","360","MC Naveed - Minecraft & Roblox and MORE!","none",1428103,13670,1002,0,597,5,2019
"uN9jAS2vMwk",2019-07-22,"UCOY-7txtRBCt2mtRlarN1NA","your next holiday is here phil hoffmann travel","","https://i.ytimg.com/vi/uN9jAS2vMwk/default.jpg","120","90","https://i.ytimg.com/vi/uN9jAS2vMwk/mqdefault.jpg","320","180","https://i.ytimg.com/vi/uN9jAS2vMwk/hqdefault.jpg","480","360","Phil Hoffmann Travel","none",5502,0,0,0,1,7,2019
"H2uIlt42zD8",2019-07-04,"UCU4CBcX20zFv1J5oE-H5bwQ","myanmar 2019 pangea travel","Daniel ging in juni naar Myanmar en heeft hier weer een prachtige video van gemaakt. Naast de hoogtepunten bracht Daniel ook een bezoek aan minder ...","https://i.ytimg.com/vi/H2uIlt42zD8/default.jpg","120","90","https://i.ytimg.com/vi/H2uIlt42zD8/mqdefault.jpg","320","180","https://i.ytimg.com/vi/H2uIlt42zD8/hqdefault.jpg","480","360","PANGEA TRAVEL","none",4495,7,3,0,0,7,2019
"PEDyATF7VuQ",2019-12-24,"UCGXaE9EsaPbG8YkSm7lBFBA","travelling first time in vande bharat train<U+0001F631> going to vaishno deviything minecraft mods","FOLLOW ME ON* FB - https://www.facebook.com/gauravzone1/ INSTAGRAM- https://www.instagram.com/gauravzone_/ EMAIL : akshatgaurav3@gmail.com ...","https://i.ytimg.com/vi/PEDyATF7VuQ/default.jpg","120","90","https://i.ytimg.com/vi/PEDyATF7VuQ/mqdefault.jpg","320","180","https://i.ytimg.com/vi/PEDyATF7VuQ/hqdefault.jpg","480","360","GAURAVZONE","none",655172,46698,4007,0,1994,12,2019
"fZsfdJy0Sbs",2019-08-13,"UC0IUg0aD3qL51L3zN-wkvHA","trust renewing your travel agent licence","Unsure of how to submit an application to renew your travel agent licence? Here's a quick guide on how you can do so on STB's one-stop licensing portal, the ...","https://i.ytimg.com/vi/fZsfdJy0Sbs/default.jpg","120","90","https://i.ytimg.com/vi/fZsfdJy0Sbs/mqdefault.jpg","320","180","https://i.ytimg.com/vi/fZsfdJy0Sbs/hqdefault.jpg","480","360","Singapore Tourism Board","none",636,1,0,0,0,8,2019
"tE16IGj5jzc",2019-12-02,"UCuTBh5JNOH23trsO0rvEQ_Q","tamil vlogs london train travel experience part1 <U+0BB2><U+0BA3><U+0BCD><U+0B9F><U+0BA9><U+0BCD> <U+0BB0><U+0BAF><U+0BBF><U+0BB2><U+0BCD> <U+0BAA><U+0BAF><U+0BA3><U+0BAE><U+0BCD> <U+0B8E><U+0BAA><U+0BCD><U+0BAA><U+0B9F><U+0BBF> <U+0B87><U+0BB0><U+0BC1><U+0BA8><U+0BCD><U+0BA4><U+0BA4><U+0BC1>","londontrain #tamilvlogs #tamilchannel Dear Viewers!! Subscribe to this channel!! This channel also Contains a separate playlists for Beauty Tips, Health tips, ...","https://i.ytimg.com/vi/tE16IGj5jzc/default.jpg","120","90","https://i.ytimg.com/vi/tE16IGj5jzc/mqdefault.jpg","320","180","https://i.ytimg.com/vi/tE16IGj5jzc/hqdefault.jpg","480","360","Poorna Kitchen London vlogs","none",2076,168,1,0,508,12,2019
"0B0ZMBIQGvE",2019-06-27,"UCtjddoPMDBsMHWWbuQK9jGg","b travel 2019","La edición 2019, que cierra hoy sus puertas al público, consolida a B-Travel como el salón de referencia del turismo de experiencias con la participación de ...","https://i.ytimg.com/vi/0B0ZMBIQGvE/default.jpg","120","90","https://i.ytimg.com/vi/0B0ZMBIQGvE/mqdefault.jpg","320","180","https://i.ytimg.com/vi/0B0ZMBIQGvE/hqdefault.jpg","480","360","B-Travel","none",517,4,0,0,0,6,2019
"N5lwxROxlzc",2019-10-15,"UCRLOjeT82M_8CyLj0BqvRaQ","s2 e1 let battle commence the great travel hack makethefuture","Sparks fly when two easy-going Brits – Team Alpha, meet two ultra-competitive Dutchies – Team Omega, on the road from the UK to the Netherlands.","https://i.ytimg.com/vi/N5lwxROxlzc/default.jpg","120","90","https://i.ytimg.com/vi/N5lwxROxlzc/mqdefault.jpg","320","180","https://i.ytimg.com/vi/N5lwxROxlzc/hqdefault.jpg","480","360","Shell","none",17584006,15286,11089,0,1172,10,2019
"mJPWHITeYB8",2019-05-03,"UCf8SRqLSd_Tl5zpvfgS6WBw","finding jgoot travel deals","9 times out of ten when subscribers tell me a deal I shared is gone, it's not. It just didn't load yet.","https://i.ytimg.com/vi/mJPWHITeYB8/default.jpg","120","90","https://i.ytimg.com/vi/mJPWHITeYB8/mqdefault.jpg","320","180","https://i.ytimg.com/vi/mJPWHITeYB8/hqdefault.jpg","480","360","Just Get Out of Town","none",2511,11,0,0,0,5,2019
"wOtEPfIuwhg",2019-07-29,"UC91HxNX9kgjwpo-6rkShYqQ","beautiful amp moving travel video solo travel amazing places","I left corporate America to travel the world. Bought a one way ticket and experienced the most beautiful places on the planet. Although it's not your typical ...","https://i.ytimg.com/vi/wOtEPfIuwhg/default.jpg","120","90","https://i.ytimg.com/vi/wOtEPfIuwhg/mqdefault.jpg","320","180","https://i.ytimg.com/vi/wOtEPfIuwhg/hqdefault.jpg","480","360","Say Lavi","none",5967,46,7,0,7,7,2019
"fHgCEd9VILk",2019-05-14,"UCOY-7txtRBCt2mtRlarN1NA","book your next adventure phil hofmann travel","","https://i.ytimg.com/vi/fHgCEd9VILk/default.jpg","120","90","https://i.ytimg.com/vi/fHgCEd9VILk/mqdefault.jpg","320","180","https://i.ytimg.com/vi/fHgCEd9VILk/hqdefault.jpg","480","360","Phil Hoffmann Travel","none",18049,0,0,0,0,5,2019
"10rMB4XaLNw",2019-03-27,"UCF4_sVa7oxUq3Qkpczuj5-Q","travelibro visual travel journeys","TraveLibro is an app that lets travellers discover, create and relive visual travel journeys. It lets users discover travel spots by exploring visual itineraries of top ...","https://i.ytimg.com/vi/10rMB4XaLNw/default.jpg","120","90","https://i.ytimg.com/vi/10rMB4XaLNw/mqdefault.jpg","320","180","https://i.ytimg.com/vi/10rMB4XaLNw/hqdefault.jpg","480","360","Trave Libro","none",43884,3,1,0,0,3,2019
"hZaZ-z2YkQ0",2019-07-12,"UCz3-h4pEz1459SqN6dfTWGw","a stress free way to travel switch to carpool","Download the App here : https://go.onelink.me/EVrB/7b9266e7 Visit our website: https://quickride.in/ Follow us on: https://www.facebook.com/QuickRidein/ ...","https://i.ytimg.com/vi/hZaZ-z2YkQ0/default.jpg","120","90","https://i.ytimg.com/vi/hZaZ-z2YkQ0/mqdefault.jpg","320","180","https://i.ytimg.com/vi/hZaZ-z2YkQ0/hqdefault.jpg","480","360","Quick Ride","none",681885,32,15,0,6,7,2019
"79fzGEz6XEY",2019-04-13,"UCadtap8RYMNy8w4K9lXhzpQ","barbie daisy and the carnival of clues barbie travel mysteries brazil barbie","Oi! Barbie and Daisy have arrived at the shores of Copacabana Beach! The clues found in China led the team to the world-famous Carnival to search for the ...","https://i.ytimg.com/vi/79fzGEz6XEY/default.jpg","120","90","https://i.ytimg.com/vi/79fzGEz6XEY/mqdefault.jpg","320","180","https://i.ytimg.com/vi/79fzGEz6XEY/hqdefault.jpg","480","360","Barbie","none",274251,1172,311,0,19,4,2019
"y0GoMlUagQU",2019-05-04,"UCFr3sz2t3bDp6Cux08B93KQ","stonehenge the don 39 ts of visiting stonehenge","The UNESCO World Heritage Sight of Stonehenge is on every travelers bucket list for so many reasons. Whether it is the mystery of its creation, to who did build ...","https://i.ytimg.com/vi/y0GoMlUagQU/default.jpg","120","90","https://i.ytimg.com/vi/y0GoMlUagQU/mqdefault.jpg","320","180","https://i.ytimg.com/vi/y0GoMlUagQU/hqdefault.jpg","480","360","Wolters World","none",37424,1521,25,0,234,5,2019
"ioWAoEVYaP0",2019-10-09,"UCEf_Bc-KVd7onSeifS3py9g","ep 1 <U+C544><U+B0A0><U+B85C><U+ADF8> <U+D2B8><U+B9BD> <U+C5EC><U+D589><U+C758> <U+C2E4><U+CCB4> analog trip <U+C544><U+B0A0><U+B85C><U+ADF8> <U+D2B8><U+B9BD>","<U+C778><U+B3C4><U+B124><U+C2DC><U+C544> <U+AFC8><U+C758> <U+D734><U+C591><U+C9C0> '<U+BC1C><U+B9AC>'<U+B85C> <U+B5A0><U+B09C> <U+B3D9><U+BC29><U+C2E0><U+AE30><U+C640> <U+C288><U+D37C><U+C8FC><U+B2C8><U+C5B4>! <U+D734><U+C591><U+C758> <U+B2EC><U+CF64><U+D568><U+B3C4> <U+C7A0><U+C2DC>, <U+BC1D><U+D600><U+C9C0><U+B294> <U+C9C4><U+C9DC> <U+C5EC><U+D589><U+C758> <U+C2E4><U+CCB4><U+B294>...? <U+ACE0><U+C544> <U+C880><U+BE14><U+B791> <U+C0AC><U+C9C4>...","https://i.ytimg.com/vi/ioWAoEVYaP0/default.jpg","120","90","https://i.ytimg.com/vi/ioWAoEVYaP0/mqdefault.jpg","320","180","https://i.ytimg.com/vi/ioWAoEVYaP0/hqdefault.jpg","480","360","SMTOWN","none",8121144,198390,2731,0,6406,10,2019
"EaG2XjVmv-Y",2019-09-13,"UCPur06mx78RtwgHJzxpu2ew","las vegas strip full walkthrough from sunset to night 2019 travel guide virtual walk tour <U+0001F3A7> <U+3010>4k<U+3011>an","Virtual walking tour of the entire Las Vegas strip during sunset / dusk to nighttime on a hot summer day. It took about 2 hours to walk 4.5 miles from Excalibur to ...","https://i.ytimg.com/vi/EaG2XjVmv-Y/default.jpg","120","90","https://i.ytimg.com/vi/EaG2XjVmv-Y/mqdefault.jpg","320","180","https://i.ytimg.com/vi/EaG2XjVmv-Y/hqdefault.jpg","480","360","Wind Walk Travel Videos <U+02AC>","none",156284,1628,49,0,169,9,2019
"3r6ERJRRng4",2019-03-25,"UC_z1H488Ijor3teosC1cdEw","game of le quot b r o n quot vs foreiignboii travels only","LeBron Is One Of My Favorite Players Of All Time So It's All Love!! ForeiignBoii YT Channel   ...","https://i.ytimg.com/vi/3r6ERJRRng4/default.jpg","120","90","https://i.ytimg.com/vi/3r6ERJRRng4/mqdefault.jpg","320","180","https://i.ytimg.com/vi/3r6ERJRRng4/hqdefault.jpg","480","360","MarcelasHoward","none",705151,13391,308,0,584,3,2019
"oqdokcjb4Ao",2019-02-08,"UCJbg_yirB5vm9VKn5yLGCKw","time traveling flipbook","Add Honey for FREE at https://joinhoney.com/andymation Honey's 10 million members save an average of $28.61 a month on sites like Amazon, eBay, ...","https://i.ytimg.com/vi/oqdokcjb4Ao/default.jpg","120","90","https://i.ytimg.com/vi/oqdokcjb4Ao/mqdefault.jpg","320","180","https://i.ytimg.com/vi/oqdokcjb4Ao/hqdefault.jpg","480","360","Andymation","none",2337775,43697,1127,0,1519,2,2019
"69KaRKC4wsU",2019-03-05,"UCq9YSKfwHPS4rvZZ8Bknh_g","miss universe cambodia 2018 rern nat rern nat travel to thailand","Miss Universe Cambodia 2018: Rern Nat} Rern Nat Travel To Thailand #miss_universe_Cambodia,#miss_universe_cambodia_2018_reren_nat,#rern_nat ...","https://i.ytimg.com/vi/69KaRKC4wsU/default.jpg","120","90","https://i.ytimg.com/vi/69KaRKC4wsU/mqdefault.jpg","320","180","https://i.ytimg.com/vi/69KaRKC4wsU/hqdefault.jpg","480","360","Cambodia Amazing","none",160281,2177,37,0,7,3,2019
"4DLqOcv8f2w",2019-09-26,"UCFYKs_0xpOB3YnpyfbwuSZQ","travel snack food challenge noah schnapp","SUBSCRIBE for NEW videos! <U+27A4> http://bit.ly/subscribetonoah When I was in Chile I decided to go on a snack hunt! I love food from all over the world, but some of ...","https://i.ytimg.com/vi/4DLqOcv8f2w/default.jpg","120","90","https://i.ytimg.com/vi/4DLqOcv8f2w/mqdefault.jpg","320","180","https://i.ytimg.com/vi/4DLqOcv8f2w/hqdefault.jpg","480","360","Noah Schnapp","none",849001,68352,438,0,5829,9,2019
"fg-RDjkQHzo",2019-12-18,"UCfYCRj25JJQ41JGPqiqXmJw","traveling inside saudi arabia saudia b787 and lcc flyadeal <U+062A><U+0631><U+062C><U+0645><U+0629> <U+0639><U+0631><U+0628><U+064A><U+0629>","Get Surfshark VPN at https://surfshark.com/sam - Enter promo code SAM for 83% off and 3 free months! This is my third vlog in Saudi Arabia focus on the aviation ...","https://i.ytimg.com/vi/fg-RDjkQHzo/default.jpg","120","90","https://i.ytimg.com/vi/fg-RDjkQHzo/mqdefault.jpg","320","180","https://i.ytimg.com/vi/fg-RDjkQHzo/hqdefault.jpg","480","360","Sam Chui","none",924229,17413,847,0,1918,12,2019
"t6msjNHX61k",2019-10-15,"UCRLOjeT82M_8CyLj0BqvRaQ","s2 e4 puppy love amp hitch hikers the great travel hack makethefuture","After the highs of the Alps, we hit the lows on the road to Budapest! Omega go underground, Alpha immerse themselves in Hungarian culture, and both teams ...","https://i.ytimg.com/vi/t6msjNHX61k/default.jpg","120","90","https://i.ytimg.com/vi/t6msjNHX61k/mqdefault.jpg","320","180","https://i.ytimg.com/vi/t6msjNHX61k/hqdefault.jpg","480","360","Shell","none",25610556,18844,13561,0,1390,10,2019
"5XWcj2PysUY",2019-12-12,"UCHhLa7EX6WJ9sbJLuDQWQdg","traveling to hometown status l travel vibes status l good vibes l","This music in the following video is not free to use if you'd like to use the music in the video please contact the artist or rightsholder for more information ...","https://i.ytimg.com/vi/5XWcj2PysUY/default.jpg","120","90","https://i.ytimg.com/vi/5XWcj2PysUY/mqdefault.jpg","320","180","https://i.ytimg.com/vi/5XWcj2PysUY/hqdefault.jpg","480","360","KaSh vloGs","none",604,6,0,0,0,12,2019
"t31tc7U61sc",2019-10-18,"UCHhLa7EX6WJ9sbJLuDQWQdg","travel vibes l best music status english l stylish status l","Facebook https://m.facebook.com/m.prakash.taksh On Instagram as @kash_taksh Support ...","https://i.ytimg.com/vi/t31tc7U61sc/default.jpg","120","90","https://i.ytimg.com/vi/t31tc7U61sc/mqdefault.jpg","320","180","https://i.ytimg.com/vi/t31tc7U61sc/hqdefault.jpg","480","360","KaSh vloGs","none",869,16,0,0,0,10,2019
"DGEN8HvC1nE",2019-11-06,"UCKYb5XBe-5OSEgLijLSoDtw","traveling to a realistic portal ultra realistic minecraft 3","TRAVELING TO A REALISTIC PORTAL.. (ULTRA REALISTIC MINECRAFT 3) MERCHANDISE - https://www.unspeakable.co/ MORE YOUTUBE ...","https://i.ytimg.com/vi/DGEN8HvC1nE/default.jpg","120","90","https://i.ytimg.com/vi/DGEN8HvC1nE/mqdefault.jpg","320","180","https://i.ytimg.com/vi/DGEN8HvC1nE/hqdefault.jpg","480","360","UnspeakableGaming","none",1049139,25182,428,0,4114,11,2019
"3N6zr3jymDE",2019-03-30,"UCadtap8RYMNy8w4K9lXhzpQ","barbie and the missing mona lisa barbie travel mysteries paris barbie","Bonjour! Barbie and Daisy finally made it to Paris! They were so excited for the first day of the world-famous Art Week Festival, but when Princess Adelaide ...","https://i.ytimg.com/vi/3N6zr3jymDE/default.jpg","120","90","https://i.ytimg.com/vi/3N6zr3jymDE/mqdefault.jpg","320","180","https://i.ytimg.com/vi/3N6zr3jymDE/hqdefault.jpg","480","360","Barbie","none",371719,1479,294,0,75,3,2019
"WSkTe63SYrA",2019-09-16,"UCFwGSZWjKB7h4FHduFU30CA","trip travel phnompenh cambodia 1 phnompenh cambodia","Trip Travel Phnompenh Cambodia #1 | TynaTube Phnompenh Cambodia Video Tutorial #TynaTube #PhnompenhCambodia #TripTravelCambodia.","https://i.ytimg.com/vi/WSkTe63SYrA/default.jpg","120","90","https://i.ytimg.com/vi/WSkTe63SYrA/mqdefault.jpg","320","180","https://i.ytimg.com/vi/WSkTe63SYrA/hqdefault.jpg","480","360","TynaTube","none",1769,272,26,0,2,9,2019
"w3Mn9ClIKdQ",2019-09-16,"UCFwGSZWjKB7h4FHduFU30CA","trip travel phnompenh cambodia 2 phnompenh cambodia","Trip Travel Phnompenh Cambodia #2 | TynaTube Phnompenh Cambodia Video Tutorial #TynaTube #PhnompenhCambodia #TripTravelCambodia.","https://i.ytimg.com/vi/w3Mn9ClIKdQ/default.jpg","120","90","https://i.ytimg.com/vi/w3Mn9ClIKdQ/mqdefault.jpg","320","180","https://i.ytimg.com/vi/w3Mn9ClIKdQ/hqdefault.jpg","480","360","TynaTube","none",1875,268,28,0,2,9,2019
"E7yQJaRw3T4",2019-12-24,"UCJjun9WXqfDFN9AKBek4DMA","the travel song","Bats Brew song, a travel tale, involving space and time and one custom strat style build! Song is from the Bats Brew album ""The Time is Magic"", found here: ...","https://i.ytimg.com/vi/E7yQJaRw3T4/default.jpg","120","90","https://i.ytimg.com/vi/E7yQJaRw3T4/mqdefault.jpg","320","180","https://i.ytimg.com/vi/E7yQJaRw3T4/hqdefault.jpg","480","360","bats brew","none",309,NA,NA,0,0,12,2019
"dbmrOy65cNw",2019-11-17,"UCvK4bOhULCpmLabd2pDMtnA","traveling 10 000 miles to fulfill subscriber 39 s dream","OUR BIGGEST DROP EVER LIVE NOW ON https://www.seekdiscomfort.com/ we will be giving out 4 Seek Discomfort Soundboxes to 4 people who order within ...","https://i.ytimg.com/vi/dbmrOy65cNw/default.jpg","120","90","https://i.ytimg.com/vi/dbmrOy65cNw/mqdefault.jpg","320","180","https://i.ytimg.com/vi/dbmrOy65cNw/hqdefault.jpg","480","360","Yes Theory","none",1877147,89296,776,0,7128,11,2019
"eUed0CnOhcE",2019-12-07,"UCSGp-UJdbBUwRVGi5YP92-w","tje 02 politics amp travel and leisure amp the unknown","","https://i.ytimg.com/vi/eUed0CnOhcE/default.jpg","120","90","https://i.ytimg.com/vi/eUed0CnOhcE/mqdefault.jpg","320","180","https://i.ytimg.com/vi/eUed0CnOhcE/hqdefault.jpg","480","360","HAPPY PEOPLE","none",68,2,0,0,0,12,2019
"M2BOLsp7PRQ",2019-04-27,"UCadtap8RYMNy8w4K9lXhzpQ","barbie daisy and the pimiento pepper festival barbie travel mysteries spain barbie","Bienvenidos! Barbie and Daisy are now in Spain looking for the next gemstone! The girls find themselves at a flamenco performance and the Pimiento Festival, ...","https://i.ytimg.com/vi/M2BOLsp7PRQ/default.jpg","120","90","https://i.ytimg.com/vi/M2BOLsp7PRQ/mqdefault.jpg","320","180","https://i.ytimg.com/vi/M2BOLsp7PRQ/hqdefault.jpg","480","360","Barbie","none",283916,1321,282,0,69,4,2019
"CjaQwTWNxDM",2019-12-07,"UCiAq_SU0ED1C6vWFMnw8Ekg","traveling to iran 39 s 1 000 000 saffron bank huge iranian street food tour of mashhad iran","More Street Food in Iran: https://youtu.be/AcsWdbSsYfo <U+25BB>Go Follow Mr. Taster: https://www.instagram.com/mr.taster <U+25BB>Check out https://www.cometopersia.com ...","https://i.ytimg.com/vi/CjaQwTWNxDM/default.jpg","120","90","https://i.ytimg.com/vi/CjaQwTWNxDM/mqdefault.jpg","320","180","https://i.ytimg.com/vi/CjaQwTWNxDM/hqdefault.jpg","480","360","The Food Ranger","none",849367,13378,406,0,1690,12,2019
