"video_id","publishedAt","channelId","title","description","thumbnails.default.url","thumbnails.default.width","thumbnails.default.height","thumbnails.medium.url","thumbnails.medium.width","thumbnails.medium.height","thumbnails.high.url","thumbnails.high.width","thumbnails.high.height","channelTitle","liveBroadcastContent","viewCount","likeCount","dislikeCount","favoriteCount","commentCount","month","year"
"YBhpID-rR6o",2019-11-14,"UCxSI_ScvntwbqmDD7VkspUQ","family trip to dehradun travel diml camping vlog mymissanand cookwithnisha","Maldevta a strange place assaulted by the thick shrubbery and stream song streaming is situated in the outskirts of DEHRADUN. The place is the picnic spot and ...","https://i.ytimg.com/vi/YBhpID-rR6o/default.jpg","120","90","https://i.ytimg.com/vi/YBhpID-rR6o/mqdefault.jpg","320","180","https://i.ytimg.com/vi/YBhpID-rR6o/hqdefault.jpg","480","360","Cook With Nisha","none",1672430,55076,2701,0,1199,11,2019
"kJS9ViONCRc",2019-08-24,"UCkAGrHCLFmlK3H2kd6isipg","travel bean mr bean full episodes mr bean official","Where is Mr Bean travelling to today! Stay tuned: https://www.youtube.com/channel/UCkAGrHCLFmlK3H2kd6isipg?sub_confirmation=1 Welcome to the official ...","https://i.ytimg.com/vi/kJS9ViONCRc/default.jpg","120","90","https://i.ytimg.com/vi/kJS9ViONCRc/mqdefault.jpg","320","180","https://i.ytimg.com/vi/kJS9ViONCRc/hqdefault.jpg","480","360","Mr Bean","none",13700179,68187,7239,0,1615,8,2019
"bSUaCO2q9NY",2019-07-27,"UCMZrx8wtMlG9rwyugDgRr5g","10 best airport tips from a flight attendant travel hacks","These are my TOP 10 AIRPORT TIPS that I always do when I'm not working as a Flight Attendant and just traveling for vacation or personal reasons. Working in ...","https://i.ytimg.com/vi/bSUaCO2q9NY/default.jpg","120","90","https://i.ytimg.com/vi/bSUaCO2q9NY/mqdefault.jpg","320","180","https://i.ytimg.com/vi/bSUaCO2q9NY/hqdefault.jpg","480","360","Fly With Stella","none",433358,11828,592,0,1190,7,2019
"LopAn_cq1B4",2019-11-08,"UCheCB_ewJf_L2kTk0649ZDQ","my first day in russia st petersburg travel guide","St Petersburg, Russia - Our goal is to travel across the entire country of Russia on the Trans-Siberian Railway. Over the next 25 days we will travel from Saint ...","https://i.ytimg.com/vi/LopAn_cq1B4/default.jpg","120","90","https://i.ytimg.com/vi/LopAn_cq1B4/mqdefault.jpg","320","180","https://i.ytimg.com/vi/LopAn_cq1B4/hqdefault.jpg","480","360","Gareth Leonard","none",396634,18897,392,0,1853,11,2019
"Fxlko6dPSgU",2019-10-10,"UCLxAS02eWvfZK4icRNzWD_g","the power of love music travel love iles de la madeleine quebec canada celine dion cover","Thanks for watching our official video of The Power of Love filmed in the Iles De La Madeleine, Quebec Canada. Filmed by JPGMOV ...","https://i.ytimg.com/vi/Fxlko6dPSgU/default.jpg","120","90","https://i.ytimg.com/vi/Fxlko6dPSgU/mqdefault.jpg","320","180","https://i.ytimg.com/vi/Fxlko6dPSgU/hqdefault.jpg","480","360","Music Travel Love","none",2240172,28204,262,0,1440,10,2019
"2h-U2FCib1k",2019-06-12,"UCEDrRCC0qRtPd5-sSa1hajw","our top travel items amp gadgets after 4 years of travel 2019 travel packing guide","We're back! And we're coming at you with an updated list of our top, must-have travel items for 2019. This is what's in our travel backs after 4 years of full-time ...","https://i.ytimg.com/vi/2h-U2FCib1k/default.jpg","120","90","https://i.ytimg.com/vi/2h-U2FCib1k/mqdefault.jpg","320","180","https://i.ytimg.com/vi/2h-U2FCib1k/hqdefault.jpg","480","360","The Endless Adventure","none",301737,6450,382,0,357,6,2019
"Z9Rs9ZFcZeM",2019-04-30,"UCh3Rpsdv1fxefE0ZcKBaNcQ","10 best places to visit in california travel video","There's more to California than just movie stars and Disneyland. This is a state that boasts a large number of stunning natural attractions, including beautiful ...","https://i.ytimg.com/vi/Z9Rs9ZFcZeM/default.jpg","120","90","https://i.ytimg.com/vi/Z9Rs9ZFcZeM/mqdefault.jpg","320","180","https://i.ytimg.com/vi/Z9Rs9ZFcZeM/hqdefault.jpg","480","360","touropia","none",729176,4948,265,0,367,4,2019
"DDaDvEFx-4k",2019-10-18,"UCSUiAn-tzSupxI8gACTs3jg","indonesia travel amp spearfishing the quest 2","Some gear that I would recommend to use Gopro Hero 8 black https://amzn.to/2O0tbBY DJI Phantom 4 pro https://amzn.to/36NER3z Sony rx 100 VII ...","https://i.ytimg.com/vi/DDaDvEFx-4k/default.jpg","120","90","https://i.ytimg.com/vi/DDaDvEFx-4k/mqdefault.jpg","320","180","https://i.ytimg.com/vi/DDaDvEFx-4k/hqdefault.jpg","480","360","dejan sverko","none",940669,10974,583,0,1052,10,2019
"C0oh-o1pY7A",2019-01-03,"UCh3Rpsdv1fxefE0ZcKBaNcQ","10 best places to visit in morocco travel video","Humphrey Bogart and Ingrid Bergman may have given the world Casablanca, but there is much more to see in Morocco than its largest city. This Atlantic coast ...","https://i.ytimg.com/vi/C0oh-o1pY7A/default.jpg","120","90","https://i.ytimg.com/vi/C0oh-o1pY7A/mqdefault.jpg","320","180","https://i.ytimg.com/vi/C0oh-o1pY7A/hqdefault.jpg","480","360","touropia","none",600284,5299,231,0,700,1,2019
"EsPmyeowaa8",2019-01-17,"UCLxAS02eWvfZK4icRNzWD_g","music travel love i will official video live acoustic at glenwood canyon","Thanks for watching our official video for ""I Will"" live acoustic at Glenwood Canyon! Spotify - https://spoti.fi/2De6RRv Itunes - https://apple.co/2Dd2lme Amazon ...","https://i.ytimg.com/vi/EsPmyeowaa8/default.jpg","120","90","https://i.ytimg.com/vi/EsPmyeowaa8/mqdefault.jpg","320","180","https://i.ytimg.com/vi/EsPmyeowaa8/hqdefault.jpg","480","360","Music Travel Love","none",5662665,31496,358,0,1148,1,2019
"JI3c4_dhDYE",2019-12-20,"UCwXfRdTtVeVnXXF4poaYw0Q","travel with chatura <U+0D85><U+0DB1><U+0DCF><U+0D9C><U+0DAD><U+0DBA><U+0DDA> <U+0D9A><U+0DDC><U+0DC5><U+0DB9> <U+0DB1><U+0D9C><U+0DBB><U+0DBA> port city colombo vlog 221 en sub","The completed city will have reclaimed 269 hectares with 116 hectares being handed over to China Communications Construction Company (CCCC), which is ...","https://i.ytimg.com/vi/JI3c4_dhDYE/default.jpg","120","90","https://i.ytimg.com/vi/JI3c4_dhDYE/mqdefault.jpg","320","180","https://i.ytimg.com/vi/JI3c4_dhDYE/hqdefault.jpg","480","360","Travel With Chatura","none",347656,7596,248,0,827,12,2019
"AhAJ6J01R7w",2019-10-27,"UCR5MByMMvz-4uWLXtrGEL-Q","don’t go to taiwan travel film by tolt 16","One advice: never set foot on Taiwanese soil. Please watch this video until the end to be sure to understand. Want to learn more about the gear and techniques ...","https://i.ytimg.com/vi/AhAJ6J01R7w/default.jpg","120","90","https://i.ytimg.com/vi/AhAJ6J01R7w/mqdefault.jpg","320","180","https://i.ytimg.com/vi/AhAJ6J01R7w/hqdefault.jpg","480","360","Tolt around the world","none",2606856,88451,1848,0,5022,10,2019
"iEXAjfTuSXo",2019-04-25,"UCLxAS02eWvfZK4icRNzWD_g","music travel love hold onto me official video","Thanks for watching our official video for ""Hold Onto Me"" live acoustic at Lake Tahoe. Get ""Hold Onto Me"": Smart URL: https://smarturl.it/ors2em Spotify: ...","https://i.ytimg.com/vi/iEXAjfTuSXo/default.jpg","120","90","https://i.ytimg.com/vi/iEXAjfTuSXo/mqdefault.jpg","320","180","https://i.ytimg.com/vi/iEXAjfTuSXo/hqdefault.jpg","480","360","Music Travel Love","none",3600929,30456,350,0,1133,4,2019
"qnpGIfWifr8",2019-02-01,"UCDBroOWVP4aN8SYM0br6sJQ","travel with me to montreal canada","Greetings from montreal! can you tell i was cold ? instagram <U+21E8> https://www.instagram.com/elenataber/ thanks to backcountry for sponsoring: ...","https://i.ytimg.com/vi/qnpGIfWifr8/default.jpg","120","90","https://i.ytimg.com/vi/qnpGIfWifr8/mqdefault.jpg","320","180","https://i.ytimg.com/vi/qnpGIfWifr8/hqdefault.jpg","480","360","Elena Taber","none",112645,3912,63,0,374,2,2019
"1hcQOXYPejA",2019-11-28,"UCGaOvAFinZ7BCN_FDmw74fQ","bordeaux vacation travel guide expedia","Bordeaux – Enjoy a region where history and charm flows as freely as the world-famous wine produced here. Discover the best places to visit and be enthralled ...","https://i.ytimg.com/vi/1hcQOXYPejA/default.jpg","120","90","https://i.ytimg.com/vi/1hcQOXYPejA/mqdefault.jpg","320","180","https://i.ytimg.com/vi/1hcQOXYPejA/hqdefault.jpg","480","360","Expedia","none",46807,861,23,0,38,11,2019
"nJNLnBCQMy0",2019-02-22,"UCGaOvAFinZ7BCN_FDmw74fQ","los cabos vacation travel guide expedia","Los Cabos is a favorite vacation spot for lovers of sea, sun and fun. This travel guide video will take you from the pulsing tempo of Cabos San Lucas to the slow ...","https://i.ytimg.com/vi/nJNLnBCQMy0/default.jpg","120","90","https://i.ytimg.com/vi/nJNLnBCQMy0/mqdefault.jpg","320","180","https://i.ytimg.com/vi/nJNLnBCQMy0/hqdefault.jpg","480","360","Expedia","none",281697,2127,100,0,133,2,2019
"bme0rs75Z3E",2019-02-07,"UCGaOvAFinZ7BCN_FDmw74fQ","yellowstone national park vacation travel guide expedia","Yellowstone National Park showcases the splendor of North American wilderness from its mountains to its valleys and its streams in between. You won't want to ...","https://i.ytimg.com/vi/bme0rs75Z3E/default.jpg","120","90","https://i.ytimg.com/vi/bme0rs75Z3E/mqdefault.jpg","320","180","https://i.ytimg.com/vi/bme0rs75Z3E/hqdefault.jpg","480","360","Expedia","none",440165,3448,95,0,201,2,2019
"WOEMkG3gOKI",2019-02-14,"UCLxAS02eWvfZK4icRNzWD_g","perfect music travel love gasparilla island ed sheeran cover","Follow us on Instagram - https://instagram.com/musictravellove/ Thanks for watching our cover of Perfect by Ed Sheeran Spotify - https://spoti.fi/2tnKSlk Itunes ...","https://i.ytimg.com/vi/WOEMkG3gOKI/default.jpg","120","90","https://i.ytimg.com/vi/WOEMkG3gOKI/mqdefault.jpg","320","180","https://i.ytimg.com/vi/WOEMkG3gOKI/hqdefault.jpg","480","360","Music Travel Love","none",16357899,207670,2465,0,3476,2,2019
"TJERhGzxRK8",2019-11-14,"UCh3Rpsdv1fxefE0ZcKBaNcQ","21 best places to visit in south america travel video","South America is a continent of superlatives: the highest lake, the driest desert, the largest waterfall… Well, you get the picture. Environmentalists will enjoy the ...","https://i.ytimg.com/vi/TJERhGzxRK8/default.jpg","120","90","https://i.ytimg.com/vi/TJERhGzxRK8/mqdefault.jpg","320","180","https://i.ytimg.com/vi/TJERhGzxRK8/hqdefault.jpg","480","360","touropia","none",154667,1056,52,0,90,11,2019
"q80bY-WvEQE",2019-03-06,"UCbkrifxiaHa0nVwW2sDCVqw","mexico city travel guide","Our Mexico City Travel Guide! This wonderful city is truly the star of one our best episodes ever. I have never fallen in love with a city quite as quickly as I fell in ...","https://i.ytimg.com/vi/q80bY-WvEQE/default.jpg","120","90","https://i.ytimg.com/vi/q80bY-WvEQE/mqdefault.jpg","320","180","https://i.ytimg.com/vi/q80bY-WvEQE/hqdefault.jpg","480","360","Attaché","none",784915,7814,210,0,1061,3,2019
"mYygvcB4ZSw",2019-09-19,"UCq22aK0t0mrOEq676Be4ezw","travel in rain beautiful chill mix","enjoy a beautiful chill music... best mixes — http://bit.do/eNr5x more mixes — http://bit.do/eNr4X unsplash — http://bit.do/e7U9b soundcloud ...","https://i.ytimg.com/vi/mYygvcB4ZSw/default.jpg","120","90","https://i.ytimg.com/vi/mYygvcB4ZSw/mqdefault.jpg","320","180","https://i.ytimg.com/vi/mYygvcB4ZSw/hqdefault.jpg","480","360","BLUME","none",539745,14366,226,0,185,9,2019
"gEYq9-vdJvc",2019-07-08,"UChObmEJP3bgGUXJGc2ePP3Q","travel hacking how to travel the world for free travelhacking","Create your own financial independence plan with our FIRE Workbook: https://www.ourrichjourney.com/workbook. We created this workbook as a 74-page ...","https://i.ytimg.com/vi/gEYq9-vdJvc/default.jpg","120","90","https://i.ytimg.com/vi/gEYq9-vdJvc/mqdefault.jpg","320","180","https://i.ytimg.com/vi/gEYq9-vdJvc/hqdefault.jpg","480","360","Our Rich Journey","none",41916,1319,21,0,96,7,2019
"LJjdKJqWzw0",2019-02-06,"UCl_7TcFxC6XNZOVmJClCUEg","best travel apps 2020","In this video, we'll show you the best travel apps in ten different categories. Top 10 Apps to Book Your Flight: https://youtu.be/adCcuDUrtOU Top 10 Apps to ...","https://i.ytimg.com/vi/LJjdKJqWzw0/default.jpg","120","90","https://i.ytimg.com/vi/LJjdKJqWzw0/mqdefault.jpg","320","180","https://i.ytimg.com/vi/LJjdKJqWzw0/hqdefault.jpg","480","360","Hungry Passport","none",51998,865,43,0,39,2,2019
"qMgL5Ew-WbI",2019-05-23,"UC6ZYnKtMbF0k2FewIgU5c3g","travel guide munich alexachung","New York, Paris, Milan, London… I'm here in a village of a million people to see what I can see but also, I just found out their phrase “München Liebt Dich”.","https://i.ytimg.com/vi/qMgL5Ew-WbI/default.jpg","120","90","https://i.ytimg.com/vi/qMgL5Ew-WbI/mqdefault.jpg","320","180","https://i.ytimg.com/vi/qMgL5Ew-WbI/hqdefault.jpg","480","360","ALEXACHUNG","none",274493,10142,131,0,359,5,2019
"ALlcAG7n4B0",2019-03-02,"UCN6hslRs2k1btobUgRFoTkQ","20 things to do in aruba complete aruba travel guide","There are so many islands in the Caribbean, why Aruba? With top rated beaches and an arid desert, this video will show you some of the best things to do and ...","https://i.ytimg.com/vi/ALlcAG7n4B0/default.jpg","120","90","https://i.ytimg.com/vi/ALlcAG7n4B0/mqdefault.jpg","320","180","https://i.ytimg.com/vi/ALlcAG7n4B0/hqdefault.jpg","480","360","Haley Dasovich","none",278620,5549,127,0,629,3,2019
"d_B3OYGOUqM",2019-12-26,"UCbQPO8TtZqhQ_7_1To2yarg","traveling to kuala lumpur by luxury bus","We accidentally booked luxury bus tickets from Penang to Kuala Lumpur. We paid about $8 USD per ticket and they were worth every penny! Would you travel ...","https://i.ytimg.com/vi/d_B3OYGOUqM/default.jpg","120","90","https://i.ytimg.com/vi/d_B3OYGOUqM/mqdefault.jpg","320","180","https://i.ytimg.com/vi/d_B3OYGOUqM/hqdefault.jpg","480","360","Jack and Gab Explore","none",355165,5761,114,0,749,12,2019
"TsOqIMbWLHI",2019-09-06,"UCzXi0cK4FC_RM857t6rGr8Q","vietnam travel cost from india flight visa hostel indian food nightlife 4k","VIETNAM #TRAVEL #GUIDE Visit My online Amazon shop https://www.amazon.in/shop/traveljunkie Camera Gadgets I Used to Make videos (Affiliate links) Main ...","https://i.ytimg.com/vi/TsOqIMbWLHI/default.jpg","120","90","https://i.ytimg.com/vi/TsOqIMbWLHI/mqdefault.jpg","320","180","https://i.ytimg.com/vi/TsOqIMbWLHI/hqdefault.jpg","480","360","Travel Junkie","none",617366,18604,885,0,1533,9,2019
"125nMc_Nz8s",2019-02-10,"UCmHn9fGfK0NmI9fMzuaYnjA","top 10 things to know before visiting santorini greece travel planning","Follow us LIVE as we travel! https://www.instagram.com/suitcasemonkey/ We go through our top 10 list of things we wish we had known before we went to ...","https://i.ytimg.com/vi/125nMc_Nz8s/default.jpg","120","90","https://i.ytimg.com/vi/125nMc_Nz8s/mqdefault.jpg","320","180","https://i.ytimg.com/vi/125nMc_Nz8s/hqdefault.jpg","480","360","Suitcase Monkey","none",430296,6932,87,0,356,2,2019
"AphHBOg9SxE",2019-03-06,"UCKuSn_LSQ_U_8o35jjpi0xQ","travel man 39 s best hotels travel man","Travel Man has seen many cool cribs over the years, here's a few of the best! The official destination (see what we did there) for all things Travel Man, where ...","https://i.ytimg.com/vi/AphHBOg9SxE/default.jpg","120","90","https://i.ytimg.com/vi/AphHBOg9SxE/mqdefault.jpg","320","180","https://i.ytimg.com/vi/AphHBOg9SxE/hqdefault.jpg","480","360","Travel Man","none",358211,3050,54,0,110,3,2019
"FUFO4vfg4V0",2019-06-08,"UC2vlpX8sNDBmPcY_1_QSGJg","cut your holiday expenses in half with these extreme travel tips extreme cheapskates","Follow penny-pincher Angela Leibee throughout her journey to Las Vegas with her daughter. She'll be revealing her most extreme money saving tips for ...","https://i.ytimg.com/vi/FUFO4vfg4V0/default.jpg","120","90","https://i.ytimg.com/vi/FUFO4vfg4V0/mqdefault.jpg","320","180","https://i.ytimg.com/vi/FUFO4vfg4V0/hqdefault.jpg","480","360","tlc uk","none",6939359,55152,4619,0,10527,6,2019
"IDJO_cHHhKI",2019-01-26,"UCTt2IMqvqahaSqQa1TKWq3g","20 things to do in tallinn estonia the complete travel guide","This is our compilation of all the things we did in Tallinn, Estonia. We hope this guide will help fellow travellers discover this amazing city. Thanks so much to ...","https://i.ytimg.com/vi/IDJO_cHHhKI/default.jpg","120","90","https://i.ytimg.com/vi/IDJO_cHHhKI/mqdefault.jpg","320","180","https://i.ytimg.com/vi/IDJO_cHHhKI/hqdefault.jpg","480","360","Rachel and Nick","none",49192,743,41,0,100,1,2019
"dnVVxJoVbGM",2019-07-21,"UCZwd0qneWpqUqLnM5nwZpsA","bad travel day autism on an airplane","It was a bad travel day...it just wasn't a good day in general. This was one of those situations as a parent and as an autism parent that we just wanted to throw in ...","https://i.ytimg.com/vi/dnVVxJoVbGM/default.jpg","120","90","https://i.ytimg.com/vi/dnVVxJoVbGM/mqdefault.jpg","320","180","https://i.ytimg.com/vi/dnVVxJoVbGM/hqdefault.jpg","480","360","FatheringAutism","none",1033961,23350,432,0,3005,7,2019
"SceyajXZZZc",2019-12-26,"UCt8NJjYKc2aT3T0TnbcWxSw","madina food amp travel guide indian amp pakistani together ziyarats of medina munawarrah","Please send your suggestions in comment box and don't forget to subscribe !! --------------------- Follow me on Instagram: https://instagram.com/streetfoodpk Like ...","https://i.ytimg.com/vi/SceyajXZZZc/default.jpg","120","90","https://i.ytimg.com/vi/SceyajXZZZc/mqdefault.jpg","320","180","https://i.ytimg.com/vi/SceyajXZZZc/hqdefault.jpg","480","360","Street Food PK","none",752061,30462,1037,0,2594,12,2019
"E-nJHaHlyG8",2019-03-24,"UCmHn9fGfK0NmI9fMzuaYnjA","how to holiday in london by a londoner 5 days travel vlog amp guide","Follow us LIVE as we travel! https://www.instagram.com/suitcasemonkey/ I have lived in London for 18 years so have never really seen London through the ...","https://i.ytimg.com/vi/E-nJHaHlyG8/default.jpg","120","90","https://i.ytimg.com/vi/E-nJHaHlyG8/mqdefault.jpg","320","180","https://i.ytimg.com/vi/E-nJHaHlyG8/hqdefault.jpg","480","360","Suitcase Monkey","none",480608,13226,156,0,701,3,2019
"kf3Xwbk5pt0",2019-11-14,"UCaP1PNnr055fOt89JPry51w","my travel bag essentials after 100 flights in a year","MotionVFX mTravel Final Cut Pro X Plugins - https://motionvfx.sjv.io/ZDeKQ RAVPower 1TB SSD (Discount Code ""MINISSD2"") https://amzn.to/2JEA1f0 ...","https://i.ytimg.com/vi/kf3Xwbk5pt0/default.jpg","120","90","https://i.ytimg.com/vi/kf3Xwbk5pt0/mqdefault.jpg","320","180","https://i.ytimg.com/vi/kf3Xwbk5pt0/hqdefault.jpg","480","360","Justin Tse","none",427220,9013,634,0,509,11,2019
"yZG6Ep0EixE",2019-05-06,"UCuN4A3GCUq5-0wJDSiJoxRQ","9 life saving travel hacks you must know travel trip journey anaysa","Are you preparing for a trip?? But before doing so check out all these travel hacks and trips which will make your next trip a whole lot easier & comfortable.","https://i.ytimg.com/vi/yZG6Ep0EixE/default.jpg","120","90","https://i.ytimg.com/vi/yZG6Ep0EixE/mqdefault.jpg","320","180","https://i.ytimg.com/vi/yZG6Ep0EixE/hqdefault.jpg","480","360","Anaysa","none",9990235,389412,11270,0,3264,5,2019
"lfxdm9VdQEM",2019-09-10,"UC1SaV8cJ5u5U9iEZS6QRbpg","30 travel hacks you need to know before your next trip","TIMESTAMPS: 00:43 How to make a hoodie pillow 02:18 How to pack makeup 02:49 How to turn a hoodie into a bag 03:34 Best ways to fold clothes 04:15 ...","https://i.ytimg.com/vi/lfxdm9VdQEM/default.jpg","120","90","https://i.ytimg.com/vi/lfxdm9VdQEM/mqdefault.jpg","320","180","https://i.ytimg.com/vi/lfxdm9VdQEM/hqdefault.jpg","480","360","5-Minute Crafts TEENS","none",1560584,14056,1505,0,212,9,2019
"pVRMFbcjszY",2019-04-27,"UCt_NLJ4McJlCyYM-dSPRo7Q","top 20 hot destinations where to travel in 2019","These are my 20 Top Hot Destinations from all of my travel adventures around the world. From Africa, Europe, the Americas, and Asia travel, here are some of ...","https://i.ytimg.com/vi/pVRMFbcjszY/default.jpg","120","90","https://i.ytimg.com/vi/pVRMFbcjszY/mqdefault.jpg","320","180","https://i.ytimg.com/vi/pVRMFbcjszY/hqdefault.jpg","480","360","Lost LeBlanc","none",287808,6935,176,0,732,4,2019
"eTE_0j2_OZw",2019-12-11,"UCl_7TcFxC6XNZOVmJClCUEg","things to know before you go to budapest 2020 hungary travel guide 4k","This video is sponsored by CEPTICS, a number one brand for travel adapters on Amazon https://www.ceptics.com Our BUDAPEST TRAVEL GUIDE ...","https://i.ytimg.com/vi/eTE_0j2_OZw/default.jpg","120","90","https://i.ytimg.com/vi/eTE_0j2_OZw/mqdefault.jpg","320","180","https://i.ytimg.com/vi/eTE_0j2_OZw/hqdefault.jpg","480","360","Hungry Passport","none",45165,942,26,0,40,12,2019
"_lcOX55Ef70",2019-04-16,"UCGeGhS_akOxBWQcSmje6B-w","solo in paro bhutan tiger 39 s nest visit bhutan travel guide bhutan series ep 1 tanya khanijow","Here's presenting the first part of the Bhutan Series Episode in Paro. I went straight to Paro as first part of my road trip in the country. The drive from Phuntsholing ...","https://i.ytimg.com/vi/_lcOX55Ef70/default.jpg","120","90","https://i.ytimg.com/vi/_lcOX55Ef70/mqdefault.jpg","320","180","https://i.ytimg.com/vi/_lcOX55Ef70/hqdefault.jpg","480","360","Tanya Khanijow","none",1062717,22730,747,0,1985,4,2019
"Q_bNu3RYXAA",2019-06-14,"UCGaOvAFinZ7BCN_FDmw74fQ","vancouver island vacation travel guide expedia","Vancouver Island – a place of awe-inspiring natural beauty. In this video, discover why the fusion of history and rugged West Coast landscapes makes this ...","https://i.ytimg.com/vi/Q_bNu3RYXAA/default.jpg","120","90","https://i.ytimg.com/vi/Q_bNu3RYXAA/mqdefault.jpg","320","180","https://i.ytimg.com/vi/Q_bNu3RYXAA/hqdefault.jpg","480","360","Expedia","none",189513,2472,44,0,185,6,2019
"yQCBAaJg1LE",2019-11-06,"UCl_7TcFxC6XNZOVmJClCUEg","top 10 things to do in miami in 2020 florida travel guide 4k","MIAMI TRAVEL GUIDE 2019 Our Miami PDF guide ONLY $4.99 https://gum.co/MiaGD 20% DISCOUNT - use code: HUNGRY20 (limited time offer) ...","https://i.ytimg.com/vi/yQCBAaJg1LE/default.jpg","120","90","https://i.ytimg.com/vi/yQCBAaJg1LE/mqdefault.jpg","320","180","https://i.ytimg.com/vi/yQCBAaJg1LE/hqdefault.jpg","480","360","Hungry Passport","none",201097,2651,120,0,158,11,2019
"y6KfrWVE-Jo",2019-03-27,"UCTcATaNqlaCF4zkZp29BJRQ","<U+0DB4><U+0DA7><U+0DCA><U+0DA7> patta travels gehan blok amp dino corera","<U+0DB4><U+0DA7><U+0DCA><U+0DA7> (Patta) Travels Created by Gehan Blok & Dino Corera Client: Classic Travel Production Crew: Neo Digital Image #blokanddino #gehanblok #dinocorera ...","https://i.ytimg.com/vi/y6KfrWVE-Jo/default.jpg","120","90","https://i.ytimg.com/vi/y6KfrWVE-Jo/mqdefault.jpg","320","180","https://i.ytimg.com/vi/y6KfrWVE-Jo/hqdefault.jpg","480","360","Blok & Dino","none",551275,12277,214,0,330,3,2019
"7gybcgRh-o4",2019-03-29,"UC03RvJoIhm_fMwlUpm9ZvFw","travel safe with these 11 useful diy travel hacks","Travel safely around the globe with NordVPN. Go to http://nordvpn.com/craftypanda and use code craftypanda to get 75% off a 3 year plan + an extra month for ...","https://i.ytimg.com/vi/7gybcgRh-o4/default.jpg","120","90","https://i.ytimg.com/vi/7gybcgRh-o4/mqdefault.jpg","320","180","https://i.ytimg.com/vi/7gybcgRh-o4/hqdefault.jpg","480","360","Crafty Panda","none",13113166,83164,14076,0,1344,3,2019
"QYNMrrRB69Y",2019-07-31,"UCl_7TcFxC6XNZOVmJClCUEg","things to know before you go to paris paris travel guide 2020","This video is sponsored by CEPTICS, a number one brand for travel adapters on Amazon https://www.ceptics.com 20% OFF - Get our Paris pdf travel ...","https://i.ytimg.com/vi/QYNMrrRB69Y/default.jpg","120","90","https://i.ytimg.com/vi/QYNMrrRB69Y/mqdefault.jpg","320","180","https://i.ytimg.com/vi/QYNMrrRB69Y/hqdefault.jpg","480","360","Hungry Passport","none",77551,1835,44,0,76,7,2019
"sdhE2hqwNuo",2019-05-14,"UCh3Rpsdv1fxefE0ZcKBaNcQ","10 best places to visit in utah travel video","With five national parks, 43 state parks, and vast areas of breathtaking wilderness, Utah is one of the most popular states in the country for tourism. Along with ...","https://i.ytimg.com/vi/sdhE2hqwNuo/default.jpg","120","90","https://i.ytimg.com/vi/sdhE2hqwNuo/mqdefault.jpg","320","180","https://i.ytimg.com/vi/sdhE2hqwNuo/hqdefault.jpg","480","360","touropia","none",520915,4313,172,0,461,5,2019
"otP2Tc9S5N0",2019-12-19,"UCgZM50Ig7STDS0l6f_QnrXw","exploring crazy beautiful kathmandu amp nepal travel tips","Walking through the streets of Kathmandu while discussing some practical info and tips for traveling and trekking in Nepal. More info about trekking in the ...","https://i.ytimg.com/vi/otP2Tc9S5N0/default.jpg","120","90","https://i.ytimg.com/vi/otP2Tc9S5N0/mqdefault.jpg","320","180","https://i.ytimg.com/vi/otP2Tc9S5N0/hqdefault.jpg","480","360","Gabriel Traveler","none",234016,6473,146,0,1227,12,2019
"OrJ-mgjG2iQ",2019-01-23,"UCzzfu83LhPMMuhtDVA75rfw","4 season fiberglass travel trailer by bigfoot rv small travel trailers","Walk through of the Bigfoot fiberglass travel trailer. These fiberglass trailers have a double hull with high density foam insulation for 4 season camping.","https://i.ytimg.com/vi/OrJ-mgjG2iQ/default.jpg","120","90","https://i.ytimg.com/vi/OrJ-mgjG2iQ/mqdefault.jpg","320","180","https://i.ytimg.com/vi/OrJ-mgjG2iQ/hqdefault.jpg","480","360","We're the Russos","none",103603,2750,84,0,170,1,2019
"gJ_D9aX-YEw",2019-07-05,"UCmnpMr4Md5CgZ5MdlghTYqA","serbia will surprise you belgrade first impressions serbia travel vlog","Don't miss this vlog - Belgrade will definitely surprise you! This is not the Serbia you expect | Grab a 2 month free trial of Skillshare Premium, only 500 available ...","https://i.ytimg.com/vi/gJ_D9aX-YEw/default.jpg","120","90","https://i.ytimg.com/vi/gJ_D9aX-YEw/mqdefault.jpg","320","180","https://i.ytimg.com/vi/gJ_D9aX-YEw/hqdefault.jpg","480","360","Daneger and Stacey","none",176994,4107,214,0,1047,7,2019
