"video_id","publishedAt","channelId","title","description","thumbnails.default.url","thumbnails.default.width","thumbnails.default.height","thumbnails.medium.url","thumbnails.medium.width","thumbnails.medium.height","thumbnails.high.url","thumbnails.high.width","thumbnails.high.height","channelTitle","liveBroadcastContent","viewCount","likeCount","dislikeCount","favoriteCount","commentCount","month","year"
"NmJKfV4ESIk",2019-06-20,"UCneyi-aYq4VIBYIAQgWmk_w","<U+0918><U+0930> <U+092C><U+0948><U+0920><U+0947> body <U+0915><U+0948><U+0938><U+0947> <U+092C><U+0928><U+093E><U+092F><U+0947> easy fitness guide in hindi beerbiceps","Buy dumbbells: http://amzn.to/2s9bRi3 INSTAGRAM : @beerbiceps https://www.instagram.com/beerbiceps/ FACEBOOK: fb.me/ranveerallahbadiaofficial ...","https://i.ytimg.com/vi/NmJKfV4ESIk/default.jpg","120","90","https://i.ytimg.com/vi/NmJKfV4ESIk/mqdefault.jpg","320","180","https://i.ytimg.com/vi/NmJKfV4ESIk/hqdefault.jpg","480","360","Ranveer Allahbadia","none",672459,40924,974,0,4252,6,2019
"7DCdVcFor10",2019-02-17,"UCTZyWwafSOvXC3bsbWdxm7w","serge beynaud kota na koto chorégraphié par djamboola fitness","DJAMBOOLA, le concept danse-fitness pour la promotion de la culture Afro et Caribéenne, partout dans le monde. * Vous voulez faire notre ...","https://i.ytimg.com/vi/7DCdVcFor10/default.jpg","120","90","https://i.ytimg.com/vi/7DCdVcFor10/mqdefault.jpg","320","180","https://i.ytimg.com/vi/7DCdVcFor10/hqdefault.jpg","480","360","Djamboola Fitness","none",1323597,6772,756,0,261,2,2019
"BfNdWAbNTv0",2019-03-23,"UCnYbtNkJij8qcdU8UfdcENw","give me more aesthetic fitness motivation <U+0001F525>djamboola fitness","IMPORTANT: If you have anything against my uploads contact me here: gymlegionproduction@gmail.com | GIVE ME MORE - Aesthetic Fitness Motivation ...","https://i.ytimg.com/vi/BfNdWAbNTv0/default.jpg","120","90","https://i.ytimg.com/vi/BfNdWAbNTv0/mqdefault.jpg","320","180","https://i.ytimg.com/vi/BfNdWAbNTv0/hqdefault.jpg","480","360","Gym Legion","none",556012,8947,178,0,69,3,2019
"d3R2-nW065U",2019-11-07,"UCPxMZIFE856tbTfdkdjzTSQ","ayushmann khurrana 39 s life hacks on confidence spirituality amp fitness the ranveer show 20","Bala movie trailer: https://www.youtube.com/watch?v=veJ6ejMjzgE&t=1s Subscribe to our HINDI YouTube Channel: ...","https://i.ytimg.com/vi/d3R2-nW065U/default.jpg","120","90","https://i.ytimg.com/vi/d3R2-nW065U/mqdefault.jpg","320","180","https://i.ytimg.com/vi/d3R2-nW065U/hqdefault.jpg","480","360","BeerBiceps","none",360571,18917,462,0,1369,11,2019
"_3OpCWp-ZFc",2019-12-16,"UCrTlvJkxo5LmCvwz8k3aXLA","new fitness generation <U+0001F525> gym motivation 2020nce spirituality amp fitness the ranveer show 20","Make sure to subscribe and click on the for more motivational videos! | NEW FITNESS GENERATION GYM MOTIVATION 2020 YouTube | Instagram: ...","https://i.ytimg.com/vi/_3OpCWp-ZFc/default.jpg","120","90","https://i.ytimg.com/vi/_3OpCWp-ZFc/mqdefault.jpg","320","180","https://i.ytimg.com/vi/_3OpCWp-ZFc/hqdefault.jpg","480","360","The Beast Motivation","none",176632,2883,71,0,94,12,2019
"OgYUkecH2UI",2019-03-11,"UCYFQ33UIPERYx8-ZHucZbDA","how to work out with apple watch — apple support","Work out with your Apple Watch when you're hiking, running, doing yoga, and more, and you can track your progress and see when you reach your goals.","https://i.ytimg.com/vi/OgYUkecH2UI/default.jpg","120","90","https://i.ytimg.com/vi/OgYUkecH2UI/mqdefault.jpg","320","180","https://i.ytimg.com/vi/OgYUkecH2UI/hqdefault.jpg","480","360","Apple Support","none",330385,3546,95,0,91,3,2019
"0GMr8xV4IY4",2019-05-27,"UCjfG0dyMUiqKleUnkX6zBrA","i took the us marine physical fitness test","My training and nutrition programmes, including my fat loss guide (approved by a GB Olympic team expert), are available at: https://www.natachaoceane.com ...","https://i.ytimg.com/vi/0GMr8xV4IY4/default.jpg","120","90","https://i.ytimg.com/vi/0GMr8xV4IY4/mqdefault.jpg","320","180","https://i.ytimg.com/vi/0GMr8xV4IY4/hqdefault.jpg","480","360","Natacha Océane","none",1771947,70552,1155,0,3992,5,2019
"5s46efcroQ0",2019-01-03,"UCGIY_O-8vW4rfX98KlMkvRg","fitness boxing overview trailer nintendo switch","Get moving with fun, boxing-based rhythmic exercises set to the instrumental beats of songs by popular artists. You can personalize your workouts by selecting ...","https://i.ytimg.com/vi/5s46efcroQ0/default.jpg","120","90","https://i.ytimg.com/vi/5s46efcroQ0/mqdefault.jpg","320","180","https://i.ytimg.com/vi/5s46efcroQ0/hqdefault.jpg","480","360","Nintendo","none",409481,4973,406,0,1493,1,2019
"sj8i-fuh61o",2019-06-25,"UCdJdEguB1F1CiYe7OEi3SBg","jt fitness sweatin 39 it out with oj jontron","Support The Channel! Download Free <U+2694><U+FE0F> Vikings War Of Clans Here <U+27A4> IOS: http://bit.ly/2RyLdgj <U+27A4> Android: http://bit.ly/2X3zHzu And Get 200 Gold, And a ...","https://i.ytimg.com/vi/sj8i-fuh61o/default.jpg","120","90","https://i.ytimg.com/vi/sj8i-fuh61o/mqdefault.jpg","320","180","https://i.ytimg.com/vi/sj8i-fuh61o/hqdefault.jpg","480","360","JonTronShow","none",4596403,240381,3285,0,12024,6,2019
"wWf_jOGz3zo",2019-12-11,"UCDwHFuZJV_2qukjmkJGWIfw","fitness habits i formed in my 20s fitter at 30 than at 19","Fitness habits I formed in my 20s! Get a month FREE on FIIT premium using my link (HIIT, strength training, yoga, combat, pilates, weights and breathwork ...","https://i.ytimg.com/vi/wWf_jOGz3zo/default.jpg","120","90","https://i.ytimg.com/vi/wWf_jOGz3zo/mqdefault.jpg","320","180","https://i.ytimg.com/vi/wWf_jOGz3zo/hqdefault.jpg","480","360","Melanie Murphy","none",293725,14142,198,0,689,12,2019
"rn6nvh0RWlg",2019-10-31,"UCx2HcmpB-UZGkMXOCJ4QIVA","scoopwhoop when you date a fitness freak ft ankita goraya and rohan khurana","""life with you is like having no leg days"" Get tickets for ScoopWhoop Presents Madness JAMS @ The Rooftop (9th November, Mumbai) ...","https://i.ytimg.com/vi/rn6nvh0RWlg/default.jpg","120","90","https://i.ytimg.com/vi/rn6nvh0RWlg/mqdefault.jpg","320","180","https://i.ytimg.com/vi/rn6nvh0RWlg/hqdefault.jpg","480","360","ScoopWhoop","none",945191,28393,1075,0,696,10,2019
"cunGcIR4bTQ",2019-10-21,"UCwJfDTNqtM5n-dQBfuuHzYw","is your fitness tracker hurting you get a grip with randall otis men 39 s health","Is Your Fitness Tracker Hurting You? | Get A Grip With Randall Otis | Men's Health Step counters. Heart rate monitors. Sleep trackers. You name it: they'll track it.","https://i.ytimg.com/vi/cunGcIR4bTQ/default.jpg","120","90","https://i.ytimg.com/vi/cunGcIR4bTQ/mqdefault.jpg","320","180","https://i.ytimg.com/vi/cunGcIR4bTQ/hqdefault.jpg","480","360","Men's Health","none",14083,324,42,0,18,10,2019
"0tjXpGVR5yE",2019-03-25,"UCNCJTCR8UNxxJwUBHhddeXA","andrei <U+0001F451> deiu fitness motivation 2019t a grip with randall otis men 39 s health","Andrei Deiu - Fitness Motivation | 2019 <U+25BB>IMPORTANT: If You Have Anything Against My Uploads Contact Me Here: motivanation.official@gmail.com ...","https://i.ytimg.com/vi/0tjXpGVR5yE/default.jpg","120","90","https://i.ytimg.com/vi/0tjXpGVR5yE/mqdefault.jpg","320","180","https://i.ytimg.com/vi/0tjXpGVR5yE/hqdefault.jpg","480","360","Motivanation","none",538019,8796,166,0,75,3,2019
"mHWY5k6Xo-k",2019-12-14,"UCvwgF_0NOZe2vN4Q3g1bY-A","my 1 year body transformation fitness guide amp motivation","For those that asked, here's an overview of my body transformation over the past year. I hope you enjoy & hopefully it can motivate some if you! SUBSCRIBE TO: ...","https://i.ytimg.com/vi/mHWY5k6Xo-k/default.jpg","120","90","https://i.ytimg.com/vi/mHWY5k6Xo-k/mqdefault.jpg","320","180","https://i.ytimg.com/vi/mHWY5k6Xo-k/hqdefault.jpg","480","360","Vikkstar123","none",2228169,95692,2690,0,5451,12,2019
"GJj7Izf5Hfc",2019-03-22,"UCJXQrSE7a5c04rvXQcwMD_w","norbi fitness kickbox 2019 középhaladó","","https://i.ytimg.com/vi/GJj7Izf5Hfc/default.jpg","120","90","https://i.ytimg.com/vi/GJj7Izf5Hfc/mqdefault.jpg","320","180","https://i.ytimg.com/vi/GJj7Izf5Hfc/hqdefault.jpg","480","360","UPDATE Up to Diet","none",91226,1233,94,0,0,3,2019
"FTSSbJkJj7k",2019-01-20,"UCfyKktpUgdV5xDEhakicCsw","khan brothers gym workout fitness challenge videos salman khan sohail khan arbaz khan","Welcome to Home Bollywud, your one stop destination for everything and anything around Movies, Celebrities and Indian Television stars.","https://i.ytimg.com/vi/FTSSbJkJj7k/default.jpg","120","90","https://i.ytimg.com/vi/FTSSbJkJj7k/mqdefault.jpg","320","180","https://i.ytimg.com/vi/FTSSbJkJj7k/hqdefault.jpg","480","360","Home Bollywud","none",12081923,55423,7153,0,1352,1,2019
"votkomftcnI",2019-08-23,"UCrBEQmWS7WV2DtHfISKeI0A","first time chiropractic cracking on fitness youtuber","FIRST TIME* Chiropractic CRACKING on *FITNESS* YouTuber By Dr Joseph Cipriano DC. Massage Gun Inquires: ...","https://i.ytimg.com/vi/votkomftcnI/default.jpg","120","90","https://i.ytimg.com/vi/votkomftcnI/mqdefault.jpg","320","180","https://i.ytimg.com/vi/votkomftcnI/hqdefault.jpg","480","360","Dr Joseph Cipriano DC","none",1358658,13242,386,0,1345,8,2019
"ql_5pk8Vwdc",2019-10-21,"UCGGZ_POGmIWG1pQXTDzQv-g","i gave a teen mom a 6 week fitness makeover","Check out the first video Ashley and I did together! https://www.youtube.com/watch?v=jUH6X2WEmeM Follow me on Instagram to see more behind the scenes ...","https://i.ytimg.com/vi/ql_5pk8Vwdc/default.jpg","120","90","https://i.ytimg.com/vi/ql_5pk8Vwdc/mqdefault.jpg","320","180","https://i.ytimg.com/vi/ql_5pk8Vwdc/hqdefault.jpg","480","360","Michelle Khare","none",981538,50330,195,0,1862,10,2019
"_wsv9FRSVgA",2019-07-07,"UCGGZ_POGmIWG1pQXTDzQv-g","i gave jazzmyne robbins a 6 week fitness makeover","I gave a 6-week health and fitness makeover to the queen of confidence - Jazzmyne Robbins! To APPLY TO be on #ExtremeBodyMakeover, scroll down for ...","https://i.ytimg.com/vi/_wsv9FRSVgA/default.jpg","120","90","https://i.ytimg.com/vi/_wsv9FRSVgA/mqdefault.jpg","320","180","https://i.ytimg.com/vi/_wsv9FRSVgA/hqdefault.jpg","480","360","Michelle Khare","none",1833975,72645,890,0,3607,7,2019
"F1orju1NsN8",2019-09-12,"UCGIY_O-8vW4rfX98KlMkvRg","ring fit adventure reveal trailer nintendo switch","Learn more about the new experience for Nintendo Switch, coming October 18th! Subscribe for more Nintendo fun! https://goo.gl/HYYsot Visit Nintendo.com for ...","https://i.ytimg.com/vi/F1orju1NsN8/default.jpg","120","90","https://i.ytimg.com/vi/F1orju1NsN8/mqdefault.jpg","320","180","https://i.ytimg.com/vi/F1orju1NsN8/hqdefault.jpg","480","360","Nintendo","none",1707826,43719,2979,0,10184,9,2019
"dK_5_8Hf_fI",2019-05-19,"UCTZyWwafSOvXC3bsbWdxm7w","quot moto moto quot dj arafat et quot amina quot ariel sheney par djamboola fitness","2 petites démos dans cette vidéo: ""MOTO MOTO"" Dj Arafat et ""AMINA"" Ariel Sheney. Juste pour le plaisir. DJAMBOOLA, le concept danse-fitness pour la ...","https://i.ytimg.com/vi/dK_5_8Hf_fI/default.jpg","120","90","https://i.ytimg.com/vi/dK_5_8Hf_fI/mqdefault.jpg","320","180","https://i.ytimg.com/vi/dK_5_8Hf_fI/hqdefault.jpg","480","360","Djamboola Fitness","none",945681,8290,560,0,574,5,2019
"tZOGdQlR1sc",2019-10-18,"UCZ7bB7Cf7tDvdmCAG-tM9dQ","guerreros hacia el fitness","Este vídeo es uno de esos vídeos que te hará reflexionar. Un vídeo conmovedor, triste, lleno de emociones, pero sobretodo REAL!!! Juan David y Jorge cuentan ...","https://i.ytimg.com/vi/tZOGdQlR1sc/default.jpg","120","90","https://i.ytimg.com/vi/tZOGdQlR1sc/mqdefault.jpg","320","180","https://i.ytimg.com/vi/tZOGdQlR1sc/hqdefault.jpg","480","360","HECTOR NICE","none",667,31,1,0,0,10,2019
"5mzRsKA-GPI",2019-05-09,"UCeI_Ji5Wc1YQvG2dCHZJINw","summer workout mix 2020<U+0001F525>fitness amp gym motivation<U+0001F525>best deep house music by max oaz","Stream/Download: https://band.link/maxoazo Spotify: <U+25BB>This is Max Oazo: https://spoti.fi/2TGqY4l <U+25BB>Fresh Summer Hits: https://spoti.fi/2Fi1KR9...","https://i.ytimg.com/vi/5mzRsKA-GPI/default.jpg","120","90","https://i.ytimg.com/vi/5mzRsKA-GPI/mqdefault.jpg","320","180","https://i.ytimg.com/vi/5mzRsKA-GPI/hqdefault.jpg","480","360","MAX OAZO","none",2797776,26433,1651,0,443,5,2019
"FWtFBYYPn-A",2019-03-20,"UCP7LUz8TKiOARTD8LdrVgXQ","people who brag and post about their fitness","Get your first audiobook for free when you try Audible for 30 days. Visit http://www.audible.com/trey or text trey to 500500 Thanks for watching! SUBSCRIBE: ...","https://i.ytimg.com/vi/FWtFBYYPn-A/default.jpg","120","90","https://i.ytimg.com/vi/FWtFBYYPn-A/mqdefault.jpg","320","180","https://i.ytimg.com/vi/FWtFBYYPn-A/hqdefault.jpg","480","360","Trey Kennedy","none",426614,13778,160,0,661,3,2019
"EAccgjAu53o",2019-12-11,"UCOXFVINC6GCo86LBy0NQCIg","loser has to go in the ice bath for 1 minute <U+0001F976> fitness challengeuse music by max oaz","SUBSCRIBE: https://bit.ly/2ID4evA Here's where I get my music from: http://share.epidemicsound.com/njDwH Personal: IG: @RomeeStrijd Business: ...","https://i.ytimg.com/vi/EAccgjAu53o/default.jpg","120","90","https://i.ytimg.com/vi/EAccgjAu53o/mqdefault.jpg","320","180","https://i.ytimg.com/vi/EAccgjAu53o/hqdefault.jpg","480","360","Romee Strijd","none",737071,19637,300,0,672,12,2019
"SpxyvZKYP58",2019-10-18,"UCvyTdLw8SkVmUcHYXSDEGwA","training agent00 how to lose weight fitness amp nutrition","Sub to my 2nd Channel!: https://goo.gl/Se1qBH 2HYPE CHANNEL: https://www.youtube.com/channel/UCY4AlDv6wL2qhrX29iwdqAg Follow me on Twitter: ...","https://i.ytimg.com/vi/SpxyvZKYP58/default.jpg","120","90","https://i.ytimg.com/vi/SpxyvZKYP58/mqdefault.jpg","320","180","https://i.ytimg.com/vi/SpxyvZKYP58/hqdefault.jpg","480","360","CashNasty","none",927306,33374,322,0,1605,10,2019
"xkPE1aDlRMY",2019-12-31,"UCIcgBZ9hEJxHv6r_jDYOMqg","2 grown men attempt the presidential fitness test","The Presidential Fitness Test is a benchmark to see if the youth of America are up to the arbitrary standards of fitness set forth by the government. Are we still up ...","https://i.ytimg.com/vi/xkPE1aDlRMY/default.jpg","120","90","https://i.ytimg.com/vi/xkPE1aDlRMY/mqdefault.jpg","320","180","https://i.ytimg.com/vi/xkPE1aDlRMY/hqdefault.jpg","480","360","Unus Annus","none",2351321,140266,667,0,16467,12,2019
"Hg_7SLFijks",2019-02-20,"UCuMFKxLoqOWVA1U1njNttXA","anaboler fitness einkauf ketogen","Im heutigen Video nehme ich euch mit zu meinem kompletten Einkauf bei Edeka für die anabole Diät. Außerdem bekommt ihr eine ausführliche Anleitung um ...","https://i.ytimg.com/vi/Hg_7SLFijks/default.jpg","120","90","https://i.ytimg.com/vi/Hg_7SLFijks/mqdefault.jpg","320","180","https://i.ytimg.com/vi/Hg_7SLFijks/hqdefault.jpg","480","360","BODY IP by Simon Teichmann","none",81633,1950,147,0,407,2,2019
"blLts_HWGdI",2019-03-26,"UC9xRcqG8V6yNi6Hum92EoGg","football conditioning session improve your fitness with the ball","In today's training session we are incorporating some fitness into our drills while disguising the conditioning work with the ball. Being fit is essential to be able to ...","https://i.ytimg.com/vi/blLts_HWGdI/default.jpg","120","90","https://i.ytimg.com/vi/blLts_HWGdI/mqdefault.jpg","320","180","https://i.ytimg.com/vi/blLts_HWGdI/hqdefault.jpg","480","360","7mlc","none",309585,7716,95,0,207,3,2019
"dTzMYevY53M",2019-08-17,"UCvpfclapgcuJo0M_x65pfRw","honor band 5 vs mi band 4 best budget fitness band","Get 15% OFF for all Web Hosting Plans! Go to https://www.hostinger.com/beebom and use Coupon Code “BEEBOM” for your order. Succeed faster! The new ...","https://i.ytimg.com/vi/dTzMYevY53M/default.jpg","120","90","https://i.ytimg.com/vi/dTzMYevY53M/mqdefault.jpg","320","180","https://i.ytimg.com/vi/dTzMYevY53M/hqdefault.jpg","480","360","Beebom","none",778615,12833,884,0,1157,8,2019
"6ml3mdq4eV0",2019-09-07,"UCl5_liU7CWXwkGU3Vf3UGNQ","sascha huber reagiert auf die heftigsten fitness videos reaktion","Spare jetzt 10% mit dem Code ""SASCHA10"" auf deine gesamte Bestellung bei Prozis (Europas Marktführer bei Sportnahrung): http://prozis.com/1VtY <U+279E> Die XXL ...","https://i.ytimg.com/vi/6ml3mdq4eV0/default.jpg","120","90","https://i.ytimg.com/vi/6ml3mdq4eV0/mqdefault.jpg","320","180","https://i.ytimg.com/vi/6ml3mdq4eV0/hqdefault.jpg","480","360","Sascha Huber","none",613853,25294,431,0,1369,9,2019
"Ct7BZziHWvs",2019-07-14,"UC3AAj3XPEkCan4PwIKJzlgg","2019 recruits new fitness test pirbright british army","Recruits New Entry Test | Pirbright | British Army New Fitness Test Entry (RFT(E)) will be used as the selection standard to confirm that potential soldier/officer ...","https://i.ytimg.com/vi/Ct7BZziHWvs/default.jpg","120","90","https://i.ytimg.com/vi/Ct7BZziHWvs/mqdefault.jpg","320","180","https://i.ytimg.com/vi/Ct7BZziHWvs/hqdefault.jpg","480","360","Fabziy","none",294068,3519,89,0,781,7,2019
"8QzdhQEdl40",2019-12-20,"UCnwgjTVObrm6SuUvJ9QyhwQ","army fitness tests joining the army army jobs","What are the fitness tests you take when you join the British Army? Find out what to expect when you go to the Assessment Centre as part of the process for ...","https://i.ytimg.com/vi/8QzdhQEdl40/default.jpg","120","90","https://i.ytimg.com/vi/8QzdhQEdl40/mqdefault.jpg","320","180","https://i.ytimg.com/vi/8QzdhQEdl40/hqdefault.jpg","480","360","ARMYjobs","none",26067,402,8,0,NA,12,2019
"kzsLOrkTphs",2019-09-26,"UC6y_DbpezOinlzHv8O092zw","samsung galaxy watch active 2 sports amp fitness first run amp tests","Samsung Galaxy Active 2 on Amazon: https://amzn.to/2GXIpVh (link helps support channel, thanks!!!) Here's your complete sports & fitness look at the Samsung ...","https://i.ytimg.com/vi/kzsLOrkTphs/default.jpg","120","90","https://i.ytimg.com/vi/kzsLOrkTphs/mqdefault.jpg","320","180","https://i.ytimg.com/vi/kzsLOrkTphs/hqdefault.jpg","480","360","DC Rainmaker","none",130764,2690,100,0,375,9,2019
"0LAwMzOAqKs",2019-02-12,"UCwCezqK84-2fyCq3aaqAQTA","another 6 biggest celebrity <U+2605> fitness body transformations","Another 6 Biggest Celebrity <U+2606> Fitness Body Transformations -------------------------------------------------------------------------- Fit actors talks about their body ...","https://i.ytimg.com/vi/0LAwMzOAqKs/default.jpg","120","90","https://i.ytimg.com/vi/0LAwMzOAqKs/mqdefault.jpg","320","180","https://i.ytimg.com/vi/0LAwMzOAqKs/hqdefault.jpg","480","360","EpicMashups","none",2023802,16137,504,0,702,2,2019
"naMOe0GGeRE",2019-04-11,"UCaimBIzSrbZ7rDemTl_dvOw","baquetaz con gabriel tristán ritmozum fitness","Que onda mi raza! Este videíto es el bueno! ojala les guste esta nueva modalidad, la clase de baquetas además de divertida se genera un trabajo muscular de ...","https://i.ytimg.com/vi/naMOe0GGeRE/default.jpg","120","90","https://i.ytimg.com/vi/naMOe0GGeRE/mqdefault.jpg","320","180","https://i.ytimg.com/vi/naMOe0GGeRE/hqdefault.jpg","480","360","RITMOZUM FITNESS","none",49814,1340,37,0,120,4,2019
"tXxAYALosDI",2019-07-22,"UCqVof1x_T_7xEcv4_LQetOg","quot senorita quot by shawn mendes amp camila cabello dance fitness with jessica","Please Subscribe to all!!! ****Dance Fitness With Jessica: Instagram: @jessicabassjames Facebook: Dance Fitness With Jessica Live Stream Link: ...","https://i.ytimg.com/vi/tXxAYALosDI/default.jpg","120","90","https://i.ytimg.com/vi/tXxAYALosDI/mqdefault.jpg","320","180","https://i.ytimg.com/vi/tXxAYALosDI/hqdefault.jpg","480","360","Dance Fitness with Jessica","none",2119621,34775,2319,0,648,7,2019
"JdSiApos5yw",2019-08-05,"UCnpCOBcIaj_zAhl19j2ex7Q","así fue mi lesión haciendo un reto fitness muy doloroso","The Titan culturista y modelo fitness hace el reto de sumo y acaba terriblemente lesionado con un desgarro completo del biceps mientras daba 200€ a quien le ...","https://i.ytimg.com/vi/JdSiApos5yw/default.jpg","120","90","https://i.ytimg.com/vi/JdSiApos5yw/mqdefault.jpg","320","180","https://i.ytimg.com/vi/JdSiApos5yw/hqdefault.jpg","480","360","The Titan","none",3179925,207451,8330,0,10714,8,2019
"PnIrgPqaauk",2019-10-02,"UCt97cNGGpoIyEqICpdJZkuA","dance monkey <U+0001F474><U+0001F3FC><U+0001F475><U+0001F3FB> tones and i coreo fitness zumba fitness choreography by marveldancow 20","dancemonkey #tonesandi #zumba DANCE MONKEY - TONES AND I | Coreo Fitness (Zumba Fitness) by Marveldancers Dancers: Anita Sanz, Eva Sánchez, ...","https://i.ytimg.com/vi/PnIrgPqaauk/default.jpg","120","90","https://i.ytimg.com/vi/PnIrgPqaauk/mqdefault.jpg","320","180","https://i.ytimg.com/vi/PnIrgPqaauk/hqdefault.jpg","480","360","MarvelDancers Production","none",249628,3019,308,0,64,10,2019
"mHGOnGKAKp0",2019-07-07,"UCmF8AOhYRX-3JbEQ3GDlF6g","sa aking puso dj bombon remix zumba dance fitness dbrk crew","Thank you everyone for watching our videos! Like and Share! If you would like to donate in our channel for some amounts or goods. Please click our donation ...","https://i.ytimg.com/vi/mHGOnGKAKp0/default.jpg","120","90","https://i.ytimg.com/vi/mHGOnGKAKp0/mqdefault.jpg","320","180","https://i.ytimg.com/vi/mHGOnGKAKp0/hqdefault.jpg","480","360","AMAZING Carlo Balingit","none",3429651,8334,1102,0,256,7,2019
"plgj_1_dh5w",2019-09-04,"UC9Zgkz_z57ePl33sGHfDn4g","paul anka neil sedaka medley retrogoove fitness toots ensomo with zttb elite and ms alicia","PAUL ANKA MEDLEY RETROGOOVE FITNESS Choreography by MR. TOOTS ENSOMO MR. NICK ANTONIO with ZTTB ELITE and Ms. Alicia Green together ...","https://i.ytimg.com/vi/plgj_1_dh5w/default.jpg","120","90","https://i.ytimg.com/vi/plgj_1_dh5w/mqdefault.jpg","320","180","https://i.ytimg.com/vi/plgj_1_dh5w/hqdefault.jpg","480","360","RETRO GROOVE FITNESS By Toots Ensomo","none",940125,3117,256,0,49,9,2019
"EI9ZzG4oPSM",2019-03-30,"UCmF8AOhYRX-3JbEQ3GDlF6g","kiat jud day discobudots zumba dance fitness","Thank you everyone for watching our videos! Like and Share! If you would like to donate in our channel for some amounts or goods. Please click our donation ...","https://i.ytimg.com/vi/EI9ZzG4oPSM/default.jpg","120","90","https://i.ytimg.com/vi/EI9ZzG4oPSM/mqdefault.jpg","320","180","https://i.ytimg.com/vi/EI9ZzG4oPSM/hqdefault.jpg","480","360","AMAZING Carlo Balingit","none",5711630,25630,2817,0,626,3,2019
"lr_UPtXPCWQ",2019-12-19,"UCS0Lrx79n1rfLp3K0EU79tw","elraenn tepkikolik fitness egitmenlerinin spor kazalarina tepkisini Izliyor","https://www.youtube.com/watch?v=HAxbFTqdxMc Videoyu begendiyseniz begenmeyi, abone olmayi,çay içmeyi, sevmeyi, sevilmeyi ve mutlu olmayi ...","https://i.ytimg.com/vi/lr_UPtXPCWQ/default.jpg","120","90","https://i.ytimg.com/vi/lr_UPtXPCWQ/mqdefault.jpg","320","180","https://i.ytimg.com/vi/lr_UPtXPCWQ/hqdefault.jpg","480","360","Kendine Twicci","none",275269,3798,137,0,111,12,2019
"wvHELogbm2E",2019-09-26,"UCGIY_O-8vW4rfX98KlMkvRg","ring fit adventure overview trailer nintendo switch","In Ring Fit Adventure, battle enemies and explore numerous colorful worlds using real-world movements on your quest to take down a giant, egotistical dragon.","https://i.ytimg.com/vi/wvHELogbm2E/default.jpg","120","90","https://i.ytimg.com/vi/wvHELogbm2E/mqdefault.jpg","320","180","https://i.ytimg.com/vi/wvHELogbm2E/hqdefault.jpg","480","360","Nintendo","none",5038153,24418,2537,0,3487,9,2019
"FkGOGe9OhIw",2019-04-19,"UCVKZZn5fcJbsKEkm8dc5cxg","kill this love by blackpink live love party™ zumba dance fitness","DO YOU WANT TO BECOME A ZUMBA FITNESS INSTRUCTOR? We have great news for you!!! You can get 15% discount when you use the discount code ...","https://i.ytimg.com/vi/FkGOGe9OhIw/default.jpg","120","90","https://i.ytimg.com/vi/FkGOGe9OhIw/mqdefault.jpg","320","180","https://i.ytimg.com/vi/FkGOGe9OhIw/hqdefault.jpg","480","360","LIVELOVEPARTY.TV","none",2845642,14445,1676,0,332,4,2019
"LqBUm7NnMgc",2019-11-25,"UCrTlvJkxo5LmCvwz8k3aXLA","all or nothing <U+0001F525> fitness motivation 2019ty™ zumba dance fitness","Make sure to subscribe and click on the for more motivational videos! | ALL OR NOTHING FITNESS MOTIVATION 2019 Track: Barren Gates - Devil [NCS ...","https://i.ytimg.com/vi/LqBUm7NnMgc/default.jpg","120","90","https://i.ytimg.com/vi/LqBUm7NnMgc/mqdefault.jpg","320","180","https://i.ytimg.com/vi/LqBUm7NnMgc/hqdefault.jpg","480","360","The Beast Motivation","none",172130,2877,61,0,31,11,2019
"-jc5QCnMwQE",2019-08-20,"UCsZXuHKonP9utl5q2hFCkgA","the perfect gym for resolution breakers one time fitness studio c","The Perfect Gym for Resolution Breakers...One Time Fitness - Studio C. Already planning on breaking your fitness goals? We have the gym for you! #Studio C ...","https://i.ytimg.com/vi/-jc5QCnMwQE/default.jpg","120","90","https://i.ytimg.com/vi/-jc5QCnMwQE/mqdefault.jpg","320","180","https://i.ytimg.com/vi/-jc5QCnMwQE/hqdefault.jpg","480","360","Studio C","none",601255,16154,125,0,1137,8,2019
"ksMvfFq1llE",2019-05-20,"UChMcx8GqaV4uz5V_Mq_u0zg","apart <U+0001F494> fitness motivation 2019reakers one time fitness studio c","APART FITNESS MOTIVATION 2019 NOT SUBSCRIBED? WHAT ARE YOU EVEN DOING?! JOIN THE FAMILY! - http://bit.ly/subtomotivathlete Track: NEFFEX ...","https://i.ytimg.com/vi/ksMvfFq1llE/default.jpg","120","90","https://i.ytimg.com/vi/ksMvfFq1llE/mqdefault.jpg","320","180","https://i.ytimg.com/vi/ksMvfFq1llE/hqdefault.jpg","480","360","Motivathlete","none",1281826,21966,424,0,120,5,2019
"RHSXqoKum8A",2019-08-18,"UC-CZmKnJbjGWAzJd6cIVUMg","how to make a fitness routine","how I make my fitness routines <U+2764> I tend to switch these bad boys up every 3 weeks or so -- just making minor tweaks to keep things fresh and exciting. Either way ...","https://i.ytimg.com/vi/RHSXqoKum8A/default.jpg","120","90","https://i.ytimg.com/vi/RHSXqoKum8A/mqdefault.jpg","320","180","https://i.ytimg.com/vi/RHSXqoKum8A/hqdefault.jpg","480","360","Kalyn Nicholson","none",95110,4330,46,0,180,8,2019
