"video_id","publishedAt","channelId","title","description","thumbnails.default.url","thumbnails.default.width","thumbnails.default.height","thumbnails.medium.url","thumbnails.medium.width","thumbnails.medium.height","thumbnails.high.url","thumbnails.high.width","thumbnails.high.height","channelTitle","liveBroadcastContent","viewCount","likeCount","dislikeCount","favoriteCount","commentCount","month","year"
"vFcMkrRqS6M",2019-12-27,"UC3mfe_tfroMoJG4-eXO1kMQ","marketing hacks for fitness professionals mrinalini agarwal","In this video our social media and marketing manager talks about social media marketing and lead generation. For any details related to the courses please call ...","https://i.ytimg.com/vi/vFcMkrRqS6M/default.jpg","120","90","https://i.ytimg.com/vi/vFcMkrRqS6M/mqdefault.jpg","320","180","https://i.ytimg.com/vi/vFcMkrRqS6M/hqdefault.jpg","480","360","Classic Fitness Academy","none",657,39,2,0,2,12,2019
"kQHOE0asSSg",2019-10-17,"UCZo8BAi0leaHpPgY1kAmwzA","banyo queen remix opm music remix zumba jm zumba dance fitness milan italy","BanyoQueenRemix #OPMmusicDance #ZumbaFitness.","https://i.ytimg.com/vi/kQHOE0asSSg/default.jpg","120","90","https://i.ytimg.com/vi/kQHOE0asSSg/mqdefault.jpg","320","180","https://i.ytimg.com/vi/kQHOE0asSSg/hqdefault.jpg","480","360","Carlos Miguel Rivera","none",365418,959,165,0,20,10,2019
"V5epY9z866Y",2019-11-03,"UCJs3Q9ndrqierxmnQWUTHXA","luigi 39 s mansion 3 walkthrough part 13 f13 fitness center","Part 13 of a complete walkthrough for Luigi's Mansion 3 on the Nintendo Switch. This part covers the 13th floor titled ""Fitness Center"". Luigi's Mansion 3 ...","https://i.ytimg.com/vi/V5epY9z866Y/default.jpg","120","90","https://i.ytimg.com/vi/V5epY9z866Y/mqdefault.jpg","320","180","https://i.ytimg.com/vi/V5epY9z866Y/hqdefault.jpg","480","360","YTSunny","none",433895,1645,209,0,30,11,2019
"1cWf4CZK6vk",2019-10-25,"UCNsw0yEc3zWIheTB0HcpW5A","cage non stop fitness","NSF Cage je baziran na Crossfit treningu. Krosfit nije specijalizovan fitnes program, vec predstavlja pokušaj da se jednim treningom ostvare najznacajniji ciljevi ...","https://i.ytimg.com/vi/1cWf4CZK6vk/default.jpg","120","90","https://i.ytimg.com/vi/1cWf4CZK6vk/mqdefault.jpg","320","180","https://i.ytimg.com/vi/1cWf4CZK6vk/hqdefault.jpg","480","360","NSF Serbia","none",861,2,0,0,0,10,2019
"BUolMPR0gcA",2019-11-04,"UCaF0z914Qs2FVV7hZYsOVQg","faith small fitness center spring arbor university","Spring Arbor University has completed a nearly $1 million renovation for a state-of-the-art 6330 square foot fitness center located in the McDonald Athletic ...","https://i.ytimg.com/vi/BUolMPR0gcA/default.jpg","120","90","https://i.ytimg.com/vi/BUolMPR0gcA/mqdefault.jpg","320","180","https://i.ytimg.com/vi/BUolMPR0gcA/hqdefault.jpg","480","360","Spring Arbor University","none",393,6,0,0,0,11,2019
"uu2IIIu7_y0",2019-06-03,"UCFjrdsVizB0HBDWf42fQFbg","remote fitness training coachmeplus warrior performance platform","CoachMePlus Warrior Performance Platform Overview. In this video, we cover what the Warrior Performance Platform is and how it addresses common issues in ...","https://i.ytimg.com/vi/uu2IIIu7_y0/default.jpg","120","90","https://i.ytimg.com/vi/uu2IIIu7_y0/mqdefault.jpg","320","180","https://i.ytimg.com/vi/uu2IIIu7_y0/hqdefault.jpg","480","360","CoachMePlus","none",391,1,0,0,0,6,2019
"0Kj8SfY30X8",2019-10-14,"UCxEUEkp5y728nY57wg8z3dw","businessman exposes hoopers 1v1 basketball at la fitness","T Jass The Businessman Is Back In Action! PART 1: https://www.youtube.com/watch?v=B16dKePlXyU&t=143s <U+25BD>Follow Me On Social Media<U+25BD> ...","https://i.ytimg.com/vi/0Kj8SfY30X8/default.jpg","120","90","https://i.ytimg.com/vi/0Kj8SfY30X8/mqdefault.jpg","320","180","https://i.ytimg.com/vi/0Kj8SfY30X8/hqdefault.jpg","480","360","Tristan Jass","none",387793,20554,304,0,891,10,2019
"RQbUz7qjb64",2019-11-04,"UCu4s1wmtCITLyYbTpTxupVg","medical programming at acac fitness","Exercise is medicine! Many years ago we discovered that patients can make incredible progress towards their goals when their healthcare providers partner with ...","https://i.ytimg.com/vi/RQbUz7qjb64/default.jpg","120","90","https://i.ytimg.com/vi/RQbUz7qjb64/mqdefault.jpg","320","180","https://i.ytimg.com/vi/RQbUz7qjb64/hqdefault.jpg","480","360","ACAC Fitness & Wellness","none",666,3,0,0,1,11,2019
"4SSCJGrhZfU",2019-12-29,"UCUiwjA5RgjU-VoGgswiEV3g","the health and fitness bounce","The two primary bounces used on a rebounder - the health bounce - for lymph drainage and energy boosting and the fitness bounce - for cardio and resistance ...","https://i.ytimg.com/vi/4SSCJGrhZfU/default.jpg","120","90","https://i.ytimg.com/vi/4SSCJGrhZfU/mqdefault.jpg","320","180","https://i.ytimg.com/vi/4SSCJGrhZfU/hqdefault.jpg","480","360","Keith McFarlane","none",875,23,0,0,8,12,2019
"97viUNQY-B4",2019-11-22,"UCSOQj3LjecVt-IMPL90Cvgg","boy wilian fitnes jangan salah fokus","video ini di ambil dari acara nebeng boy di trastv.","https://i.ytimg.com/vi/97viUNQY-B4/default.jpg","120","90","https://i.ytimg.com/vi/97viUNQY-B4/mqdefault.jpg","320","180","https://i.ytimg.com/vi/97viUNQY-B4/hqdefault.jpg","480","360","Ade Vino Ainin","none",2535,4,0,0,0,11,2019
"uZBOU85eXrw",2019-09-16,"UC32BMf4BlWihPxCp9sM1eSw","women 39 s health ministry of fitness teaser","From the team that brought you SAs original fitness party, Fit Night Out. Women's Health SA presents Ministry Of Fitness. An epic late-night exercise party that ...","https://i.ytimg.com/vi/uZBOU85eXrw/default.jpg","120","90","https://i.ytimg.com/vi/uZBOU85eXrw/mqdefault.jpg","320","180","https://i.ytimg.com/vi/uZBOU85eXrw/hqdefault.jpg","480","360","Women's Health South Africa","none",911,3,0,0,1,9,2019
"ZAmbxFIPERQ",2019-12-19,"UC1ELIZQC_5nHBYmOzhDIDqQ","forte fitness dance fit<U+2120> “motivation”","Tribute to The Fitness Marshall! We are performing CHOREO by The Fitness Marshall. CONNECT: Instagram (fortefitness_nc) and Facebook (Forte Fitness ...","https://i.ytimg.com/vi/ZAmbxFIPERQ/default.jpg","120","90","https://i.ytimg.com/vi/ZAmbxFIPERQ/mqdefault.jpg","320","180","https://i.ytimg.com/vi/ZAmbxFIPERQ/hqdefault.jpg","480","360","Forte Fitness- Southern Pines, NC- Brandi Martin","none",514,6,0,0,1,12,2019
"DUo2oKpc28M",2019-12-17,"UCNGAvYdwZhWgkLq5TcO7HfQ","update fitness centerportrait bern schönburg","Herzlich willkommen im update Fitness Bern Schönburg Im Dezember 2019 haben wir an der Viktoriastrasse 21 das update Fitness Bern Schönburg für dich ...","https://i.ytimg.com/vi/DUo2oKpc28M/default.jpg","120","90","https://i.ytimg.com/vi/DUo2oKpc28M/mqdefault.jpg","320","180","https://i.ytimg.com/vi/DUo2oKpc28M/hqdefault.jpg","480","360","update Fitness info channel","none",781,1,0,0,0,12,2019
"GVUSNGB_T4E",2019-10-17,"UCVkMJGnd53OzhRopGnxsq6g","bailando zin 83 zumba fitness at dome balikpapan","Rayvanny Ft Mayorkun - Gimi Dat | ZUMBA | FITNESS | At D'One Studio Balikpapan Choreo By Paltu (One On One) At Dome Balikpapan don't forget like ...","https://i.ytimg.com/vi/GVUSNGB_T4E/default.jpg","120","90","https://i.ytimg.com/vi/GVUSNGB_T4E/mqdefault.jpg","320","180","https://i.ytimg.com/vi/GVUSNGB_T4E/hqdefault.jpg","480","360","DwikyDanceFitSwag","none",178434,1188,40,0,19,10,2019
"gmL9c_uFLFY",2019-12-23,"UCrTlvJkxo5LmCvwz8k3aXLA","you can do it <U+0001F3C6> fitness motivation 2020likpapan","Make sure to subscribe and click on the for more motivational videos! | YOU CAN DO IT FITNESS MOTIVATION 2020 Track: ROY KNOX x Tim Beeren ...","https://i.ytimg.com/vi/gmL9c_uFLFY/default.jpg","120","90","https://i.ytimg.com/vi/gmL9c_uFLFY/mqdefault.jpg","320","180","https://i.ytimg.com/vi/gmL9c_uFLFY/hqdefault.jpg","480","360","The Beast Motivation","none",57652,1053,24,0,50,12,2019
"9Jmpm73xDzs",2019-01-24,"UC5JzNGod8Vdu9WvRvIRKkjQ","eat the frog fitness","","https://i.ytimg.com/vi/9Jmpm73xDzs/default.jpg","120","90","https://i.ytimg.com/vi/9Jmpm73xDzs/mqdefault.jpg","320","180","https://i.ytimg.com/vi/9Jmpm73xDzs/hqdefault.jpg","480","360","Eat The Frog Fitness","none",17645,7,0,0,1,1,2019
"Wu5opcWjgI0",2019-05-15,"UC3OHxXBPav-LG7wcu39T_tw","new gym in blaine xperience fitness northtown","Join Xperience Fitness in Blaine. Sign up has started. Be one of the first 500 Founding Members and recieve exclusive perks. Check it out here.","https://i.ytimg.com/vi/Wu5opcWjgI0/default.jpg","120","90","https://i.ytimg.com/vi/Wu5opcWjgI0/mqdefault.jpg","320","180","https://i.ytimg.com/vi/Wu5opcWjgI0/hqdefault.jpg","480","360","XperienceFitness","none",1164,6,0,0,5,5,2019
"8K1RgVVhshE",2019-11-21,"UCSOQj3LjecVt-IMPL90Cvgg","ali syakip fitnes","","https://i.ytimg.com/vi/8K1RgVVhshE/default.jpg","120","90","https://i.ytimg.com/vi/8K1RgVVhshE/mqdefault.jpg","320","180","https://i.ytimg.com/vi/8K1RgVVhshE/hqdefault.jpg","480","360","Ade Vino Ainin","none",803,1,0,0,0,11,2019
"dghWn2ljwQM",2019-05-06,"UCWiGnqxYp71_SsuUF7r8Avg","bringing free fitness to 1000 cities colleges and schools","National Fitness Campaign is excited to share our vision for a world where everyone has access to beautiful, outdoor public fitness. We're partnering with cities, ...","https://i.ytimg.com/vi/dghWn2ljwQM/default.jpg","120","90","https://i.ytimg.com/vi/dghWn2ljwQM/mqdefault.jpg","320","180","https://i.ytimg.com/vi/dghWn2ljwQM/hqdefault.jpg","480","360","National Fitness Campaign","none",2870,11,0,0,1,5,2019
"ZXrkIgxR2qM",2019-08-15,"UCZIZI4uySgE6G_FPVJ4HRgg","the best fitness advice i ever received","View the Blog Post with this video: http://www.totalgymdirect.com/total-gym-blog http://www.TotalGymDirect.com - Total Gym Direct is the ultimate source for Total ...","https://i.ytimg.com/vi/ZXrkIgxR2qM/default.jpg","120","90","https://i.ytimg.com/vi/ZXrkIgxR2qM/mqdefault.jpg","320","180","https://i.ytimg.com/vi/ZXrkIgxR2qM/hqdefault.jpg","480","360","TotalGymDirect","none",1562,38,1,0,3,8,2019
"uWiDJkEY-q4",2019-02-17,"UCTM41fu6HQp8geosS5X-ODA","sparrow fitness the fight","Personal Trainer, Katie Sparrow, shows off her sword fighting skills in this short form action epic created to advertise 'Sparrow Fitness', a PT based service on ...","https://i.ytimg.com/vi/uWiDJkEY-q4/default.jpg","120","90","https://i.ytimg.com/vi/uWiDJkEY-q4/mqdefault.jpg","320","180","https://i.ytimg.com/vi/uWiDJkEY-q4/hqdefault.jpg","480","360","James Whaler","none",9319,52,6,0,0,2,2019
"hSPechJ93DE",2019-06-19,"UC9kN7lAe0Q7-mHPtHlAq7Fw","workout music 2019 fitness gym","Motivational Workout music videos for your gym training and inspiration. Fit girls show off their best leg, glute, arm, and chest exercises. Thank you for watching!","https://i.ytimg.com/vi/hSPechJ93DE/default.jpg","120","90","https://i.ytimg.com/vi/hSPechJ93DE/mqdefault.jpg","320","180","https://i.ytimg.com/vi/hSPechJ93DE/hqdefault.jpg","480","360","Fitness Remix","none",52266,444,28,0,6,6,2019
"c3m2Ag07ISs",2019-05-21,"UCVRIw39rh98yHiKyytbqgEg","getbig tv online 24x7 bodybuilding fitness bikini","<U+0422><U+0440><U+0430><U+043D><U+0441><U+043B><U+044F><U+0446><U+0438><U+0438>, <U+0432><U+0438><U+0434><U+0435><U+043E> <U+0438> <U+0444><U+043E><U+0442><U+043E> - http://www.getbig.tv - Youtube-<U+043A><U+0430><U+043D><U+0430><U+043B> - https://www.youtube.com/getbigtv - <U+0418><U+043D><U+0441><U+0442><U+0430><U+0433><U+0440><U+0430><U+043C> - https://instagram.com/getbigtv - Facebook...","https://i.ytimg.com/vi/c3m2Ag07ISs/default_live.jpg","120","90","https://i.ytimg.com/vi/c3m2Ag07ISs/mqdefault_live.jpg","320","180","https://i.ytimg.com/vi/c3m2Ag07ISs/hqdefault_live.jpg","480","360","GETBIG.TV","live",431697,2112,366,0,0,5,2019
"72Bj8AoYfjs",2019-11-18,"UCKuKaT-qekq-F0cWaVXROaA","máy ch<U+1EA1>y b<U+1ED9> tech fitness tf 19as khuy<U+1EBF>n mãi h<U+1EA5>p d<U+1EAB>n tài phát sport","Chuong trình “Siêu khuy<U+1EBF>n mãi mua 1 du<U+1EE3>c 5 – ng<U+1EAD>p tràn uu dãi” duy nh<U+1EA5>t t<U+1EA1>i Tài Phát Sport Mua máy ch<U+1EA1>y b<U+1ED9> TF-19AS ti<U+1EBF>t ki<U+1EC7>m cho gia dình 2.500.000...","https://i.ytimg.com/vi/72Bj8AoYfjs/default.jpg","120","90","https://i.ytimg.com/vi/72Bj8AoYfjs/mqdefault.jpg","320","180","https://i.ytimg.com/vi/72Bj8AoYfjs/hqdefault.jpg","480","360","Tài Phát Sport","none",30452,2,0,0,0,11,2019
"9rd57xCIG3s",2019-03-20,"UCifn5evYJA1ycmanGrHGtlA","fitness equipment manufacturer","[www.sdfitnessequipment.in] Leading manufacturer of Fitness Equipment. Share your details here to get free price quotes http://goim.in/Pnnnv36p<U+200B> . Have any ...","https://i.ytimg.com/vi/9rd57xCIG3s/default.jpg","120","90","https://i.ytimg.com/vi/9rd57xCIG3s/mqdefault.jpg","320","180","https://i.ytimg.com/vi/9rd57xCIG3s/hqdefault.jpg","480","360","Business Video","none",742,16,0,0,0,3,2019
"BCS5hSXQcjY",2019-10-06,"UCjU6qyQA-C7BeGswVgA5Apg","lets go soca zin 83 zumba fitness zin jenifar amp team","Mount Fitness Studio (MFS)","https://i.ytimg.com/vi/BCS5hSXQcjY/default.jpg","120","90","https://i.ytimg.com/vi/BCS5hSXQcjY/mqdefault.jpg","320","180","https://i.ytimg.com/vi/BCS5hSXQcjY/hqdefault.jpg","480","360","Mount fitness studio Zin jenifar","none",6812,94,4,0,6,10,2019
"4dDpMuG0Pac",2019-12-27,"UCDZofic8Z-MQIYl7ZYxeRuA","turnfit personal trainers fitness assessment","Why choose Vancouver's #1 rated personal trainers according to Google, Facebook & Top Choice Awards winner for 2019? We add personal care which makes ...","https://i.ytimg.com/vi/4dDpMuG0Pac/default.jpg","120","90","https://i.ytimg.com/vi/4dDpMuG0Pac/mqdefault.jpg","320","180","https://i.ytimg.com/vi/4dDpMuG0Pac/hqdefault.jpg","480","360","TurnFit - Vancouver Personal Trainers","none",2310,1,0,0,0,12,2019
"EwUZHi92tXE",2019-01-09,"UC0ufulrcYfa0l21209svULA","sky fitness sarpsborg","TRENINGSSENTER SARPSBORG – SKY FITNESS SARPSBORG SKY Fitness Sarpsborg er et treningssenter for deg som vil ha god kvalitet, til lav pris. Hos oss ...","https://i.ytimg.com/vi/EwUZHi92tXE/default.jpg","120","90","https://i.ytimg.com/vi/EwUZHi92tXE/mqdefault.jpg","320","180","https://i.ytimg.com/vi/EwUZHi92tXE/hqdefault.jpg","480","360","SKY Fitness Norge","none",827,2,0,0,0,1,2019
"l9iMzsHK6yY",2019-05-03,"UCDMnylsgZXVa6yhozqQZ9DA","<U+0001F351> twerk fitness <U+0001F351> • twerking • core stabilizatiOteam","ONLY FANS • • https://onlyfans.com/ninaunrated?ref=1118007 INSTAGRAM • NinaUnrated TWITTER • NinaUnrated TIK TOK • NinaUnrated SNAPCHAT   ...","https://i.ytimg.com/vi/l9iMzsHK6yY/default.jpg","120","90","https://i.ytimg.com/vi/l9iMzsHK6yY/mqdefault.jpg","320","180","https://i.ytimg.com/vi/l9iMzsHK6yY/hqdefault.jpg","480","360","Nina Unrated","none",24330,948,36,0,56,5,2019
"-UVYwirzuio",2019-09-29,"UCoDxyq4ZNjh4Dht6PvLMMzQ","elevate premium fitness saint genes","Découvrez Elevate Premium Fitness Saint-Genes.","https://i.ytimg.com/vi/-UVYwirzuio/default.jpg","120","90","https://i.ytimg.com/vi/-UVYwirzuio/mqdefault.jpg","320","180","https://i.ytimg.com/vi/-UVYwirzuio/hqdefault.jpg","480","360","Elevate Premium Fitness Bordeaux Chartrons","none",5549,0,1,0,0,9,2019
"jUjUxAUFgNw",2019-01-23,"UCqd7ebEFADvJ0-1eTeH1H-Q","pilates total fitness","","https://i.ytimg.com/vi/jUjUxAUFgNw/default.jpg","120","90","https://i.ytimg.com/vi/jUjUxAUFgNw/mqdefault.jpg","320","180","https://i.ytimg.com/vi/jUjUxAUFgNw/hqdefault.jpg","480","360","Total Fitness","none",2054,0,0,0,0,1,2019
"6oXTswAZrL8",2019-12-19,"UC1ELIZQC_5nHBYmOzhDIDqQ","forte fitness dance fit<U+2120> “acappella”","CONNECT: Instagram (fortefitness_nc) and Facebook (Forte Fitness - Southern Pines, NC). Join us for a live class at our locations in Southern Pines and ...","https://i.ytimg.com/vi/6oXTswAZrL8/default.jpg","120","90","https://i.ytimg.com/vi/6oXTswAZrL8/mqdefault.jpg","320","180","https://i.ytimg.com/vi/6oXTswAZrL8/hqdefault.jpg","480","360","Forte Fitness- Southern Pines, NC- Brandi Martin","none",416,5,0,0,0,12,2019
"NayqVL1r3Tk",2019-11-04,"UC2q8U8d0ZNbzVtJGpQQubhQ","5 day fitness challenge cardio hiit health and fitness day 1 motivation","Please watch: ""(21) 20 Minute Christmas Aerobic Workout | Last Christmas Feliz Navidad All I want For Xmas Is You ...","https://i.ytimg.com/vi/NayqVL1r3Tk/default.jpg","120","90","https://i.ytimg.com/vi/NayqVL1r3Tk/mqdefault.jpg","320","180","https://i.ytimg.com/vi/NayqVL1r3Tk/hqdefault.jpg","480","360","THE FABULOUS FITNESS INSTRUCTOR","none",1907,74,5,0,210,11,2019
"wljXh58AtsA",2019-10-16,"UChMcx8GqaV4uz5V_Mq_u0zg","not a day off <U+0001F621> fitness motivation 2019th and fitness day 1 motivation","FOLLOW MOTIVATHLETE INSTAGRAM: https://www.instagram.com/uljaskarlfit WEAR MOTIVATHLETE APPAREL & BE FEATURED: ...","https://i.ytimg.com/vi/wljXh58AtsA/default.jpg","120","90","https://i.ytimg.com/vi/wljXh58AtsA/mqdefault.jpg","320","180","https://i.ytimg.com/vi/wljXh58AtsA/hqdefault.jpg","480","360","Motivathlete","none",127683,2648,60,0,43,10,2019
"yMVsSL-no1w",2019-05-29,"UCucpNJR2BhLQ9j6um1BIskw","athletics and fitness association of america afaa the group fitness experts","For over 35 years, AFAA® has provided generations of instructors with practical skills and hands-on experience needed to inspire and motivate the world to ...","https://i.ytimg.com/vi/yMVsSL-no1w/default.jpg","120","90","https://i.ytimg.com/vi/yMVsSL-no1w/mqdefault.jpg","320","180","https://i.ytimg.com/vi/yMVsSL-no1w/hqdefault.jpg","480","360","Athletics and Fitness Association of America (AFAA)","none",371941,2,1,0,0,5,2019
"x-oTzVK9qi8",2019-12-19,"UC1ELIZQC_5nHBYmOzhDIDqQ","forte fitness dance fit<U+2120> “me amp my girls”","CONNECT: Instagram (fortefitness_nc) and Facebook (Forte Fitness - Southern Pines, NC). Join us for a live class at our locations in Southern Pines and ...","https://i.ytimg.com/vi/x-oTzVK9qi8/default.jpg","120","90","https://i.ytimg.com/vi/x-oTzVK9qi8/mqdefault.jpg","320","180","https://i.ytimg.com/vi/x-oTzVK9qi8/hqdefault.jpg","480","360","Forte Fitness- Southern Pines, NC- Brandi Martin","none",435,4,0,0,0,12,2019
"cXG-9-_aS40",2019-07-01,"UC3OHxXBPav-LG7wcu39T_tw","we are taking on summer 19 39 xperience fitness","This year we are taking summer on, not off. We have made it easier than ever to sign up. Join for $4. Plus, have fun working out in a fun, uplifting atmosphere.","https://i.ytimg.com/vi/cXG-9-_aS40/default.jpg","120","90","https://i.ytimg.com/vi/cXG-9-_aS40/mqdefault.jpg","320","180","https://i.ytimg.com/vi/cXG-9-_aS40/hqdefault.jpg","480","360","XperienceFitness","none",32732,5,1,0,0,7,2019
"hRLUBE0qeuI",2019-08-24,"UCrbsrMJLXEyQvoXtZipgr8A","welcome to total body experts commercial fitness equipment for clubs amp home","Large selection of New & Pre-Owned Commercial Fitness Equipment for Clubs and Home for any budget. Please visit our sister company www.","https://i.ytimg.com/vi/hRLUBE0qeuI/default.jpg","120","90","https://i.ytimg.com/vi/hRLUBE0qeuI/mqdefault.jpg","320","180","https://i.ytimg.com/vi/hRLUBE0qeuI/hqdefault.jpg","480","360","TotalBodyExperts","none",2461,8,0,0,0,8,2019
"9aBkKn1o-sI",2019-11-29,"UCuy09aO3fQtBg0kqS5syeGA","love gymming try new pond 39 s skinfit high performance skincare range for fitness enthusiasts","Sweat now, glow later with our newest range of products - Pond's Skinfit. With a range of pre and post workout products Pre-Workout products: High ...","https://i.ytimg.com/vi/9aBkKn1o-sI/default.jpg","120","90","https://i.ytimg.com/vi/9aBkKn1o-sI/mqdefault.jpg","320","180","https://i.ytimg.com/vi/9aBkKn1o-sI/hqdefault.jpg","480","360","Pond's India","none",6007497,12,6,0,0,11,2019
"Z_E3pQ9hem0",2019-05-12,"UCY_RU885HGSWVySk4vsvfAA","from homeless to fit my 1 year natural transformation from heroin to fitness","Hey guys! This is my first video on YouTube, but I will upload more talking about how I did exactly to quit drugs, using fitness. Hopefully my experiences and I can ...","https://i.ytimg.com/vi/Z_E3pQ9hem0/default.jpg","120","90","https://i.ytimg.com/vi/Z_E3pQ9hem0/mqdefault.jpg","320","180","https://i.ytimg.com/vi/Z_E3pQ9hem0/hqdefault.jpg","480","360","Zebastian Aesir - From Addiction To Recovery","none",3896,95,2,0,17,5,2019
"Yg9yUpZyrCk",2019-12-09,"UCbmo6kTbFeZncngAN7z1PhQ","flexx fitness yoga nmstmthrfckr","Fitness und Kurse für nur 15,95 € pro Monat! Finde dein Studio und komm zu einem kostenlosen Probetraining vorbei ...","https://i.ytimg.com/vi/Yg9yUpZyrCk/default.jpg","120","90","https://i.ytimg.com/vi/Yg9yUpZyrCk/mqdefault.jpg","320","180","https://i.ytimg.com/vi/Yg9yUpZyrCk/hqdefault.jpg","480","360","FLEXX Fitness","none",436,1,2,0,0,12,2019
"CRf8Bn3Nt9g",2019-04-05,"UCTE5NKGQO-N1yT9lsTjIj9A","bodyboss 12 week fitness review <U+0001F4AA>ural transformation from heroin to fitness","Review of the BodyBoss 12 Week Fitness and Nutrition Guide. I purchased this program sometime in December and will be starting over the program shortly as I ...","https://i.ytimg.com/vi/CRf8Bn3Nt9g/default.jpg","120","90","https://i.ytimg.com/vi/CRf8Bn3Nt9g/mqdefault.jpg","320","180","https://i.ytimg.com/vi/CRf8Bn3Nt9g/hqdefault.jpg","480","360","TheBestLife","none",287,13,0,0,19,4,2019
"kMqHWGZ9Jlc",2019-05-29,"UCKBgXG1cvvQ0dsmjSBmwmAA","functional fitness trainer attraktiv videreutdanning for deg som personlig trener","Endelig! Nå har du mulighet til å bli en av de første sertifiserte Functional Fitness-trenerne i Norge. Utdanningen kombinerer teori med omfattende praktisk ...","https://i.ytimg.com/vi/kMqHWGZ9Jlc/default.jpg","120","90","https://i.ytimg.com/vi/kMqHWGZ9Jlc/mqdefault.jpg","320","180","https://i.ytimg.com/vi/kMqHWGZ9Jlc/hqdefault.jpg","480","360","Active Education","none",13083,1,0,0,0,5,2019
"cPNUAA3OLV8",2019-06-29,"UCpkmMlmTwDHvSETxED0U0gg","my daily diet and fitness routine diet meals lose weight lifestyle with sahiba","My Daily Diet And Fitness Routine | Diet Meals | Lose Weight | Lifestyle With Sahiba Today #Sahiba shares her daily routine of what she eats in breakfast, lunch, ...","https://i.ytimg.com/vi/cPNUAA3OLV8/default.jpg","120","90","https://i.ytimg.com/vi/cPNUAA3OLV8/mqdefault.jpg","320","180","https://i.ytimg.com/vi/cPNUAA3OLV8/hqdefault.jpg","480","360","Lifestyle with Sahiba","none",747099,13947,903,0,979,6,2019
"VvtdZa6w5eg",2019-12-05,"UCzUZWf2_RI7ifxY-Q7O68Kg","<U+0993><U+09AD><U+09BE><U+09B0> <U+0993><U+09DF><U+09C7><U+099F><U+09C7><U+09B0> <U+099C><U+09A8><U+09CD><U+09AF> <U+098F><U+09B0><U+0995><U+09AE> <U+0985><U+09AA><U+09CD><U+09B0><U+09C0><U+09A4><U+09BF><U+0995><U+09B0> <U+0985><U+09AC><U+09B8><U+09CD><U+09A5><U+09BE> <U+099A><U+09B2><U+09C7> <U+0986><U+09B8><U+09C1><U+09A8> bio xin fitness solution","<U+09B8><U+09CD><U+09B2><U+09BF><U+09AE><U+09BF><U+0982> <U+098F><U+09B0> <U+099C><U+09A8><U+09CD><U+09AF> <U+098F><U+09B2><U+09CB> <U+09AE><U+09C7><U+09B2><U+09CB> <U+099A><U+09C7><U+09B7><U+09CD><U+099F><U+09BE> <U+09A8><U+09BE> <U+0995><U+09B0><U+09C7> <U+099A><U+09B2><U+09C7> <U+0986><U+09B8><U+09C1><U+09A8> <U+09AC><U+09BE><U+09AF><U+09BC><U+09CB><U+099C><U+09BF><U+09A8><U+09C7><U+0964> <U+0985><U+09AD><U+09BF><U+099C><U+09CD><U+099E> <U+09A8><U+09BF><U+0989><U+099F><U+09CD><U+09B0><U+09BF><U+09B6>...","https://i.ytimg.com/vi/VvtdZa6w5eg/default.jpg","120","90","https://i.ytimg.com/vi/VvtdZa6w5eg/mqdefault.jpg","320","180","https://i.ytimg.com/vi/VvtdZa6w5eg/hqdefault.jpg","480","360","Bio-Xin Cosmeceuticals","none",700092,22,1,0,3,12,2019
"rghYtfFA8HY",2019-04-19,"UCoBxClqhnUq1JqIjqznnDfA","quot ormed fitness quot <U+043B><U+0443><U+0447><U+0448><U+0438><U+0435> <U+0442><U+0440><U+0435><U+043D><U+0430><U+0436><U+0435><U+0440><U+044B> <U+0434><U+043B><U+044F> <U+0441><U+0444><U+0435><U+0440><U+044B> <U+0444><U+0438><U+0442><U+043D><U+0435><U+0441><U+0430>","<U+041F><U+0440><U+0435><U+0434><U+0441><U+0442><U+0430><U+0432><U+043B><U+044F><U+0435><U+043C> <U+0412><U+0430><U+043C> <U+043C><U+0435><U+0434><U+0438><U+0446><U+0438><U+043D><U+0441><U+043A><U+043E><U+0435> <U+043E><U+0431><U+043E><U+0440><U+0443><U+0434><U+043E><U+0432><U+0430><U+043D><U+0438><U+0435> <U+0434><U+043B><U+044F> <U+0441><U+0444><U+0435><U+0440><U+044B> <U+0444><U+0438><U+0442><U+043D><U+0435><U+0441><U+0430>. <U+0417><U+0434><U+043E><U+0440><U+043E><U+0432><U+044C><U+0435> <U+0412><U+0430><U+0448><U+0435><U+0433><U+043E> <U+043F><U+043E><U+0437><U+0432><U+043E><U+043D><U+043E><U+0447><U+043D><U+0438><U+043A><U+0430> <U+0432> <U+0412><U+0430><U+0448><U+0438><U+0445> <U+0440><U+0443><U+043A><U+0430><U+0445>!","https://i.ytimg.com/vi/rghYtfFA8HY/default.jpg","120","90","https://i.ytimg.com/vi/rghYtfFA8HY/mqdefault.jpg","320","180","https://i.ytimg.com/vi/rghYtfFA8HY/hqdefault.jpg","480","360","<U+041E><U+041E><U+041E> <U+041D><U+0412><U+041F> <U+041E><U+0440><U+0431><U+0438><U+0442><U+0430> ORMED","none",54839,13,2,0,0,4,2019
"iRkvsabBnTI",2019-10-27,"UCcfwq8GB9wEL52PBQUN7NyA","zin 83 bailando merengue zumba fitness mzf crew laren sunga","","https://i.ytimg.com/vi/iRkvsabBnTI/default.jpg","120","90","https://i.ytimg.com/vi/iRkvsabBnTI/mqdefault.jpg","320","180","https://i.ytimg.com/vi/iRkvsabBnTI/hqdefault.jpg","480","360","Laren Sunga","none",85372,701,36,0,1,10,2019
"QAMJBvL9qXw",2019-11-28,"UC07dF6KmTDSvrXqYdBryXgA","tik tok fitness clips tik tok bodybuilding","Subscribe and share.","https://i.ytimg.com/vi/QAMJBvL9qXw/default.jpg","120","90","https://i.ytimg.com/vi/QAMJBvL9qXw/mqdefault.jpg","320","180","https://i.ytimg.com/vi/QAMJBvL9qXw/hqdefault.jpg","480","360","Fitness trends","none",1071,28,1,0,0,11,2019
"rM4JAuY7B-k",2019-11-29,"UChMcx8GqaV4uz5V_Mq_u0zg","it 39 s grind season <U+0001F608> fitness motivation 2019 laren sunga","FOLLOW MOTIVATHLETE INSTAGRAM: https://www.instagram.com/motivathleteofficial/ MAN BEHIND THE MOTIVATION: ...","https://i.ytimg.com/vi/rM4JAuY7B-k/default.jpg","120","90","https://i.ytimg.com/vi/rM4JAuY7B-k/mqdefault.jpg","320","180","https://i.ytimg.com/vi/rM4JAuY7B-k/hqdefault.jpg","480","360","Motivathlete","none",95847,2086,61,0,93,11,2019
