"video_id","publishedAt","channelId","title","description","thumbnails.default.url","thumbnails.default.width","thumbnails.default.height","thumbnails.medium.url","thumbnails.medium.width","thumbnails.medium.height","thumbnails.high.url","thumbnails.high.width","thumbnails.high.height","channelTitle","liveBroadcastContent","viewCount","likeCount","dislikeCount","favoriteCount","commentCount","month","year"
"e2c8u3L3Nco",2020-02-07,"UCykF1Xxix-FPXIayGkuN7Zg","miniature chicken spring rolls i mini real cooking with mdc","Don't forget to give us a like on the video and share, subscribe to our channel it means a lot for us. Thank you make us family. <U+2764><U+FE0F><U+2764><U+FE0F><U+2764><U+FE0F><U+2764><U+FE0F><U+2764><U+FE0F> MINIATURE ...","https://i.ytimg.com/vi/e2c8u3L3Nco/default.jpg","120","90","https://i.ytimg.com/vi/e2c8u3L3Nco/mqdefault.jpg","320","180","https://i.ytimg.com/vi/e2c8u3L3Nco/hqdefault.jpg","480","360","Miniature Dream Cooking","none",7595485,103321,5549,0,4130,2,2020
"Ads6BBq5Hbk",2020-03-09,"UCkqaQoGJ2rAHhWk7gzsb9Aw","30 unusual ways of cooking outdoors and in your kitchen","UNEXPECTED COOKING HACKS Wow! We've collected alternative ways of cooking for you in this video! Here you'll find delicious tricks and unusual ways of ...","https://i.ytimg.com/vi/Ads6BBq5Hbk/default.jpg","120","90","https://i.ytimg.com/vi/Ads6BBq5Hbk/mqdefault.jpg","320","180","https://i.ytimg.com/vi/Ads6BBq5Hbk/hqdefault.jpg","480","360","5-Minute Recipes","none",134431,1813,128,0,76,3,2020
"tGq7cDlgyuE",2019-08-13,"UChGJGhZ9SOOHvBB0Y4DOO_w","ryan made mommy small with pretend play cooking kitchen toys","Ryan Made Mommy Small pretend Play!!! Fun Kids video where Ryan and Mommy play with toys!!! Ryan play with cooking kitchen for Mommy!!!","https://i.ytimg.com/vi/tGq7cDlgyuE/default.jpg","120","90","https://i.ytimg.com/vi/tGq7cDlgyuE/mqdefault.jpg","320","180","https://i.ytimg.com/vi/tGq7cDlgyuE/hqdefault.jpg","480","360","Ryan's World","none",16245862,23766,7792,0,NA,8,2019
"RavPwfpdB7Q",2019-11-10,"UC2WuPTt0k8yDJpfenggOAVQ","make the most of your food with these 10 amazing cooking hacks i life hacks by blossom","Check out our 10 amazing cooking hacks to help you make the most out of your food. Want to see more food hacks videos? Let us know in the comments below!","https://i.ytimg.com/vi/RavPwfpdB7Q/default.jpg","120","90","https://i.ytimg.com/vi/RavPwfpdB7Q/mqdefault.jpg","320","180","https://i.ytimg.com/vi/RavPwfpdB7Q/hqdefault.jpg","480","360","Blossom","none",6617998,51222,2844,0,763,11,2019
"79vZrthC_og",2018-06-11,"UCbtgvc9joz_6xBr4OLoy0iA","s2 ep4 miniature cooking beef stir fry fried rice functional mini kitchen set","Hi everyone! Today's episode is just an experiment recipe, surprisingly is very tasty :) I am not able to upload this Wednesday, me and my team will go in Taiwan.","https://i.ytimg.com/vi/79vZrthC_og/default.jpg","120","90","https://i.ytimg.com/vi/79vZrthC_og/mqdefault.jpg","320","180","https://i.ytimg.com/vi/79vZrthC_og/hqdefault.jpg","480","360","Miniature Cusina","none",47349389,440166,28100,0,28156,6,2018
"BCf5gsl3C08",2019-12-18,"UCbpMy0Fg74eXXkvxJrtEn3w","every way to cook bacon 50 methods bon appétit","Yes, bacon is good. There's no arguing with that. But if you think that the only way to cook bacon is to just throw it in a frying pan and get sizzlin', well then does ...","https://i.ytimg.com/vi/BCf5gsl3C08/default.jpg","120","90","https://i.ytimg.com/vi/BCf5gsl3C08/mqdefault.jpg","320","180","https://i.ytimg.com/vi/BCf5gsl3C08/hqdefault.jpg","480","360","Bon Appétit","none",2974870,53366,2757,0,5445,12,2019
"iQgAN8540f8",2019-06-07,"UCiOkLGlj4azqep3O_J0wLkw","cooking maliatsis 134 fish amp chips ft e<U+03B9>sß<U+03BF><U+03BB><U+03AD>a<U+03C2>","<U+039F> <U+0395><U+03B9>sß<U+03BF><U+03BB><U+03AD>a<U+03C2> µpa<U+03AF><U+03BD>e<U+03B9> st<U+03B7><U+03BD> <U+03BA><U+03BF><U+03C5><U+03B6><U+03AF><U+03BD>a <U+03BA>a<U+03B9> <U+03CC><U+03BB><U+03BF><U+03B9> µa<U+03B6><U+03AF> µa<U+03B3>e<U+03B9><U+03C1>e<U+03CD><U+03BF><U+03C5><U+03BD> <U+03AD><U+03BD>a <U+03B3><U+03BB><U+03C5><U+03BA><U+03CC> <U+03C8>a<U+03C1><U+03AC><U+03BA><U+03B9>. Official Merch µ<U+03CC><U+03BD><U+03BF> st<U+03BF> https://www.comedylab.st...","https://i.ytimg.com/vi/iQgAN8540f8/default.jpg","120","90","https://i.ytimg.com/vi/iQgAN8540f8/mqdefault.jpg","320","180","https://i.ytimg.com/vi/iQgAN8540f8/hqdefault.jpg","480","360","ComedyLab GR","none",226407,6587,204,0,610,6,2019
"vNLV4DhvLRU",2020-03-13,"UCMmLIP_QfsDu_bavpX9ulcg","stop motion cooking making spring roll from medical equipment asmr 4k","Stop Motion Cooking - Making Spring Roll From Medical Equipment ASMR 4K Today's menu is Spring Roll From Medical Devices, don't forget to wear ...","https://i.ytimg.com/vi/vNLV4DhvLRU/default.jpg","120","90","https://i.ytimg.com/vi/vNLV4DhvLRU/mqdefault.jpg","320","180","https://i.ytimg.com/vi/vNLV4DhvLRU/hqdefault.jpg","480","360","Stop Motion Cooking","none",756229,7882,928,0,389,3,2020
"gseFlWwzIa8",2020-03-18,"UCzgxx_DM2Dcb9Y1spb9mUJA","jeongyeon tv quot cooking video of doggy snack 2 quot","JEONGYEON TV ""Cooking video of Doggy snack! 2"" Spotify http://open.spotify.com/album/4EG4E0Uk0HpJBgOMgXI26z iTunes/Apple Music ...","https://i.ytimg.com/vi/gseFlWwzIa8/default.jpg","120","90","https://i.ytimg.com/vi/gseFlWwzIa8/mqdefault.jpg","320","180","https://i.ytimg.com/vi/gseFlWwzIa8/hqdefault.jpg","480","360","TWICE","none",137926,19278,79,0,1289,3,2020
"6pL_5zCHiT0",2020-01-22,"UC2WuPTt0k8yDJpfenggOAVQ","15 efficient ways to meal prep or cook for a crowd cooking and food hacks by blossom","Cooking for a crowd this weekend? Check out these 15 efficient ways to meal prep and cook in bulk. For more cooking and food hacks, subscribe to Blossom!","https://i.ytimg.com/vi/6pL_5zCHiT0/default.jpg","120","90","https://i.ytimg.com/vi/6pL_5zCHiT0/mqdefault.jpg","320","180","https://i.ytimg.com/vi/6pL_5zCHiT0/hqdefault.jpg","480","360","Blossom","none",4147245,28156,1436,0,480,1,2020
"SSKUcx5dnsw",2020-01-06,"UC49jksLkSkmetiZv2p7uYNg","tasty crispy fish cooking whole fish crispy recipe","Hello everyone, today I show you ""Crispy Fish Cooking Recipe"". +++ Ingredient: Fish, Duck eggs, Crispy flour and Soybean oil. +++ Sauce Recipe: Mango, ...","https://i.ytimg.com/vi/SSKUcx5dnsw/default.jpg","120","90","https://i.ytimg.com/vi/SSKUcx5dnsw/mqdefault.jpg","320","180","https://i.ytimg.com/vi/SSKUcx5dnsw/hqdefault.jpg","480","360","Kdeb Cooking","none",809907,8068,764,0,NA,1,2020
"mE1Uaqb5wgY",2020-01-24,"UCekQr9znsk2vWxBo3YiLq2w","bacon jalapeño poppers you suck at cooking episode 103","Jalapeño Poppers are called Jalapeño Poppers for some reason. Nobody knows why. I think some bar decided to use the word poppers to make them sound ...","https://i.ytimg.com/vi/mE1Uaqb5wgY/default.jpg","120","90","https://i.ytimg.com/vi/mE1Uaqb5wgY/mqdefault.jpg","320","180","https://i.ytimg.com/vi/mE1Uaqb5wgY/hqdefault.jpg","480","360","You Suck At Cooking","none",801233,38560,375,0,1892,1,2020
"WGFLPbpdMS8",2020-03-19,"UCdN4aXTrHAtfgbVG9HjBmxQ","tim cook loses his s t at his first apple keynote key amp peele","Apple CEO Tim Cook shows everyone some classified, next-level s**t at the iPhone 5 launch. About Key & Peele: Key & Peele showcases the fearless wit of ...","https://i.ytimg.com/vi/WGFLPbpdMS8/default.jpg","120","90","https://i.ytimg.com/vi/WGFLPbpdMS8/mqdefault.jpg","320","180","https://i.ytimg.com/vi/WGFLPbpdMS8/hqdefault.jpg","480","360","Key & Peele","none",404578,14843,337,0,707,3,2020
"2eINllOc0hc",2020-02-07,"UCsP7Bpw36J666Fct5M8u-ZA","debunking fake cooking videos 2020 how to cook that ann reardon","You asked for it... more debunking videos exposing fake recipes from 5-minute crafts, so yummy and more. SUBSCRIBE on youtube: http://bit.ly/H2CThat ...","https://i.ytimg.com/vi/2eINllOc0hc/default.jpg","120","90","https://i.ytimg.com/vi/2eINllOc0hc/mqdefault.jpg","320","180","https://i.ytimg.com/vi/2eINllOc0hc/hqdefault.jpg","480","360","How To Cook That","none",3417957,165154,3003,0,9629,2,2020
"KV-iRBrGQAc",2019-12-13,"UCiOkLGlj4azqep3O_J0wLkw","cooking maliatsis 139 a<U+03C5>t<U+03CC> p<U+03BF><U+03C5> de<U+03BD> ß<U+03C1><U+03AF><U+03B6><U+03BF><U+03C5>µe","<U+0391><U+03BA><U+03CC>µa <U+03AD><U+03BD>a epe<U+03B9>s<U+03CC>d<U+03B9><U+03BF> <U+03CC>p<U+03BF><U+03C5> p<U+03C1><U+03BF>spa<U+03B8><U+03BF><U+03CD>µe <U+03BD>a <U+03BA><U+03AC><U+03BD><U+03BF><U+03C5>µe a<U+03C5>t<U+03CC> p<U+03BF><U+03C5> µa<U+03C2> <U+03AD><U+03C7>ete <U+03B6><U+03B7>t<U+03AE>se<U+03B9>. <U+039D>a µa<U+03B3>e<U+03B9><U+03C1><U+03AD><U+03C8><U+03BF><U+03C5>µe <U+03C7><U+03C9><U+03C1><U+03AF><U+03C2> <U+03BD>a ß<U+03C1><U+03AF>s<U+03BF><U+03C5>...","https://i.ytimg.com/vi/KV-iRBrGQAc/default.jpg","120","90","https://i.ytimg.com/vi/KV-iRBrGQAc/mqdefault.jpg","320","180","https://i.ytimg.com/vi/KV-iRBrGQAc/hqdefault.jpg","480","360","ComedyLab GR","none",170293,6956,121,0,423,12,2019
"Uw78ZObZYC0",2019-07-20,"UCV3sPnh7wwVyZ1qnoudgVZA","cooking duck and eating delicious by kmeng prey","Cooking duck and eating delicious By ( Kmeng Prey ) This videos is performance please do not according. ------------------------------- Welcome to Kmeng Prey With ...","https://i.ytimg.com/vi/Uw78ZObZYC0/default.jpg","120","90","https://i.ytimg.com/vi/Uw78ZObZYC0/mqdefault.jpg","320","180","https://i.ytimg.com/vi/Uw78ZObZYC0/hqdefault.jpg","480","360","Kmeng Prey","none",49154571,158654,53382,0,3855,7,2019
"P63L1_gINd0",2019-05-24,"UC295-Dw_tDNtZXFeAPAW6Aw","100 best cooking hacks live","Check out the best cooking hacks that you should immediately try! https://www.epidemicsound.com/ ...","https://i.ytimg.com/vi/P63L1_gINd0/default.jpg","120","90","https://i.ytimg.com/vi/P63L1_gINd0/mqdefault.jpg","320","180","https://i.ytimg.com/vi/P63L1_gINd0/hqdefault.jpg","480","360","5-Minute Crafts","none",5541336,30304,5445,0,1164,5,2019
"AbxbOd_mtn8",2019-10-21,"UCbpMy0Fg74eXXkvxJrtEn3w","every way to cook salmon 43 methods bon appétit","You know, salmon ice cream isn't as bad as it sounds, though maybe don't give it to your children unless they know what they're signing up for. Join Amiel ...","https://i.ytimg.com/vi/AbxbOd_mtn8/default.jpg","120","90","https://i.ytimg.com/vi/AbxbOd_mtn8/mqdefault.jpg","320","180","https://i.ytimg.com/vi/AbxbOd_mtn8/hqdefault.jpg","480","360","Bon Appétit","none",2752363,55036,2227,0,5778,10,2019
"J0pS2lhH0Vc",2020-02-25,"UCNqpN335uVY9Sx_ZK_WuOAA","the best lobster catch and cook eating raw lobster and lobster ramen","Went out for my first night dive with Max (IG@Kre8la) and his crew for Spiny Lobster in LA. The meal that followed was the best we've had yet! CampChef Table ...","https://i.ytimg.com/vi/J0pS2lhH0Vc/default.jpg","120","90","https://i.ytimg.com/vi/J0pS2lhH0Vc/mqdefault.jpg","320","180","https://i.ytimg.com/vi/J0pS2lhH0Vc/hqdefault.jpg","480","360","Outdoor Chef Life","none",455302,12890,260,0,1097,2,2020
"qf99IlFZY2o",2019-01-21,"UC_ZlSKo7iJpkD0lsx77OjlA","khamandhokla <U+0906><U+0938><U+093E><U+0928><U+0940> <U+0938><U+0947> <U+092C><U+0928><U+093E><U+092F><U+0947> <U+0939><U+0932><U+0935><U+093E><U+0908> <U+091C><U+0948><U+0938><U+093E> <U+0916><U+092E><U+0923> <U+0922><U+094B><U+0915><U+0932><U+093E> gayatri quot s cooking club","Ingrediants: 1 1/2 cup water 1tsp salt 1/4 tsp haldi 2 tsp sugar 1 tsp citric acid(Nimbu phool) 2 tblsp Rawa 1 1/2 cup Besan 2 tblsp oil 1 &1/2 tsp Eno (Regular) ...","https://i.ytimg.com/vi/qf99IlFZY2o/default.jpg","120","90","https://i.ytimg.com/vi/qf99IlFZY2o/mqdefault.jpg","320","180","https://i.ytimg.com/vi/qf99IlFZY2o/hqdefault.jpg","480","360","Gayatri's Cooking Club","none",5181740,41769,5432,0,1348,1,2019
"yVDmHcMKDbk",2019-09-27,"UChGJGhZ9SOOHvBB0Y4DOO_w","ryan pretend play cooking with kitchen playset and cash register","Ryan Pretend Play Cooking with Kitchen Playset and Cash Register!! Ryan cook food for daddy and friends!!!","https://i.ytimg.com/vi/yVDmHcMKDbk/default.jpg","120","90","https://i.ytimg.com/vi/yVDmHcMKDbk/mqdefault.jpg","320","180","https://i.ytimg.com/vi/yVDmHcMKDbk/hqdefault.jpg","480","360","Ryan's World","none",28112431,66145,23643,0,NA,9,2019
"Cf_YfZPc5Qo",2020-02-02,"UCMmLIP_QfsDu_bavpX9ulcg","stop motion cooking prawn coconut curry from scary thing asmr 4k","Stop Motion Cooking - Prawn Coconut Curry From Scary Thing ASMR 4K Coming back to the topic of Cooking Horror Food, in this video we will bring you a new ...","https://i.ytimg.com/vi/Cf_YfZPc5Qo/default.jpg","120","90","https://i.ytimg.com/vi/Cf_YfZPc5Qo/mqdefault.jpg","320","180","https://i.ytimg.com/vi/Cf_YfZPc5Qo/hqdefault.jpg","480","360","Stop Motion Cooking","none",1938721,12216,2190,0,320,2,2020
"T8kZ5r6PnBw",2020-03-11,"UCI78AdiI6f7VKhqW1i4B3Rw","asmr kobe wagyu amp garlic asparagus mukbang no talking cooking amp eating sounds zach choi asmr","ASMR KOBE WAGYU & GARLIC ASPARAGUS MUKBANG <U+BA39><U+BC29> (COOKING & EATING SOUNDS) Check out my Instagram: http://www.instagram.com/zachchoi ...","https://i.ytimg.com/vi/T8kZ5r6PnBw/default.jpg","120","90","https://i.ytimg.com/vi/T8kZ5r6PnBw/mqdefault.jpg","320","180","https://i.ytimg.com/vi/T8kZ5r6PnBw/hqdefault.jpg","480","360","Zach Choi ASMR","none",1287615,42454,1914,0,2304,3,2020
"uc1kcQXlRcc",2019-12-28,"UC4gDBTG2BMuiwJp_Fe2i_2w","cooking potato with chicken in my homeland polin lifestyle","Hi every one today i am show you the Cooking potato with chicken in my homeland. please subscribe my channel for more view thank you all friend always ...","https://i.ytimg.com/vi/uc1kcQXlRcc/default.jpg","120","90","https://i.ytimg.com/vi/uc1kcQXlRcc/mqdefault.jpg","320","180","https://i.ytimg.com/vi/uc1kcQXlRcc/hqdefault.jpg","480","360","Polin Lifestyle","none",1041339,10719,679,0,950,12,2019
"t_pleaws7zY",2020-01-18,"UC9-3c4LzdzT_HvW3Xuti9wg","youtuber cook off ft behzinga","Subscribe & click that notification bell so you don't miss anything! Subscribe to Ethan - http://www.youtube.com/Behzinga : Follow me on my socials so you ...","https://i.ytimg.com/vi/t_pleaws7zY/default.jpg","120","90","https://i.ytimg.com/vi/t_pleaws7zY/mqdefault.jpg","320","180","https://i.ytimg.com/vi/t_pleaws7zY/hqdefault.jpg","480","360","Calfreezy","none",2054237,70790,679,0,3409,1,2020
"oApy7QwkN_0",2019-11-03,"UCQmioHcXvcJel87_VabXgKQ","survival skills cooking big chicken and eating delicious ep53","Hi every one welcome to visit my channel is talk about : Survival Skills - Cooking big chicken and eating delicious Ep53 This videos is performance please do ...","https://i.ytimg.com/vi/oApy7QwkN_0/default.jpg","120","90","https://i.ytimg.com/vi/oApy7QwkN_0/mqdefault.jpg","320","180","https://i.ytimg.com/vi/oApy7QwkN_0/hqdefault.jpg","480","360","Survival Skills2","none",3361161,28643,6128,0,1087,11,2019
"EZ4Q62tU084",2020-02-10,"UCEj3EHFwSOfadwufHnZlNNQ","lego bibimbap and makgeolli lego in real life stop motion cooking","Lego #Bibimbap #Stopmotion - 2890 still pictures has been used for this. Hello! This is Clicker that produces stop motion videos.   Bibimbap and makgeolli!","https://i.ytimg.com/vi/EZ4Q62tU084/default.jpg","120","90","https://i.ytimg.com/vi/EZ4Q62tU084/mqdefault.jpg","320","180","https://i.ytimg.com/vi/EZ4Q62tU084/hqdefault.jpg","480","360","Clicker","none",7329950,110713,5493,0,7145,2,2020
"gjV-K4g3fm4",2018-04-13,"UCRB4xZ_2ew7fzmrcv8aj4Lw","e54 how to cook spicy clam rice noodles at office with a brick ms yeah","I just received a full package of clams from Lu. And I crave for rice noodles recently, so clam and rice noodles, great combination! If you like this video ,you can ...","https://i.ytimg.com/vi/gjV-K4g3fm4/default.jpg","120","90","https://i.ytimg.com/vi/gjV-K4g3fm4/mqdefault.jpg","320","180","https://i.ytimg.com/vi/gjV-K4g3fm4/hqdefault.jpg","480","360","<U+529E><U+516C><U+5BA4><U+5C0F><U+91CE><U+5B98><U+65B9><U+9891><U+9053> Ms Yeah Official Channel","none",30610437,214069,18159,0,6686,4,2018
"Vuy2nrJz0Zw",2014-01-13,"UCTvPPWA9w4n4NNzBSttt0Mw","how to cook perfect fluffy scrambled eggs","This is my no-fail technique for cooking perfect scrambled eggs. Please SUBSCRIBE to my page, LIKE, and SHARE it with your friends, family, etc. Also please ...","https://i.ytimg.com/vi/Vuy2nrJz0Zw/default.jpg","120","90","https://i.ytimg.com/vi/Vuy2nrJz0Zw/mqdefault.jpg","320","180","https://i.ytimg.com/vi/Vuy2nrJz0Zw/hqdefault.jpg","480","360","AmyLearnsToCook","none",15577200,123420,15221,0,11664,1,2014
"zjoYb0m65Xs",2019-09-16,"UCTVxDzRVd3y1jQWWqa6KtBw","amazing cooking goat recipe in forest to survival","New Video Every everyday GET READY...things are about to get Wilderness Life Channel Amazing Cooking Goat Recipe in Forest to Survival New More Videos ...","https://i.ytimg.com/vi/zjoYb0m65Xs/default.jpg","120","90","https://i.ytimg.com/vi/zjoYb0m65Xs/mqdefault.jpg","320","180","https://i.ytimg.com/vi/zjoYb0m65Xs/hqdefault.jpg","480","360","Wilderness Life","none",4694856,43853,9608,0,2935,9,2019
"wDooaT6qKKo",2018-09-14,"UCHp19YI5Alff6jfadPx4l6Q","yummy horseshoe crab salad cooking horseshoe crab cooking cooking with sros","Wow wow. Welcome back with yummy horseshoe crab salad cooking that I cook horseshoe crab by boiling then grill and make as salad with vegetable. I swear ...","https://i.ytimg.com/vi/wDooaT6qKKo/default.jpg","120","90","https://i.ytimg.com/vi/wDooaT6qKKo/mqdefault.jpg","320","180","https://i.ytimg.com/vi/wDooaT6qKKo/hqdefault.jpg","480","360","Cooking With Sros","none",5697453,42922,9508,0,11764,9,2018
"KWDnPjIAxmc",2020-03-16,"UCsYlwsIqo1czaj2gsnRAS-w","cooking vadapav with my indian mother ii famous maharastrian street food","Last time we were in India, we cooked a traditional Maharashtrian chicken curry with our Indian mother. Now that Kishan's parents are home, we thought it would ...","https://i.ytimg.com/vi/KWDnPjIAxmc/default.jpg","120","90","https://i.ytimg.com/vi/KWDnPjIAxmc/mqdefault.jpg","320","180","https://i.ytimg.com/vi/KWDnPjIAxmc/hqdefault.jpg","480","360","Kishanell","none",466220,14719,346,0,799,3,2020
"e5kb2NcUXE4",2019-03-26,"UCwHE1kM1CPJd_pI9FQ0-4dg","<U+0627><U+0644><U+0633><U+0627> <U+0636><U+062F> <U+0627><U+0646><U+0627> <U+062A><U+062D><U+062F><U+064A> <U+0627><U+0644><U+0637><U+0628><U+062E> elsa vs anna food cooking competition","<U+0644><U+0644><U+0627><U+0633><U+062A><U+0641><U+0633><U+0627><U+0631><U+0627><U+062A> <U+0627><U+0644><U+062A><U+062C><U+0627><U+0631><U+064A><U+0629>: shfaworld@gmail.com.","https://i.ytimg.com/vi/e5kb2NcUXE4/default.jpg","120","90","https://i.ytimg.com/vi/e5kb2NcUXE4/mqdefault.jpg","320","180","https://i.ytimg.com/vi/e5kb2NcUXE4/hqdefault.jpg","480","360","shfa","none",57484091,257157,90474,0,NA,3,2019
"Id_x9LusLyA",2020-03-11,"UC-hlztR5l2sZbRRstO8Zazg","wax gourd harvesting from farm for soup sros yummy cooking vlogs","Hi. Here is wax gourd farm that I went out and harvest some for soup. Wax gourd was being grown in many way based on family and location culture. By the ...","https://i.ytimg.com/vi/Id_x9LusLyA/default.jpg","120","90","https://i.ytimg.com/vi/Id_x9LusLyA/mqdefault.jpg","320","180","https://i.ytimg.com/vi/Id_x9LusLyA/hqdefault.jpg","480","360","Sros Yummy Cooking Vlogs","none",115704,1348,88,0,70,3,2020
"I0t8ZAhb8lQ",2014-07-22,"UCn0NTkWyvU1eLfLAN8yMpGA","faster no knead bread so easy anyone can make but no boiling water","NO BOILING WATER !! - 130° F MAX !! 3 cups bread flour or all purpose flour 1/4 teaspoon yeast 1 teaspoon salt 1 1/2 cups hot water (NOT OVER 130° F) about ...","https://i.ytimg.com/vi/I0t8ZAhb8lQ/default.jpg","120","90","https://i.ytimg.com/vi/I0t8ZAhb8lQ/mqdefault.jpg","320","180","https://i.ytimg.com/vi/I0t8ZAhb8lQ/hqdefault.jpg","480","360","Jenny Can Cook","none",9279958,172808,5076,0,12256,7,2014
"b5J7JYyMk_0",2020-03-07,"UCk8GzjMOrta8yxDcKfylJYw","diana pretend play cooking with kitchen toys","Diana pretend to play a Cook. Roma is hungry. Diana cook food for brother with her new kitchen toys. Subscribe to Kids Diana Show - http://bit.ly/2k7NrSx ...","https://i.ytimg.com/vi/b5J7JYyMk_0/default.jpg","120","90","https://i.ytimg.com/vi/b5J7JYyMk_0/mqdefault.jpg","320","180","https://i.ytimg.com/vi/b5J7JYyMk_0/hqdefault.jpg","480","360","<U+273F> Kids Diana Show","none",3473286,20942,7871,0,NA,3,2020
"bXf5_6zsHnA",2020-03-15,"UCzqbfYjQmf9nLQPMxVgPhiA","cooking ram don at your desk amp dinner in your car itaki electric lunchbox","A perfect and healthy way to avoid eating out/takeout! Itaki Co offers handy nifty cooking lunchboxes/devices perfect for quick & fresh, mess-free meals at your ...","https://i.ytimg.com/vi/bXf5_6zsHnA/default.jpg","120","90","https://i.ytimg.com/vi/bXf5_6zsHnA/mqdefault.jpg","320","180","https://i.ytimg.com/vi/bXf5_6zsHnA/hqdefault.jpg","480","360","emmymadeinjapan","none",117003,6572,135,0,605,3,2020
"BaxvApyXwBA",2020-03-07,"UCI78AdiI6f7VKhqW1i4B3Rw","asmr filet mignon amp extra cheesy pizza mukbang no talking cooking amp eating sounds zach choi asmr","ASMR FILET MIGNON & EXTRA CHEESY PIZZA MUKBANG <U+BA39><U+BC29> (COOKING & EATING SOUNDS) BUY MY MERCH!: https://fanjoy.co/collections/zach-choi ...","https://i.ytimg.com/vi/BaxvApyXwBA/default.jpg","120","90","https://i.ytimg.com/vi/BaxvApyXwBA/mqdefault.jpg","320","180","https://i.ytimg.com/vi/BaxvApyXwBA/hqdefault.jpg","480","360","Zach Choi ASMR","none",1306408,47822,1619,0,2506,3,2020
"UXpouL9Q1iY",2009-02-24,"UCRKls2LLMqU-uK2csT6FOKw","great depression cooking poorman 39 s feast","Clara's Official Website: www.welcometoclaraskitchen.com IMPORTANT: There have been a few requests concerning this video. The first is to notify people that ...","https://i.ytimg.com/vi/UXpouL9Q1iY/default.jpg","120","90","https://i.ytimg.com/vi/UXpouL9Q1iY/mqdefault.jpg","320","180","https://i.ytimg.com/vi/UXpouL9Q1iY/hqdefault.jpg","480","360","Great Depression Cooking","none",3340050,130102,1320,0,570,2,2009
"I27oRkaP_V4",2019-01-31,"UCvlE5gTbOvjiolFlEm-c_Ow","vlad and nikita cooking breakfast for mama","Vlad and Nikita love to pretend play in a cafe and restaurant with his mother. Kids pretend to make breakfast for mom. Now the children know that the omelette is ...","https://i.ytimg.com/vi/I27oRkaP_V4/default.jpg","120","90","https://i.ytimg.com/vi/I27oRkaP_V4/mqdefault.jpg","320","180","https://i.ytimg.com/vi/I27oRkaP_V4/hqdefault.jpg","480","360","Vlad and Nikita","none",150261891,380888,155046,0,NA,1,2019
"DEJrEV7yr4o",2020-02-28,"UC1rIOwTqDuWkFj87HZYRFOg","making southern soul food with chef millie peartree nyt cooking","Get the Caramelized Banana Pudding recipe: https://nyti.ms/2wOxVWq Make Millie's Southern Macaroni and Cheese: https://nyti.ms/2TlS3qA The Bronx-born ...","https://i.ytimg.com/vi/DEJrEV7yr4o/default.jpg","120","90","https://i.ytimg.com/vi/DEJrEV7yr4o/mqdefault.jpg","320","180","https://i.ytimg.com/vi/DEJrEV7yr4o/hqdefault.jpg","480","360","NYT Cooking","none",92886,5385,34,0,339,2,2020
"zrR0ZIR4wPM",2020-01-05,"UCMmLIP_QfsDu_bavpX9ulcg","stop motion cooking cook ramen from painting tools asmr 4k","Stop Motion Cooking - Cook Ramen From Painting Tools ASMR 4K Ramen is an easy, quick-cooking meal perfect for those on the go or college students who ...","https://i.ytimg.com/vi/zrR0ZIR4wPM/default.jpg","120","90","https://i.ytimg.com/vi/zrR0ZIR4wPM/mqdefault.jpg","320","180","https://i.ytimg.com/vi/zrR0ZIR4wPM/hqdefault.jpg","480","360","Stop Motion Cooking","none",4007305,36584,3726,0,1025,1,2020
"MpTodVRR73E",2009-12-22,"UCIEv3lZ_tNXHzL3ox-_uUGQ","cooking in disguise gordon ramsay","Gordon Ramsay road tests Aldo Zilli's cookery course under cover and fools him. From the Cookalong Live show. Subscribe Here: ...","https://i.ytimg.com/vi/MpTodVRR73E/default.jpg","120","90","https://i.ytimg.com/vi/MpTodVRR73E/mqdefault.jpg","320","180","https://i.ytimg.com/vi/MpTodVRR73E/hqdefault.jpg","480","360","Gordon Ramsay","none",29386297,266458,5233,0,7167,12,2009
"-C8LEPmSTnQ",2018-09-21,"UCqeAtpCuDTzp5Zdr-etWfXg","primitive technology cooking big cat fish by woman at river grilled fish eating delicious 32","Hi Guy! today i show you about: Primitive Technology - Cooking Big Cat fish by woman At river - grilled fish Eating delicious 32 Please share and subscribe my ...","https://i.ytimg.com/vi/-C8LEPmSTnQ/default.jpg","120","90","https://i.ytimg.com/vi/-C8LEPmSTnQ/mqdefault.jpg","320","180","https://i.ytimg.com/vi/-C8LEPmSTnQ/hqdefault.jpg","480","360","Natural LifeStyle","none",226975576,462997,226181,0,22616,9,2018
"qcr1rMVCj-I",2019-08-29,"UCk3JZr7eS3pg5AGEvBdEvFg","turkey fry indian style turkey recipe cooking in village traditional vaan kozhi varuval recipe","Today we cooking turkey fry recipe with using four turkeys. Normally western country foods have turkey with roasted turkeys and thanksgiving turkey. But Indian ...","https://i.ytimg.com/vi/qcr1rMVCj-I/default.jpg","120","90","https://i.ytimg.com/vi/qcr1rMVCj-I/mqdefault.jpg","320","180","https://i.ytimg.com/vi/qcr1rMVCj-I/hqdefault.jpg","480","360","Village Cooking Channel","none",5348509,93811,5020,0,3423,8,2019
"yXT4DRC6hKQ",2020-03-20,"UC5hDkgjlza-OEtcs22yjJ5Q","mahi and tuna catch and cook in islamorada","I had Jeremy and his family and friends out for a fishing trip aboard the ""Broad Minded"". We started out catching some blackfin tuna and then headed further ...","https://i.ytimg.com/vi/yXT4DRC6hKQ/default.jpg","120","90","https://i.ytimg.com/vi/yXT4DRC6hKQ/mqdefault.jpg","320","180","https://i.ytimg.com/vi/yXT4DRC6hKQ/hqdefault.jpg","480","360","StanzFam","none",17560,918,14,0,113,3,2020
"Lhn32f7ymcA",2019-06-15,"UCk3JZr7eS3pg5AGEvBdEvFg","chicken chukka healthy country chicken fry traditional village cooking village food recipes","Today we cook a chicken recipe with 20 KG country chicken. In this village cooking video, we show our farming and our cooking in our village. We made one of ...","https://i.ytimg.com/vi/Lhn32f7ymcA/default.jpg","120","90","https://i.ytimg.com/vi/Lhn32f7ymcA/mqdefault.jpg","320","180","https://i.ytimg.com/vi/Lhn32f7ymcA/hqdefault.jpg","480","360","Village Cooking Channel","none",7999906,106930,6379,0,3495,6,2019
