"video_id","publishedAt","channelId","title","description","thumbnails.default.url","thumbnails.default.width","thumbnails.default.height","thumbnails.medium.url","thumbnails.medium.width","thumbnails.medium.height","thumbnails.high.url","thumbnails.high.width","thumbnails.high.height","channelTitle","liveBroadcastContent","viewCount","likeCount","dislikeCount","favoriteCount","commentCount","month","year"
"pUC_UJbBBLk",2019-10-01,"UCGGifQ6ioVqKUBmHjgavFSw","stir fry 101 cook like a man something 39 s cooking tv","J'Something will show you how to make a simple tasty Stir Fry for all the Gents. Get this recipe: www.jsomething.com FOLLOW US: Instagram: ...","https://i.ytimg.com/vi/pUC_UJbBBLk/default.jpg","120","90","https://i.ytimg.com/vi/pUC_UJbBBLk/mqdefault.jpg","320","180","https://i.ytimg.com/vi/pUC_UJbBBLk/hqdefault.jpg","480","360","Something's Cooking TV","none",2985,21,1,0,3,10,2019
"VyaxDWLe6A4",2018-09-27,"UCbpMy0Fg74eXXkvxJrtEn3w","every way to cook a chicken breast 32 methods bon appétit","Join Basically editor Amiel Stanek as he attempts to cook chicken breast in almost every way possible. Which method is the best? Deep-fried? Coal-cooked?","https://i.ytimg.com/vi/VyaxDWLe6A4/default.jpg","120","90","https://i.ytimg.com/vi/VyaxDWLe6A4/mqdefault.jpg","320","180","https://i.ytimg.com/vi/VyaxDWLe6A4/hqdefault.jpg","480","360","Bon Appétit","none",10772503,165815,12277,0,18958,9,2018
"faRhWsg65BE",2014-10-28,"UCeYYaEzfsdDRy-QPhkjwdog","vizio brasil baby cooking by wanessa camargo","Mais uma novidade da Vizio Brasil. O Baby Cooking chegou para facilitar a vida das mamães. Encontre em: Bebê Store - http://goo.gl/etIiZS Ponto Frio ...","https://i.ytimg.com/vi/faRhWsg65BE/default.jpg","120","90","https://i.ytimg.com/vi/faRhWsg65BE/mqdefault.jpg","320","180","https://i.ytimg.com/vi/faRhWsg65BE/hqdefault.jpg","480","360","Vizio Brasil","none",78110,170,12,0,4,10,2014
"eCiX83zGxHo",2008-01-17,"UCE7Gh6KTo0fklz8FdNKGi-g","how to cook the perfect steak with david knight healthy cooking","Induction Fry Pan and Skillet Sale - SAVE 25% July 4-6, 2014 www.healthcraftcookware.com.","https://i.ytimg.com/vi/eCiX83zGxHo/default.jpg","120","90","https://i.ytimg.com/vi/eCiX83zGxHo/mqdefault.jpg","320","180","https://i.ytimg.com/vi/eCiX83zGxHo/hqdefault.jpg","480","360","Health Craft Cookware","none",14220,32,5,0,3,1,2008
"6HbcWiLCMY8",2011-07-04,"UCmK2TQWFVKiaaAXUspW5FoA","beach cooking","Idea for easy beach cooking. We promised the kids a day out on the beach so a threw a skillet some of my own eggs and local bacon in my bag. It beats ...","https://i.ytimg.com/vi/6HbcWiLCMY8/default.jpg","120","90","https://i.ytimg.com/vi/6HbcWiLCMY8/mqdefault.jpg","320","180","https://i.ytimg.com/vi/6HbcWiLCMY8/hqdefault.jpg","480","360","HalfQ","none",292315,396,199,0,165,7,2011
"79lpSvgChLg",2019-12-07,"UC9fpcAHmoEmVzNyv8Ph30XQ","using only candy to cook challenge 1 vs 100 challenge","TRY OUT THE SLIMEATORY APP! here is the link to the app: https://itunes.apple.com/us/app/slimeatory/id1446656651?mt=8 GET YOUR MERCH: ...","https://i.ytimg.com/vi/79lpSvgChLg/default.jpg","120","90","https://i.ytimg.com/vi/79lpSvgChLg/mqdefault.jpg","320","180","https://i.ytimg.com/vi/79lpSvgChLg/hqdefault.jpg","480","360","MoreAmeerah","none",1598323,33706,1411,0,3258,12,2019
"okYngw88z54",2019-08-03,"UC7TTtOQKMXTWWMtWQMIgVSA","10 000 cook off 2 must see genius food hacks best gallium vs target hack wins challenge","Learn how to make 3 iconic dishes in this genius cook-off featuring a must see gallium vs liquid metal cooking hack challenge, Target hacks, and so much more.","https://i.ytimg.com/vi/okYngw88z54/default.jpg","120","90","https://i.ytimg.com/vi/okYngw88z54/mqdefault.jpg","320","180","https://i.ytimg.com/vi/okYngw88z54/hqdefault.jpg","480","360","Collins Key","none",11805440,320512,9397,0,22570,8,2019
"Q9y3VRWYtGE",2019-11-18,"UCbpMy0Fg74eXXkvxJrtEn3w","12 types of steak examined and cooked bon appétit","There are exactly 12 types of steak, no more, no less. Wait.. what's that? Ok, we just got word that there are actually a few more types of steak, but what defines a ...","https://i.ytimg.com/vi/Q9y3VRWYtGE/default.jpg","120","90","https://i.ytimg.com/vi/Q9y3VRWYtGE/mqdefault.jpg","320","180","https://i.ytimg.com/vi/Q9y3VRWYtGE/hqdefault.jpg","480","360","Bon Appétit","none",1208938,23659,1175,0,2514,11,2019
"EGaf6yMtBF0",2020-01-29,"UCbpMy0Fg74eXXkvxJrtEn3w","andy learns how to cook palestinian food bon appétit","Andy Baraghani is on to his next exploration and this time it's Palestinian cooking. He's joined by Rawia Bishara, a fixture in Palestinian cooking, to introduce ...","https://i.ytimg.com/vi/EGaf6yMtBF0/default.jpg","120","90","https://i.ytimg.com/vi/EGaf6yMtBF0/mqdefault.jpg","320","180","https://i.ytimg.com/vi/EGaf6yMtBF0/hqdefault.jpg","480","360","Bon Appétit","none",860097,21747,667,0,2265,1,2020
"dx8rs8Y9SR8",2019-04-29,"UCgFXm4TI8htWmCyJ6cVPG_A","wendy pretend play minnie mouse kitchen cooking toy restaurant play set","Wendy pretend play with her Minnie Mouse kitchen cooking toy restaurant play set! She got student of the month and decided to open a restaurant with her new ...","https://i.ytimg.com/vi/dx8rs8Y9SR8/default.jpg","120","90","https://i.ytimg.com/vi/dx8rs8Y9SR8/mqdefault.jpg","320","180","https://i.ytimg.com/vi/dx8rs8Y9SR8/hqdefault.jpg","480","360","Toys and Colors","none",19917311,64786,26983,0,NA,4,2019
"ktk_VbpXVe8",2020-03-18,"UCnjU1FHmao9YNfPzE039YTw","andhra food cooked with hygiene kostha ruchulu","KOSTHA RUCHULU invited me to check out their kitchen. They're trying their best to make food with Hygiene. I've already made a video at this place in which I ...","https://i.ytimg.com/vi/ktk_VbpXVe8/default.jpg","120","90","https://i.ytimg.com/vi/ktk_VbpXVe8/mqdefault.jpg","320","180","https://i.ytimg.com/vi/ktk_VbpXVe8/hqdefault.jpg","480","360","Irfan's view","none",155625,5566,319,0,634,3,2020
"onMbSLuC7Oc",2017-04-19,"UCXA05MlE6HicYcKkQ9jNCpQ","diy brick rocket stove cooking without power","How to build a simple and inexpensive rocket stove for cooking using 25 bricks for about $15. Would you like to learn more about the Thrive Life freeze dried ...","https://i.ytimg.com/vi/onMbSLuC7Oc/default.jpg","120","90","https://i.ytimg.com/vi/onMbSLuC7Oc/mqdefault.jpg","320","180","https://i.ytimg.com/vi/onMbSLuC7Oc/hqdefault.jpg","480","360","Live Simple, Live Free - Tinyhouse Prepper","none",2676668,57841,2172,0,3657,4,2017
"ZwbEhmbk8cI",2020-01-04,"UChGJGhZ9SOOHvBB0Y4DOO_w","ryan cooking and pretend play grocery store fun","Ryan Cooking and Pretend Play Grocery Store fun!!! Ryan play with kitchen playset and and does chores!!!","https://i.ytimg.com/vi/ZwbEhmbk8cI/default.jpg","120","90","https://i.ytimg.com/vi/ZwbEhmbk8cI/mqdefault.jpg","320","180","https://i.ytimg.com/vi/ZwbEhmbk8cI/hqdefault.jpg","480","360","Ryan's World","none",10062343,22897,10127,0,NA,1,2020
"vSBSzWmjXO0",2019-07-12,"UCsP7Bpw36J666Fct5M8u-ZA","blossom 39 s fake video exposed by food scientist how to cook that ann reardon","Food Scientist reacts to ""Is your food fake or real?"" video by Blossom and examines their claims. Is their video true or fake? SUBSCRIBE on youtube: ...","https://i.ytimg.com/vi/vSBSzWmjXO0/default.jpg","120","90","https://i.ytimg.com/vi/vSBSzWmjXO0/mqdefault.jpg","320","180","https://i.ytimg.com/vi/vSBSzWmjXO0/hqdefault.jpg","480","360","How To Cook That","none",7303134,314575,6490,0,22454,7,2019
"8JlvcFLePKs",2007-03-08,"UCOnqxvmYTsjn_dpyqJ6EvFw","cooking with the emperor pop tarts","The Emperor of the Universe provides some cooking tips. This episode is about Pop-Tarts.","https://i.ytimg.com/vi/8JlvcFLePKs/default.jpg","120","90","https://i.ytimg.com/vi/8JlvcFLePKs/mqdefault.jpg","320","180","https://i.ytimg.com/vi/8JlvcFLePKs/hqdefault.jpg","480","360","Andrew Looney","none",93637,261,103,0,182,3,2007
"LzwGHt2nc20",2020-02-28,"UCroJ5uxmGr-WOtXUPyqeh6g","cooking mama the musical by random encounters","Mama's cooking up a musical number, but this recipe may turn out spicier than she'd like... WATCH US PLAY COOKING MAMA LIVE <U+27A4> youtube.com/REplayed ...","https://i.ytimg.com/vi/LzwGHt2nc20/default.jpg","120","90","https://i.ytimg.com/vi/LzwGHt2nc20/mqdefault.jpg","320","180","https://i.ytimg.com/vi/LzwGHt2nc20/hqdefault.jpg","480","360","Random Encounters","none",931824,25009,502,0,2963,2,2020
"LynEyDLCGbQ",2020-02-01,"UCByXlUQD0YPUv8QSm5iVfjw","amazing girl catching big crocodile in forest cooking big crocodile and eating delicious ep 85","Hi to day I want to show you about videos: Amazing Girl Catching Big Crocodile in Forest Thanks you for watching and <U+200B><U+200B> hope you enjoy my video. Don't forget ...","https://i.ytimg.com/vi/LynEyDLCGbQ/default.jpg","120","90","https://i.ytimg.com/vi/LynEyDLCGbQ/mqdefault.jpg","320","180","https://i.ytimg.com/vi/LynEyDLCGbQ/hqdefault.jpg","480","360","Survival skills Anywhere","none",532959,6540,2039,0,NA,2,2020
"O6BcD6k_3yI",2020-03-14,"UCk3qsDyU2gwyz3sL6VP3fUQ","we ate a shark catch clean cook blacktip shark from beach","I can't believe it took me so many years to make this video! Land based shark fishing is something I grew up doing and something i love very much. My buddy ...","https://i.ytimg.com/vi/O6BcD6k_3yI/default.jpg","120","90","https://i.ytimg.com/vi/O6BcD6k_3yI/mqdefault.jpg","320","180","https://i.ytimg.com/vi/O6BcD6k_3yI/hqdefault.jpg","480","360","Landshark Outdoors","none",170530,5024,270,0,556,3,2020
"IsMonxeCQqE",2019-11-27,"UCbpMy0Fg74eXXkvxJrtEn3w","pro chef learns how to cook ostrich eggs bon appétit","Molly Baz is the master-ish of pancake art. She's the master-ish of Iberico ham. She's the master-ish of survival cooking. And mostly recently she's the master-ish ...","https://i.ytimg.com/vi/IsMonxeCQqE/default.jpg","120","90","https://i.ytimg.com/vi/IsMonxeCQqE/mqdefault.jpg","320","180","https://i.ytimg.com/vi/IsMonxeCQqE/hqdefault.jpg","480","360","Bon Appétit","none",2806836,56523,1910,0,3365,11,2019
"z3nch8NG2mo",2017-04-22,"UCrLAdgHzX0zudPhxM58kYgA","wow amazing cute girl cooking snail with coconut aha factory","Welcome to AHA FACTORY Channel This video I want to show you about: Amazing cute girl cooking snail with coconut Subscribe Me! Youtube: ...","https://i.ytimg.com/vi/z3nch8NG2mo/default.jpg","120","90","https://i.ytimg.com/vi/z3nch8NG2mo/mqdefault.jpg","320","180","https://i.ytimg.com/vi/z3nch8NG2mo/hqdefault.jpg","480","360","AHA Factory","none",74056,253,41,0,26,4,2017
"bYwicrZw2xc",2018-02-13,"UCKM58KE553jfeyhc4MawHVQ","how to cook a ribeye steak","So you want to know how to cook a ribeye steak? Well your in the right place. In 2015 we won the world steak championship and these are the techniques that ...","https://i.ytimg.com/vi/bYwicrZw2xc/default.jpg","120","90","https://i.ytimg.com/vi/bYwicrZw2xc/mqdefault.jpg","320","180","https://i.ytimg.com/vi/bYwicrZw2xc/hqdefault.jpg","480","360","Kosmo's Q BBQ & Grilling","none",1319261,16990,1300,0,1253,2,2018
"jRTDGDYBp8c",2019-10-24,"UCGGifQ6ioVqKUBmHjgavFSw","chocolate tiramisu milkshake something smeg something 39 s cooking tv","A Kickass Chocolate Tiramisu Milkshake. Enjoy the summer. Tell your friends to come join the party at Something's Cooking TV. Get this recipe: ...","https://i.ytimg.com/vi/jRTDGDYBp8c/default.jpg","120","90","https://i.ytimg.com/vi/jRTDGDYBp8c/mqdefault.jpg","320","180","https://i.ytimg.com/vi/jRTDGDYBp8c/hqdefault.jpg","480","360","Something's Cooking TV","none",4000,15,0,0,4,10,2019
"-W37TDK6dBM",2016-07-06,"UC-kIKjS3gUFvsi4YoxveiWA","gordon ramsay demonstrates how to cook the perfect lobster season 7 ep 6 masterchef","Gordon demonstrates how to get every ounce of lobster out of its shell. Subscribe now for more MasterChef clips: http://fox.tv/SubscribeMASTERCHEFonFOX ...","https://i.ytimg.com/vi/-W37TDK6dBM/default.jpg","120","90","https://i.ytimg.com/vi/-W37TDK6dBM/mqdefault.jpg","320","180","https://i.ytimg.com/vi/-W37TDK6dBM/hqdefault.jpg","480","360","MasterChef On FOX","none",28585719,187367,7694,0,7687,7,2016
"ogjF4p9QdcY",2019-06-28,"UCZH5hvYxLRTX5r5W2wDziiA","module 11 — safe cooking","","https://i.ytimg.com/vi/ogjF4p9QdcY/default.jpg","120","90","https://i.ytimg.com/vi/ogjF4p9QdcY/mqdefault.jpg","320","180","https://i.ytimg.com/vi/ogjF4p9QdcY/hqdefault.jpg","480","360","Southern Nevada Health District","none",30147,74,3,0,0,6,2019
"_ExbrQ03Wok",2020-01-19,"UCyEd6QBSgat5kkC6svyjudA","rare tribal food in india leaf basket cooking kerala india","Hot Lava Fish Fry: https://youtu.be/f0TqulqxLF4 Ebbin's Channel: https://www.youtube.com/channel/UC-wTAWLHOWLYyZI9m_JV8zg T-shirts and caps: ...","https://i.ytimg.com/vi/_ExbrQ03Wok/default.jpg","120","90","https://i.ytimg.com/vi/_ExbrQ03Wok/mqdefault.jpg","320","180","https://i.ytimg.com/vi/_ExbrQ03Wok/hqdefault.jpg","480","360","Mark Wiens","none",1089321,23122,898,0,1980,1,2020
"kJ5PCbtiCpk",2017-02-28,"UCftwRNsjfRo08xYE31tkiyw","gordon ramsay answers cooking questions from twitter tech support wired","Gordon Ramsay uses the power of Twitter to answer some common cooking questions. Does cheese go bad? Is British food as awful as they say? Gordon offers ...","https://i.ytimg.com/vi/kJ5PCbtiCpk/default.jpg","120","90","https://i.ytimg.com/vi/kJ5PCbtiCpk/mqdefault.jpg","320","180","https://i.ytimg.com/vi/kJ5PCbtiCpk/hqdefault.jpg","480","360","WIRED","none",24016588,457321,5647,0,20543,2,2017
"ol8vanx9DRQ",2019-11-29,"UCfZLvJ3gDM0Egks8g5WYCxw","google ad cooking with elia","This is a formal introduction trailer for my cooking show, ""Cooking with Elia"" through my production company ""Octopluck"". I created this preview as an ad for ...","https://i.ytimg.com/vi/ol8vanx9DRQ/default.jpg","120","90","https://i.ytimg.com/vi/ol8vanx9DRQ/mqdefault.jpg","320","180","https://i.ytimg.com/vi/ol8vanx9DRQ/hqdefault.jpg","480","360","Cooking with Elia / Octopluck","none",23389,13,0,0,9,11,2019
"gLOLaXDPb38",2008-04-11,"UC_9buKlVfwRnC-MZQW29ivg","cooking crab in the wild for a shore lunch","There is nothing like eating Pacific Dungeness Crab just caught in the ocean and cooked within minutes for a shore lunch. Here you see Dustin Kovacvich as the ...","https://i.ytimg.com/vi/gLOLaXDPb38/default.jpg","120","90","https://i.ytimg.com/vi/gLOLaXDPb38/mqdefault.jpg","320","180","https://i.ytimg.com/vi/gLOLaXDPb38/hqdefault.jpg","480","360","Noel Gyger","none",87083,137,34,0,29,4,2008
"pYwYv24X2Vw",2019-06-10,"UChGJGhZ9SOOHvBB0Y4DOO_w","ryan pretend play pizza delivery cooking playhouse","Ryan Pretend Play Pizza Delivery Cooking Playhouse for kids! Ryan open a pizza restaurant and cook pretend play food toys! Then Ryan play hide and seek ...","https://i.ytimg.com/vi/pYwYv24X2Vw/default.jpg","120","90","https://i.ytimg.com/vi/pYwYv24X2Vw/mqdefault.jpg","320","180","https://i.ytimg.com/vi/pYwYv24X2Vw/hqdefault.jpg","480","360","Ryan's World","none",17539178,33456,10700,0,NA,6,2019
"vco6ccwYvIg",2011-08-18,"UCJWAXhc666KqIhQ5R-Jz40g","kitchen counter cooking school book trailer mov","The official Book Trailer for The Kitchen Counter Cooking School (viking/penguin) by author Kathleen Flinn. Available everywhere books are sold October 2011.","https://i.ytimg.com/vi/vco6ccwYvIg/default.jpg","120","90","https://i.ytimg.com/vi/vco6ccwYvIg/mqdefault.jpg","320","180","https://i.ytimg.com/vi/vco6ccwYvIg/hqdefault.jpg","480","360","Kathleen Flinn","none",91711,NA,NA,0,2,8,2011
"YQj-cEn3xZQ",2010-09-29,"UCs-VHgNx3YK7qorYKBZDYOg","cooking dash 3 thrills and spills official trailer","Take a walk down memory lane with Cooking Dash 3: Thrills & Spills. Meet Flo and the rest of the DinerToons as youthful DinerTeens, working their first summer ...","https://i.ytimg.com/vi/YQj-cEn3xZQ/default.jpg","120","90","https://i.ytimg.com/vi/YQj-cEn3xZQ/mqdefault.jpg","320","180","https://i.ytimg.com/vi/YQj-cEn3xZQ/hqdefault.jpg","480","360","PlayFirstGames","none",44340,71,10,0,11,9,2010
"XgCyAG-A0GA",2019-06-23,"UC7TTtOQKMXTWWMtWQMIgVSA","10 000 cook off best tacos mac n cheese amp more wins with cheap vs expensive amazon food","We're back with an epic cook-off where the best chef wins a $10000 exclusive Starbucks! Learn how to make dishes like tacos, mac n cheese, and more using ...","https://i.ytimg.com/vi/XgCyAG-A0GA/default.jpg","120","90","https://i.ytimg.com/vi/XgCyAG-A0GA/mqdefault.jpg","320","180","https://i.ytimg.com/vi/XgCyAG-A0GA/hqdefault.jpg","480","360","Collins Key","none",17038190,433848,16210,0,33078,6,2019
"yVHxaPGXi5s",2019-06-29,"UCC-RHF_77zQdKcA75hr5oTQ","toca kitchen 2 cooking up fun fgteev chef duddy amp shawn","Chef Duddz and Chef Shawn are up in Toca Kitchen 2!!! Thumbs up for cooking!!!! Have you heard about our new FGTEEV BOOK: http://smarturl.it/fgteev Be an ...","https://i.ytimg.com/vi/yVHxaPGXi5s/default.jpg","120","90","https://i.ytimg.com/vi/yVHxaPGXi5s/mqdefault.jpg","320","180","https://i.ytimg.com/vi/yVHxaPGXi5s/hqdefault.jpg","480","360","FGTeeV","none",11332891,58830,7658,0,5287,6,2019
"3fV5eEtBrms",2017-08-31,"UCFXBY044POFH4VafWnrOpAw","awesome cooking beef with vegetables amp eggs recipe cook beef recipes village food factory","Awesome Cooking Beef With vegetables & Eggs Recipe - Cook Beef Recipes - Village Food Factory Hi Guy today i want to show you about Awesome Cooking ...","https://i.ytimg.com/vi/3fV5eEtBrms/default.jpg","120","90","https://i.ytimg.com/vi/3fV5eEtBrms/mqdefault.jpg","320","180","https://i.ytimg.com/vi/3fV5eEtBrms/hqdefault.jpg","480","360","Food Travel KH","none",60324,501,39,0,70,8,2017
"8OJBHuStKzI",2017-08-17,"UCFXBY044POFH4VafWnrOpAw","awesome cooking egg fried with vegetable recipe cook egg recipes village food factory","Awesome Cooking Egg Fried With Vegetable Recipe - Cook Egg Recipes - Village Food Factory Hi Guy today i want to show you about Awesome Cooking Egg ...","https://i.ytimg.com/vi/8OJBHuStKzI/default.jpg","120","90","https://i.ytimg.com/vi/8OJBHuStKzI/mqdefault.jpg","320","180","https://i.ytimg.com/vi/8OJBHuStKzI/hqdefault.jpg","480","360","Food Travel KH","none",29479,185,83,0,37,8,2017
"tt-RC8SfHaI",2020-03-18,"UCPsy4hWCtQNyrr2Q3fsq3jQ","bisi bele bath get set cook by anu hasan jfw cooking","Presenting you the SEVENTH episode of GET SET CO0K BY ANU HASAN! In this episode, Anu will be bringing you the recipe of ""BISI BELE BATH"".","https://i.ytimg.com/vi/tt-RC8SfHaI/default.jpg","120","90","https://i.ytimg.com/vi/tt-RC8SfHaI/mqdefault.jpg","320","180","https://i.ytimg.com/vi/tt-RC8SfHaI/hqdefault.jpg","480","360","JFW - Just for Women","none",25925,529,70,0,62,3,2020
"V2LXrlFMH-g",2018-07-22,"UCsaOzYsyshyrYL4SHCTI8xw","kid size cooking making gyoza japanese dumpling with ryan 39 s family review","Kid Size Cooking Making Gyoza Japanese Dumpling with Ryan's Family Review!!! Ryan helps Daddy cook some yummy Dumpling!!! Let us know what other ...","https://i.ytimg.com/vi/V2LXrlFMH-g/default.jpg","120","90","https://i.ytimg.com/vi/V2LXrlFMH-g/mqdefault.jpg","320","180","https://i.ytimg.com/vi/V2LXrlFMH-g/hqdefault.jpg","480","360","Kaji Family","none",15446445,33371,7303,0,NA,7,2018
"Rg8d2pl5HN8",2019-12-22,"UCvlE5gTbOvjiolFlEm-c_Ow","vlad and nikita pretend play with cooking toys","Vlad and Nikita pretend play with cooking toys and cook for mom Please Subscribe! VLAD Instagram - https://www.instagram.com/Vlad.super.Vlad/ NIKITA ...","https://i.ytimg.com/vi/Rg8d2pl5HN8/default.jpg","120","90","https://i.ytimg.com/vi/Rg8d2pl5HN8/mqdefault.jpg","320","180","https://i.ytimg.com/vi/Rg8d2pl5HN8/hqdefault.jpg","480","360","Vlad and Nikita","none",62987179,225678,88813,0,NA,12,2019
"hu6-BLqYtVM",2016-05-17,"UCMk19wFl9QKm9hMAt-mFx7A","cooking in a wood fired oven with david cox 16th april 2016","A half day workshop at Rosby vineyard in how to cook with a wood fired oven with master oven chef, David Cox. Recipes below. If you are interested in how this ...","https://i.ytimg.com/vi/hu6-BLqYtVM/default.jpg","120","90","https://i.ytimg.com/vi/hu6-BLqYtVM/mqdefault.jpg","320","180","https://i.ytimg.com/vi/hu6-BLqYtVM/hqdefault.jpg","480","360","Simon Pockley","none",9533,27,1,0,2,5,2016
"10PMrlpQtiQ",2017-08-01,"UCFXBY044POFH4VafWnrOpAw","awesome cooking ice with dried fish cook duck egg recipe village food factory","Awesome Cooking Ice With Dried Fish - Cook Duck Egg Recipe - Village Food Factory ...","https://i.ytimg.com/vi/10PMrlpQtiQ/default.jpg","120","90","https://i.ytimg.com/vi/10PMrlpQtiQ/mqdefault.jpg","320","180","https://i.ytimg.com/vi/10PMrlpQtiQ/hqdefault.jpg","480","360","Food Travel KH","none",49286,267,80,0,55,8,2017
"4lRW3m8GO0g",2018-09-14,"UCWNGSF_ikMkkumMGzsPzQ1A","crazy chef 2018 new top hits cooking game","Tap to enjoy all the Cooking gestures with your fingers, and Cook Food in word-wide restaurants like a Crazy Chef! Serve the customers fast enough and time ...","https://i.ytimg.com/vi/4lRW3m8GO0g/default.jpg","120","90","https://i.ytimg.com/vi/4lRW3m8GO0g/mqdefault.jpg","320","180","https://i.ytimg.com/vi/4lRW3m8GO0g/hqdefault.jpg","480","360","Casual Joy Games","none",40748,15,6,0,1,9,2018
"-c86YEvHPzM",2020-03-19,"UC3XjEumltux24x_oq9uNOMg","giant yellowfin tuna catch clean amp cook venice louisiana","What's up everybody Bluegabe here !! We're in Venice Louisiana catching GIANT YELLOWFIN TUNA For Louisiana blue water charters call Capt BOb ...","https://i.ytimg.com/vi/-c86YEvHPzM/default.jpg","120","90","https://i.ytimg.com/vi/-c86YEvHPzM/mqdefault.jpg","320","180","https://i.ytimg.com/vi/-c86YEvHPzM/hqdefault.jpg","480","360","Bluegabe","none",129079,6431,90,0,869,3,2020
"hAUZPEzPSzQ",2007-04-25,"UCJOELIn06RE2wAfvrWBcPtA","quick amp easy cooking video episode 1 a romantic dinner","Chef MikeC, executive chef of Kitchen On Fire, demonstrates how to serve up a romantic dinner preparing a delicious Asparagus Prosciutto & Truffle Essence ...","https://i.ytimg.com/vi/hAUZPEzPSzQ/default.jpg","120","90","https://i.ytimg.com/vi/hAUZPEzPSzQ/mqdefault.jpg","320","180","https://i.ytimg.com/vi/hAUZPEzPSzQ/hqdefault.jpg","480","360","MeyerOnline","none",34882,19,8,0,10,4,2007
"rURJS-NtyOo",2018-05-16,"UC8xJaVdLk7kj3KjXUcj4HYQ","serasadirumah panasonic cooking indonesia","Ramadan adalah momen yang selalu dirindukan untuk bisa berkumpul di rumah bersama keluarga. Hingga tiba waktunya untuk melepas rindu dengan pulang ...","https://i.ytimg.com/vi/rURJS-NtyOo/default.jpg","120","90","https://i.ytimg.com/vi/rURJS-NtyOo/mqdefault.jpg","320","180","https://i.ytimg.com/vi/rURJS-NtyOo/hqdefault.jpg","480","360","Panasonic Indonesia","none",29324,51,5,0,4,5,2018
"bp_njdxz1Rw",2016-08-06,"UC9ecwl3FTG66jIKA9JRDtmg","cheap cheap the cooking chicken 39 s rap parappa the rapper","Music: Cheap Cheap The Cooking Chicken's RAP Composer: Masaya Matsuura Playlist: ...","https://i.ytimg.com/vi/bp_njdxz1Rw/default.jpg","120","90","https://i.ytimg.com/vi/bp_njdxz1Rw/mqdefault.jpg","320","180","https://i.ytimg.com/vi/bp_njdxz1Rw/hqdefault.jpg","480","360","SiIvaGunner","none",37012,1178,20,0,196,8,2016
"UEtp-AcGmrg",2019-02-11,"UCLTL_PCVGPiYLeVOJh4aqiA","what 39 s cooking tasty chef 2018 pixio games","WHAT'S COOKING? – TASTY FEATURES <U+2981> Combine ingredients to discover and cook 700+ recipes <U+2981> Customize your restaurant and kitchen with unique ...","https://i.ytimg.com/vi/UEtp-AcGmrg/default.jpg","120","90","https://i.ytimg.com/vi/UEtp-AcGmrg/mqdefault.jpg","320","180","https://i.ytimg.com/vi/UEtp-AcGmrg/hqdefault.jpg","480","360","Pixio Studio","none",25706,8,2,0,NA,2,2019
"SFeChtLaHy4",2019-10-02,"UC8Y-jrV8oR3s2Ix4viDkZtA","how to make lo mein with jet tila ready jet cook","You can make your own restaurant-quality Lo Mein at home... and in ONE PAN! Jet is here to show you the ropes step-by-step. Check back for a new episode of ...","https://i.ytimg.com/vi/SFeChtLaHy4/default.jpg","120","90","https://i.ytimg.com/vi/SFeChtLaHy4/mqdefault.jpg","320","180","https://i.ytimg.com/vi/SFeChtLaHy4/hqdefault.jpg","480","360","Food Network","none",797343,32921,436,0,1280,10,2019
"IbiXc5cUVus",2017-05-27,"UC295-Dw_tDNtZXFeAPAW6Aw","35 unbelievable cooking hacks","Subscribe to 5-Minute Crafts: https://www.goo.gl/8JVmuC For copyright matters please contact us at: welcome@brightside.me ...","https://i.ytimg.com/vi/IbiXc5cUVus/default.jpg","120","90","https://i.ytimg.com/vi/IbiXc5cUVus/mqdefault.jpg","320","180","https://i.ytimg.com/vi/IbiXc5cUVus/hqdefault.jpg","480","360","5-Minute Crafts","none",66289742,311579,76393,0,14909,5,2017
"-vVwRJjPtfM",2019-07-24,"UCt_KDu-DtBqvIw7X-V7mlmQ","who is better cook snacks corner war funny kids video amp moral story pari 39 s lifestyle","In today's video pari have opened new shop and sanket is trying to close her shop by copying her store idea and stealing her customers. We hope you guys love ...","https://i.ytimg.com/vi/-vVwRJjPtfM/default.jpg","120","90","https://i.ytimg.com/vi/-vVwRJjPtfM/mqdefault.jpg","320","180","https://i.ytimg.com/vi/-vVwRJjPtfM/hqdefault.jpg","480","360","Pari's Lifestyle","none",13995041,85656,26059,0,449,7,2019
"47FCm_n6SK0",2020-02-07,"UCbpMy0Fg74eXXkvxJrtEn3w","pro chefs review tv cooking shows test kitchen talks bon appétit","Join Brad Leone, Gaby Melian, Molly Baz, Chris Morocco, Alex Delany, Priya Krishna, Carla Lalli Music and Claire Saffitz for another episode of Test Kitchen ...","https://i.ytimg.com/vi/47FCm_n6SK0/default.jpg","120","90","https://i.ytimg.com/vi/47FCm_n6SK0/mqdefault.jpg","320","180","https://i.ytimg.com/vi/47FCm_n6SK0/hqdefault.jpg","480","360","Bon Appétit","none",1646900,38093,659,0,2244,2,2020
"PKz70B4O4ig",2020-01-31,"UCbpMy0Fg74eXXkvxJrtEn3w","12 types of eggs examined and cooked bon appétit","Have you ever tried a deviled ostrich egg? Would you try a deviled ostrich egg? Well, Amiel Stanek did and he has thoughts. Join him as he examines and cooks ...","https://i.ytimg.com/vi/PKz70B4O4ig/default.jpg","120","90","https://i.ytimg.com/vi/PKz70B4O4ig/mqdefault.jpg","320","180","https://i.ytimg.com/vi/PKz70B4O4ig/hqdefault.jpg","480","360","Bon Appétit","none",1237472,26143,2088,0,3627,1,2020
