"","video_id","publishedAt","channelId","title","description","thumbnails.default.url","thumbnails.default.width","thumbnails.default.height","thumbnails.medium.url","thumbnails.medium.width","thumbnails.medium.height","thumbnails.high.url","thumbnails.high.width","thumbnails.high.height","channelTitle","liveBroadcastContent","viewCount","likeCount","dislikeCount","favoriteCount","commentCount","month","year"
"853","ZfCznuLx-OU","2019-11-14","UCdhMqFFPqKd54ZMcxzRq5Qg","death stranding licks my balls","Norman Reedus delivers packages and drinks Monster Energy drinks. SHOT FOR AARON, EMRE, = $25 USD via http://PayPal.com to AaronYonda@gmail.com ...","https://i.ytimg.com/vi/ZfCznuLx-OU/default.jpg",120,90,"https://i.ytimg.com/vi/ZfCznuLx-OU/mqdefault.jpg",320,180,"https://i.ytimg.com/vi/ZfCznuLx-OU/hqdefault.jpg",480,360,"Game Society Pimps","none",5119,184,8,0,33,11,2019
"854","NJSVNjInaDk","2017-04-27","UCBoRD9HJvfBo8tS7_Lc-PwQ","i am not madame bovary official uk trailer hd in cinemas may 26","Watch the UK trailer for I AM NOT MADAME BOVARY, a razor-sharp adaptation of Liu Zheyun's 2012 novel, starring Chinese superstar Fan Bingbing and telling ...","https://i.ytimg.com/vi/NJSVNjInaDk/default.jpg",120,90,"https://i.ytimg.com/vi/NJSVNjInaDk/mqdefault.jpg",320,180,"https://i.ytimg.com/vi/NJSVNjInaDk/hqdefault.jpg",480,360,"Thunderbird Releasing","none",7209,24,1,0,0,4,2017
"855","FzW-dcIfjvA","2018-01-04","UCUhFaUpnq31m6TNX2VKVSVA","hyundai i20 2018 in depth review carwow reviews","This is the Hyundai i20. It's a sensible, spacious alternative to cars like the Volkswagen Polo and Ford Fiesta. But in a class full of stylish, fun-to-drive superminis, ...","https://i.ytimg.com/vi/FzW-dcIfjvA/default.jpg",120,90,"https://i.ytimg.com/vi/FzW-dcIfjvA/mqdefault.jpg",320,180,"https://i.ytimg.com/vi/FzW-dcIfjvA/hqdefault.jpg",480,360,"carwow","none",782647,6642,273,0,667,1,2018
"856","DF8B01r4Abw","2018-08-19","UCR_0PhpgIlOG7rUjsXDxhUA","dumb driving theory test questions","In this video I look at the dumbest driving theory test questions. Some them include what do you do at a red light and should you drink and drive. So yeah they ...","https://i.ytimg.com/vi/DF8B01r4Abw/default.jpg",120,90,"https://i.ytimg.com/vi/DF8B01r4Abw/mqdefault.jpg",320,180,"https://i.ytimg.com/vi/DF8B01r4Abw/hqdefault.jpg",480,360,"Caseatron","none",309,29,2,0,4,8,2018
"857","jrK5-bJSjrc","2018-08-19","UCwIEFke5UZ-cKxKxTjjWu7g","2 weeks of vlogging 100 likes to grow my beard challenge <U+0001F4AF><U+2705> 26","Hey guys in this video I offer a challenge. If I get 100 likes I'll grow an insane long BEARD Plus I go on to discuss my 2 week vlogging tour commencing on the ...","https://i.ytimg.com/vi/jrK5-bJSjrc/default.jpg",120,90,"https://i.ytimg.com/vi/jrK5-bJSjrc/mqdefault.jpg",320,180,"https://i.ytimg.com/vi/jrK5-bJSjrc/hqdefault.jpg",480,360,"Nathan Howard","none",12997,160,2,0,70,8,2018
"858","ggH8cKcPOHI","2016-05-06","UCSju5G2aFaWMqn-_0YBtq5A","quick mathematical card trick","Colm Mulcahy's Mathematical Card Magic: Fifty-Two New Effects US AMAZON ...","https://i.ytimg.com/vi/ggH8cKcPOHI/default.jpg",120,90,"https://i.ytimg.com/vi/ggH8cKcPOHI/mqdefault.jpg",320,180,"https://i.ytimg.com/vi/ggH8cKcPOHI/hqdefault.jpg",480,360,"standupmaths","none",148669,3282,88,0,598,5,2016
"859","1_O6kGpO6y4","2011-01-03","UC9Q8AoQIdtWPr8UAqqEiPDg","gullivers travel 39 s trailer","Gulliver's Travel's Trailer.","https://i.ytimg.com/vi/1_O6kGpO6y4/default.jpg",120,90,"https://i.ytimg.com/vi/1_O6kGpO6y4/mqdefault.jpg",320,180,"https://i.ytimg.com/vi/1_O6kGpO6y4/hqdefault.jpg",480,360,"GulliversTravelsKore","none",11194,3,0,0,0,1,2011
"860","gH9XrR5oROM","2019-09-19","UCdhMqFFPqKd54ZMcxzRq5Qg","bumpercar bad boys live wreckfest","TONIGHT ONLY SALE ON MALORT! $20 or $60 for all three of us to drink it! SHOT FOR AARON, EMRE, or KAY = $25 USD via http://PayPal.com to ...","https://i.ytimg.com/vi/gH9XrR5oROM/default.jpg",120,90,"https://i.ytimg.com/vi/gH9XrR5oROM/mqdefault.jpg",320,180,"https://i.ytimg.com/vi/gH9XrR5oROM/hqdefault.jpg",480,360,"Game Society Pimps","none",3546,156,2,0,13,9,2019
"861","xYjUzMCPa7k","2018-07-22","UChcirlcdLdpGvx2QtXQK2Rw","xxxlutz tv spot 2018 heimtextilien","20% auf viele Heimtextilien, Vorhänge und Matratzen. Aktion gültig bis 04.08.2018. Fernsehwerbung 2018, XXXLutz Österreich.","https://i.ytimg.com/vi/xYjUzMCPa7k/default.jpg",120,90,"https://i.ytimg.com/vi/xYjUzMCPa7k/mqdefault.jpg",320,180,"https://i.ytimg.com/vi/xYjUzMCPa7k/hqdefault.jpg",480,360,"XXXLutz Österreich","none",1820231,644,361,0,0,7,2018
"862","B2vE5D21hag","2019-02-28","UCGuIbAVY4_O-KOQmLkU0IKQ","soundcity official top 10 uk sam smith ariana grande and calvin harris february week 4","Sam Smith, Ariana Grande and Calvin Harris top the Soundcity Top 10 UK chart for this week - February, Week 4 Stay connected with us here: + Subscribe now: ...","https://i.ytimg.com/vi/B2vE5D21hag/default.jpg",120,90,"https://i.ytimg.com/vi/B2vE5D21hag/mqdefault.jpg",320,180,"https://i.ytimg.com/vi/B2vE5D21hag/hqdefault.jpg",480,360,"Soundcity","none",765,7,2,0,0,2,2019
"863","NnROGOXv_jQ","2016-08-22","UC4ZWaV_svQiBXvk4MbM2gmw","snapchat go a pokemon go parody","Help me reach 100 subscribers: http://bit.ly/katyayoutube In this video learn how to: - Upload Your Own Snapchat Geofilter. - The Dimensions The Geofilter ...","https://i.ytimg.com/vi/NnROGOXv_jQ/default.jpg",120,90,"https://i.ytimg.com/vi/NnROGOXv_jQ/mqdefault.jpg",320,180,"https://i.ytimg.com/vi/NnROGOXv_jQ/hqdefault.jpg",480,360,"LiveStreamKatya","none",26,1,0,0,0,8,2016
"864","-7fLz0abhv4","2011-01-14","UCiDBXboIGMctoMpiRE6DBIA","gulliver 39 s travels emily blunt interview","by Dr. Ted Baehr, http://movieguide.org.","https://i.ytimg.com/vi/-7fLz0abhv4/default.jpg",120,90,"https://i.ytimg.com/vi/-7fLz0abhv4/mqdefault.jpg",320,180,"https://i.ytimg.com/vi/-7fLz0abhv4/hqdefault.jpg",480,360,"Movieguide","none",1246,2,0,0,0,1,2011
"865","mmgTPvtCtmk","2017-10-14","UCyAyIfOlHYZejLC8lLo9DcA","pros amp cons of 5 popular cruise lines","Hi Cruisers, Today we go live again to talk about the pros & cons of 5 popular cruise lines. We'll look at Princess Cruises, Royal Caribbean Cruises, Norwegian ...","https://i.ytimg.com/vi/mmgTPvtCtmk/default.jpg",120,90,"https://i.ytimg.com/vi/mmgTPvtCtmk/mqdefault.jpg",320,180,"https://i.ytimg.com/vi/mmgTPvtCtmk/hqdefault.jpg",480,360,"CruiseTipsTV","none",115209,1045,107,0,217,10,2017
"866","awa9uBMKSYA","2019-10-05","UCdhMqFFPqKd54ZMcxzRq5Qg","alpha 18 is here 7 days to die livestream tonight","7 Days to Die Alpha 18 is finally here (streamers only until next week). What's changed? Well there are mountain lions. And lots more variety of weapons. Watch ...","https://i.ytimg.com/vi/awa9uBMKSYA/default.jpg",120,90,"https://i.ytimg.com/vi/awa9uBMKSYA/mqdefault.jpg",320,180,"https://i.ytimg.com/vi/awa9uBMKSYA/hqdefault.jpg",480,360,"Game Society Pimps","none",8228,291,5,0,29,10,2019
"867","Gr7nWfmCCpg","2019-09-26","UCdhMqFFPqKd54ZMcxzRq5Qg","untitled goose game live goosing and juicing","Get Goosed! SHOT FOR AARON, EMRE, or KAY = $25 USD via http://PayPal.com to AaronYonda@gmail.com That's $35 Australian or Canadian, €20 UK, and ...","https://i.ytimg.com/vi/Gr7nWfmCCpg/default.jpg",120,90,"https://i.ytimg.com/vi/Gr7nWfmCCpg/mqdefault.jpg",320,180,"https://i.ytimg.com/vi/Gr7nWfmCCpg/hqdefault.jpg",480,360,"Game Society Pimps","none",4673,214,5,0,20,9,2019
"868","dKo75TYnfzM","2016-08-25","UC4ZWaV_svQiBXvk4MbM2gmw","rant about overly sensitive people 007","Help me reach 100 subscribers: http://bit.ly/katyayoutube In this video, watch: - me rant about overly-sensitive people. - why I don't take myself seriously and why ...","https://i.ytimg.com/vi/dKo75TYnfzM/default.jpg",120,90,"https://i.ytimg.com/vi/dKo75TYnfzM/mqdefault.jpg",320,180,"https://i.ytimg.com/vi/dKo75TYnfzM/hqdefault.jpg",480,360,"LiveStreamKatya","none",117,7,2,0,1,8,2016
"869","qCLOb8Pl5Wk","2019-08-21","UC-2KVbW4mu7XJt2vGHsH_xA","buying my dream car at 19","Welcome Back La Familia!!!! Smash The Like Button And Subscribe To The Channel. Lets Try To Get To 200 Subscribers By September. I'm So Bless To Have ...","https://i.ytimg.com/vi/qCLOb8Pl5Wk/default.jpg",120,90,"https://i.ytimg.com/vi/qCLOb8Pl5Wk/mqdefault.jpg",320,180,"https://i.ytimg.com/vi/qCLOb8Pl5Wk/hqdefault.jpg",480,360,"Riqovinez","none",112,9,2,0,0,8,2019
"870","Ez1vjgdnDD4","2019-07-25","UCdhMqFFPqKd54ZMcxzRq5Qg","live 7d2d sermon on a hill","The GSP server is a place of ongoing madness. Join us for more. No Stranger Things 3 tonight because people were concerned about spoilers. SHOT FOR ...","https://i.ytimg.com/vi/Ez1vjgdnDD4/default.jpg",120,90,"https://i.ytimg.com/vi/Ez1vjgdnDD4/mqdefault.jpg",320,180,"https://i.ytimg.com/vi/Ez1vjgdnDD4/hqdefault.jpg",480,360,"Game Society Pimps","none",6936,281,7,0,14,7,2019
"871","VUWtELGD6zM","2017-10-29","UCd5esrJjToAlaZAdB-ER_AA","red dwarf wikividi documentary","Red Dwarf is a English science fiction comedy franchise which primarily consists of a television sitcom that aired on BBC Two between 1988 and 1999, and on ...","https://i.ytimg.com/vi/VUWtELGD6zM/default.jpg",120,90,"https://i.ytimg.com/vi/VUWtELGD6zM/mqdefault.jpg",320,180,"https://i.ytimg.com/vi/VUWtELGD6zM/hqdefault.jpg",480,360,"WikiVidi Documentaries","none",261,0,3,0,0,10,2017
"872","nMHvqSzaKus","2015-03-17","UC8dhfZgZp21ytR56pFylfMg","mom and me driving practice part 1","Thankfully my mom was kind enough to allow me to practice for my road test using her Toyota Matrix. This is our day of practicing before the road test.","https://i.ytimg.com/vi/nMHvqSzaKus/default.jpg",120,90,"https://i.ytimg.com/vi/nMHvqSzaKus/mqdefault.jpg",320,180,"https://i.ytimg.com/vi/nMHvqSzaKus/hqdefault.jpg",480,360,"Keith Saunders","none",431,4,0,0,1,3,2015
"873","5MLOXjucx6s","2019-06-20","UCdhMqFFPqKd54ZMcxzRq5Qg","live fallout 76 nuclear winter","Another Battle Royale? Well yeah but it's Fallout so that's something. SHOT FOR AARON, EMRE, or KAY = $25 USD via http://PayPal.com to ...","https://i.ytimg.com/vi/5MLOXjucx6s/default.jpg",120,90,"https://i.ytimg.com/vi/5MLOXjucx6s/mqdefault.jpg",320,180,"https://i.ytimg.com/vi/5MLOXjucx6s/hqdefault.jpg",480,360,"Game Society Pimps","none",7124,248,10,0,23,6,2019
"874","vc5GNO_R5jk","2019-10-25","UCvUf_yOU_swE6PtOuv2yBqg","shocking tesla q3 aluminum air battery chris gebhardt on starlink ep 57","Joe, Tim and Ben talk about Tesla's big Q3 results, a new aluminum battery that could save the world, and Tim interviews Chris Gebhardt on Starlink Links: Tim ...","https://i.ytimg.com/vi/vc5GNO_R5jk/default.jpg",120,90,"https://i.ytimg.com/vi/vc5GNO_R5jk/mqdefault.jpg",320,180,"https://i.ytimg.com/vi/vc5GNO_R5jk/hqdefault.jpg",480,360,"Our Ludicrous Future","none",49217,1497,69,0,451,10,2019
"875","3AeJ1jdd_dg","2014-02-19","UCyAyIfOlHYZejLC8lLo9DcA","carnival imagination ship video tour cruise tips tv","See our updated video here: https://youtu.be/zwF0cAbbVjw Welcome to our video tour of the refurbished Carnival Imagination. How can you shop amazon to ...","https://i.ytimg.com/vi/3AeJ1jdd_dg/default.jpg",120,90,"https://i.ytimg.com/vi/3AeJ1jdd_dg/mqdefault.jpg",320,180,"https://i.ytimg.com/vi/3AeJ1jdd_dg/hqdefault.jpg",480,360,"CruiseTipsTV","none",117380,592,25,0,111,2,2014
"876","2QhCXev9YGc","2015-06-16","UCyAyIfOlHYZejLC8lLo9DcA","golden princess cruise ship tour","Today we have a Golden Princess Cruise Ship Tour where we take a look a most public areas on the Golden Princess. Use links below to jump to a specific ...","https://i.ytimg.com/vi/2QhCXev9YGc/default.jpg",120,90,"https://i.ytimg.com/vi/2QhCXev9YGc/mqdefault.jpg",320,180,"https://i.ytimg.com/vi/2QhCXev9YGc/hqdefault.jpg",480,360,"CruiseTipsTV","none",105022,313,29,0,76,6,2015
"877","OVb1JUh6i7c","2018-10-03","UCEbM1tSotKSmDOlxr1-gnPg","car tour 2018","Thanks for watching! ---------------------------------------------------------------------------------------------------------------- Business Inquiries Email me at- ...","https://i.ytimg.com/vi/OVb1JUh6i7c/default.jpg",120,90,"https://i.ytimg.com/vi/OVb1JUh6i7c/mqdefault.jpg",320,180,"https://i.ytimg.com/vi/OVb1JUh6i7c/hqdefault.jpg",480,360,"Savannah Deann","none",102,4,0,0,1,10,2018
"878","dzuTqIHwZWw","2019-10-17","UCdhMqFFPqKd54ZMcxzRq5Qg","we 39 re on trial live 7 days to die","Aaron and Emre are on trial for crimes committed on the 7 Days To Die server. Will they be convicted or will their lawyer get them off? SHOT FOR AARON, EMRE ...","https://i.ytimg.com/vi/dzuTqIHwZWw/default.jpg",120,90,"https://i.ytimg.com/vi/dzuTqIHwZWw/mqdefault.jpg",320,180,"https://i.ytimg.com/vi/dzuTqIHwZWw/hqdefault.jpg",480,360,"Game Society Pimps","none",5374,231,8,0,18,10,2019
"879","Cj_LU4iDIkE","2019-10-10","UCdhMqFFPqKd54ZMcxzRq5Qg","blowing up our alpha 17 server 7 days to die live","Alpha 18 is here so we're blowing up everything on our Alpha 17 server! Plus a puzzle/treasure hunt. You can see Emre's view on Twitch: ...","https://i.ytimg.com/vi/Cj_LU4iDIkE/default.jpg",120,90,"https://i.ytimg.com/vi/Cj_LU4iDIkE/mqdefault.jpg",320,180,"https://i.ytimg.com/vi/Cj_LU4iDIkE/hqdefault.jpg",480,360,"Game Society Pimps","none",4744,287,7,0,30,10,2019
"880","DDNYJ-kTvzI","2019-11-07","UCdhMqFFPqKd54ZMcxzRq5Qg","live dungeon crawl of insanity 7 days to die stream","A dungeon designed by an insane genius and there is only one way out! Watch 2 of our fans struggle to find a way through as we make fun of them for failing!","https://i.ytimg.com/vi/DDNYJ-kTvzI/default.jpg",120,90,"https://i.ytimg.com/vi/DDNYJ-kTvzI/mqdefault.jpg",320,180,"https://i.ytimg.com/vi/DDNYJ-kTvzI/hqdefault.jpg",480,360,"Game Society Pimps","none",5151,210,4,0,14,11,2019
"881","QWOPXBqLBAQ","2012-03-05","UCUC2NZe-aIpXPbnyQd9Gf0A","cadbury creme egg man delivering your eggs happy easter","Cadbury Creme Egg Man Delivering your eggs. Happy Easter!! He comes from the north this time of year to bring you these eggs.","https://i.ytimg.com/vi/QWOPXBqLBAQ/default.jpg",120,90,"https://i.ytimg.com/vi/QWOPXBqLBAQ/mqdefault.jpg",320,180,"https://i.ytimg.com/vi/QWOPXBqLBAQ/hqdefault.jpg",480,360,"Carlos Pineiro","none",239,1,0,0,0,3,2012
"882","543OXPfsdfk","2019-06-06","UCdhMqFFPqKd54ZMcxzRq5Qg","pimpamania 6 jon snow vs night king picard vs kirk babies vs alabama john wick wwe 2k19","Tonight's matches include Picard VS Kirk, Jon Snow VS Night King Babies VS Alabama, and Aaron and Emre VS Youtube. Plus an 8 woman royal rumble and ...","https://i.ytimg.com/vi/543OXPfsdfk/default.jpg",120,90,"https://i.ytimg.com/vi/543OXPfsdfk/mqdefault.jpg",320,180,"https://i.ytimg.com/vi/543OXPfsdfk/hqdefault.jpg",480,360,"Game Society Pimps","none",6651,275,9,0,31,6,2019
"883","3Id0Vm2Y0qI","2019-07-11","UCdhMqFFPqKd54ZMcxzRq5Qg","live 7d2d new bases and more","Emre made a base on our server! And there's a new highway that is a feat of engineering. Join us for hijinx. SHOT FOR AARON, EMRE, or KAY = $25 USD via ...","https://i.ytimg.com/vi/3Id0Vm2Y0qI/default.jpg",120,90,"https://i.ytimg.com/vi/3Id0Vm2Y0qI/mqdefault.jpg",320,180,"https://i.ytimg.com/vi/3Id0Vm2Y0qI/hqdefault.jpg",480,360,"Game Society Pimps","none",9265,276,12,0,26,7,2019
"884","bzxfJBBL6R4","2015-09-09","UCThUlOwowSnEL2gN7UeICtQ","film pendek krop sairkel crop circle","Berikan apresiasi dan dukungan kepada kami hanya dengan klik subscribe, bunyikan tanda lonceng, like, share dan tidak tergesa-gesa skip iklan, hehe... :) .","https://i.ytimg.com/vi/bzxfJBBL6R4/default.jpg",120,90,"https://i.ytimg.com/vi/bzxfJBBL6R4/mqdefault.jpg",320,180,"https://i.ytimg.com/vi/bzxfJBBL6R4/hqdefault.jpg",480,360,"Kantata Ilmu","none",71,2,1,0,0,9,2015
"885","pz89geUR44U","2019-06-13","UCdhMqFFPqKd54ZMcxzRq5Qg","7 days to die live official gsp server","We're testing out the upcoming OFFICIAL GSP 7 DAYS SERVER! Let's see if this brand new crew can make it past the first Day 7 Horde, or if it will just devolve ...","https://i.ytimg.com/vi/pz89geUR44U/default.jpg",120,90,"https://i.ytimg.com/vi/pz89geUR44U/mqdefault.jpg",320,180,"https://i.ytimg.com/vi/pz89geUR44U/hqdefault.jpg",480,360,"Game Society Pimps","none",6310,255,9,0,17,6,2019
"886","BshWO201_qA","2018-01-18","UCQmAK-VrIR8aq1hL2_nK0aw","out of my depth riding black rocks in the derbyshire dales","I went to Black Rocks in Derbyshire expecting it to be a fairly tame XC ride. I soon realised the opposite was going to be the case. The trails at Black Rocks are ...","https://i.ytimg.com/vi/BshWO201_qA/default.jpg",120,90,"https://i.ytimg.com/vi/BshWO201_qA/mqdefault.jpg",320,180,"https://i.ytimg.com/vi/BshWO201_qA/hqdefault.jpg",480,360,"Dave Jenvey","none",11348,262,9,0,142,1,2018
"887","thaGXGt0o6o","2017-04-21","UChcirlcdLdpGvx2QtXQK2Rw","vossen erhältlich bei xxxlutz","VOSSEN Produkte ansehen: https://www.xxxlutz.at/c/vossen.","https://i.ytimg.com/vi/thaGXGt0o6o/default.jpg",120,90,"https://i.ytimg.com/vi/thaGXGt0o6o/mqdefault.jpg",320,180,"https://i.ytimg.com/vi/thaGXGt0o6o/hqdefault.jpg",480,360,"XXXLutz Österreich","none",1559562,735,424,0,NA,4,2017
"888","uw8dW9Hyno0","2010-07-13","UCvlkMq7QfHFK5VJZa0aeMeQ","official rowan atkinson live full length standup","The full length and official Rowan Atkinson Live DVD is now available on Youtube! Whether mesmerising us with the sheer visual mastery of Mr. Bean, beguiling ...","https://i.ytimg.com/vi/uw8dW9Hyno0/default.jpg",120,90,"https://i.ytimg.com/vi/uw8dW9Hyno0/mqdefault.jpg",320,180,"https://i.ytimg.com/vi/uw8dW9Hyno0/hqdefault.jpg",480,360,"Rowan Atkinson Live","none",5310096,59130,1405,0,2740,7,2010
"889","R7OxTxAvvLw","2014-01-24","UCvlkMq7QfHFK5VJZa0aeMeQ","rowan atkinson live dirty names","A classic bit by comedian, Rowan Atkinson. A teacher does roll call with a class register full of hilarious dirty names. Whether mesmerising us with the sheer ...","https://i.ytimg.com/vi/R7OxTxAvvLw/default.jpg",120,90,"https://i.ytimg.com/vi/R7OxTxAvvLw/mqdefault.jpg",320,180,"https://i.ytimg.com/vi/R7OxTxAvvLw/hqdefault.jpg",480,360,"Rowan Atkinson Live","none",13014498,168111,3255,0,4785,1,2014
"890","ppVpdsClN80","2014-01-24","UCvlkMq7QfHFK5VJZa0aeMeQ","rowan atkinson live headmaster kills student","One of the most loved clips from Rowan's vast back catalogue, a hilarious sketch where the angry teacher played by Rowan invites a father in to talk about the ...","https://i.ytimg.com/vi/ppVpdsClN80/default.jpg",120,90,"https://i.ytimg.com/vi/ppVpdsClN80/mqdefault.jpg",320,180,"https://i.ytimg.com/vi/ppVpdsClN80/hqdefault.jpg",480,360,"Rowan Atkinson Live","none",4535926,57771,707,0,1226,1,2014
"891","KXRDF2Vi_Gw","2013-02-13","UC7UY7PogIW70R4HCNHQCGFw","quot goodness gracious me quot rowan atkinson pixie lott and nick mohammed","Rowan Atkinson, Pixie Lott and Nick Mohammed. Directed by Oliver Parker. Special performance to promote @NHSOrganDonor @PopePower.","https://i.ytimg.com/vi/KXRDF2Vi_Gw/default.jpg",120,90,"https://i.ytimg.com/vi/KXRDF2Vi_Gw/mqdefault.jpg",320,180,"https://i.ytimg.com/vi/KXRDF2Vi_Gw/hqdefault.jpg",480,360,"Pixie Lott","none",3123130,17528,1273,0,1334,2,2013
"892","T29hBG44wiU","2010-05-02","UCMYClcPO7GKL3FWOQWCtQVg","rowan atkinson sketch reading of will approx 1985","Rowan Atkinson.","https://i.ytimg.com/vi/T29hBG44wiU/default.jpg",120,90,"https://i.ytimg.com/vi/T29hBG44wiU/mqdefault.jpg",320,180,"https://i.ytimg.com/vi/T29hBG44wiU/hqdefault.jpg",480,360,"RettroKunk","none",795570,3894,166,0,186,5,2010
"893","sg-4ATrE8n0","2007-12-10","UCFIKcIPByl1ZAHXhxlR6Eyg","rowan atkinson conservative conference","rowan atkinson once again!","https://i.ytimg.com/vi/sg-4ATrE8n0/default.jpg",120,90,"https://i.ytimg.com/vi/sg-4ATrE8n0/mqdefault.jpg",320,180,"https://i.ytimg.com/vi/sg-4ATrE8n0/hqdefault.jpg",480,360,"lostsightofvehicle","none",1698276,11196,290,0,1338,12,2007
"894","Ut116mBuPpg","2014-01-24","UCvlkMq7QfHFK5VJZa0aeMeQ","rowan atkinson live the devil 39 toby 39 welcomes you to hell","In this funny sketch, Rowan plays the devil, also known as 'Toby', he welcomes new people to hell! Selected Highlights from Rowan's stand up tours during the ...","https://i.ytimg.com/vi/Ut116mBuPpg/default.jpg",120,90,"https://i.ytimg.com/vi/Ut116mBuPpg/mqdefault.jpg",320,180,"https://i.ytimg.com/vi/Ut116mBuPpg/hqdefault.jpg",480,360,"Rowan Atkinson Live","none",3857535,44413,605,0,1280,1,2014
"895","tOjbo74Hq-k","2010-08-27","UCvlkMq7QfHFK5VJZa0aeMeQ","rowan atkinson live no one called jones dirty words","An hilarious skit by the comedic genius Rowan Atkinson. Using dirty words he roll calls class and 'accidentally' twists their names into hilarious meanings. rowan ...","https://i.ytimg.com/vi/tOjbo74Hq-k/default.jpg",120,90,"https://i.ytimg.com/vi/tOjbo74Hq-k/mqdefault.jpg",320,180,"https://i.ytimg.com/vi/tOjbo74Hq-k/hqdefault.jpg",480,360,"Rowan Atkinson Live","none",1165425,9790,135,0,541,8,2010
"896","fZMoB6ms2mE","2010-07-29","UCvlkMq7QfHFK5VJZa0aeMeQ","rowan atkinson live fatal beatings mr bean actor 39 s hilarious schoolmaster","One of the most loved clips from Rowan's vast back catalogue, a hilarious sketch where the angry teacher played by Rowan invites a father in to talk about the ...","https://i.ytimg.com/vi/fZMoB6ms2mE/default.jpg",120,90,"https://i.ytimg.com/vi/fZMoB6ms2mE/mqdefault.jpg",320,180,"https://i.ytimg.com/vi/fZMoB6ms2mE/hqdefault.jpg",480,360,"Rowan Atkinson Live","none",2490301,15810,179,0,652,7,2010
"897","XbY8MH1TpEw","2014-01-24","UCvlkMq7QfHFK5VJZa0aeMeQ","rowan atkinson live amazing jesus","Classic comedy - Rowan Atkinson plays a vicar speaking from the pulpit who tells us how amazing Jesus is... Whether mesmerising us with the sheer visual ...","https://i.ytimg.com/vi/XbY8MH1TpEw/default.jpg",120,90,"https://i.ytimg.com/vi/XbY8MH1TpEw/mqdefault.jpg",320,180,"https://i.ytimg.com/vi/XbY8MH1TpEw/hqdefault.jpg",480,360,"Rowan Atkinson Live","none",1767054,19961,588,0,742,1,2014
"898","xl9XI_LvkHg","2018-10-25","UCMtFAi84ehTSYSE9XoHefig","rowan atkinson dusts off an old comedy bit","'Johnny English Strikes Again' star Rowan Atkinson gives Stephen a taste of the old bit he used to do that got seven minutes of laughter without using a single ...","https://i.ytimg.com/vi/xl9XI_LvkHg/default.jpg",120,90,"https://i.ytimg.com/vi/xl9XI_LvkHg/mqdefault.jpg",320,180,"https://i.ytimg.com/vi/xl9XI_LvkHg/hqdefault.jpg",480,360,"The Late Show with Stephen Colbert","none",5204601,69874,1545,0,4967,10,2018
"899","W4rtGPCsoXA","2018-10-05","UCdHkLMxTYwV66Sky1xXVrxQ","is rowan atkinson the real mr bean the graham norton show bbc america","Rowan Atkinson tries to convince someone that he's the REAL Rowan Atkinson. New episode Friday October 12th at 11/10c on BBC America. Subscribe now: ...","https://i.ytimg.com/vi/W4rtGPCsoXA/default.jpg",120,90,"https://i.ytimg.com/vi/W4rtGPCsoXA/mqdefault.jpg",320,180,"https://i.ytimg.com/vi/W4rtGPCsoXA/hqdefault.jpg",480,360,"BBC America","none",827882,11917,142,0,348,10,2018
"900","91DSNL1BEeY","2010-07-29","UCvlkMq7QfHFK5VJZa0aeMeQ","rowan atkinson live the devil toby welcomes you to hell","In this funny sketch, Rowan plays the devil, also known as 'Toby', he welcomes new people to hell! Selected Highlights from Rowan's stand up tours during the ...","https://i.ytimg.com/vi/91DSNL1BEeY/default.jpg",120,90,"https://i.ytimg.com/vi/91DSNL1BEeY/mqdefault.jpg",320,180,"https://i.ytimg.com/vi/91DSNL1BEeY/hqdefault.jpg",480,360,"Rowan Atkinson Live","none",3808427,34041,473,0,1597,7,2010
"901","43AxOe3bhsw","2011-10-28","UCkAGrHCLFmlK3H2kd6isipg","no one called jones rowan atkinson live","An hilarious skit by the comedic genius Rowan Atkinson. Using dirty words he roll calls class and 'accidentally' twists their names into hilarious meanings.","https://i.ytimg.com/vi/43AxOe3bhsw/default.jpg",120,90,"https://i.ytimg.com/vi/43AxOe3bhsw/mqdefault.jpg",320,180,"https://i.ytimg.com/vi/43AxOe3bhsw/hqdefault.jpg",480,360,"Mr Bean","none",332092,2954,91,0,171,10,2011
"902","umRRCkspaQU","2008-12-03","UCTH3vRFT6Eg8N6zvhVRbJYA","rowan atkinson in 39 we are most amused 39","Rowan Atkinson tells the Gospel of John in 'We are most amused', broadcast on ITV on November 15th marking Prince Charles's 60th birthday.","https://i.ytimg.com/vi/umRRCkspaQU/default.jpg",120,90,"https://i.ytimg.com/vi/umRRCkspaQU/mqdefault.jpg",320,180,"https://i.ytimg.com/vi/umRRCkspaQU/hqdefault.jpg",480,360,"Kevyn","none",15360107,112273,6735,0,NA,12,2008
"903","KN-8G0HCD5U","2010-07-29","UCvlkMq7QfHFK5VJZa0aeMeQ","rowan atkinson live amazing jesus","Classic comedy - Rowan Atkinson plays a vicar speaking from the pulpit who tells us how amazing Jesus is... Selected Highlights from Rowan's stand up tours ...","https://i.ytimg.com/vi/KN-8G0HCD5U/default.jpg",120,90,"https://i.ytimg.com/vi/KN-8G0HCD5U/mqdefault.jpg",320,180,"https://i.ytimg.com/vi/KN-8G0HCD5U/hqdefault.jpg",480,360,"Rowan Atkinson Live","none",1190721,7415,302,0,599,7,2010
"904","pHj77P1wSeM","2014-01-24","UCvlkMq7QfHFK5VJZa0aeMeQ","rowan atkinson live tom dick and harry","Rowan Atkinson plays a funeral priest in this classic sketch. Whether mesmerising us with the sheer visual mastery of Mr. Bean, beguiling us with the acerbic wit ...","https://i.ytimg.com/vi/pHj77P1wSeM/default.jpg",120,90,"https://i.ytimg.com/vi/pHj77P1wSeM/mqdefault.jpg",320,180,"https://i.ytimg.com/vi/pHj77P1wSeM/hqdefault.jpg",480,360,"Rowan Atkinson Live","none",1785324,20498,290,0,319,1,2014
"905","Nl0HqlbX7dc","2009-03-23","UC5rdwqt-HEBZ6fxFjV_RQWA","rowan atkinson interview with elton john","Rowan Atkinson interviews Elton John at Hysteria 3 (1991)","https://i.ytimg.com/vi/Nl0HqlbX7dc/default.jpg",120,90,"https://i.ytimg.com/vi/Nl0HqlbX7dc/mqdefault.jpg",320,180,"https://i.ytimg.com/vi/Nl0HqlbX7dc/hqdefault.jpg",480,360,"SlugBalancer","none",11744647,133078,2979,0,5539,3,2009
