"","video_id","publishedAt","channelId","title","description","thumbnails.default.url","thumbnails.default.width","thumbnails.default.height","thumbnails.medium.url","thumbnails.medium.width","thumbnails.medium.height","thumbnails.high.url","thumbnails.high.width","thumbnails.high.height","channelTitle","liveBroadcastContent","viewCount","likeCount","dislikeCount","favoriteCount","commentCount","month","year"
"1281","59D38QIS9Ek","2019-10-06","UCax-4TdDh3oetlyh-GoL7UA","cat sitting mr bean the animated series funny cartoons feat rowan atkinson","Subscribe to ToysReviewToys <U+25B6><U+FE0E> https://www.youtube.com/channel/UCax-4TdDh3oetlyh-GoL7UA?sub_confirmation=1 Watch More of ToysReviewToys ...","https://i.ytimg.com/vi/59D38QIS9Ek/default.jpg",120,90,"https://i.ytimg.com/vi/59D38QIS9Ek/mqdefault.jpg",320,180,"https://i.ytimg.com/vi/59D38QIS9Ek/hqdefault.jpg",480,360,"TRT TV","none",5328,58,7,0,NA,10,2019
"1282","IFldoz08BgU","2007-07-06","UCVod4Lxursh34RF8mcpezAw","rowan atkinson as pizzaman","A funny clip from ""Not The Nine O'clock News"" (1982) with Rowan Atkinson as pizzaman.","https://i.ytimg.com/vi/IFldoz08BgU/default.jpg",120,90,"https://i.ytimg.com/vi/IFldoz08BgU/mqdefault.jpg",320,180,"https://i.ytimg.com/vi/IFldoz08BgU/hqdefault.jpg",480,360,"masterpete84","none",958611,1480,62,0,150,7,2007
"1283","oJqOdNngv0c","2011-10-30","UCIaoqL8kslcyEorENAwevYA","rowan atkinson funny reaction to massa hamilton accident hd","Rowan Atkinson's funny reaction to the Massa Hamilton accident. Massa got a penalty for causing the collision. Enjoy it!","https://i.ytimg.com/vi/oJqOdNngv0c/default.jpg",120,90,"https://i.ytimg.com/vi/oJqOdNngv0c/mqdefault.jpg",320,180,"https://i.ytimg.com/vi/oJqOdNngv0c/hqdefault.jpg",480,360,"RobinTheGhost","none",10600,36,3,0,11,10,2011
"1284","4m-cnWetnds","2020-01-13","UCfEvmW1iiK-9E1etRKHMExw","who is mr bean rowan atkinson comedy genius","Mr. Bean is known all around the world for his physical comedy but do deaf people know about the man behind it all? Learn, how Rowan Atkinson made Mr.","https://i.ytimg.com/vi/4m-cnWetnds/default.jpg",120,90,"https://i.ytimg.com/vi/4m-cnWetnds/mqdefault.jpg",320,180,"https://i.ytimg.com/vi/4m-cnWetnds/hqdefault.jpg",480,360,"ConnectHear","none",475,67,0,0,4,1,2020
"1285","Kozv1blf7mo","2019-11-08","UCax-4TdDh3oetlyh-GoL7UA","gadget kid mr bean the animated series funny cartoons feat rowan atkinson","Subscribe to ToysReviewToys <U+25B6><U+FE0E> https://www.youtube.com/channel/UCax-4TdDh3oetlyh-GoL7UA?sub_confirmation=1 Watch More of ToysReviewToys ...","https://i.ytimg.com/vi/Kozv1blf7mo/default.jpg",120,90,"https://i.ytimg.com/vi/Kozv1blf7mo/mqdefault.jpg",320,180,"https://i.ytimg.com/vi/Kozv1blf7mo/hqdefault.jpg",480,360,"TRT TV","none",2973,26,8,0,NA,11,2019
"1286","rGbZ_XLeAfQ","2011-10-30","UC26-6BsEnTP4mM2W6LtQQrA","bbc f1 2011 rowan atkinson 39 s reaction on hamilton massa crash","Rowan Atkinson reaction when Hamilton and Massa collided in India.","https://i.ytimg.com/vi/rGbZ_XLeAfQ/default.jpg",120,90,"https://i.ytimg.com/vi/rGbZ_XLeAfQ/mqdefault.jpg",320,180,"https://i.ytimg.com/vi/rGbZ_XLeAfQ/hqdefault.jpg",480,360,"Mooorteeen","none",61447,293,6,0,18,10,2011
"1287","xGOVTNYWIM0","2019-06-10","UCoO1tefYJcwBRW3E4W8ZJ0g","how i cartoonize johnny english rowan atkinson picsart","One of my favorite Comedian in Hollywood and also my favorite cartoon character in television (Mr. Bean). I hope you like it and please cllick ""  "" this video.","https://i.ytimg.com/vi/xGOVTNYWIM0/default.jpg",120,90,"https://i.ytimg.com/vi/xGOVTNYWIM0/mqdefault.jpg",320,180,"https://i.ytimg.com/vi/xGOVTNYWIM0/hqdefault.jpg",480,360,"Monmon Millan","none",392,22,0,0,7,6,2019
"1288","NiXnV9YsxTM","2015-11-23","UCDlJnDCpCFsi8tVLhuHy6JA","mr bean deluxe version rowan atkinson figure zc world","Unboxing and review of the 1/6 scale Mr Bean (deluxe version) figure (ZC185 ) from ZCWorld. This ZC World Mr Bean is a good alternative to the hard to find ...","https://i.ytimg.com/vi/NiXnV9YsxTM/default.jpg",120,90,"https://i.ytimg.com/vi/NiXnV9YsxTM/mqdefault.jpg",320,180,"https://i.ytimg.com/vi/NiXnV9YsxTM/hqdefault.jpg",480,360,"Karlo Sun","none",798191,2599,534,0,159,11,2015
"1289","jldCKUuyjSY","2011-08-08","UCwgrYryfSBQ8GMXuaKWWiVw","rowan atkinson enrico pollini entrance in rat race hd","Rowan Atkinson's entrance in Rat Race.","https://i.ytimg.com/vi/jldCKUuyjSY/default.jpg",120,90,"https://i.ytimg.com/vi/jldCKUuyjSY/mqdefault.jpg",320,180,"https://i.ytimg.com/vi/jldCKUuyjSY/hqdefault.jpg",480,360,"Jonathan Wyles","none",89754,322,12,0,41,8,2011
"1290","Le2ocIXtrSs","2017-06-20","UC2-FWL7Qtc-bvrS5AhiIeBw","bean 1997 trailer rowan atkinson","Bean 1997 The bumbling Mr. Bean travels to America when he is given the responsibility of bringing a highly valuable painting to a Los Angeles museum.","https://i.ytimg.com/vi/Le2ocIXtrSs/default.jpg",120,90,"https://i.ytimg.com/vi/Le2ocIXtrSs/mqdefault.jpg",320,180,"https://i.ytimg.com/vi/Le2ocIXtrSs/hqdefault.jpg",480,360,"Trailer Chan","none",12132,19,6,0,0,6,2017
"1291","Fi7ftxpOgao","2017-09-21","UCBLHoBhZGLTzEoUSLBfsAjQ","mersal teaser mr bean rowan atkinson version","Let see What if Mr. Bean (Rowan Atkinson) took the Lead Role in Mersal Teaser. Mersal Teaser become the teaser with most likes on Youtube. Just for Fun and ...","https://i.ytimg.com/vi/Fi7ftxpOgao/default.jpg",120,90,"https://i.ytimg.com/vi/Fi7ftxpOgao/mqdefault.jpg",320,180,"https://i.ytimg.com/vi/Fi7ftxpOgao/hqdefault.jpg",480,360,"Uh Uh Oh Oh","none",1165072,9355,1799,0,306,9,2017
"1292","N792o8Ulm6k","2019-08-09","UC3UIgtHGTReU8u3oMevkpcg","deepfake rowan atkinson kevan keegan 39 s 39 i will love it if we beat them 39 rant","Decides to dip my toes into the water of Deep Learning and begin with deepfakes... I thought i would start off with a easy one at first.","https://i.ytimg.com/vi/N792o8Ulm6k/default.jpg",120,90,"https://i.ytimg.com/vi/N792o8Ulm6k/mqdefault.jpg",320,180,"https://i.ytimg.com/vi/N792o8Ulm6k/hqdefault.jpg",480,360,"Deepfake Spoofs","none",1684,6,0,0,1,8,2019
"1293","tBWmTAjEypA","2019-02-24","UCEkhNMbRFcyqYZ4u-crryyw","quot mr bean quot rowan atkinson as shazam deepfake","","https://i.ytimg.com/vi/tBWmTAjEypA/default.jpg",120,90,"https://i.ytimg.com/vi/tBWmTAjEypA/mqdefault.jpg",320,180,"https://i.ytimg.com/vi/tBWmTAjEypA/hqdefault.jpg",480,360,"ZeroCool22","none",16175,175,8,0,12,2,2019
"1294","Y353tLDzfAw","2008-04-10","UC2CbX8GPEkO33XPujEanhrA","rowan atkinson amazing jesus","Rowan Atkinson does a stage skit spoof of the biblical passage of the wedding at Cana.","https://i.ytimg.com/vi/Y353tLDzfAw/default.jpg",120,90,"https://i.ytimg.com/vi/Y353tLDzfAw/mqdefault.jpg",320,180,"https://i.ytimg.com/vi/Y353tLDzfAw/hqdefault.jpg",480,360,"twoscoopschedder","none",9254,20,2,0,3,4,2008
"1295","I7aWQr_ieuw","2010-01-03","UCo9arDBYXLyohNvqN1nBlLQ","rowan atkinson live part 3 of 5 1992","This is the WHOLE Rowan Atkinson StandUp show from 1992, in Boston xP ENJOY !!! Episodes in this Show: ################### Part 1/5 : --------------- - A ...","https://i.ytimg.com/vi/I7aWQr_ieuw/default.jpg",120,90,"https://i.ytimg.com/vi/I7aWQr_ieuw/mqdefault.jpg",320,180,"https://i.ytimg.com/vi/I7aWQr_ieuw/hqdefault.jpg",480,360,"Pasha","none",14935,29,0,0,2,1,2010
"1296","RO1zyRVOrag","2019-10-19","UCax-4TdDh3oetlyh-GoL7UA","the ball mr bean the animated series funny cartoons feat rowan atkinson","Subscribe to ToysReviewToys <U+25B6><U+FE0E> https://www.youtube.com/channel/UCax-4TdDh3oetlyh-GoL7UA?sub_confirmation=1 Watch More of ToysReviewToys ...","https://i.ytimg.com/vi/RO1zyRVOrag/default.jpg",120,90,"https://i.ytimg.com/vi/RO1zyRVOrag/mqdefault.jpg",320,180,"https://i.ytimg.com/vi/RO1zyRVOrag/hqdefault.jpg",480,360,"TRT TV","none",19846,47,16,0,NA,10,2019
"1297","02JbMdo-9LU","2010-06-27","UCcB6M54IeogYODUQnRVzznQ","rowan atkinson live quot signed news quot bit 39 87","in Canada. For another, hit http://www.youtube.com/watch?v=QeFG0dGi6Vo.","https://i.ytimg.com/vi/02JbMdo-9LU/default.jpg",120,90,"https://i.ytimg.com/vi/02JbMdo-9LU/mqdefault.jpg",320,180,"https://i.ytimg.com/vi/02JbMdo-9LU/hqdefault.jpg",480,360,"dwaynepipe59","none",15896,104,1,0,4,6,2010
"1298","BmhXs1Hk9qw","2019-10-06","UCHDe6fMvgoCeVE9bdDnIXCw","scooby doo best scene raja gosnell rowan atkinson emile mondavarious neil fanning scooby doo","The members of Mystery, Inc. solve the case of the Luna Ghost. However, long-time friction among Fred Jones, a glory hog; Daphne Blake, who is fed up with ...","https://i.ytimg.com/vi/BmhXs1Hk9qw/default.jpg",120,90,"https://i.ytimg.com/vi/BmhXs1Hk9qw/mqdefault.jpg",320,180,"https://i.ytimg.com/vi/BmhXs1Hk9qw/hqdefault.jpg",480,360,"Eli D","none",607,9,0,0,0,10,2019
"1299","KPdtE18kGLQ","2020-03-19","UCtLZOjYfEthyT3ivNbHbwZQ","rowan atkinson 39 s organ talk from 39 the innes book of records 39 hd","Rowan Atkinson's Organ Talk from 'The Innes Book of Records' Original broadcast date: 30th June 1980 A very, very young Rowan Atkinson delivers a double ...","https://i.ytimg.com/vi/KPdtE18kGLQ/default.jpg",120,90,"https://i.ytimg.com/vi/KPdtE18kGLQ/mqdefault.jpg",320,180,"https://i.ytimg.com/vi/KPdtE18kGLQ/hqdefault.jpg",480,360,"opulent7","none",45,2,0,0,0,3,2020
"1300","BgR7RhJH1vg","2015-04-22","UCa8LLSBY_oH4a0S-do4s36g","rowan atkinson who is he british comedy uk","BRITISH COMEDY UK PRODUCTS CAN BE FOUND HERE: https://www.amazon.co.uk/shop/britishcomedyuk Who is Rowan Atkinson Rowan Sebastian ...","https://i.ytimg.com/vi/BgR7RhJH1vg/default.jpg",120,90,"https://i.ytimg.com/vi/BgR7RhJH1vg/mqdefault.jpg",320,180,"https://i.ytimg.com/vi/BgR7RhJH1vg/hqdefault.jpg",480,360,"British Comedy UK","none",5374,22,2,0,1,4,2015
"1301","UGzVDS-se7Q","2020-03-02","UCkAGrHCLFmlK3H2kd6isipg","best of bean live stream mr bean official","Your best bits of Mr Bean Stay tuned: https://www.youtube.com/channel/UCkAGrHCLFmlK3H2kd6isipg?sub_confirmation=1 Welcome to the official Mr Bean ...","https://i.ytimg.com/vi/UGzVDS-se7Q/default_live.jpg",120,90,"https://i.ytimg.com/vi/UGzVDS-se7Q/mqdefault_live.jpg",320,180,"https://i.ytimg.com/vi/UGzVDS-se7Q/hqdefault_live.jpg",480,360,"Mr Bean","live",2724606,22860,2425,0,0,3,2020
"1302","04m9J65dxfU","2017-01-03","UCEXubrLNjVoyD2jhAzAo6ug","love actually the necklace scene alan rickman amp rowan atkinson","Love Actually - The Necklace Scene - Alan Rickman & Rowan Atkinson Playlist: https://www.youtube.com/playlist?list=","https://i.ytimg.com/vi/04m9J65dxfU/default.jpg",120,90,"https://i.ytimg.com/vi/04m9J65dxfU/mqdefault.jpg",320,180,"https://i.ytimg.com/vi/04m9J65dxfU/hqdefault.jpg",480,360,"Love Actually CHANNEL","none",2391,9,0,0,0,1,2017
"1303","qKMSv1UYupw","2007-01-01","UChXjYZMMs6PUICV6KUhQvhg","rowan atkinson nissan ad 2","Rowan Atkinson japanders for Nissan.","https://i.ytimg.com/vi/qKMSv1UYupw/default.jpg",120,90,"https://i.ytimg.com/vi/qKMSv1UYupw/mqdefault.jpg",320,180,"https://i.ytimg.com/vi/qKMSv1UYupw/hqdefault.jpg",480,360,"hatsujoki","none",29318,26,2,0,3,1,2007
"1304","SWXB--U-xO0","2020-03-14","UCEwIUtFBhaI2L2PuKv0KL2g","in bed with mr bean mr bean full episodes mr bean official classic mr bean","Rowan Atkinson's madcap, quirky creation Mr Bean is a global phenomenon having been sold to over 200 territories worldwide and has been in continual ...","https://i.ytimg.com/vi/SWXB--U-xO0/default.jpg",120,90,"https://i.ytimg.com/vi/SWXB--U-xO0/mqdefault.jpg",320,180,"https://i.ytimg.com/vi/SWXB--U-xO0/hqdefault.jpg",480,360,"Classic Mr Bean","none",529626,3740,485,0,112,3,2020
"1305","6vBadGJp1hQ","2008-07-20","UCEzwNfEBJbU-ppahwDC-3tQ","four weddings and a funeral rowan atkinson","Four weddings and a Funeral, Rowan Atkinson plays a priest.","https://i.ytimg.com/vi/6vBadGJp1hQ/default.jpg",120,90,"https://i.ytimg.com/vi/6vBadGJp1hQ/mqdefault.jpg",320,180,"https://i.ytimg.com/vi/6vBadGJp1hQ/hqdefault.jpg",480,360,"aydin214","none",86661,115,4,0,23,7,2008
"1306","dNgyvD4L5fs","2017-06-29","UCr8RHXsKSbfM2wNL1b08x_A","despacito ft mr bean rowan atkinson","","https://i.ytimg.com/vi/dNgyvD4L5fs/default.jpg",120,90,"https://i.ytimg.com/vi/dNgyvD4L5fs/mqdefault.jpg",320,180,"https://i.ytimg.com/vi/dNgyvD4L5fs/hqdefault.jpg",480,360,"Edit Tool","none",41634,378,29,0,11,6,2017
"1307","Rp79kB6rL7g","2019-11-27","UCWKwXnefPqI3mmywGLQ38PQ","khabib nurmagomedov vs rowan atkinson ea sports ufc 2","Khabib Nurmagomedov vs. Rowan Atkinson (EA sports UFC 2) Dear subscribers and guests of my channel, this video was made by me just for you, enjoy ...","https://i.ytimg.com/vi/Rp79kB6rL7g/default.jpg",120,90,"https://i.ytimg.com/vi/Rp79kB6rL7g/mqdefault.jpg",320,180,"https://i.ytimg.com/vi/Rp79kB6rL7g/hqdefault.jpg",480,360,"UFC Unlimited Fights","none",398,2,0,0,0,11,2019
"1308","miDNBPf8j1A","2019-03-23","UCHDe6fMvgoCeVE9bdDnIXCw","rat race best scene jerry zucker rowan atkinson wayne knight john cleese","Donald Sinclair, the eccentric owner of The Venetian Resort in Las Vegas, devises a new game to entertain the high rollers who visit his hotel/casino. Six special ...","https://i.ytimg.com/vi/miDNBPf8j1A/default.jpg",120,90,"https://i.ytimg.com/vi/miDNBPf8j1A/mqdefault.jpg",320,180,"https://i.ytimg.com/vi/miDNBPf8j1A/hqdefault.jpg",480,360,"Eli D","none",4626,23,2,0,0,3,2019
"1309","E1bBwTXoRUY","2015-12-04","UCCa0BnCIDBGzmw4daUGZ0yg","pancake mr bean rowan atkinson by tiger tomato","PANCAKE - Mr Bean (Rowan Atkinson) by TigerTomato Join TigerTomato here: https://www.youtube.com/TigerTomato Check out other TigerTomato videos: ...","https://i.ytimg.com/vi/E1bBwTXoRUY/default.jpg",120,90,"https://i.ytimg.com/vi/E1bBwTXoRUY/mqdefault.jpg",320,180,"https://i.ytimg.com/vi/E1bBwTXoRUY/hqdefault.jpg",480,360,"TigerTomato","none",8308075,35347,2133,0,2192,12,2015
"1310","teOqoG0o4mU","2010-09-26","UC_OTX5N4HM1wDPgbY8Z71VA","rowan atkinson johnny english reborn","Rowan Atkinson scene sa snimanja Johnny English Reborn 3.","https://i.ytimg.com/vi/teOqoG0o4mU/default.jpg",120,90,"https://i.ytimg.com/vi/teOqoG0o4mU/mqdefault.jpg",320,180,"https://i.ytimg.com/vi/teOqoG0o4mU/hqdefault.jpg",480,360,"Edin Avdic","none",43523,34,0,0,25,9,2010
"1311","vNmBzFSodvc","2019-03-17","UCQpa2EChQ4h8kazVcRf9_mA","rowan atkinson passes away 1955 2019 uk wikipedia 17th march 2019","Comedian and actor Rowan Atkinson who starred in ""Mr Bean"" and in the spy movies ""Johnny English"" has died at the age of 64. He had been battling with a ...","https://i.ytimg.com/vi/vNmBzFSodvc/default.jpg",120,90,"https://i.ytimg.com/vi/vNmBzFSodvc/mqdefault.jpg",320,180,"https://i.ytimg.com/vi/vNmBzFSodvc/hqdefault.jpg",480,360,"Dove Windsor","none",10032,57,118,0,0,3,2019
"1312","s8A2OwwUivc","2012-07-17","UCT9tOWandpb28emFnCKzkDQ","rowan atkinson ad for barclaycard part 1","Rowan Atkinson in Barclaycard advertisement 1992.","https://i.ytimg.com/vi/s8A2OwwUivc/default.jpg",120,90,"https://i.ytimg.com/vi/s8A2OwwUivc/mqdefault.jpg",320,180,"https://i.ytimg.com/vi/s8A2OwwUivc/hqdefault.jpg",480,360,"vhsvillage","none",3579,13,1,0,0,7,2012
"1313","PR90GkeVoPE","2018-03-11","UCY921pqVLODlSQF5DnX0LjQ","1997 barclaycard rowan atkinson mi7 advert long version","Classic Barclaycard Rowan Atkinson Advert.","https://i.ytimg.com/vi/PR90GkeVoPE/default.jpg",120,90,"https://i.ytimg.com/vi/PR90GkeVoPE/mqdefault.jpg",320,180,"https://i.ytimg.com/vi/PR90GkeVoPE/hqdefault.jpg",480,360,"Cereal Mad","none",1910,14,0,0,0,3,2018
"1314","r2iDLruhc7c","2020-03-14","UCPCDIy3Qi3cdozL9gkZpolg","rowan atkinson does not take risks with female corona viruses mgtow","","https://i.ytimg.com/vi/r2iDLruhc7c/default.jpg",120,90,"https://i.ytimg.com/vi/r2iDLruhc7c/mqdefault.jpg",320,180,"https://i.ytimg.com/vi/r2iDLruhc7c/hqdefault.jpg",480,360,"f3mh8r HiDef","none",290,46,0,0,4,3,2020
"1315","LkTdKuMcFp4","2019-03-02","UCEkhNMbRFcyqYZ4u-crryyw","quot mr bean quot rowan atkinson as quot peter parker quot tobey maguire deepfake","","https://i.ytimg.com/vi/LkTdKuMcFp4/default.jpg",120,90,"https://i.ytimg.com/vi/LkTdKuMcFp4/mqdefault.jpg",320,180,"https://i.ytimg.com/vi/LkTdKuMcFp4/hqdefault.jpg",480,360,"ZeroCool22","none",8565,51,6,0,5,3,2019
"1316","kpU_L0nSnnU","2018-02-19","UCNGml98j0QvFGiS4IrbV6wg","rowan atkinson amp angus deayton piece comic relief 1986","The Nose At Ten, 1996 - Brief extract. Not my copyright (obviously), just sharing found ephemera.","https://i.ytimg.com/vi/kpU_L0nSnnU/default.jpg",120,90,"https://i.ytimg.com/vi/kpU_L0nSnnU/mqdefault.jpg",320,180,"https://i.ytimg.com/vi/kpU_L0nSnnU/hqdefault.jpg",480,360,"ppotter","none",832,6,0,0,0,2,2018
"1317","yj5xsZiC9Lg","2007-12-11","UCFIKcIPByl1ZAHXhxlR6Eyg","rowan atkinson welcome to the hell","rowan atkinson welcomes us to the hell.","https://i.ytimg.com/vi/yj5xsZiC9Lg/default.jpg",120,90,"https://i.ytimg.com/vi/yj5xsZiC9Lg/mqdefault.jpg",320,180,"https://i.ytimg.com/vi/yj5xsZiC9Lg/hqdefault.jpg",480,360,"lostsightofvehicle","none",41461,99,7,0,8,12,2007
"1318","dd7ouOQq-IY","2009-03-20","UCYMaHKRtfGFYm6S2VyZdc5Q","be back soon oliver 2009 london cast rowan atkinson and tanners gang","","https://i.ytimg.com/vi/dd7ouOQq-IY/default.jpg",120,90,"https://i.ytimg.com/vi/dd7ouOQq-IY/mqdefault.jpg",320,180,"https://i.ytimg.com/vi/dd7ouOQq-IY/hqdefault.jpg",480,360,"Shelley Legge","none",52806,52,5,0,27,3,2009
"1319","S-IqPLtoVKg","2018-04-05","UCOP-gP2WgKUKfFBMnkR3iaA","johnny english strikes again official trailer rowan atkinson action comedy sequel","Johnny English Strikes Again - official Trailer The new adventure begins when a cyber-attack reveals the identity of all active undercover agents in Britain, ...","https://i.ytimg.com/vi/S-IqPLtoVKg/default.jpg",120,90,"https://i.ytimg.com/vi/S-IqPLtoVKg/mqdefault.jpg",320,180,"https://i.ytimg.com/vi/S-IqPLtoVKg/hqdefault.jpg",480,360,"FilmIsNow Movie Trailers","none",12271,141,5,0,15,4,2018
"1320","j9wrgl2G_HY","2016-12-12","UCEXubrLNjVoyD2jhAzAo6ug","love actually gift wrapping rowan atkinson","Love Actually | Gift Wrapping | Rowan Atkinson Playlist: https://www.youtube.com/playlist?list=","https://i.ytimg.com/vi/j9wrgl2G_HY/default.jpg",120,90,"https://i.ytimg.com/vi/j9wrgl2G_HY/mqdefault.jpg",320,180,"https://i.ytimg.com/vi/j9wrgl2G_HY/hqdefault.jpg",480,360,"Love Actually CHANNEL","none",2340,3,1,0,0,12,2016
"1321","I8mDsNSJOgw","2013-07-16","UCXbJeqkX-xACCHkhrJjTHXQ","vietsub comic relief doctor who v<U+1EDB>i rowan atkinson part 2 2","","https://i.ytimg.com/vi/I8mDsNSJOgw/default.jpg",120,90,"https://i.ytimg.com/vi/I8mDsNSJOgw/mqdefault.jpg",320,180,"https://i.ytimg.com/vi/I8mDsNSJOgw/hqdefault.jpg",480,360,"lucifersam","none",10004,83,4,0,3,7,2013
"1322","cxDLuJWLJrg","2013-03-21","UCn9pEy6K7MRkdq6BbVgn6cw","rowan atkinson the new archbishop comic relief 2013","Rowan Atkinson, the new Archbishop teaches us the importance of red nose day and one direction, but not prayer.","https://i.ytimg.com/vi/cxDLuJWLJrg/default.jpg",120,90,"https://i.ytimg.com/vi/cxDLuJWLJrg/mqdefault.jpg",320,180,"https://i.ytimg.com/vi/cxDLuJWLJrg/hqdefault.jpg",480,360,"Jack Bicknell","none",26449,110,15,0,18,3,2013
"1323","sLlgWAel5xE","2020-03-19","UCW6BAq2swXOc0-OarSUmQwg","biografi seorang rowan atkinson tugas bahasa indonesia","","https://i.ytimg.com/vi/sLlgWAel5xE/default.jpg",120,90,"https://i.ytimg.com/vi/sLlgWAel5xE/mqdefault.jpg",320,180,"https://i.ytimg.com/vi/sLlgWAel5xE/hqdefault.jpg",480,360,"Farish Farish","none",25,9,0,0,1,3,2020
"1324","oajNijbgsAI","2020-02-11","UCHlJWYuForJO7I6DiDBtUnQ","ytp god the devil and rowan atkinson","Created for parody and comedy purposes. In this YTP, Rowan Atkinson is a jack of all trades: From being an Indian waiter to the Devil, Rowan is never short of ...","https://i.ytimg.com/vi/oajNijbgsAI/default.jpg",120,90,"https://i.ytimg.com/vi/oajNijbgsAI/mqdefault.jpg",320,180,"https://i.ytimg.com/vi/oajNijbgsAI/hqdefault.jpg",480,360,"TonyYorkieSilky1991","none",93,2,1,0,1,2,2020
"1325","qep9yjkZgbc","2012-04-22","UCprNbyp1s61d9pP4UnhoEWQ","rowan atkinson mr bean 5 fun facts that you probably did not know","Did you know that Rowan Atkinson has a Master of Science (MSc) degree in Electrical Engineering? Or did you know that once when his pilot passed,Atkinson ...","https://i.ytimg.com/vi/qep9yjkZgbc/default.jpg",120,90,"https://i.ytimg.com/vi/qep9yjkZgbc/mqdefault.jpg",320,180,"https://i.ytimg.com/vi/qep9yjkZgbc/hqdefault.jpg",480,360,"factXtract","none",78437,244,21,0,47,4,2012
"1326","K56QCvcy04w","2020-03-20","UCEwIUtFBhaI2L2PuKv0KL2g","trying new food with mr bean mr bean 39 s holiday movie clip classic mr bean","Rowan Atkinson's madcap, quirky creation Mr Bean is a global phenomenon having been sold to over 200 territories worldwide and has been in continual ...","https://i.ytimg.com/vi/K56QCvcy04w/default.jpg",120,90,"https://i.ytimg.com/vi/K56QCvcy04w/mqdefault.jpg",320,180,"https://i.ytimg.com/vi/K56QCvcy04w/hqdefault.jpg",480,360,"Classic Mr Bean","none",109363,1236,118,0,51,3,2020
"1327","cJwFsdYp2gw","2018-04-02","UC8HQNpRZaMKRtjKG5Bw75lw","mr bean biography in urdu rowan atkinson life story","i am sharing Mr Bean Biography In urdu and Hindi ,About Rowan Atkinson Life Story , Johnny English Reborn & Dead On Time.","https://i.ytimg.com/vi/cJwFsdYp2gw/default.jpg",120,90,"https://i.ytimg.com/vi/cJwFsdYp2gw/mqdefault.jpg",320,180,"https://i.ytimg.com/vi/cJwFsdYp2gw/hqdefault.jpg",480,360,"ZARAK KHAN Media","none",30581,587,31,0,36,4,2018
"1328","RNBnYL3ZG_I","2011-09-15","UChg_JUovjgjwn13CGDudMbw","next <U+0438><U+043D><U+0442><U+0435><U+0440><U+0432><U+044C><U+044E> <U+0441> rowan atkinson","<U+0412><U+0435><U+0434><U+0443><U+0449><U+0438><U+0439> <U+0443><U+0442><U+0440><U+0435><U+043D><U+043D><U+0435><U+0433><U+043E> <U+0448><U+043E><U+0443> «<U+0414><U+0435><U+043D><U+044C> <U+0421><U+0443><U+0440><U+043A><U+0430>» <U+043D><U+0430> NEXT <U+0415><U+0432><U+0433><U+0435><U+043D><U+0438><U+0439> <U+0420><U+044B><U+0431><U+043E><U+0432> <U+0432><U+0437><U+044F><U+043B> <U+044D><U+043A><U+0441><U+043A><U+043B><U+044E><U+0437><U+0438><U+0432><U+043D><U+043E><U+0435> <U+0438><U+043D><U+0442><U+0435><U+0440><U+0432><U+044C><U+044E> <U+0443> <U+0430><U+043A><U+0442><U+0435><U+0440><U+0430> <U+0420><U+043E><U+0443><U+044D><U+043D><U+0430> <U+0410><U+0442><U+043A><U+0438><U+043D><U+0441><U+043E><U+043D>...","https://i.ytimg.com/vi/RNBnYL3ZG_I/default.jpg",120,90,"https://i.ytimg.com/vi/RNBnYL3ZG_I/mqdefault.jpg",320,180,"https://i.ytimg.com/vi/RNBnYL3ZG_I/hqdefault.jpg",480,360,"Dmitry Lensky","none",18347,165,0,0,10,9,2011
"1329","7NTtQjI5i4Q","2011-12-23","UCfddRSrtz5aVOiTYvvWJdDA","mr bean dance rowan atkinson 39 s fan dancing mister bombastic","Dancing concurrently - Rowan Atkinson tribute Shaggy - Mr Bombastic.","https://i.ytimg.com/vi/7NTtQjI5i4Q/default.jpg",120,90,"https://i.ytimg.com/vi/7NTtQjI5i4Q/mqdefault.jpg",320,180,"https://i.ytimg.com/vi/7NTtQjI5i4Q/hqdefault.jpg",480,360,"stttep","none",93309,231,71,0,30,12,2011
"1330","qs3k0mDmB2g","2009-07-20","UCzzgEOi0xR9SuflkXmTQv6g","rowan atkinson 39 s final performance as fagin in oliver london 18th july 2009","Recorded at the Theatre Royal Drury Lane. Sir Cameron Mackintosh pays a tribute to Rowan, who is presented with a gift from the cast, he then gives a farewell ...","https://i.ytimg.com/vi/qs3k0mDmB2g/default.jpg",120,90,"https://i.ytimg.com/vi/qs3k0mDmB2g/mqdefault.jpg",320,180,"https://i.ytimg.com/vi/qs3k0mDmB2g/hqdefault.jpg",480,360,"MrWestendboy","none",97720,87,5,0,0,7,2009
"1331","HsX4EI1io6M","2020-03-14","UCkAGrHCLFmlK3H2kd6isipg","coffee bean <U+2615> mr bean full episodes mr bean official","Bean has a trick up his sleeve with his cup of coffee in the launderette... Stay tuned: ...","https://i.ytimg.com/vi/HsX4EI1io6M/default.jpg",120,90,"https://i.ytimg.com/vi/HsX4EI1io6M/mqdefault.jpg",320,180,"https://i.ytimg.com/vi/HsX4EI1io6M/hqdefault.jpg",480,360,"Mr Bean","none",589507,4692,469,0,186,3,2020
"1332","nbRSiyM2eIs","2019-10-06","UCHDe6fMvgoCeVE9bdDnIXCw","scooby doo best scene matthew lillard linda cardellini isla fisher rowan atkinson","The members of Mystery, Inc. solve the case of the Luna Ghost. However, long-time friction among Fred Jones, a glory hog; Daphne Blake, who is fed up with ...","https://i.ytimg.com/vi/nbRSiyM2eIs/default.jpg",120,90,"https://i.ytimg.com/vi/nbRSiyM2eIs/mqdefault.jpg",320,180,"https://i.ytimg.com/vi/nbRSiyM2eIs/hqdefault.jpg",480,360,"Eli D","none",1415,13,0,0,3,10,2019
"1333","KtevN6_g0kA","2018-01-01","UCDraeOigzyHfJCa7LJxf10w","at the age of 62 mr bean star rowan atkinson has revealed some pretty surprising news","At The Age Of 62, Mr Bean Star Rowan Atkinson Has Revealed Some Pretty Surprising News contact us at: watchjojo2@gmail.com http://watchjojo.com When A ...","https://i.ytimg.com/vi/KtevN6_g0kA/default.jpg",120,90,"https://i.ytimg.com/vi/KtevN6_g0kA/mqdefault.jpg",320,180,"https://i.ytimg.com/vi/KtevN6_g0kA/hqdefault.jpg",480,360,"watchJojo","none",178176,1057,456,0,331,1,2018
"1334","NoCa0AG7L0I","2011-12-21","UCwVyQZvwVgGyODGzv8tb5Mw","johnny english reborn interview with rowan atkinson and rosamund pike","So Johnny English was fired five years ago. What happens next? Find out about this definitely 'not rude' comedy spy thriller, with an ambition to be Bond with a ...","https://i.ytimg.com/vi/NoCa0AG7L0I/default.jpg",120,90,"https://i.ytimg.com/vi/NoCa0AG7L0I/mqdefault.jpg",320,180,"https://i.ytimg.com/vi/NoCa0AG7L0I/hqdefault.jpg",480,360,"ScreenThing","none",60379,204,6,0,15,12,2011
"1335","bOfXl3CDEDA","2019-12-04","UCcOmfLvzJ3Q7zhOmcp9R6yQ","rowan atkinson 39 s speech at reform section 5 parliamentary reception","","https://i.ytimg.com/vi/bOfXl3CDEDA/default.jpg",120,90,"https://i.ytimg.com/vi/bOfXl3CDEDA/mqdefault.jpg",320,180,"https://i.ytimg.com/vi/bOfXl3CDEDA/hqdefault.jpg",480,360,"PurpleChicken.TV","none",253,5,0,0,2,12,2019
