"","video_id","publishedAt","channelId","title","description","thumbnails.default.url","thumbnails.default.width","thumbnails.default.height","thumbnails.medium.url","thumbnails.medium.width","thumbnails.medium.height","thumbnails.high.url","thumbnails.high.width","thumbnails.high.height","channelTitle","liveBroadcastContent","viewCount","likeCount","dislikeCount","favoriteCount","commentCount","month","year"
"1","0LfWMrERydM","2020-03-06","UC87GeMqLLIIP9D6-6kug11A","rajpal yadav best comedy scene rajpal comedy video","Rajpal yadav best comedy scene || Rajpal comedy video.","https://i.ytimg.com/vi/0LfWMrERydM/default.jpg",120,90,"https://i.ytimg.com/vi/0LfWMrERydM/mqdefault.jpg",320,180,"https://i.ytimg.com/vi/0LfWMrERydM/hqdefault.jpg",480,360,"RSY Records","none",92787,370,78,0,8,3,2020
"2","63PoPEeMdiU","2020-03-06","UCQmZ9BIYOBSkxL-eqqg5z-g","baby food mark angel comedy episode 250","This funny video is very hilarious. Everyone in the Mark Angel Comedy crew is a clown. Please don't forget to subscribe to Mark Angel Comedy Official YouTube ...","https://i.ytimg.com/vi/63PoPEeMdiU/default.jpg",120,90,"https://i.ytimg.com/vi/63PoPEeMdiU/mqdefault.jpg",320,180,"https://i.ytimg.com/vi/63PoPEeMdiU/hqdefault.jpg",480,360,"MarkAngelComedy","none",447285,13430,661,0,1226,3,2020
"3","Sp0D5_YkYhc","2020-03-07","UCF1JIbMUs6uqoZEY1Haw0GQ","vijay raaz comedy scenes anwar bollywood comedy scenes hindi comedy videos","Subscribe to Shemaroo - http://bit.ly/2DNFnzF Download the app now and share it with all the asli fans http://twd.bz/shemaroome Give a missed call on ...","https://i.ytimg.com/vi/Sp0D5_YkYhc/default.jpg",120,90,"https://i.ytimg.com/vi/Sp0D5_YkYhc/mqdefault.jpg",320,180,"https://i.ytimg.com/vi/Sp0D5_YkYhc/hqdefault.jpg",480,360,"Shemaroo","none",19902,268,33,0,12,3,2020
"4","TToBppEkntA","2020-03-07","UCGE-L0dJpos3ut0N96H75Jw","natia comedy part 55 holi","Natia Comedy part 55 || Holi.","https://i.ytimg.com/vi/TToBppEkntA/default.jpg",120,90,"https://i.ytimg.com/vi/TToBppEkntA/mqdefault.jpg",320,180,"https://i.ytimg.com/vi/TToBppEkntA/hqdefault.jpg",480,360,"utkal cartoon world","none",2602224,77558,3927,0,2678,3,2020
"5","hEyEHUgDlBc","2020-03-05","UCJYi5GZRNoW1nJGU_Y1JbGA","very funny stupid boys top comedy video 2020 try not to laugh episode 117 by maha fun tv","In this video You are watching, Very Funny Stupid Boys_Top Comedy Video 2020_Try Not To Laugh_Episode 117_By Maha Fun Tv If We have any mistake.","https://i.ytimg.com/vi/hEyEHUgDlBc/default.jpg",120,90,"https://i.ytimg.com/vi/hEyEHUgDlBc/mqdefault.jpg",320,180,"https://i.ytimg.com/vi/hEyEHUgDlBc/hqdefault.jpg",480,360,"Maha Fun Tv","none",738220,3524,766,0,111,3,2020
"6","RCttR07Ciw4","2020-03-06","UCAWWoipi8gcLwDRmdd8oZKg","<U+091A><U+0932> <U+091C><U+093E><U+0932><U+093E> <U+092E><U+0947><U+0930><U+0940> <U+0938><U+0940><U+0915><U+094D><U+0930><U+0947><U+091F> johnney lever comedy scenes","<U+091A><U+0932> <U+091C><U+093E><U+0932><U+093E> <U+092E><U+0947><U+0930><U+0940> <U+0938><U+0940><U+0915><U+094D><U+0930><U+0947><U+091F> || Johnney Lever || Comedy Scenes Movies :- Wajood And Do Numri.","https://i.ytimg.com/vi/RCttR07Ciw4/default.jpg",120,90,"https://i.ytimg.com/vi/RCttR07Ciw4/mqdefault.jpg",320,180,"https://i.ytimg.com/vi/RCttR07Ciw4/hqdefault.jpg",480,360,"Comedy Wale","none",380016,1135,234,0,44,3,2020
"7","fQjNUMJQ_08","2020-03-06","UC0PKLLmL8pIJLjOI1gBH_pA","<U+0930><U+093E><U+091C><U+092A><U+093E><U+0932> <U+092F><U+093E><U+0926><U+0935> <U+0915><U+0940> <U+092C><U+0949><U+0932><U+0940><U+0935><U+0941><U+0921> <U+092B><U+093F><U+0932><U+094D><U+092E> <U+0915><U+0940> <U+0939><U+093F><U+091F> <U+0915><U+0949><U+092E><U+0947><U+0921><U+0940> rajpal yadav superhit comedy scenes shemaroocomedy","Rajpal Yadav has an amazing comic timing. We can watch his comedy videos over and over again. Here is a compilation of some of the best comedy scenes by ...","https://i.ytimg.com/vi/fQjNUMJQ_08/default.jpg",120,90,"https://i.ytimg.com/vi/fQjNUMJQ_08/mqdefault.jpg",320,180,"https://i.ytimg.com/vi/fQjNUMJQ_08/hqdefault.jpg",480,360,"Shemaroo Comedy","none",67688,677,56,0,21,3,2020
"8","47iOCC1DHoM","2020-03-07","UCdnOG_jDq5TR5sWuQkoZHMg","<U+091C><U+093E><U+0926><U+0941><U+0908> <U+092E><U+091B><U+0932><U+0940> <U+0916><U+093F><U+0932><U+094C><U+0928><U+093E> magical fish toy comedy story <U+0939><U+093F><U+0902><U+0926><U+0940> <U+0915><U+0939><U+093E><U+0928><U+093F><U+092F><U+093E><U+0902> hindi kahaniya village comedy video","<U+091C><U+093E><U+0926><U+0941><U+0908> <U+092E><U+091B><U+0932><U+0940> <U+0916><U+093F><U+0932><U+094C><U+0928><U+093E> Magical Fish Toy Comedy Story <U+0939><U+093F><U+0902><U+0926><U+0940> <U+0915><U+0939><U+093E><U+0928><U+093F><U+092F><U+093E><U+0902> Hindi Kahaniya Village Comedy Video. For More Moral Stories To Watch ...","https://i.ytimg.com/vi/47iOCC1DHoM/default.jpg",120,90,"https://i.ytimg.com/vi/47iOCC1DHoM/mqdefault.jpg",320,180,"https://i.ytimg.com/vi/47iOCC1DHoM/hqdefault.jpg",480,360,"Scooby TV - Moral Stories in Hindi Kahaniya","none",1482306,8145,2033,0,157,3,2020
"9","aYMn2GMZ8g8","2020-03-06","UC0ByJPzNt_4HgXXj8Os0hsw","try not to laugh challenge <U+0001F602> comedy videos 2020 funny vines episode 56haniya village comedy video","TRY NOT TO LAUGH CHALLENGE Comedy Videos 2020 - Funny Vines Warning: This is just one of the videos with entertainment content made by our team.","https://i.ytimg.com/vi/aYMn2GMZ8g8/default.jpg",120,90,"https://i.ytimg.com/vi/aYMn2GMZ8g8/mqdefault.jpg",320,180,"https://i.ytimg.com/vi/aYMn2GMZ8g8/hqdefault.jpg",480,360,"SML Prank","none",74695,433,103,0,16,3,2020
"10","s6uW1odtjPc","2019-10-14","UCtw7q4SyOeoCwM1i_3x8lDg","12 comics you need to see comedy central stand up presents","The comedians from the new season of Comedy Central Stand-Up Presents take the stage. Season 3 kicks off with back-to-back new episodes on Friday, ...","https://i.ytimg.com/vi/s6uW1odtjPc/default.jpg",120,90,"https://i.ytimg.com/vi/s6uW1odtjPc/mqdefault.jpg",320,180,"https://i.ytimg.com/vi/s6uW1odtjPc/hqdefault.jpg",480,360,"Comedy Central Stand-Up","none",733024,6672,954,0,329,10,2019
"11","ziBjMv9K40o","2020-03-07","UCiG4YPtAs0rAcI3A8jtnZrA","<U+0905><U+0923><U+0916><U+093E><U+0935><U+0923><U+0940> <U+0932><U+0941><U+0917><U+093E><U+0908> rajasthani hariyanvi comedy murari ki koxktail muarari lal","Artist Murari Lal Mahesh Kumar Pareek Shiv Kumar Tiwadi Sajani Pareek Malchand Pareek Bal Kalakar Anirudh Pareek Dop : Balram Verma Bobby, Patroda ...","https://i.ytimg.com/vi/ziBjMv9K40o/default.jpg",120,90,"https://i.ytimg.com/vi/ziBjMv9K40o/mqdefault.jpg",320,180,"https://i.ytimg.com/vi/ziBjMv9K40o/hqdefault.jpg",480,360,"Murari Ki Kocktail","none",141650,8488,500,0,202,3,2020
"12","rStsx8SGsPc","2018-09-28","UCe_Fx4EZAgKjDz0aQ_Y7hSA","top 10 funniest comedians that made simon cowell laugh on agt amp bgt got talent global","Watch the funniest and down right hilarious comedy auditions on America's Got Talent and Britain's Got Talent 2017-18. Simon Cowell can't stop laughing.","https://i.ytimg.com/vi/rStsx8SGsPc/default.jpg",120,90,"https://i.ytimg.com/vi/rStsx8SGsPc/mqdefault.jpg",320,180,"https://i.ytimg.com/vi/rStsx8SGsPc/hqdefault.jpg",480,360,"Got Talent Global","none",34614074,328070,15817,0,21159,9,2018
"13","iCP0bakbPR0","2020-03-05","UCab142H1vpeKP6z5qEWQJJg","must watch new very funny stupid boys 2020 top new comedy video try to not laugh fun ki vines","Top New Comedy Video 2019 | Try Not To laugh | Episode-56 | By fun ki vines #New_Funny_Videos #Very_Funny #Top_Funny_2019 #Best_Funny_Videos ...","https://i.ytimg.com/vi/iCP0bakbPR0/default.jpg",120,90,"https://i.ytimg.com/vi/iCP0bakbPR0/mqdefault.jpg",320,180,"https://i.ytimg.com/vi/iCP0bakbPR0/hqdefault.jpg",480,360,"Fun Ki Vines","none",294606,1557,273,0,57,3,2020
"14","twlb_LJsp4Q","2017-07-16","UC8wa0R6JnLlQ_eS7K3Pyq_w","kevin hart 39 s funniest best jokes comedy","","https://i.ytimg.com/vi/twlb_LJsp4Q/default.jpg",120,90,"https://i.ytimg.com/vi/twlb_LJsp4Q/mqdefault.jpg",320,180,"https://i.ytimg.com/vi/twlb_LJsp4Q/hqdefault.jpg",480,360,"WORLDWIDE PRODUCTION ENTERTAINMENT","none",8219054,79370,5595,0,2937,7,2017
"15","M9sHwGQYmJI","2020-03-07","UCcvDxf3OKcvZzRYvcIyikLw","<U+091C><U+093E><U+0926><U+0941><U+0908> <U+092C><U+0948><U+0932> <U+0914><U+0930> <U+0939><U+0940><U+0930><U+0947> magical diamond bull comedy video <U+0939><U+093F><U+0902><U+0926><U+0940> <U+0915><U+0939><U+093E><U+0928><U+093F><U+092F><U+093E><U+0902> hindi kahaniya funny comedy video","<U+091C><U+093E><U+0926><U+0941><U+0908> <U+092C><U+0948><U+0932> <U+0914><U+0930> <U+0939><U+0940><U+0930><U+0947> Magical Diamond Bull Comedy Video <U+0939><U+093F><U+0902><U+0926><U+0940> <U+0915><U+0939><U+093E><U+0928><U+093F><U+092F><U+093E><U+0902> Hindi Kahaniya Funny Comedy Video. For More Stories To Watch Please...","https://i.ytimg.com/vi/M9sHwGQYmJI/default.jpg",120,90,"https://i.ytimg.com/vi/M9sHwGQYmJI/mqdefault.jpg",320,180,"https://i.ytimg.com/vi/M9sHwGQYmJI/hqdefault.jpg",480,360,"Masti Tv - Bedtime Stories / Fairy Tales","none",2934344,15965,3630,0,416,3,2020
"16","nWe2On5H6UA","2020-03-06","UCFREM8qDW8rjM-c-75-wrYA","kashmir delhi amp the bjp stand up comedy by daniel fernandes","This is a clip from a gig in Chandigarh where I talk to the crowd about recent political events in India. ******** PAY-AS-YOU-LIKE ********* If you like this video ...","https://i.ytimg.com/vi/nWe2On5H6UA/default.jpg",120,90,"https://i.ytimg.com/vi/nWe2On5H6UA/mqdefault.jpg",320,180,"https://i.ytimg.com/vi/nWe2On5H6UA/hqdefault.jpg",480,360,"Daniel Fernandes","none",131305,9082,1003,0,1053,3,2020
"17","8vOUnywZxrs","2020-03-04","UCLZc32yrTEMxH1ZO-6fKOzA","latinos make no sense andrew schulz stand up comedy","What up people! Latinos here's a clip for you from my Miami shows. Thank you for coming out and showing love! Video By: @ALEXXMEDIA Subscribe to the ...","https://i.ytimg.com/vi/8vOUnywZxrs/default.jpg",120,90,"https://i.ytimg.com/vi/8vOUnywZxrs/mqdefault.jpg",320,180,"https://i.ytimg.com/vi/8vOUnywZxrs/hqdefault.jpg",480,360,"The Andrew Schulz","none",417571,17727,323,0,1307,3,2020
"18","JhixxfQWauw","2019-12-28","UCBXMpFsxz-QyFEevJgPl-Og","indian new funny video<U+0001F604> <U+0001F605>hindi comedy videos 2019 episode 85 indian fun me Tiya funny comedy video","Welcome To Our Channel.This is a International Funny youtube Channel. My Team Always Trying To Provide Best Quality Funny Videos. If you have good ...","https://i.ytimg.com/vi/JhixxfQWauw/default.jpg",120,90,"https://i.ytimg.com/vi/JhixxfQWauw/mqdefault.jpg",320,180,"https://i.ytimg.com/vi/JhixxfQWauw/hqdefault.jpg",480,360,"ME Tv","none",6334547,19139,5447,0,432,12,2019
"19","mzF1nZjGdGQ","2020-02-11","UCZIv78thfup6-JB5HxqT3Pg","ricky gervais on hitler best of politics universal comedy","NOT FOR THE EASILY OFFENDED... Taken from his 2nd special POLITICS, the recent host of the 2020 Golden Globes and master of monologues Ricky ...","https://i.ytimg.com/vi/mzF1nZjGdGQ/default.jpg",120,90,"https://i.ytimg.com/vi/mzF1nZjGdGQ/mqdefault.jpg",320,180,"https://i.ytimg.com/vi/mzF1nZjGdGQ/hqdefault.jpg",480,360,"Universal Comedy","none",621665,8431,223,0,525,2,2020
"20","qmMN9MLMWfs","2020-03-05","UC5tuYcCdiKuF5Y2ZonuarwA","chotu ki school bus quot <U+091B><U+094B><U+091F><U+0942> <U+0926><U+093E><U+0926><U+093E> <U+0915><U+0940> <U+0938><U+094D><U+0915><U+0942><U+0932> <U+092C><U+0938> quot khandesh comedy chotu comedy video","chotudadakischoolbus #schoolbus #chotudada <U+0906><U+0917><U+092F><U+0940> <U+091B><U+094B><U+091F><U+0942> <U+0915><U+0940> <U+0938><U+0915><U+0942><U+0932> <U+092C><U+0938> <U+0915><U+094D><U+092F><U+093E> <U+0939><U+0941><U+0906> <U+091C><U+092C> <U+092E><U+094B><U+092C><U+093E><U+0908><U+0932> <U+092A><U+0930> <U+0935><U+093F><U+0921><U+093F><U+092F><U+094B> <U+092C><U+0928><U+093E><U+0928><U+0947> <U+0935><U+093E><U+0932>...","https://i.ytimg.com/vi/qmMN9MLMWfs/default.jpg",120,90,"https://i.ytimg.com/vi/qmMN9MLMWfs/mqdefault.jpg",320,180,"https://i.ytimg.com/vi/qmMN9MLMWfs/hqdefault.jpg",480,360,"Jkk Entertainment","none",6764262,42854,9176,0,856,3,2020
"21","xG-shzpyAnI","2020-03-02","UCPLRUTUA8h0UodWUob3slng","corona virus la springs comedy","Watch this very funny comedy as Emmanuella and Success contacts virus. Please don't forget to subscribe to this channel is free. stay away from corona virus.","https://i.ytimg.com/vi/xG-shzpyAnI/default.jpg",120,90,"https://i.ytimg.com/vi/xG-shzpyAnI/mqdefault.jpg",320,180,"https://i.ytimg.com/vi/xG-shzpyAnI/hqdefault.jpg",480,360,"La Springs Comedy","none",327116,5241,525,0,468,3,2020
"22","npfahtvaWOk","2020-03-05","UCZSNzBgFub_WWil6TOTYwAg","how indian couples fight amit tandon stand up comedy netflix india","We're sure you're gonna relate, watch so we can tell you the three magic words. <U+2764><U+FE0F> Unearth the secret to relationships, parenting and other mysteries of the ...","https://i.ytimg.com/vi/npfahtvaWOk/default.jpg",120,90,"https://i.ytimg.com/vi/npfahtvaWOk/mqdefault.jpg",320,180,"https://i.ytimg.com/vi/npfahtvaWOk/hqdefault.jpg",480,360,"Netflix India","none",841685,28526,879,0,321,3,2020
"23","58oVAN8BYBE","2020-03-04","UCG_rbseeLwlrNVJg-p4M3rA","<U+0938><U+092C> <U+0915><U+0941><U+091B> <U+0926><U+093F><U+0915><U+0924><U+093E> <U+0939><U+0948> johnny lever comedy scenes","<U+0938><U+092C> <U+0915><U+0941><U+091B> <U+0926><U+093F><U+0915><U+0924><U+093E> <U+0939><U+0948> || Johnny Lever || Comedy Scenes Movies :- Haqeeqat, Daag The Fire, Farz.","https://i.ytimg.com/vi/58oVAN8BYBE/default.jpg",120,90,"https://i.ytimg.com/vi/58oVAN8BYBE/mqdefault.jpg",320,180,"https://i.ytimg.com/vi/58oVAN8BYBE/hqdefault.jpg",480,360,"Captain Watch Hits","none",86529,222,52,0,10,3,2020
"24","O0kFELTag1o","2020-02-25","UCab142H1vpeKP6z5qEWQJJg","very funny stupid boys new comedy videos 2020 episode 54 by funkivines","Must watch new funny video Comedy Videos 2019 - Episode 53 || Funny Videos | Chotu dipu Funny Videos | Chotu dipu Thanks for watching. Please Like ...","https://i.ytimg.com/vi/O0kFELTag1o/default.jpg",120,90,"https://i.ytimg.com/vi/O0kFELTag1o/mqdefault.jpg",320,180,"https://i.ytimg.com/vi/O0kFELTag1o/hqdefault.jpg",480,360,"Fun Ki Vines","none",512794,1961,475,0,45,2,2020
"25","1OfABoqs27I","2020-03-01","UC4B6dDVB0Umrh5l4UgxUtyg","must watch new very funny stupid boys 2020 top funny comedy video try to not laugh myfamily","Must Watch New Very Funny Stupid Boys 2020 | Top Funny Comedy Video | Try To Not Laugh | #myfamily #My_Family #new_funny_video #hindi_comedy ...","https://i.ytimg.com/vi/1OfABoqs27I/default.jpg",120,90,"https://i.ytimg.com/vi/1OfABoqs27I/mqdefault.jpg",320,180,"https://i.ytimg.com/vi/1OfABoqs27I/hqdefault.jpg",480,360,"MY FAMILY","none",245566,1013,238,0,53,3,2020
"26","crhvwfX8CLQ","2020-03-02","UCErEMQf4SmG0wzGV2gxg7jw","if hitler started a comedy night nick dixon","Live at London's free-thinking comedy club https://comedyunleashed.co.uk/whatson Nick Dixon interviews Andrew Doyle on his podcast: ...","https://i.ytimg.com/vi/crhvwfX8CLQ/default.jpg",120,90,"https://i.ytimg.com/vi/crhvwfX8CLQ/mqdefault.jpg",320,180,"https://i.ytimg.com/vi/crhvwfX8CLQ/hqdefault.jpg",480,360,"Comedy Unleashed","none",50088,2852,59,0,399,3,2020
"27","vZ23ZxDcRB8","2020-03-06","UCwO2NgrXCTE0Y4_KxCCVyoQ","from china with love bordea stand up comedy","bordea #coronavirus Dupa ce trece coronavirus-ul poate am sa raman cu acest obicei de a ma spala mai des pe maini :) Enjoy! Find me on: ...","https://i.ytimg.com/vi/vZ23ZxDcRB8/default.jpg",120,90,"https://i.ytimg.com/vi/vZ23ZxDcRB8/mqdefault.jpg",320,180,"https://i.ytimg.com/vi/vZ23ZxDcRB8/hqdefault.jpg",480,360,"Bordea Stand Up Comedy Official Channel","none",47170,2380,38,0,50,3,2020
"28","aoHziWK2TcI","2020-03-03","UCBXMpFsxz-QyFEevJgPl-Og","new top funny comedy video 2020 very funny stupid boys episode 104 indian fun me tv","Don't Forget To SUBSCRIBE To My Channel For New Videos Every Weekend!! Also, Make Sure To Like This Video If You Enjoyed It! Turn My Post ...","https://i.ytimg.com/vi/aoHziWK2TcI/default.jpg",120,90,"https://i.ytimg.com/vi/aoHziWK2TcI/mqdefault.jpg",320,180,"https://i.ytimg.com/vi/aoHziWK2TcI/hqdefault.jpg",480,360,"ME Tv","none",232629,1196,259,0,52,3,2020
"29","xkWZhQ67Cq0","2018-08-06","UCkzysCn-I7UJlWWjlIhy2ug","stand up kevin hart stand up comedy hilarious amp very funny the best","Kevin Hart Stand-up comedy show, one of his best performances Like, Share & Subscribe the channel for more videos.","https://i.ytimg.com/vi/xkWZhQ67Cq0/default.jpg",120,90,"https://i.ytimg.com/vi/xkWZhQ67Cq0/mqdefault.jpg",320,180,"https://i.ytimg.com/vi/xkWZhQ67Cq0/hqdefault.jpg",480,360,"Yazan Haleem","none",3145734,38804,1585,0,1121,8,2018
"30","t_E4SFZ1hMc","2020-03-07","UC9fTi9wTYOtJZ6L8s07-bSQ","alex muhangi comedy store march 2020 vinka","Uganda Comedy #alexmuhangi #comedystoreuganda #Vinka.","https://i.ytimg.com/vi/t_E4SFZ1hMc/default.jpg",120,90,"https://i.ytimg.com/vi/t_E4SFZ1hMc/mqdefault.jpg",320,180,"https://i.ytimg.com/vi/t_E4SFZ1hMc/hqdefault.jpg",480,360,"Alex Muhangi Comedian","none",4886,237,1,0,53,3,2020
"31","hjI2-o60W1I","2019-05-11","UCtZie1TODEYT98YZb0b85Ow","<U+091C><U+0949><U+0928><U+0940> <U+092D><U+093E><U+0908> <U+0915><U+0940> <U+0915><U+095C><U+0915> <U+091A><U+093E><U+092F> johnny lever comedy","<U+091C><U+0949><U+0928><U+0940> <U+092D><U+093E><U+0908> <U+0915><U+0940> <U+0915><U+0921><U+093C><U+0915> <U+091A><U+093E><U+092F> - Johnny Lever Comedy Movie : Jwalamukhi comedian,indian,indian comedian,india,indian comedy,comedy,indian parents,india ...","https://i.ytimg.com/vi/hjI2-o60W1I/default.jpg",120,90,"https://i.ytimg.com/vi/hjI2-o60W1I/mqdefault.jpg",320,180,"https://i.ytimg.com/vi/hjI2-o60W1I/hqdefault.jpg",480,360,"Comedy No.1","none",27409220,70614,15463,0,1442,5,2019
"32","kLUFit8815c","2019-11-29","UCvlVuntLjdURVD3b3Hx7kxw","funniest joke you’ve ever heard about being late andy woodhull full special","If you enjoyed this full comedy special from Andy Woodhull, chances are you'll enjoy our other comedy specials as well, and you can watch them for FREE right ...","https://i.ytimg.com/vi/kLUFit8815c/default.jpg",120,90,"https://i.ytimg.com/vi/kLUFit8815c/mqdefault.jpg",320,180,"https://i.ytimg.com/vi/kLUFit8815c/hqdefault.jpg",480,360,"Dry Bar Comedy","none",4128296,87643,3313,0,3784,11,2019
"33","GLZqyCqTxTM","2020-03-06","UCALeHfwxZslowXw-ug7tT7g","<U+0932><U+0917><U+0924><U+093E> <U+0939><U+0948> <U+092C><U+0942><U+0922><U+093E> <U+092B><U+0938> <U+0917><U+092F><U+093E> kadar khan and shakti kapoor comedy scenes","<U+0932><U+0917><U+0924><U+093E> <U+0939><U+0948> <U+092C><U+0942><U+0922><U+093E> <U+092B><U+0938> <U+0917><U+092F><U+093E> || Kadar Khan and Shakti Kapoor || Comedy Scenes Movies :- Jallad And Trinetra Mix Comedy.","https://i.ytimg.com/vi/GLZqyCqTxTM/default.jpg",120,90,"https://i.ytimg.com/vi/GLZqyCqTxTM/mqdefault.jpg",320,180,"https://i.ytimg.com/vi/GLZqyCqTxTM/hqdefault.jpg",480,360,"Comedy Captain","none",455810,1811,361,0,43,3,2020
"34","-M6-gVCZBnc","2020-03-06","UCbCAA45JRl38hxSSGf6LxPw","dhudu pagla <U+09A7><U+09C1><U+09A6><U+09C1> <U+09AA><U+09BE><U+0997><U+09B2><U+09BE> akhomo hasan anny khan bangla comedy natok 2020","Dhudu Pagla | <U+09A7><U+09C1><U+09A6><U+09C1> <U+09AA><U+09BE><U+0997><U+09B2><U+09BE> | Akhomo Hasan | Anny Khan | Bangla Comedy Natok 2020 Script : Ruhul Amin Pothik Director : Babu Ashraf Cast : Akhomo Hasan, ...","https://i.ytimg.com/vi/-M6-gVCZBnc/default.jpg",120,90,"https://i.ytimg.com/vi/-M6-gVCZBnc/mqdefault.jpg",320,180,"https://i.ytimg.com/vi/-M6-gVCZBnc/hqdefault.jpg",480,360,"RUN BD","none",80016,1459,98,0,54,3,2020
"35","He1SQV8kAqY","2020-03-07","UCnSFZ-olBoLGLRUS_3RI2Aw","washing machine mein bhoot tmkoc comedy taarak mehta ka ooltah chashmah","Click here to Subscribe to Taarak Mehta Ka Ooltah Chashmah Official Channel: https://www.youtube.com/taarakmehtakaooltahchashmah Click here to watch all ...","https://i.ytimg.com/vi/He1SQV8kAqY/default.jpg",120,90,"https://i.ytimg.com/vi/He1SQV8kAqY/mqdefault.jpg",320,180,"https://i.ytimg.com/vi/He1SQV8kAqY/hqdefault.jpg",480,360,"Taarak Mehta Ka Ooltah Chashmah","none",413831,6560,390,0,166,3,2020
"36","FKcr2h7RR-g","2019-02-16","UC_LeY42hkzHVtNwH-0HIW8w","joe rogan 2019 standup comedy full show","The Joe Rogan Experience - https://amzn.to/2Z8ZYZ5 JRE - https://www.youtube.com/watch?v=EX3Tm_Yi5XE.","https://i.ytimg.com/vi/FKcr2h7RR-g/default.jpg",120,90,"https://i.ytimg.com/vi/FKcr2h7RR-g/mqdefault.jpg",320,180,"https://i.ytimg.com/vi/FKcr2h7RR-g/hqdefault.jpg",480,360,"ChrissyA1","none",473284,2646,659,0,364,2,2019
"37","oGLeVSSErXk","2020-02-17","UCJYi5GZRNoW1nJGU_Y1JbGA","very funny stupid boys top comedy video 2020 try not to laugh episode 115 by maha fun tv","In this video You are watching, Very Funny Stupid Boys_Top Comedy Video 2020_Try Not To Laugh_Episode 115_By Maha Fun Tv If We have any mistake.","https://i.ytimg.com/vi/oGLeVSSErXk/default.jpg",120,90,"https://i.ytimg.com/vi/oGLeVSSErXk/mqdefault.jpg",320,180,"https://i.ytimg.com/vi/oGLeVSSErXk/hqdefault.jpg",480,360,"Maha Fun Tv","none",4756433,16962,4581,0,242,2,2020
"38","hPSRSDEaYJg","2020-01-30","UCJYi5GZRNoW1nJGU_Y1JbGA","new top funny comedy video 2020 try not to laugh episode 112 by mahafuntv","In this video You are watching, ew Top Funny Comedy Video 2020_Try Not To Laugh_Episode 112_By MahaFunTv If We have any mistake. please comment ...","https://i.ytimg.com/vi/hPSRSDEaYJg/default.jpg",120,90,"https://i.ytimg.com/vi/hPSRSDEaYJg/mqdefault.jpg",320,180,"https://i.ytimg.com/vi/hPSRSDEaYJg/hqdefault.jpg",480,360,"Maha Fun Tv","none",10440182,37345,9608,0,465,1,2020
"39","saDnAkBU6Qs","2018-04-20","UCxyCzPY2pjAjrxoSYclpuLg","try not to laugh 420 jokes laugh factory stand up comedy","In celebration of this national holiday, enjoy this compilation of some of the funniest 420 comedy that has come through the Laugh Factory in Hollywood!","https://i.ytimg.com/vi/saDnAkBU6Qs/default.jpg",120,90,"https://i.ytimg.com/vi/saDnAkBU6Qs/mqdefault.jpg",320,180,"https://i.ytimg.com/vi/saDnAkBU6Qs/hqdefault.jpg",480,360,"Laugh Factory","none",8177955,95214,4101,0,2540,4,2018
"40","oPU4rmIrvuw","2020-03-06","UCGfUuxBzB8E30XjCjOvji2w","michael 39 s greatest misquotes the office us comedy bites","'That's sort of an oaky after-birth....' All the times Michael Scott would try words and phrases that were way out of his vocabulary Welcome to the OFFICIAL ...","https://i.ytimg.com/vi/oPU4rmIrvuw/default.jpg",120,90,"https://i.ytimg.com/vi/oPU4rmIrvuw/mqdefault.jpg",320,180,"https://i.ytimg.com/vi/oPU4rmIrvuw/hqdefault.jpg",480,360,"Comedy Bites","none",41401,1050,17,0,42,3,2020
"41","idwchtBBXB0","2020-03-06","UC6TOAsh402h1BqxcB18ey2Q","<U+0938><U+0942><U+0928><U+092C><U+093E><U+0908> <U+091A><U+0947> <U+0921><U+094B><U+0939><U+093E><U+0933><U+0947> <U+0907><U+0902><U+0926><U+0941><U+0930><U+0940><U+0915><U+0930> <U+092E><U+0939><U+093E><U+0930><U+093E><U+091C> <U+0915><U+0949><U+092E><U+0947><U+0921><U+0940> <U+0915><U+0940><U+0930><U+094D><U+0924><U+0928> indurikar maharaj latest comedy kirtan","<U+0928><U+093F><U+0935><U+0943><U+0924><U+094D><U+0924><U+0940> <U+092E><U+0939><U+093E><U+0930><U+093E><U+091C> <U+0907><U+0902><U+0926><U+094B><U+0930><U+0940><U+0915><U+0930> <U+0939><U+0947> <U+092E><U+0939><U+093E><U+0930><U+093E><U+0937><U+094D><U+091F><U+094D><U+0930><U+093E><U+0924><U+0940><U+0932> <U+0932><U+094B><U+0915><U+092A><U+094D><U+0930><U+093F><U+092F> <U+0915><U+0940><U+0930><U+094D><U+0924><U+0928><U+0915><U+093E><U+0930> <U+0906><U+0939><U+0947><U+0924>, <U+0928><U+093F><U+0930>...","https://i.ytimg.com/vi/idwchtBBXB0/default.jpg",120,90,"https://i.ytimg.com/vi/idwchtBBXB0/mqdefault.jpg",320,180,"https://i.ytimg.com/vi/idwchtBBXB0/hqdefault.jpg",480,360,"MEDIA MARATHI","none",169952,1598,194,0,25,3,2020
"42","2nNzfGHvl7U","2020-01-12","UCSR8ClRz9hfBkOlrgZvx1Ow","rajpal yadav best comedy scene rajpal best comedy","Rajpal comedy.","https://i.ytimg.com/vi/2nNzfGHvl7U/default.jpg",120,90,"https://i.ytimg.com/vi/2nNzfGHvl7U/mqdefault.jpg",320,180,"https://i.ytimg.com/vi/2nNzfGHvl7U/hqdefault.jpg",480,360,"RSY Films","none",3989810,17004,2830,0,239,1,2020
"43","quZU_hA4Pr4","2020-02-08","UCtw7q4SyOeoCwM1i_3x8lDg","john mulaney “canceling plans is like heroin”","John Mulaney describes the instant joy of breaking off plans and wonders why people treat ordering fries like it's an adventure. Subscribe to Comedy Central ...","https://i.ytimg.com/vi/quZU_hA4Pr4/default.jpg",120,90,"https://i.ytimg.com/vi/quZU_hA4Pr4/mqdefault.jpg",320,180,"https://i.ytimg.com/vi/quZU_hA4Pr4/hqdefault.jpg",480,360,"Comedy Central Stand-Up","none",1375522,38587,575,0,632,2,2020
"44","83a1lb5gwNQ","2019-12-01","UC76Yc75RGWonijH02CIhPaw","brahmanandam best comedy scene nela ticket south indian hindi dubbed best comedy scene","Watch Brahmanandam Best Comedy Scene From Super Hit Movie ""Nela Ticket"". Starring Ravi Teja, Malvika Sharma, Jagapathi Babu, Sampath Raj, Sarath ...","https://i.ytimg.com/vi/83a1lb5gwNQ/default.jpg",120,90,"https://i.ytimg.com/vi/83a1lb5gwNQ/mqdefault.jpg",320,180,"https://i.ytimg.com/vi/83a1lb5gwNQ/hqdefault.jpg",480,360,"Great Indian Comedy","none",7232230,47805,3801,0,472,12,2019
"45","T6QYI2Me-L4","2018-08-02","UCk-wMHcv-Vm-K23YlUPbDow","gabriel iglesias i’m not fat i’m fluffy comedy central special","Copyright Disclaimer Under Section 107 of the Copyright Act 1976, allowance is made for ""fair use"" for purposes such as criticism, comment, news reporting, ...","https://i.ytimg.com/vi/T6QYI2Me-L4/default.jpg",120,90,"https://i.ytimg.com/vi/T6QYI2Me-L4/mqdefault.jpg",320,180,"https://i.ytimg.com/vi/T6QYI2Me-L4/hqdefault.jpg",480,360,"Angelo Ortiz","none",1338867,13716,581,0,498,8,2018
