"","video_id","publishedAt","channelId","title","description","thumbnails.default.url","thumbnails.default.width","thumbnails.default.height","thumbnails.medium.url","thumbnails.medium.width","thumbnails.medium.height","thumbnails.high.url","thumbnails.high.width","thumbnails.high.height","channelTitle","liveBroadcastContent","viewCount","likeCount","dislikeCount","favoriteCount","commentCount","month","year"
"386","4BCnaZVxNeE","2018-10-13","UCRHcpjAIeJpAVhnSaa_I2hQ","the undertaker and his pals full length comedy horror movie english hd 720p","An undertaker and his two friends, who are restaurant owners, drum up some business. Their racket goes awry when 2 detectives suspect that something isn't ...","https://i.ytimg.com/vi/4BCnaZVxNeE/default.jpg",120,90,"https://i.ytimg.com/vi/4BCnaZVxNeE/mqdefault.jpg",320,180,"https://i.ytimg.com/vi/4BCnaZVxNeE/hqdefault.jpg",480,360,"MOVIEHOLIC","none",236185,350,149,0,7,10,2018
"387","y-w6balD58E","2017-07-28","UCrzyJYtjLOTfnUur8hsr7ow","new nepali movie 3 monkeys comedy full movie 2017 resham firiri saroj kc dilip tamang","Don't forget to like and share with everyone if you liked this video! Jyoti Films Production Presents! New Nepali Movie 3 MONKEYS a Film by Bhairam Shrestha ...","https://i.ytimg.com/vi/y-w6balD58E/default.jpg",120,90,"https://i.ytimg.com/vi/y-w6balD58E/mqdefault.jpg",320,180,"https://i.ytimg.com/vi/y-w6balD58E/hqdefault.jpg",480,360,"HighlightsNepal","none",1846317,5484,1092,0,367,7,2017
"388","7Z1X4ZFzXdc","2017-08-19","UCTmo6Mwiw6IXJ-_8Vgzg-tw","ek kutub teen minar bharat jadhav vijay chavan amruta deshmukh marathi comedy full movie","Ek Kutub Teen Minar | Bharat Jadhav, Vijay Chavan, Amruta Deshmukh | Marathi Comedy Full Movie The film is a comedy about a civil engineer who dreams of ...","https://i.ytimg.com/vi/7Z1X4ZFzXdc/default.jpg",120,90,"https://i.ytimg.com/vi/7Z1X4ZFzXdc/mqdefault.jpg",320,180,"https://i.ytimg.com/vi/7Z1X4ZFzXdc/hqdefault.jpg",480,360,"Fakt Marathi Tv","none",818426,1588,447,0,31,8,2017
"389","mMrKeRCyQDM","2014-06-14","UCKAN892rlYqn1GY038fUEvg","arike romantic comedy malayalam full movie","Director - Shyamaprasad Producer - N. B. Vindhyan Screenplay - Shyamaprasad Story - Sunil Gangopadhyay Starring - Dileep,Samvrutha Sunil,Mamta ...","https://i.ytimg.com/vi/mMrKeRCyQDM/default.jpg",120,90,"https://i.ytimg.com/vi/mMrKeRCyQDM/mqdefault.jpg",320,180,"https://i.ytimg.com/vi/mMrKeRCyQDM/hqdefault.jpg",480,360,"Amrita Online Movies","none",763291,2527,421,0,304,6,2014
"390","K7RSG08tx_c","2020-02-29","UC0yoDn4jXS2S_rPn958otyQ","the under world xploit comedy","Figure 8 Has Caused A lot of Problems in our society today . PLEASE SUBSCRIBE TO THIS CHANNEL FOR MORE FUNNY VIDEOS. Music: Problem By ...","https://i.ytimg.com/vi/K7RSG08tx_c/default.jpg",120,90,"https://i.ytimg.com/vi/K7RSG08tx_c/mqdefault.jpg",320,180,"https://i.ytimg.com/vi/K7RSG08tx_c/hqdefault.jpg",480,360,"xploit comedy","none",302733,6240,270,0,359,2,2020
"391","QHho_JYNKXY","2020-03-07","UCkJqlgjBQ_xRO1N7XjSnE3A","<U+0915><U+0947><U+0932><U+0947> <U+091A><U+094B><U+0930> banana chor village comedy <U+0939><U+093F><U+0902><U+0926><U+0940> <U+0915><U+0939><U+093E><U+0928><U+093F><U+092F><U+093E> hindi kahaniya hindi comedy videos hindi stories","<U+0915><U+0947><U+0932><U+0947> <U+0915><U+093E> <U+091A><U+094B><U+0930> Banana Chor Village Comedy <U+0939><U+093F><U+0902><U+0926><U+0940> <U+0915><U+0939><U+093E><U+0928><U+093F><U+092F><U+093E> Hindi Kahaniya Hindi Comedy Videos Hindi Stories hindi Comedy stories Hindi Funny ...","https://i.ytimg.com/vi/QHho_JYNKXY/default.jpg",120,90,"https://i.ytimg.com/vi/QHho_JYNKXY/mqdefault.jpg",320,180,"https://i.ytimg.com/vi/QHho_JYNKXY/hqdefault.jpg",480,360,"KirraK Tv","none",204641,1832,281,0,65,3,2020
"392","dJ6DdErHugY","2019-10-28","UCBJ01wsHhc_RSEarVeFlzTw","must watch new funny video<U+0001F602><U+0001F602>top new comedy video 2019 try to not laugh pooryoutuber fmtv meTries","Must Watch New Funny Video    Top New Comedy Video 2019 |Try To Not Laugh |#Pooryoutuber |#FmTV |#MeTv Hello dear Viewers, We make this video with ...","https://i.ytimg.com/vi/dJ6DdErHugY/default.jpg",120,90,"https://i.ytimg.com/vi/dJ6DdErHugY/mqdefault.jpg",320,180,"https://i.ytimg.com/vi/dJ6DdErHugY/hqdefault.jpg",480,360,"Poor Youtuber","none",7650616,29448,5710,0,484,10,2019
"393","EQdeHNWf-0I","2019-11-20","UCtw7q4SyOeoCwM1i_3x8lDg","when your student writes a story about having sex with you amy silverberg stand up featuring","Amy Silverberg remembers when one of her university students crossed the line with his writing assignment and reveals her friend's embarrassingly personal ...","https://i.ytimg.com/vi/EQdeHNWf-0I/default.jpg",120,90,"https://i.ytimg.com/vi/EQdeHNWf-0I/mqdefault.jpg",320,180,"https://i.ytimg.com/vi/EQdeHNWf-0I/hqdefault.jpg",480,360,"Comedy Central Stand-Up","none",3287508,73558,2654,0,1928,11,2019
"394","xIX5J11Vxuc","2014-12-12","UCSUMyPPmunaDKk0YHxCK-cw","novel romance romance amp comedy movie full movie","Future single mother and successful editor Max is publishing struggling author Jake. Soon they come to realize what they have been missing so long. Subscribe ...","https://i.ytimg.com/vi/xIX5J11Vxuc/default.jpg",120,90,"https://i.ytimg.com/vi/xIX5J11Vxuc/mqdefault.jpg",320,180,"https://i.ytimg.com/vi/xIX5J11Vxuc/hqdefault.jpg",480,360,"Viewster","none",8050241,13186,3992,0,114,12,2014
"395","5vatA3H94HY","2019-11-04","UCBXMpFsxz-QyFEevJgPl-Og","indian new funny video<U+0001F604> <U+0001F605>hindi comedy videos 2019 episode 68 indian fun me Td up featuring","Welcome To Our Channel.This is a International Funny youtube Channel. My Team Always Trying To Provide Best Quality Funny Videos. If you have good ...","https://i.ytimg.com/vi/5vatA3H94HY/default.jpg",120,90,"https://i.ytimg.com/vi/5vatA3H94HY/mqdefault.jpg",320,180,"https://i.ytimg.com/vi/5vatA3H94HY/hqdefault.jpg",480,360,"ME Tv","none",955246,3013,783,0,79,11,2019
"396","zjOhYvk_cZA","2019-11-15","UCXVCSFFpHry6WZFMvVCFH4w","joke of barati ka swagat <U+092C><U+0930><U+093E><U+0924><U+0940> <U+0915><U+093E> <U+0938><U+094D><U+0935><U+093E><U+0917><U+0924> comedy time toons","JOKE OF - BARATI KA SWAGAT ( <U+092C><U+0930><U+093E><U+0924><U+0940> <U+0915><U+093E> <U+0938><U+094D><U+0935><U+093E><U+0917><U+0924> ) - comedy time toons In this video funny comedy of shadi is shown.... Hope u all will like this.","https://i.ytimg.com/vi/zjOhYvk_cZA/default.jpg",120,90,"https://i.ytimg.com/vi/zjOhYvk_cZA/mqdefault.jpg",320,180,"https://i.ytimg.com/vi/zjOhYvk_cZA/hqdefault.jpg",480,360,"Comedy Time Toons","none",1772338,5916,1293,0,147,11,2019
"397","Ji-X81l_H0c","2019-02-16","UCqMolAcGDftCIAevfV4VKCQ","tomboy full length comedy movie english hd 720p","Scrappy, willful, and fiercely self-reliant spitfire hoyden automobile mechanic Tomasina 'Tommy' Boyd develops a huge crush on cocky race car driving ...","https://i.ytimg.com/vi/Ji-X81l_H0c/default.jpg",120,90,"https://i.ytimg.com/vi/Ji-X81l_H0c/mqdefault.jpg",320,180,"https://i.ytimg.com/vi/Ji-X81l_H0c/hqdefault.jpg",480,360,"COOL CINEMA™","none",109468,157,49,0,4,2,2019
"398","7ZvYsWjzrEk","2019-11-16","UCxyCzPY2pjAjrxoSYclpuLg","matt rife meeting a pornstar laugh factory stand up comedy","Matt (@MattRife) warns against meeting your heroes in-person, even porn heroes. See a LIVE SHOW at the Hollywood Laugh Factory! BUY TICKETS: ...","https://i.ytimg.com/vi/7ZvYsWjzrEk/default.jpg",120,90,"https://i.ytimg.com/vi/7ZvYsWjzrEk/mqdefault.jpg",320,180,"https://i.ytimg.com/vi/7ZvYsWjzrEk/hqdefault.jpg",480,360,"Laugh Factory","none",1115391,49716,717,0,1485,11,2019
"399","75Vb4PT5aJ0","2018-07-22","UCOTeh4TQ6MrFF4Agq_pYXJQ","eegah arch hall jr marilyn manning richard kiel full comedy movie english hd 720p","Teenagers stumble across a prehistoric caveman, who goes on a rampage. ---------------- Cast: Arch Hall Jr., Marilyn Manning, Richard Kiel ---------------- TOP 10!","https://i.ytimg.com/vi/75Vb4PT5aJ0/default.jpg",120,90,"https://i.ytimg.com/vi/75Vb4PT5aJ0/mqdefault.jpg",320,180,"https://i.ytimg.com/vi/75Vb4PT5aJ0/hqdefault.jpg",480,360,"Movie Navigator","none",2767928,2078,991,0,72,7,2018
"400","bw26GwL5NAw","2018-10-10","UCRHcpjAIeJpAVhnSaa_I2hQ","criminal affair seven men and one brain full comedy movie english 720p","A renowned author, college professor and criminologist is given a year off from his teaching position in order to write his latest book. His arrival in Buenos Aires ...","https://i.ytimg.com/vi/bw26GwL5NAw/default.jpg",120,90,"https://i.ytimg.com/vi/bw26GwL5NAw/mqdefault.jpg",320,180,"https://i.ytimg.com/vi/bw26GwL5NAw/hqdefault.jpg",480,360,"MOVIEHOLIC","none",4401994,3886,1553,0,262,10,2018
"401","OjamZ1MZw-U","2019-09-18","UC7HbEnwSlavtBqDoFivvJIw","mv around il hamari kaamwali hai ii funny comedy video ii joke off ii traffic challan iimv mjoii","VIDEO - HAMARI KAAMWALI HAI This is a funny entertaining comedy video about funny traffic challan. I hope you will like video. If u like just give me one like. ...","https://i.ytimg.com/vi/OjamZ1MZw-U/default.jpg",120,90,"https://i.ytimg.com/vi/OjamZ1MZw-U/mqdefault.jpg",320,180,"https://i.ytimg.com/vi/OjamZ1MZw-U/hqdefault.jpg",480,360,"MV Around","none",17703191,52581,11978,0,950,9,2019
"402","mSEUcuFFBec","2018-08-08","UCeuA6RU1Ua3Mstr2gcnAYCQ","cave girl cynthia thompson full length comedy movie english","On a class excursion to a cave with stone age paintings the clumsy Rex gets lost. A mysterious crystal opens a gateway in time and sets him back to the stone ...","https://i.ytimg.com/vi/mSEUcuFFBec/default.jpg",120,90,"https://i.ytimg.com/vi/mSEUcuFFBec/mqdefault.jpg",320,180,"https://i.ytimg.com/vi/mSEUcuFFBec/hqdefault.jpg",480,360,"Film Zone","none",11956897,13162,4652,0,386,8,2018
"403","PzUXOrJ_1us","2019-11-30","UCab142H1vpeKP6z5qEWQJJg","top new comedy video 2019 try to not laugh episode 33 by fun ki vines","Top New Comedy Video 2019 | Try To Not Laugh | Episode-33 | By Fun Ki Vines Hello dear Viewers, We make this video with some fail funny videos and mixed ...","https://i.ytimg.com/vi/PzUXOrJ_1us/default.jpg",120,90,"https://i.ytimg.com/vi/PzUXOrJ_1us/mqdefault.jpg",320,180,"https://i.ytimg.com/vi/PzUXOrJ_1us/hqdefault.jpg",480,360,"Fun Ki Vines","none",7207721,20238,4848,0,290,11,2019
"404","Ozpa6uc_nsk","2019-02-23","UCpbFhiz364ZE0NSstVJBIwg","must watch funny<U+0001F602><U+0001F602>comedy videos 2019 episode 104 jewels funni vines","Hello Dear Viewers, We make this video with some fail funny videos and mixed some comedy videos . This is Funny Village Videos our most of the funny videos ...","https://i.ytimg.com/vi/Ozpa6uc_nsk/default.jpg",120,90,"https://i.ytimg.com/vi/Ozpa6uc_nsk/mqdefault.jpg",320,180,"https://i.ytimg.com/vi/Ozpa6uc_nsk/hqdefault.jpg",480,360,"Jewels Funny","none",11645482,24153,9054,0,521,2,2019
"405","v8ScRl7rWQQ","2012-12-05","UCHVd0LM1g9S0cttDHkidEHA","20 us presidents in 35 seconds","20 US Presidents in 35 Seconds SUBSCRIBE: http://bit.ly/SubHof |||| LIVE SHOWS: http://bit.ly/SeeHof WATCH NEXT: http://bit.ly/WatchHof No need for a history ...","https://i.ytimg.com/vi/v8ScRl7rWQQ/default.jpg",120,90,"https://i.ytimg.com/vi/v8ScRl7rWQQ/mqdefault.jpg",320,180,"https://i.ytimg.com/vi/v8ScRl7rWQQ/hqdefault.jpg",480,360,"Steve Hofstetter","none",5534,125,9,0,23,12,2012
"406","P9oLZsk-DzE","2019-03-16","UCBXNpF6k2n8dsI6nBH8q4sQ","10 funny diy pranks brilliant tricks and pranks for friends","Are you always on the lookout for funny pranks to use on friends? Or perhaps you're sick of being the victim of someone who is? You've come to the right place, ...","https://i.ytimg.com/vi/P9oLZsk-DzE/default.jpg",120,90,"https://i.ytimg.com/vi/P9oLZsk-DzE/mqdefault.jpg",320,180,"https://i.ytimg.com/vi/P9oLZsk-DzE/hqdefault.jpg",480,360,"123 GO!","none",26490560,143219,21956,0,5026,3,2019
"407","WfkhvRFTTq0","2008-12-09","UCQKfuQtFjlL8jazT11JKFKA","vergewaltigt afghane von 20us soldaten vergewaltigt","finger im po.","https://i.ytimg.com/vi/WfkhvRFTTq0/default.jpg",120,90,"https://i.ytimg.com/vi/WfkhvRFTTq0/mqdefault.jpg",320,180,"https://i.ytimg.com/vi/WfkhvRFTTq0/hqdefault.jpg",480,360,"uricka123","none",13130,23,12,0,1,12,2008
"408","IQxptvEL70k","2012-12-07","UCHVd0LM1g9S0cttDHkidEHA","steve hofstetter 39 s political comedy 2004","Steve Hofstetter's Political Comedy (2004) SUBSCRIBE: http://bit.ly/SubHof |||| LIVE SHOWS: http://bit.ly/SeeHof WATCH NEXT: http://bit.ly/WatchHof A routine I ...","https://i.ytimg.com/vi/IQxptvEL70k/default.jpg",120,90,"https://i.ytimg.com/vi/IQxptvEL70k/mqdefault.jpg",320,180,"https://i.ytimg.com/vi/IQxptvEL70k/hqdefault.jpg",480,360,"Steve Hofstetter","none",7455,110,1,0,22,12,2012
"409","PDylgzybWAw","2014-08-11","UC3XTzVzaHQEd30rQbuvCtTQ","predatory lending last week tonight with john oliver hbo","Payday loans put a staggering amount of Americans in debt. They prey on the elderly and military service members. They're awful, and nearly impossible to ...","https://i.ytimg.com/vi/PDylgzybWAw/default.jpg",120,90,"https://i.ytimg.com/vi/PDylgzybWAw/mqdefault.jpg",320,180,"https://i.ytimg.com/vi/PDylgzybWAw/hqdefault.jpg",480,360,"LastWeekTonight","none",12615762,77909,2435,0,5191,8,2014
"410","PP00uy82Rhc","2018-08-08","UC2iUwfYi_1FCGGqhOUNx-iA","20 american dad moments that are not for kids","American Dad isn't known for being the most kid-friendly show, but these moments really cross the line! Subscribe to our channel: http://goo.gl/ho3Hg6 When ...","https://i.ytimg.com/vi/PP00uy82Rhc/default.jpg",120,90,"https://i.ytimg.com/vi/PP00uy82Rhc/mqdefault.jpg",320,180,"https://i.ytimg.com/vi/PP00uy82Rhc/hqdefault.jpg",480,360,"Screen Rant","none",183172,2165,673,0,486,8,2018
"411","7FO8TDoBAJw","2019-04-21","UCrzMCdy83LeWpdNS6cJkPFg","us kids parody music video 20us","brand new music video created by Visionary Studios UK for new single 'Kids' taken from the brand new '20US' EP commercially released 19th April 2019, find ...","https://i.ytimg.com/vi/7FO8TDoBAJw/default.jpg",120,90,"https://i.ytimg.com/vi/7FO8TDoBAJw/mqdefault.jpg",320,180,"https://i.ytimg.com/vi/7FO8TDoBAJw/hqdefault.jpg",480,360,"US music","none",62,1,0,0,NA,4,2019
"412","n_LXM7pmU24","2018-01-03","UCUcugWyYvCaF2lrdkXQchfw","children 39 s film festival seattle 2018 trailer january 25 february 10","www.childrensfilmfestivalseattle.org Over the past 13 years, Children's Film Festival Seattle has become the largest and most respected film festival on the West ...","https://i.ytimg.com/vi/n_LXM7pmU24/default.jpg",120,90,"https://i.ytimg.com/vi/n_LXM7pmU24/mqdefault.jpg",320,180,"https://i.ytimg.com/vi/n_LXM7pmU24/hqdefault.jpg",480,360,"Northwest Film Forum","none",988,5,2,0,1,1,2018
"413","KHR6LUuUs_k","2008-12-10","UCQqp9eaO6Wn7eySYaZSPFFw","jonathan richman speaks not","Now available on DVD! This is the infamous 'wordless interview' from 1985, in which Modern Lovers founder Jonathan Richman grants a rare on-camera ...","https://i.ytimg.com/vi/KHR6LUuUs_k/default.jpg",120,90,"https://i.ytimg.com/vi/KHR6LUuUs_k/mqdefault.jpg",320,180,"https://i.ytimg.com/vi/KHR6LUuUs_k/hqdefault.jpg",480,360,"1nceBitten2wiceShy","none",14086,94,0,0,7,12,2008
"414","eogu5eldquc","2018-09-25","UCXLw_h6bFfPOKbDJXDUjA-Q","baby spiderman triplets cartoon <U+0001F495>superhero play doh stop motion vengatoon","Baby Hulk loves milk Superhero Play Doh Stop motion cartoons https://www.youtube.com/watch?v=pZL-wHsoVUI Sand Snowman Paw Patrol Superhero ...","https://i.ytimg.com/vi/eogu5eldquc/default.jpg",120,90,"https://i.ytimg.com/vi/eogu5eldquc/mqdefault.jpg",320,180,"https://i.ytimg.com/vi/eogu5eldquc/hqdefault.jpg",480,360,"Funny Stop Motion videos","none",18978851,39517,19128,0,209,9,2018
"415","Jb72QpbrXMk","2013-04-23","UCFGb2SX2W_N3otEY2zidFWw","futurama cancelled","Don't let the bad guys win. Subscribe: http://bit.ly/subRoss I have twitter and tumblr and facebook too!: http://twitter.com/therosseverett ...","https://i.ytimg.com/vi/Jb72QpbrXMk/default.jpg",120,90,"https://i.ytimg.com/vi/Jb72QpbrXMk/mqdefault.jpg",320,180,"https://i.ytimg.com/vi/Jb72QpbrXMk/hqdefault.jpg",480,360,"Ross Everett","none",6538,196,3,0,53,4,2013
"416","PCegweeyb_I","2018-10-29","UCICVvpvI6pk51Yp-02FV7Qw","jealous best friend bromance problems 2 differentsame crazy funny","Everyone knows that feeling!!! If your best friend gets visited by another good friend. After a long time they haven't met in person, they are trying to spend all the ...","https://i.ytimg.com/vi/PCegweeyb_I/default.jpg",120,90,"https://i.ytimg.com/vi/PCegweeyb_I/mqdefault.jpg",320,180,"https://i.ytimg.com/vi/PCegweeyb_I/hqdefault.jpg",480,360,"DifferentSame","none",49044,828,18,0,83,10,2018
"417","oTymagBVNLU","2019-03-31","UC3rLoj87ctEHCcS7BuvIzkQ","top 10 times justin timberlake amp jessica biel made us believe in love","Talk about a power couple! For this list, we're taking a look at moments between celebrity husband and wife Justin Timberlake and Jessica Biel that made our ...","https://i.ytimg.com/vi/oTymagBVNLU/default.jpg",120,90,"https://i.ytimg.com/vi/oTymagBVNLU/mqdefault.jpg",320,180,"https://i.ytimg.com/vi/oTymagBVNLU/hqdefault.jpg",480,360,"MsMojo","none",51818,669,35,0,89,3,2019
"418","acSJhfmDE4I","2009-10-09","UCbObxjfi3W9YKnDS0PgadNA","dud leaves home","SUMMARY Dud wants to buy his girlfriend Maime an ice cream cone so he breaks open his mother's bank, and splits their last dime in half in the process.","https://i.ytimg.com/vi/acSJhfmDE4I/default.jpg",120,90,"https://i.ytimg.com/vi/acSJhfmDE4I/mqdefault.jpg",320,180,"https://i.ytimg.com/vi/acSJhfmDE4I/hqdefault.jpg",480,360,"Library of Congress","none",21294,63,1,0,NA,10,2009
"419","rJwSZIRQ54w","2018-09-28","UCuT0B27AxYqCPWMJixOOnMQ","tom segura 2019 new tour annoucement take it down","Comedian Tom Segura's new 2019 Take It Down tour is on sale now. TomSegura.com/tour has the first 40 dates of his tour listed. Fans can purchase tickets now ...","https://i.ytimg.com/vi/rJwSZIRQ54w/default.jpg",120,90,"https://i.ytimg.com/vi/rJwSZIRQ54w/mqdefault.jpg",320,180,"https://i.ytimg.com/vi/rJwSZIRQ54w/hqdefault.jpg",480,360,"Tom Segura","none",21278,326,11,0,54,9,2018
"420","W6uRNCJmdtI","2013-06-17","UChPBZTyia3nHGk78ljsq3vA","jim parsons sheldon big bang theory late night show david letterman 2013","Jim Parsons Sheldon big bang theory Late night Show David Letterman 2013 Jim Parsons Sheldon big bang theory Late night Show David Letterman 2013 Jim ...","https://i.ytimg.com/vi/W6uRNCJmdtI/default.jpg",120,90,"https://i.ytimg.com/vi/W6uRNCJmdtI/mqdefault.jpg",320,180,"https://i.ytimg.com/vi/W6uRNCJmdtI/hqdefault.jpg",480,360,"SuperAmericanShow","none",320344,1163,14,0,99,6,2013
"421","-MfZAkb9M8Y","2018-09-08","UCIPVJoHb_A5S3kcv3TJlyEg","pka 403 josh wolf epic prank story preacher grabs ariana grande celebrity privates","Sponsors: https://music.youtube.com/ https://tombraider.square-enix-games.com/en-us https://stitchfix.com/pka https://nba.2k.com/2k19/ ...","https://i.ytimg.com/vi/-MfZAkb9M8Y/default.jpg",120,90,"https://i.ytimg.com/vi/-MfZAkb9M8Y/mqdefault.jpg",320,180,"https://i.ytimg.com/vi/-MfZAkb9M8Y/hqdefault.jpg",480,360,"WoodysGamertag","none",99943,1483,75,0,267,9,2018
"422","PMtFaJp5-38","2019-03-23","UCB1u_wJThc3_e5J4VVj7hQQ","learn the alphabet with memri tv","This took ages to make lmao. Don't forget to subscribe. peace. Facebook<U+25BB> https://www.facebook.com/papichulomin ...","https://i.ytimg.com/vi/PMtFaJp5-38/default.jpg",120,90,"https://i.ytimg.com/vi/PMtFaJp5-38/mqdefault.jpg",320,180,"https://i.ytimg.com/vi/PMtFaJp5-38/hqdefault.jpg",480,360,"Papi Chulomin","none",51448,1919,33,0,166,3,2019
"423","IPeb6jJShLE","2018-09-01","UCKaQnJbTbRCATB0AKp1b50g","papa sava ep9 inyanda by niyitegegeka gratien rwandan comedy","Uyu mugabo ra! Bati isazi y'ubute ntiguguna igisebe,ukazana ibyo gusoba hano!Mujye mureka ubunyanda!","https://i.ytimg.com/vi/IPeb6jJShLE/default.jpg",120,90,"https://i.ytimg.com/vi/IPeb6jJShLE/mqdefault.jpg",320,180,"https://i.ytimg.com/vi/IPeb6jJShLE/hqdefault.jpg",480,360,"Niyitegeka Gratien","none",208938,682,77,0,39,9,2018
"424","zzprK3dQ6xU","2017-08-20","UCSrZ3UV4jOidv8ppoVuvW9Q","us comic and civil rights activist dick gregory dies at 84","The US comedian Dick Gregory has died in Washington D.C after being hospitalised for a week. He was 84. Gregory, who lived in Washington, suffered heart ...","https://i.ytimg.com/vi/zzprK3dQ6xU/default.jpg",120,90,"https://i.ytimg.com/vi/zzprK3dQ6xU/mqdefault.jpg",320,180,"https://i.ytimg.com/vi/zzprK3dQ6xU/hqdefault.jpg",480,360,"euronews (in English)","none",8686,62,1,0,8,8,2017
"425","a5Q45eLJyBE","2017-08-20","UCACdxU3VrJIJc7ujxtHWs1w","us komiker jerry lewis ist tot","US-Komiker Jerry Lewis hat die Welt zum Lachen gebracht. Im Alter von 91 Jahren ist er zu Hause in Las Vegas im Kreise seiner Angehörigen friedlich ...","https://i.ytimg.com/vi/a5Q45eLJyBE/default.jpg",120,90,"https://i.ytimg.com/vi/a5Q45eLJyBE/mqdefault.jpg",320,180,"https://i.ytimg.com/vi/a5Q45eLJyBE/hqdefault.jpg",480,360,"euronews (deutsch)","none",1984,6,0,0,2,8,2017
"426","qfcREQ95-k0","2011-08-26","UCBAXYG5u4BBw1AQxnlO1hQQ","behind the scenes with our saxophone quartet","West Point Saxophone Quartet rehearses Handel's ""Entrance of the Queen of Sheba"" for an upcoming concert. Read more about the ensemble: ...","https://i.ytimg.com/vi/qfcREQ95-k0/default.jpg",120,90,"https://i.ytimg.com/vi/qfcREQ95-k0/mqdefault.jpg",320,180,"https://i.ytimg.com/vi/qfcREQ95-k0/hqdefault.jpg",480,360,"West Point Band","none",1942,9,0,0,0,8,2011
"427","nT5hmvv1Wzw","2017-07-10","UC3SvxbZILmFBJ5AKwJ70_ug","inside out claire desmond","Introducing USA Ultimate's ""Inside Out,"" a new video series dedicated to telling the stories of the 20 U.S. National Team athletes on the 2017 World Games Team ...","https://i.ytimg.com/vi/nT5hmvv1Wzw/default.jpg",120,90,"https://i.ytimg.com/vi/nT5hmvv1Wzw/mqdefault.jpg",320,180,"https://i.ytimg.com/vi/nT5hmvv1Wzw/hqdefault.jpg",480,360,"USA Ultimate","none",3661,55,0,0,0,7,2017
"428","Knl8GVCIXG4","2019-02-12","UC3rLoj87ctEHCcS7BuvIzkQ","top 10 times ashton kutcher amp mila kunis made us believe in love","Top 10 Times Ashton Kutcher & Mila Kunis Made Us Believe in Love // Subscribe: http://www.youtube.com/c/MsMojo?sub_confirmation=1 From on the screen to ...","https://i.ytimg.com/vi/Knl8GVCIXG4/default.jpg",120,90,"https://i.ytimg.com/vi/Knl8GVCIXG4/mqdefault.jpg",320,180,"https://i.ytimg.com/vi/Knl8GVCIXG4/hqdefault.jpg",480,360,"MsMojo","none",536372,7277,141,0,196,2,2019
"429","3q-KXNSUq3g","2014-08-18","UCkoXSwooJ8WYKk5nyXZY4Vg","massage mustard ep 10 improv web series chicago comedy film festival","Chicago Comedy Film Festival brings you smart comedy for smart people. From Jack Farrell- http://massagemustard.com More episodes here- ...","https://i.ytimg.com/vi/3q-KXNSUq3g/default.jpg",120,90,"https://i.ytimg.com/vi/3q-KXNSUq3g/mqdefault.jpg",320,180,"https://i.ytimg.com/vi/3q-KXNSUq3g/hqdefault.jpg",480,360,"Film Fest Chicago","none",59,3,0,0,0,8,2014
"430","XTUSGZQjeQo","2015-01-20","UCzznO4xSV8BKnUBPyswtCUw","s korean civic group launches more anti north korea leaflets <U+D0C8><U+BD81><U+B2E8><U+CCB4> <U+C5B4><U+C82F><U+BC24> <U+BE44><U+ACF5><U+AC1C><U+B85C> <U+B300>","A South Korean activist group flew 100-thousand anti-North Korea leaflets across the inter-Korean border last night... in a move that will likely stir up tension on ...","https://i.ytimg.com/vi/XTUSGZQjeQo/default.jpg",120,90,"https://i.ytimg.com/vi/XTUSGZQjeQo/mqdefault.jpg",320,180,"https://i.ytimg.com/vi/XTUSGZQjeQo/hqdefault.jpg",480,360,"ARIRANG NEWS","none",41,0,0,0,0,1,2015
"431","CDMWIPcAP9I","2017-07-24","UCpsR8NvP8FvPYxLmHj1sPXw","81 morning tea r kelly usher and actual news","R. Kelly, Usher and news that matters. Become a Patreon Patron! https://www.patreon.com/justcallmewah Subscribe to my channel: http://bit.ly/1mmyk81 ...","https://i.ytimg.com/vi/CDMWIPcAP9I/default.jpg",120,90,"https://i.ytimg.com/vi/CDMWIPcAP9I/mqdefault.jpg",320,180,"https://i.ytimg.com/vi/CDMWIPcAP9I/hqdefault.jpg",480,360,"Just Call Me Wah","none",1938,138,10,0,45,7,2017
"432","zRsErn-ZQFk","2016-05-21","UCfkpM3RuyUHqY4nRlP-egNA","39 mr ed 39 star alan young dies at 96","A spokeswoman for the Motion Picture and Television Home said Friday, actor-comedian Alan Young, who played the amiable straight man to a talking horse in ...","https://i.ytimg.com/vi/zRsErn-ZQFk/default.jpg",120,90,"https://i.ytimg.com/vi/zRsErn-ZQFk/mqdefault.jpg",320,180,"https://i.ytimg.com/vi/zRsErn-ZQFk/hqdefault.jpg",480,360,"Wochit Entertainment","none",25625,105,10,0,55,5,2016
"433","gt2nxBbZ1zE","2017-04-20","UCJmSX7ghommK3pwMLGNUvPA","alex jones says his on air persona not a 39 trick 39","Alex Jones, the right-wing radio host and conspiracy theorist, has testified that he's sincere in his ""Infowars"" commentary. Jones did acknowledge he also uses ...","https://i.ytimg.com/vi/gt2nxBbZ1zE/default.jpg",120,90,"https://i.ytimg.com/vi/gt2nxBbZ1zE/mqdefault.jpg",320,180,"https://i.ytimg.com/vi/gt2nxBbZ1zE/hqdefault.jpg",480,360,"Wochit News","none",114,0,4,0,0,4,2017
"434","aVOyeYT3umM","2017-06-20","UCJmSX7ghommK3pwMLGNUvPA","bill cosby 39 s accuser thanks her supporters for their love and kindness","On Tuesday, the woman Bill Cosby was accused of sexually assaulting thanked her supporters for their ""outpouring of love and kindness"" since the conclusion ...","https://i.ytimg.com/vi/aVOyeYT3umM/default.jpg",120,90,"https://i.ytimg.com/vi/aVOyeYT3umM/mqdefault.jpg",320,180,"https://i.ytimg.com/vi/aVOyeYT3umM/hqdefault.jpg",480,360,"Wochit News","none",72,2,1,0,0,6,2017
"435","39xaPDTeWSc","2016-06-20","UCJmSX7ghommK3pwMLGNUvPA","1776 british spy sketches up for auction in nyc","Benedict Arnold is a British officer who turned into a spy during the Revolutionary War. This Tuesday, two portraits that he drew are being sold at Swann Auction ...","https://i.ytimg.com/vi/39xaPDTeWSc/default.jpg",120,90,"https://i.ytimg.com/vi/39xaPDTeWSc/mqdefault.jpg",320,180,"https://i.ytimg.com/vi/39xaPDTeWSc/hqdefault.jpg",480,360,"Wochit News","none",56,0,0,0,0,6,2016
